select * from performance_schema.events_statements_history_long
where event_name like 'statement/%' limit 1;
select * from performance_schema.events_statements_history_long
where event_name='FOO';
select * from performance_schema.events_statements_history_long
where event_name like 'statement/%' order by timer_wait limit 1;
select * from performance_schema.events_statements_history_long
where event_name like 'statement/%' order by timer_wait desc limit 1;
insert into performance_schema.events_statements_history_long
set thread_id='1', event_id=1,
event_name='FOO', timer_start=1, timer_end=2, timer_wait=3;
ERROR 42000: INSERT command denied to user 'root'@'localhost' for table 'events_statements_history_long'
update performance_schema.events_statements_history_long
set timer_start=12;
ERROR 42000: UPDATE command denied to user 'root'@'localhost' for table 'events_statements_history_long'
update performance_schema.events_statements_history_long
set timer_start=12 where thread_id=0;
ERROR 42000: UPDATE command denied to user 'root'@'localhost' for table 'events_statements_history_long'
delete from performance_schema.events_statements_history_long
where thread_id=1;
ERROR 42000: DELETE command denied to user 'root'@'localhost' for table 'events_statements_history_long'
delete from performance_schema.events_statements_history_long;
ERROR 42000: DELETE command denied to user 'root'@'localhost' for table 'events_statements_history_long'
LOCK TABLES performance_schema.events_statements_history_long READ;
ERROR 42000: SELECT, LOCK TABLES command denied to user 'root'@'localhost' for table 'events_statements_history_long'
UNLOCK TABLES;
LOCK TABLES performance_schema.events_statements_history_long WRITE;
ERROR 42000: SELECT, LOCK TABLES command denied to user 'root'@'localhost' for table 'events_statements_history_long'
UNLOCK TABLES;
SHOW VARIABLES LIKE '%performance%';
Variable_name	Value
performance_schema	ON
performance_schema_accounts_size	100
performance_schema_digests_size	200
performance_schema_error_size	5450
performance_schema_events_stages_history_long_size	1000
performance_schema_events_stages_history_size	10
performance_schema_events_statements_history_long_size	1000
performance_schema_events_statements_history_size	10
performance_schema_events_transactions_history_long_size	1000
performance_schema_events_transactions_history_size	10
performance_schema_events_waits_history_long_size	10000
performance_schema_events_waits_history_size	10
performance_schema_hosts_size	100
performance_schema_max_cond_classes	150
performance_schema_max_cond_instances	-1
performance_schema_max_digest_length	1024
performance_schema_max_digest_sample_age	60
performance_schema_max_file_classes	80
performance_schema_max_file_handles	32768
performance_schema_max_file_instances	-1
performance_schema_max_index_stat	-1
performance_schema_max_memory_classes	454
performance_schema_max_metadata_locks	-1
performance_schema_max_mutex_classes	350
performance_schema_max_mutex_instances	-1
performance_schema_max_prepared_statements_instances	-1
performance_schema_max_program_instances	-1
performance_schema_max_rwlock_classes	70
performance_schema_max_rwlock_instances	-1
performance_schema_max_socket_classes	10
performance_schema_max_socket_instances	-1
performance_schema_max_sql_text_length	1024
performance_schema_max_stage_classes	175
performance_schema_max_statement_classes	229
performance_schema_max_statement_stack	10
performance_schema_max_table_handles	-1
performance_schema_max_table_instances	-1
performance_schema_max_table_lock_stat	-1
performance_schema_max_thread_classes	100
performance_schema_max_thread_instances	-1
performance_schema_session_connect_attrs_size	2048
performance_schema_setup_actors_size	100
performance_schema_setup_objects_size	100
performance_schema_show_processlist	OFF
performance_schema_users_size	100
SELECT * FROM performance_schema.setup_consumers WHERE NAME LIKE '%statements%';
NAME	ENABLED
events_statements_cpu	YES
events_statements_current	YES
events_statements_history	YES
events_statements_history_long	YES
statements_digest	YES
SELECT * FROM mysql.user;
SET debug='+d,pfs_source_cs_null';
select DIGEST_TEXT from performance_schema.events_statements_history_long where DIGEST_TEXT like '%SELECT * FROM `mysql` . `user`%';
SET debug='-d,pfs_source_cs_null';
select DIGEST_TEXT from performance_schema.events_statements_history_long where DIGEST_TEXT like '%SELECT * FROM `mysql` . `user`%';
