DROP TABLE IF EXISTS t1;
CREATE TABLE t1 (
c1 INT AUTO_INCREMENT PRIMARY KEY,
c2 INT,
c3 INT,
c4 INT,
KEY k2(c2)
) ENGINE=InnoDB;
INSERT INTO t1(c2,c3,c4) VALUES
(1,1,1),(2,2,2),(3,3,3),(4,4,4),(5,5,5),
(6,6,6),(7,7,7),(8,8,8),(9,9,9),(10,10,10);
SET SESSION parallel_query=ON;
SET SESSION parallel_default_dop=2;
SET SESSION parallel_cost_threshold=0;
SET SESSION parallel_query_experimental_threaded_dop=ON;
SET @pq_executed_before = (
SELECT CAST(variable_value AS UNSIGNED)
FROM performance_schema.global_status
WHERE variable_name = 'Parallel_queries_executed');
SET @pq_fallback_before = (
SELECT CAST(variable_value AS UNSIGNED)
FROM performance_schema.global_status
WHERE variable_name = 'Parallel_queries_fallback');
SET @pq_rows_before = (
SELECT CAST(variable_value AS UNSIGNED)
FROM performance_schema.global_status
WHERE variable_name = 'Parallel_rows_scanned');
SET @pq_workers_before = (
SELECT CAST(variable_value AS UNSIGNED)
FROM performance_schema.global_status
WHERE variable_name = 'Parallel_workers_launched');
BEGIN;
UPDATE t1 SET c2 = c2 * 3 WHERE c1 = 1;
DELETE FROM t1 WHERE c1 = 6;
SELECT COUNT(c2) FROM t1 FORCE INDEX(PRIMARY);
COUNT(c2)
9
BEGIN;
SELECT COUNT(c2) FROM t1;
COUNT(c2)
10
COMMIT;
COMMIT;
SELECT
(SELECT CAST(variable_value AS UNSIGNED) FROM performance_schema.global_status
WHERE variable_name = 'Parallel_queries_executed') - @pq_executed_before
AS executed_delta,
(SELECT CAST(variable_value AS UNSIGNED) FROM performance_schema.global_status
WHERE variable_name = 'Parallel_queries_fallback') - @pq_fallback_before
AS fallback_delta,
(SELECT CAST(variable_value AS UNSIGNED) FROM performance_schema.global_status
WHERE variable_name = 'Parallel_rows_scanned') - @pq_rows_before
AS rows_delta,
(SELECT CAST(variable_value AS UNSIGNED) FROM performance_schema.global_status
WHERE variable_name = 'Parallel_workers_launched') - @pq_workers_before
AS workers_delta;
executed_delta	fallback_delta	rows_delta	workers_delta
1	0	9	2
SET SESSION parallel_query_experimental_threaded_dop=OFF;
SET SESSION parallel_query=OFF;
SET SESSION parallel_default_dop=4;
SET SESSION parallel_cost_threshold=10000;
DROP TABLE t1;
