DROP TABLE IF EXISTS t1;
CREATE TABLE t1 (id INT PRIMARY KEY, val INT) ENGINE=InnoDB;
INSERT INTO t1 VALUES (1,10),(2,20),(3,30),(4,40);
SET SESSION parallel_query=ON;
SET SESSION parallel_default_dop=1;
SET SESSION parallel_cost_threshold=0;
SET @pq_executed_before = (
SELECT CAST(variable_value AS UNSIGNED)
FROM performance_schema.global_status
WHERE variable_name = 'Parallel_queries_executed');
SET @pq_fallback_before = (
SELECT CAST(variable_value AS UNSIGNED)
FROM performance_schema.global_status
WHERE variable_name = 'Parallel_queries_fallback');
SET @pq_rows_before = (
SELECT CAST(variable_value AS UNSIGNED)
FROM performance_schema.global_status
WHERE variable_name = 'Parallel_rows_scanned');
SET @pq_workers_before = (
SELECT CAST(variable_value AS UNSIGNED)
FROM performance_schema.global_status
WHERE variable_name = 'Parallel_workers_launched');
SET SESSION transaction_isolation='REPEATABLE-READ';
START TRANSACTION;
SELECT COUNT(*) AS cnt, SUM(val) AS sum_val FROM t1;
cnt	sum_val
4	100
INSERT INTO t1 VALUES (5,50);
UPDATE t1 SET val=200 WHERE id=2;
DELETE FROM t1 WHERE id=3;
COMMIT;
SELECT COUNT(*) AS cnt, SUM(val) AS sum_val FROM t1;
cnt	sum_val
4	100
COMMIT;
SELECT COUNT(*) AS cnt, SUM(val) AS sum_val FROM t1;
cnt	sum_val
4	300
SET SESSION transaction_isolation='READ-COMMITTED';
START TRANSACTION;
SELECT COUNT(*) AS cnt, SUM(val) AS sum_val FROM t1;
cnt	sum_val
4	300
INSERT INTO t1 VALUES (6,60);
COMMIT;
SELECT COUNT(*) AS cnt, SUM(val) AS sum_val FROM t1;
cnt	sum_val
5	360
COMMIT;
SELECT
(SELECT CAST(variable_value AS UNSIGNED) FROM performance_schema.global_status
WHERE variable_name = 'Parallel_queries_executed') - @pq_executed_before
AS executed_delta,
(SELECT CAST(variable_value AS UNSIGNED) FROM performance_schema.global_status
WHERE variable_name = 'Parallel_queries_fallback') - @pq_fallback_before
AS fallback_delta,
(SELECT CAST(variable_value AS UNSIGNED) FROM performance_schema.global_status
WHERE variable_name = 'Parallel_rows_scanned') - @pq_rows_before
AS rows_delta,
(SELECT CAST(variable_value AS UNSIGNED) FROM performance_schema.global_status
WHERE variable_name = 'Parallel_workers_launched') - @pq_workers_before
AS workers_delta;
executed_delta	fallback_delta	rows_delta	workers_delta
0	5	0	0
SET SESSION parallel_query=OFF;
SET SESSION parallel_default_dop=4;
SET SESSION parallel_cost_threshold=10000;
DROP TABLE t1;
