#
# Initialization
#
INSTALL PLUGIN rpl_semi_sync_source SONAME 'semisync_source.so';
SELECT @@GLOBAL.rpl_semi_sync_source_wait_point;
@@GLOBAL.rpl_semi_sync_source_wait_point
AFTER_SYNC
reset master;
create table t1 (x int, y int);
include/show_binlog_events.inc
Log_name	Pos	Event_type	Server_id	End_log_pos	Info
binlog.000001	#	Query	#	#	use `test`; create table t1 (x int, y int)
insert into t1 values(1,1);
select * from t1;
x	y
1	1
begin;
insert into t1 values(1,2);
commit;
include/show_binlog_events.inc
Log_name	Pos	Event_type	Server_id	End_log_pos	Info
binlog.000001	#	Query	#	#	use `test`; create table t1 (x int, y int)
binlog.000001	#	Query	#	#	BEGIN
binlog.000001	#	Table_map	#	#	table_id: # (test.t1)
binlog.000001	#	Write_rows	#	#	table_id: # flags: STMT_END_F
binlog.000001	#	Xid	#	#	COMMIT /* XID */
binlog.000001	#	Query	#	#	BEGIN
binlog.000001	#	Table_map	#	#	table_id: # (test.t1)
binlog.000001	#	Write_rows	#	#	table_id: # flags: STMT_END_F
binlog.000001	#	Xid	#	#	COMMIT /* XID */
update t1 set x = 2;
update t1 set x = 3 where y = 1;
include/show_binlog_events.inc
Log_name	Pos	Event_type	Server_id	End_log_pos	Info
binlog.000001	#	Query	#	#	use `test`; create table t1 (x int, y int)
binlog.000001	#	Query	#	#	BEGIN
binlog.000001	#	Table_map	#	#	table_id: # (test.t1)
binlog.000001	#	Write_rows	#	#	table_id: # flags: STMT_END_F
binlog.000001	#	Xid	#	#	COMMIT /* XID */
binlog.000001	#	Query	#	#	BEGIN
binlog.000001	#	Table_map	#	#	table_id: # (test.t1)
binlog.000001	#	Write_rows	#	#	table_id: # flags: STMT_END_F
binlog.000001	#	Xid	#	#	COMMIT /* XID */
binlog.000001	#	Query	#	#	BEGIN
binlog.000001	#	Table_map	#	#	table_id: # (test.t1)
binlog.000001	#	Update_rows	#	#	table_id: # flags: STMT_END_F
binlog.000001	#	Xid	#	#	COMMIT /* XID */
binlog.000001	#	Query	#	#	BEGIN
binlog.000001	#	Table_map	#	#	table_id: # (test.t1)
binlog.000001	#	Update_rows	#	#	table_id: # flags: STMT_END_F
binlog.000001	#	Xid	#	#	COMMIT /* XID */
delete from t1 where y = 1;
select * from t1;
x	y
2	2
delete from t1;
include/show_binlog_events.inc
Log_name	Pos	Event_type	Server_id	End_log_pos	Info
binlog.000001	#	Query	#	#	use `test`; create table t1 (x int, y int)
binlog.000001	#	Query	#	#	BEGIN
binlog.000001	#	Table_map	#	#	table_id: # (test.t1)
binlog.000001	#	Write_rows	#	#	table_id: # flags: STMT_END_F
binlog.000001	#	Xid	#	#	COMMIT /* XID */
binlog.000001	#	Query	#	#	BEGIN
binlog.000001	#	Table_map	#	#	table_id: # (test.t1)
binlog.000001	#	Write_rows	#	#	table_id: # flags: STMT_END_F
binlog.000001	#	Xid	#	#	COMMIT /* XID */
binlog.000001	#	Query	#	#	BEGIN
binlog.000001	#	Table_map	#	#	table_id: # (test.t1)
binlog.000001	#	Update_rows	#	#	table_id: # flags: STMT_END_F
binlog.000001	#	Xid	#	#	COMMIT /* XID */
binlog.000001	#	Query	#	#	BEGIN
binlog.000001	#	Table_map	#	#	table_id: # (test.t1)
binlog.000001	#	Update_rows	#	#	table_id: # flags: STMT_END_F
binlog.000001	#	Xid	#	#	COMMIT /* XID */
binlog.000001	#	Query	#	#	BEGIN
binlog.000001	#	Table_map	#	#	table_id: # (test.t1)
binlog.000001	#	Delete_rows	#	#	table_id: # flags: STMT_END_F
binlog.000001	#	Xid	#	#	COMMIT /* XID */
binlog.000001	#	Query	#	#	BEGIN
binlog.000001	#	Table_map	#	#	table_id: # (test.t1)
binlog.000001	#	Delete_rows	#	#	table_id: # flags: STMT_END_F
binlog.000001	#	Xid	#	#	COMMIT /* XID */
drop table t1;
#
# Cleanup
#
UNINSTALL PLUGIN rpl_semi_sync_source;
