call mtr.add_suppression("mysql.outline");
call mtr.add_suppression("Statement outline");
call mtr.add_suppression("Column count of mysql.* is wrong");
call mtr.add_suppression("Error in applying outline, cause: some records are invalid");
call dbms_admin.show_native_procedure();
SCHEMA_NAME	PROC_NAME	PROC_TYPE	PARAMETERS
dbms_admin	show_native_procedure	ADMIN_PROC	
dbms_dstore_maintenance	show_dstore_info	ADMIN_PROC	VARCHAR, VARCHAR
dbms_outln	add_index_outline	ADMIN_PROC	VARCHAR, VARCHAR, LONGLONG, VARCHAR, VARCHAR, VARCHAR, VARCHAR
dbms_outln	add_optimizer_outline	ADMIN_PROC	VARCHAR, VARCHAR, LONGLONG, VARCHAR, VARCHAR
dbms_outln	del_outline	ADMIN_PROC	LONGLONG
dbms_outln	flush_outline	ADMIN_PROC	
dbms_outln	preview_outline	ADMIN_PROC	VARCHAR, VARCHAR
dbms_outln	show_outline	ADMIN_PROC	
dbms_sqlfilter	add_sql_filter	ADMIN_PROC	VARCHAR, LONGLONG, VARCHAR, VARCHAR
dbms_sqlfilter	delete_sql_filter	ADMIN_PROC	LONGLONG
dbms_sqlfilter	flush_sql_filter	ADMIN_PROC	
dbms_sqlfilter	show_sql_filter	ADMIN_PROC	
dbms_sqlfilter	update_sql_filter	ADMIN_PROC	LONGLONG, VARCHAR, LONGLONG, VARCHAR, VARCHAR
mysql	dummy	ADMIN_PROC	
mysql	dummy_3	ADMIN_PROC	LONGLONG, VARCHAR, NEWDECIMAL
rds_backup	start_full_local_backup	ADMIN_PROC	LONGLONG
rds_backup	start_log_archive	ADMIN_PROC	
rds_backup	stop_full_local_backup	ADMIN_PROC	
rds_backup	stop_log_archive	ADMIN_PROC	
rpl_wal	pdb_demote	ADMIN_PROC	
rpl_wal	pdb_promote	ADMIN_PROC	
CREATE DATABASE outline_db;
CREATE TABLE outline_db.t1(id int auto_increment primary key,
col1 int,
col2 varchar(100),
key ind_1(col1),
key ind_2(col2)) engine = Dstore;
CREATE TABLE outline_db.t2(id int auto_increment primary key,
col1 int,
col2 varchar(100),
key ind_1(col1),
key ind_2(col2)) engine = Dstore;
insert into outline_db.t1 values(1, 2, 'xpchild');
insert into outline_db.t2 values(1, 2, 'xpchild');
CREATE user 'u0'@'%';
grant all privileges on *.* to 'u0'@'%';
CREATE user 'u1'@'%';
grant all privileges on outline_db.* to 'u1'@'%';
grant all privileges on mysql.* to 'u1'@'%';
SHOW CREATE TABLE mysql.outline;
Table	Create Table
outline	CREATE TABLE `outline` (
  `Id` bigint NOT NULL AUTO_INCREMENT,
  `Schema_name` varchar(64) COLLATE utf8mb3_bin DEFAULT NULL,
  `Digest` varchar(64) COLLATE utf8mb3_bin NOT NULL,
  `Digest_text` longtext COLLATE utf8mb3_bin,
  `Type` enum('IGNORE INDEX','USE INDEX','FORCE INDEX','OPTIMIZER') CHARACTER SET utf8mb3 COLLATE utf8mb3_general_ci NOT NULL,
  `Scope` enum('','FOR JOIN','FOR ORDER BY','FOR GROUP BY') CHARACTER SET utf8mb3 COLLATE utf8mb3_general_ci DEFAULT '',
  `State` enum('N','Y') CHARACTER SET utf8mb3 COLLATE utf8mb3_general_ci NOT NULL DEFAULT 'Y',
  `Position` bigint NOT NULL,
  `Hint` text COLLATE utf8mb3_bin NOT NULL,
  PRIMARY KEY (`Id`)
) ENGINE=InnoDB DEFAULT CHARSET=utf8mb3 COLLATE=utf8mb3_bin STATS_PERSISTENT=0 ROW_FORMAT=DYNAMIC COMMENT='Statement outline'
call dbms_outln.add_index_outline('outline_db', '', 1, 'USE INDEX', 'ind_1', '',
"select * from t1 where col1 = 2 and col2 = 'xpchild'");
ERROR HY000: command denied to current user
call dbms_outln.add_optimizer_outline('outline_db', '', 1, "/*+ SET_VAR(optimizer_switch = 'mrr_cost_based=off') SET_VAR(max_heap_table_size = 1G) */",
"select * from t1 where col1 = 2 and col2 = 'xpchild'");
ERROR HY000: command denied to current user
call dbms_outln.flush_outline();
ERROR HY000: command denied to current user
call dbms_outln.del_outline(1);
ERROR HY000: command denied to current user
call dbms_outln.preview_outline('outline_db',
"select * from t1 where col1 = 2 and col2 = 'xxx'");
SCHEMA	DIGEST	BLOCK_TYPE	BLOCK_NAME	BLOCK	HINT
call dbms_outln.show_outline();
ID	SCHEMA	DIGEST	TYPE	SCOPE	POS	HINT	HIT	OVERFLOW	DIGEST_TEXT
call dbms_outln.add_index_outline('outline_db', '', 1, 'USE INDEX', 'ind_1', '',
"select * from t1 where col1 = 2 and col2 = 'xpchild'");
call dbms_outln.add_optimizer_outline('outline_db', '', 1, "/*+ SET_VAR(optimizer_switch = 'mrr_cost_based=off') SET_VAR(max_heap_table_size = 1G) */",
"select * from t1 where col1 = 2 and col2 = 'xpchild'");
call dbms_outln.flush_outline();
call dbms_outln.del_outline(1);
call dbms_outln.preview_outline('outline_db',
"select * from t1 where col1 = 2 and col2 = 'xxx'");
SCHEMA	DIGEST	BLOCK_TYPE	BLOCK_NAME	BLOCK	HINT
outline_db	c3fa7558f4dd3dd0713428fbd60beda118f35ed9c447ce58b2bb9239539fab76	QUERY		1	/*+ SET_VAR(optimizer_switch='mrr_cost_based=off') SET_VAR(max_heap_table_size=1073741824) */ 
call dbms_outln.show_outline();
ID	SCHEMA	DIGEST	TYPE	SCOPE	POS	HINT	HIT	OVERFLOW	DIGEST_TEXT
#	outline_db	c3fa7558f4dd3dd0713428fbd60beda118f35ed9c447ce58b2bb9239539fab76	OPTIMIZER		1	/*+ SET_VAR(optimizer_switch = 'mrr_cost_based=off') SET_VAR(max_heap_table_size = 1G) */	1	0	SELECT * FROM `t1` WHERE `col1` = ? AND `col2` = ?
truncate TABLE mysql.outline;
call dbms_outln.flush_outline();
call dbms_outln.add_index_outline('outline_db', '', 1, 'USE INDEX', 'ind_1', '',
"select * from t1 where col1 = 2 and col2 = 'xpchild'");
call dbms_outln.add_optimizer_outline('outline_db', '', 1, "/*+ SET_VAR(optimizer_switch = 'mrr_cost_based=off') SET_VAR(max_heap_table_size = 1G) */",
"select * from t1 where col1 = 2 and col2 = 'xpchild'");
call dbms_outln.show_outline();
ID	SCHEMA	DIGEST	TYPE	SCOPE	POS	HINT	HIT	OVERFLOW	DIGEST_TEXT
#	outline_db	c3fa7558f4dd3dd0713428fbd60beda118f35ed9c447ce58b2bb9239539fab76	OPTIMIZER		1	/*+ SET_VAR(optimizer_switch = 'mrr_cost_based=off') SET_VAR(max_heap_table_size = 1G) */	0	0	SELECT * FROM `t1` WHERE `col1` = ? AND `col2` = ?
#	outline_db	c3fa7558f4dd3dd0713428fbd60beda118f35ed9c447ce58b2bb9239539fab76	USE INDEX		1	ind_1	0	0	SELECT * FROM `t1` WHERE `col1` = ? AND `col2` = ?
call dbms_outln.preview_outline('outline_db',
"select * from t1 where col1 = 2 and col2 = 'xxx'");
SCHEMA	DIGEST	BLOCK_TYPE	BLOCK_NAME	BLOCK	HINT
outline_db	c3fa7558f4dd3dd0713428fbd60beda118f35ed9c447ce58b2bb9239539fab76	TABLE	t1	1	USE INDEX (`ind_1`)
outline_db	c3fa7558f4dd3dd0713428fbd60beda118f35ed9c447ce58b2bb9239539fab76	QUERY		1	/*+ SET_VAR(optimizer_switch='mrr_cost_based=off') SET_VAR(max_heap_table_size=1073741824) */ 
call dbms_outln.del_outline(1);
call dbms_outln.show_outline();
ID	SCHEMA	DIGEST	TYPE	SCOPE	POS	HINT	HIT	OVERFLOW	DIGEST_TEXT
#	outline_db	c3fa7558f4dd3dd0713428fbd60beda118f35ed9c447ce58b2bb9239539fab76	OPTIMIZER		1	/*+ SET_VAR(optimizer_switch = 'mrr_cost_based=off') SET_VAR(max_heap_table_size = 1G) */	1	0	SELECT * FROM `t1` WHERE `col1` = ? AND `col2` = ?
truncate TABLE mysql.outline;
call dbms_outln.flush_outline();
call dbms_outln.add_index_outline('outline_db', 1, 'USE INDEX', 'ind_1', '',
"select * from t1 where col1 = 2 and col2 = 'xpchild'");
ERROR 42000: Incorrect number of arguments for PROCEDURE dbms_outln.add_index_outline; expected 7, got 6
call dbms_outln.add_index_outline('outline_db', 2, 0, 'USE INDEX', 'ind_1', '',
"select * from t1 where col1 = 2 and col2 = 'xpchild'");
ERROR HY000: Incorrect parameters (pos is 2) to native procedure 'dbms_outln.add_index_outline.
call dbms_outln.add_index_outline('outline_db', '', 1, 'USE xxx', 'ind_1', '',
"select * from t1 where col1 = 2 and col2 = 'xpchild'");
ERROR HY000: Statement outline 0 is not valid when add index outline since Outline type or position is invalid
call dbms_outln.add_index_outline('outline_db', '', 1, 'USE INDEX', 'ind_1', 'FOR
                                  ORDER', "select * from t1 where col1 = 2 and col2 = 'xpchild'");
ERROR HY000: Statement outline 0 is not valid when add index outline since Outline index's hint, digest, or scope is invalid
call dbms_outln.add_index_outline('outline_db', 'a7558f4dd3dd0713428fbd60beda118f35ed9c447ce58b2bb9239539fab76',
0, 'USE INDEX', 'ind_1, ind_2', 'FOR ORDER BY', "select * from t1 where col1 = 2 and col2 = 'xpchild'");
ERROR HY000: Statement outline digest didn't match between a7558f4dd3dd0713428fbd60beda118f35ed9c447ce58b2bb9239539fab76 and c3fa7558f4dd3dd0713428fbd60beda118f35ed9c447ce58b2bb9239539fab76
call dbms_outln.add_index_outline('outline_db', '', 1, 'USE INDEX', 'ind_1', 'FOR
                                  ORDER', "select * t1 where col1 = 2 and col2 = 'xpchild'");
ERROR HY000: Statement outline query parse error: You have an error in your SQL syntax; check the manual that corresponds to your MySQL server version for the right syntax to use near 't1 where col1 = 2 and col2 = 'xpchild'' at line 1
call dbms_outln.add_index_outline('outline_db', '', 1, 'USE INDEX', 'ind_1, ind_2',
'FOR ORDER BY', "select * from t1 where col1 = 2 and col2 = 'xpchild'");
call dbms_outln.show_outline();
ID	SCHEMA	DIGEST	TYPE	SCOPE	POS	HINT	HIT	OVERFLOW	DIGEST_TEXT
#	outline_db	c3fa7558f4dd3dd0713428fbd60beda118f35ed9c447ce58b2bb9239539fab76	USE INDEX	FOR ORDER BY	1	ind_1, ind_2	0	0	SELECT * FROM `t1` WHERE `col1` = ? AND `col2` = ?
select * from mysql.outline;
Id	Schema_name	Digest	Digest_text	Type	Scope	State	Position	Hint
#	outline_db	c3fa7558f4dd3dd0713428fbd60beda118f35ed9c447ce58b2bb9239539fab76	SELECT * FROM `t1` WHERE `col1` = ? AND `col2` = ?	USE INDEX	FOR ORDER BY	Y	1	ind_1, ind_2
delete from mysql.outline;
call dbms_outln.flush_outline();
call dbms_outln.show_outline();
ID	SCHEMA	DIGEST	TYPE	SCOPE	POS	HINT	HIT	OVERFLOW	DIGEST_TEXT
call dbms_outln.add_optimizer_outline('outline_db', 1, 'OPTIMIZER', 'ind_1', '',
"select * from t1 where col1 = 2 and col2 = 'xpchild'");
ERROR 42000: Incorrect number of arguments for PROCEDURE dbms_outln.add_optimizer_outline; expected 5, got 6
call dbms_outln.add_optimizer_outline('outline_db', 2, 0, 'OPTIMIZER', 'ind_1', '',
"select * from t1 where col1 = 2 and col2 = 'xpchild'");
ERROR 42000: Incorrect number of arguments for PROCEDURE dbms_outln.add_optimizer_outline; expected 5, got 7
call dbms_outln.add_optimizer_outline('outline_db', '', 1, '/*+ EXECUTION_TIME(1000) */',
"select * from t1 where col1 = 2 and col2 = 'xpchild'");
ERROR HY000: Statement outline optimizer hint parse error: /*+ EXECUTION_TIME(1000) */
call dbms_outln.add_optimizer_outline('outline_db', '', 1, '/*+ MAX_EXECUTION_TIME(1000) */',
"select * from t1 where col1 = 2 and col2 = 'xpchild'");
call dbms_outln.show_outline();
ID	SCHEMA	DIGEST	TYPE	SCOPE	POS	HINT	HIT	OVERFLOW	DIGEST_TEXT
#	outline_db	c3fa7558f4dd3dd0713428fbd60beda118f35ed9c447ce58b2bb9239539fab76	OPTIMIZER		1	/*+ MAX_EXECUTION_TIME(1000) */	0	0	SELECT * FROM `t1` WHERE `col1` = ? AND `col2` = ?
select * from mysql.outline;
Id	Schema_name	Digest	Digest_text	Type	Scope	State	Position	Hint
#	outline_db	c3fa7558f4dd3dd0713428fbd60beda118f35ed9c447ce58b2bb9239539fab76	SELECT * FROM `t1` WHERE `col1` = ? AND `col2` = ?	OPTIMIZER		Y	1	/*+ MAX_EXECUTION_TIME(1000) */
delete from mysql.outline;
call dbms_outln.flush_outline();
call dbms_outln.add_index_outline('outline_db', '', 1, 'USE INDEX', 'ind_1, ind_2',
'FOR ORDER BY', "select * from t1 where col1 = 2 and col2 = 'xpchild'");
call dbms_outln.add_optimizer_outline('outline_db', '', 1, '/*+ MAX_EXECUTION_TIME(1000) */',
"select * from t1 where col1 = 2 and col2 = 'xpchild'");
alter TABLE mysql.outline add col1 int;
call dbms_outln.add_index_outline('outline_db', '', 1, 'USE INDEX', 'ind_1, ind_2',
'FOR ORDER BY', "select * from t1 where col1 = 2 and col2 = 'xpchild'");
ERROR HY000: Cannot load from mysql.outline. The table is probably corrupted
call dbms_outln.add_optimizer_outline('outline_db', '', 1, '/*+ MAX_EXECUTION_TIME(1000) */',
"select * from t1 where col1 = 2 and col2 = 'xpchild'");
ERROR HY000: Cannot load from mysql.outline. The table is probably corrupted
call dbms_outln.flush_outline();
ERROR HY000: Cannot load from mysql.outline. The table is probably corrupted
call dbms_outln.del_outline(11111);
ERROR HY000: Cannot load from mysql.outline. The table is probably corrupted
call dbms_outln.show_outline();
ID	SCHEMA	DIGEST	TYPE	SCOPE	POS	HINT	HIT	OVERFLOW	DIGEST_TEXT
4	outline_db	c3fa7558f4dd3dd0713428fbd60beda118f35ed9c447ce58b2bb9239539fab76	OPTIMIZER		1	/*+ MAX_EXECUTION_TIME(1000) */	0	0	SELECT * FROM `t1` WHERE `col1` = ? AND `col2` = ?
3	outline_db	c3fa7558f4dd3dd0713428fbd60beda118f35ed9c447ce58b2bb9239539fab76	USE INDEX	FOR ORDER BY	1	ind_1, ind_2	0	0	SELECT * FROM `t1` WHERE `col1` = ? AND `col2` = ?
use outline_db;
explain select * from t1 where col1 = 2 and col2 = 'xpchild';
id	select_type	table	partitions	type	possible_keys	key	key_len	ref	rows	filtered	Extra
1	SIMPLE	t1	NULL	ref	ind_1,ind_2	ind_1	5	const	1	100.00	Using where
Warnings:
Note	1003	/* select#1 */ select /*+ MAX_EXECUTION_TIME(1000) */ `outline_db`.`t1`.`id` AS `id`,`outline_db`.`t1`.`col1` AS `col1`,`outline_db`.`t1`.`col2` AS `col2` from `outline_db`.`t1` USE INDEX FOR ORDER BY (`ind_1`) USE INDEX FOR ORDER BY (`ind_2`) where ((`outline_db`.`t1`.`col2` = 'xpchild') and (`outline_db`.`t1`.`col1` = 2))
alter TABLE mysql.outline drop column col1;
delete from mysql.outline;
call dbms_outln.flush_outline();
call dbms_outln.del_outline(123456);
Warnings:
Warning	8038	Statement outline 123456 is not found in table
Warning	8038	Statement outline 123456 is not found in cache
call dbms_outln.add_index_outline('outline_db', '', 1, 'USE INDEX', 'ind_1, ind_2',
'FOR ORDER BY', "select * from t1 where col1 = 2 and col2 = 'xpchild'");
call dbms_outln.add_optimizer_outline('outline_db', '', 1, '/*+ MAX_EXECUTION_TIME(1000) */',
"select * from t1 where col1 = 2 and col2 = 'xpchild'");
call dbms_outln.show_outline();
ID	SCHEMA	DIGEST	TYPE	SCOPE	POS	HINT	HIT	OVERFLOW	DIGEST_TEXT
#	outline_db	c3fa7558f4dd3dd0713428fbd60beda118f35ed9c447ce58b2bb9239539fab76	OPTIMIZER		1	/*+ MAX_EXECUTION_TIME(1000) */	0	0	SELECT * FROM `t1` WHERE `col1` = ? AND `col2` = ?
#	outline_db	c3fa7558f4dd3dd0713428fbd60beda118f35ed9c447ce58b2bb9239539fab76	USE INDEX	FOR ORDER BY	1	ind_1, ind_2	0	0	SELECT * FROM `t1` WHERE `col1` = ? AND `col2` = ?
update mysql.outline set  hint ='xxxx' where type ='OPTIMIZER';
call dbms_outln.flush_outline();
Warnings:
Warning	8034	Statement outline 6 is not valid when read outline since parse optimizer hint error
use outline_db;
explain select * from t1 where col1 = 2 and col2 = 'xpchild';
id	select_type	table	partitions	type	possible_keys	key	key_len	ref	rows	filtered	Extra
1	SIMPLE	t1	NULL	ref	ind_1,ind_2	ind_1	5	const	1	100.00	Using where
Warnings:
Note	1003	/* select#1 */ select `outline_db`.`t1`.`id` AS `id`,`outline_db`.`t1`.`col1` AS `col1`,`outline_db`.`t1`.`col2` AS `col2` from `outline_db`.`t1` USE INDEX FOR ORDER BY (`ind_1`) USE INDEX FOR ORDER BY (`ind_2`) where ((`outline_db`.`t1`.`col2` = 'xpchild') and (`outline_db`.`t1`.`col1` = 2))
delete from mysql.outline;
call dbms_outln.flush_outline();
call dbms_outln.add_index_outline('outline_db', '', 1, 'USE INDEX', 'ind_2',
'', "select * from t1 where col1 = 1 and col2='xpchild'");
call dbms_outln.add_index_outline('outline_db', '', 1, 'USE INDEX', 'ind_2',
'', "select * from t2 where col1 = 1 and col2='xpchild';");
explain select * from t1 where col1 = 1 and col2='xpchild';
id	select_type	table	partitions	type	possible_keys	key	key_len	ref	rows	filtered	Extra
1	SIMPLE	t1	NULL	ref	ind_2	ind_2	403	const	1	100.00	Using where
Warnings:
Note	1003	/* select#1 */ select `outline_db`.`t1`.`id` AS `id`,`outline_db`.`t1`.`col1` AS `col1`,`outline_db`.`t1`.`col2` AS `col2` from `outline_db`.`t1` USE INDEX (`ind_2`) where ((`outline_db`.`t1`.`col2` = 'xpchild') and (`outline_db`.`t1`.`col1` = 1))
explain select * from t2 where col1 = 1 and col2='xpchild';
id	select_type	table	partitions	type	possible_keys	key	key_len	ref	rows	filtered	Extra
1	SIMPLE	t2	NULL	ref	ind_2	ind_2	403	const	1	100.00	Using where
Warnings:
Note	1003	/* select#1 */ select `outline_db`.`t2`.`id` AS `id`,`outline_db`.`t2`.`col1` AS `col1`,`outline_db`.`t2`.`col2` AS `col2` from `outline_db`.`t2` USE INDEX (`ind_2`) where ((`outline_db`.`t2`.`col2` = 'xpchild') and (`outline_db`.`t2`.`col1` = 1))
explain select * from t1 where col1 = 1 and col2='xpchild';$
id	select_type	table	partitions	type	possible_keys	key	key_len	ref	rows	filtered	Extra
1	SIMPLE	t1	NULL	ref	ind_2	ind_2	403	const	1	100.00	Using where
Warnings:
Note	1003	/* select#1 */ select `outline_db`.`t1`.`id` AS `id`,`outline_db`.`t1`.`col1` AS `col1`,`outline_db`.`t1`.`col2` AS `col2` from `outline_db`.`t1` USE INDEX (`ind_2`) where ((`outline_db`.`t1`.`col2` = 'xpchild') and (`outline_db`.`t1`.`col1` = 1))
explain select * from t2 where col1 = 1 and col2='xpchild';$
id	select_type	table	partitions	type	possible_keys	key	key_len	ref	rows	filtered	Extra
1	SIMPLE	t2	NULL	ref	ind_2	ind_2	403	const	1	100.00	Using where
Warnings:
Note	1003	/* select#1 */ select `outline_db`.`t2`.`id` AS `id`,`outline_db`.`t2`.`col1` AS `col1`,`outline_db`.`t2`.`col2` AS `col2` from `outline_db`.`t2` USE INDEX (`ind_2`) where ((`outline_db`.`t2`.`col2` = 'xpchild') and (`outline_db`.`t2`.`col1` = 1))
call dbms_outln.show_outline();
ID	SCHEMA	DIGEST	TYPE	SCOPE	POS	HINT	HIT	OVERFLOW	DIGEST_TEXT
#	outline_db	c3fa7558f4dd3dd0713428fbd60beda118f35ed9c447ce58b2bb9239539fab76	USE INDEX		1	ind_2	2	0	SELECT * FROM `t1` WHERE `col1` = ? AND `col2` = ?
#	outline_db	7d34b970640634d8b412a315168c88b2ed240379e3ea5fc7f897e0ec02434028	USE INDEX		1	ind_2	2	0	SELECT * FROM `t2` WHERE `col1` = ? AND `col2` = ?
call dbms_outln.preview_outline("outline_db", "select * from t2 where col1 = 1 and col2='xpchild'");
SCHEMA	DIGEST	BLOCK_TYPE	BLOCK_NAME	BLOCK	HINT
outline_db	7d34b970640634d8b412a315168c88b2ed240379e3ea5fc7f897e0ec02434028	TABLE	t2	1	USE INDEX (`ind_2`)
call dbms_outln.preview_outline("outline_db", "select * from t2 where col1 = 1 and col2='xpchild';");
SCHEMA	DIGEST	BLOCK_TYPE	BLOCK_NAME	BLOCK	HINT
outline_db	7d34b970640634d8b412a315168c88b2ed240379e3ea5fc7f897e0ec02434028	TABLE	t2	1	USE INDEX (`ind_2`)
call dbms_outln.preview_outline("outline_db", "select * from t2 where col1 = 1 and col2='xpchild';;;");
SCHEMA	DIGEST	BLOCK_TYPE	BLOCK_NAME	BLOCK	HINT
outline_db	7d34b970640634d8b412a315168c88b2ed240379e3ea5fc7f897e0ec02434028	TABLE	t2	1	USE INDEX (`ind_2`)
CALL dbms_outln.add_index_outline('outline_db', '', 1, 'USE INDEX', 'ind_1', '',
"select * from t1 where t1.col1 =1 and t1.col2 ='xpchild'");
CALL dbms_outln.preview_outline('outline_db', "select * from t1 where t1.col1 =1 and t1.col2 ='xpchild'");
SCHEMA	DIGEST	BLOCK_TYPE	BLOCK_NAME	BLOCK	HINT
outline_db	b4369611be7ab2d27c85897632576a04bc08f50b928a1d735b62d0a140628c4c	TABLE	t1	1	USE INDEX (`ind_1`)
use outline_db;
EXPLAIN SELECT * FROM t1 WHERE t1.col1 =2 AND t1.col2 ='xpchild';
id	select_type	table	partitions	type	possible_keys	key	key_len	ref	rows	filtered	Extra
1	SIMPLE	t1	NULL	ref	ind_1	ind_1	5	const	1	100.00	Using where
Warnings:
Note	1003	/* select#1 */ select `outline_db`.`t1`.`id` AS `id`,`outline_db`.`t1`.`col1` AS `col1`,`outline_db`.`t1`.`col2` AS `col2` from `outline_db`.`t1` USE INDEX (`ind_1`) where ((`outline_db`.`t1`.`col2` = 'xpchild') and (`outline_db`.`t1`.`col1` = 2))
EXPLAIN FORMAT = JSON SELECT * FROM t1 WHERE t1.col1 =2 AND t1.col2 ='xpchild';
EXPLAIN
{
  "query_block": {
    "select_id": 1,
    "cost_info": {
      "query_cost": "0.35"
    },
    "table": {
      "table_name": "t1",
      "access_type": "ref",
      "possible_keys": [
        "ind_1"
      ],
      "key": "ind_1",
      "used_key_parts": [
        "col1"
      ],
      "key_length": "5",
      "ref": [
        "const"
      ],
      "rows_examined_per_scan": 1,
      "rows_produced_per_join": 1,
      "filtered": "100.00",
      "cost_info": {
        "read_cost": "0.25",
        "eval_cost": "0.10",
        "prefix_cost": "0.35",
        "data_read_per_join": "416"
      },
      "used_columns": [
        "id",
        "col1",
        "col2"
      ],
      "attached_condition": "(`outline_db`.`t1`.`col2` = 'xpchild')"
    }
  }
}
Warnings:
Note	1003	/* select#1 */ select `outline_db`.`t1`.`id` AS `id`,`outline_db`.`t1`.`col1` AS `col1`,`outline_db`.`t1`.`col2` AS `col2` from `outline_db`.`t1` USE INDEX (`ind_1`) where ((`outline_db`.`t1`.`col2` = 'xpchild') and (`outline_db`.`t1`.`col1` = 2))
EXPLAIN FORMAT = TRADITIONAL SELECT * FROM t1 WHERE t1.col1 =2 AND t1.col2 ='xpchild';
id	select_type	table	partitions	type	possible_keys	key	key_len	ref	rows	filtered	Extra
1	SIMPLE	t1	NULL	ref	ind_1	ind_1	5	const	1	100.00	Using where
Warnings:
Note	1003	/* select#1 */ select `outline_db`.`t1`.`id` AS `id`,`outline_db`.`t1`.`col1` AS `col1`,`outline_db`.`t1`.`col2` AS `col2` from `outline_db`.`t1` USE INDEX (`ind_1`) where ((`outline_db`.`t1`.`col2` = 'xpchild') and (`outline_db`.`t1`.`col1` = 2))
EXPLAIN FORMAT = 'JsOn' SELECT * FROM t1 WHERE t1.col1 =2 AND t1.col2 ='xpchild';
EXPLAIN
{
  "query_block": {
    "select_id": 1,
    "cost_info": {
      "query_cost": "0.35"
    },
    "table": {
      "table_name": "t1",
      "access_type": "ref",
      "possible_keys": [
        "ind_1"
      ],
      "key": "ind_1",
      "used_key_parts": [
        "col1"
      ],
      "key_length": "5",
      "ref": [
        "const"
      ],
      "rows_examined_per_scan": 1,
      "rows_produced_per_join": 1,
      "filtered": "100.00",
      "cost_info": {
        "read_cost": "0.25",
        "eval_cost": "0.10",
        "prefix_cost": "0.35",
        "data_read_per_join": "416"
      },
      "used_columns": [
        "id",
        "col1",
        "col2"
      ],
      "attached_condition": "(`outline_db`.`t1`.`col2` = 'xpchild')"
    }
  }
}
Warnings:
Note	1003	/* select#1 */ select `outline_db`.`t1`.`id` AS `id`,`outline_db`.`t1`.`col1` AS `col1`,`outline_db`.`t1`.`col2` AS `col2` from `outline_db`.`t1` USE INDEX (`ind_1`) where ((`outline_db`.`t1`.`col2` = 'xpchild') and (`outline_db`.`t1`.`col1` = 2))
EXPLAIN FORMAT = 'TrAdItIoNaL' SELECT * FROM t1 WHERE t1.col1 =2 AND t1.col2 ='xpchild';
id	select_type	table	partitions	type	possible_keys	key	key_len	ref	rows	filtered	Extra
1	SIMPLE	t1	NULL	ref	ind_1	ind_1	5	const	1	100.00	Using where
Warnings:
Note	1003	/* select#1 */ select `outline_db`.`t1`.`id` AS `id`,`outline_db`.`t1`.`col1` AS `col1`,`outline_db`.`t1`.`col2` AS `col2` from `outline_db`.`t1` USE INDEX (`ind_1`) where ((`outline_db`.`t1`.`col2` = 'xpchild') and (`outline_db`.`t1`.`col1` = 2))
truncate TABLE mysql.outline;
call dbms_outln.flush_outline();
CALL dbms_outln.add_index_outline('outline_db', '', 1, 'USE INDEX', 'ind_1', '',
"select * from t1 where t1.col1 =1 and t1.col2 ='xpchild'");
SELECT * FROM mysql.outline;
Id	Schema_name	Digest	Digest_text	Type	Scope	State	Position	Hint
1	outline_db	b4369611be7ab2d27c85897632576a04bc08f50b928a1d735b62d0a140628c4c	SELECT * FROM `t1` WHERE `t1` . `col1` = ? AND `t1` . `col2` = ?	USE INDEX		Y	1	ind_1
use outline_db;
EXPLAIN SELECT * FROM t1 WHERE t1.col1 =2 AND t1.col2 ='xpchild';
id	select_type	table	partitions	type	possible_keys	key	key_len	ref	rows	filtered	Extra
1	SIMPLE	t1	NULL	ref	ind_1	ind_1	5	const	1	100.00	Using where
Warnings:
Note	1003	/* select#1 */ select `outline_db`.`t1`.`id` AS `id`,`outline_db`.`t1`.`col1` AS `col1`,`outline_db`.`t1`.`col2` AS `col2` from `outline_db`.`t1` USE INDEX (`ind_1`) where ((`outline_db`.`t1`.`col2` = 'xpchild') and (`outline_db`.`t1`.`col1` = 2))
# restart
SELECT * FROM mysql.outline;
Id	Schema_name	Digest	Digest_text	Type	Scope	State	Position	Hint
1	outline_db	b4369611be7ab2d27c85897632576a04bc08f50b928a1d735b62d0a140628c4c	SELECT * FROM `t1` WHERE `t1` . `col1` = ? AND `t1` . `col2` = ?	USE INDEX		Y	1	ind_1
use outline_db;
EXPLAIN SELECT * FROM t1 WHERE t1.col1 =2 AND t1.col2 ='xpchild';
id	select_type	table	partitions	type	possible_keys	key	key_len	ref	rows	filtered	Extra
1	SIMPLE	t1	NULL	ref	ind_1	ind_1	5	const	1	100.00	Using where
Warnings:
Note	1003	/* select#1 */ select `outline_db`.`t1`.`id` AS `id`,`outline_db`.`t1`.`col1` AS `col1`,`outline_db`.`t1`.`col2` AS `col2` from `outline_db`.`t1` USE INDEX (`ind_1`) where ((`outline_db`.`t1`.`col2` = 'xpchild') and (`outline_db`.`t1`.`col1` = 2))
truncate TABLE mysql.outline;
call dbms_outln.flush_outline();
use outline_db;
call dbms_outln.preview_outline("outline_db", "");
ERROR HY000: Statement outline preview input is invalid, empty input detected
call dbms_outln.preview_outline("outline_db", "  ");
ERROR HY000: Statement outline preview input is invalid, empty input detected
call dbms_outln.preview_outline("", "");
ERROR HY000: Statement outline preview input is invalid, empty input detected
call dbms_outln.preview_outline(' ', '');
ERROR HY000: Statement outline preview input is invalid, empty input detected
call dbms_outln.preview_outline(' ', ' ');
ERROR HY000: Statement outline preview input is invalid, empty input detected
drop DATABASE outline_db;
drop user 'u0'@'%';
drop user 'u1'@'%';
