SET @saved_rds_extended_partitions_enabled=@@rds_extended_partitions_enabled;
SET global rds_extended_partitions_enabled = true;
#
# Verify hash-range
#
CREATE TABLE t3 (
id INT NOT NULL,
store_id INT NOT NULL
)
PARTITION BY  KEY (store_id) 
SUBPARTITION BY RANGE(id) (
PARTITION p0 (
SUBPARTITION q1 VALUES LESS THAN (4),
SUBPARTITION q2 VALUES LESS THAN (10)
),
PARTITION p1 (
SUBPARTITION q3 VALUES LESS THAN (15),
SUBPARTITION q4 VALUES LESS THAN (20)
)
);
INSERT INTO t3 VALUES(1,3);
INSERT INTO t3 VALUES(14, 9);
ERROR HY000: Table has no partition for value 14
INSERT INTO t3 VALUES(9, 8);
ALTER TABLE t3 ADD PARTITION (PARTITION p3 (SUBPARTITION q5 VALUES LESS THAN(15), SUBPARTITION q6 VALUES LESS THAN(19)));
SHOW CREATE TABLE t3;
Table	Create Table
t3	CREATE TABLE `t3` (
  `id` int NOT NULL,
  `store_id` int NOT NULL
) ENGINE=Dstore DEFAULT CHARSET=utf8mb4 COLLATE=utf8mb4_0900_ai_ci
/*!50100 PARTITION BY KEY (store_id)
SUBPARTITION BY RANGE (`id`)
(PARTITION p0
 (SUBPARTITION q1 VALUES LESS THAN (4) ENGINE = Dstore,
  SUBPARTITION q2 VALUES LESS THAN (10) ENGINE = Dstore),
 PARTITION p1
 (SUBPARTITION q3 VALUES LESS THAN (15) ENGINE = Dstore,
  SUBPARTITION q4 VALUES LESS THAN (20) ENGINE = Dstore),
 PARTITION p3
 (SUBPARTITION q5 VALUES LESS THAN (15) ENGINE = Dstore,
  SUBPARTITION q6 VALUES LESS THAN (19) ENGINE = Dstore)) */
ALTER TABLE t3 DROP PARTITION p0;
ERROR HY000: DROP PARTITION can only be used on RANGE/LIST partitions
SELECT * FROM t3;
id	store_id
1	3
9	8
DROP TABLE t3;
CREATE TABLE sales_range_range
(
dept_no     INT,
part_no     INT,
country     varchar(20),
date        DATE,
amount      INT
)
PARTITION BY  KEY(date, amount)
SUBPARTITION BY RANGE(month(date))
(
PARTITION p_2020 (
SUBPARTITION q1_2020 VALUES LESS THAN(4),
SUBPARTITION q2_2020 VALUES LESS THAN(7),
SUBPARTITION q3_2020 VALUES LESS THAN(10),
SUBPARTITION q4_2020 VALUES LESS THAN(13)
),
PARTITION p_2021 (
SUBPARTITION q1_2021 VALUES LESS THAN(4),
SUBPARTITION q2_2021 VALUES LESS THAN(7),
SUBPARTITION q3_2021 VALUES LESS THAN(10),
SUBPARTITION q4_2021 VALUES LESS THAN(13)
),
PARTITION p_2022 (
SUBPARTITION q1_2022 VALUES LESS THAN(4),
SUBPARTITION q2_2022 VALUES LESS THAN(7),
SUBPARTITION q3_2022 VALUES LESS THAN(10),
SUBPARTITION q4_2022 VALUES LESS THAN(13)
)
);
ALTER TABLE sales_range_range ADD PARTITION (
PARTITION p_2025  (
SUBPARTITION q1_2015 VALUES LESS THAN(4),
SUBPARTITION q2_2015 VALUES LESS THAN(7),
SUBPARTITION q3_2015 VALUES LESS THAN(10),
SUBPARTITION q4_2015 VALUES LESS THAN(13)
)
);
SHOW CREATE TABLE sales_range_range;
Table	Create Table
sales_range_range	CREATE TABLE `sales_range_range` (
  `dept_no` int DEFAULT NULL,
  `part_no` int DEFAULT NULL,
  `country` varchar(20) DEFAULT NULL,
  `date` date DEFAULT NULL,
  `amount` int DEFAULT NULL
) ENGINE=Dstore DEFAULT CHARSET=utf8mb4 COLLATE=utf8mb4_0900_ai_ci
/*!50100 PARTITION BY KEY (`date`,amount)
SUBPARTITION BY RANGE (month(`date`))
(PARTITION p_2020
 (SUBPARTITION q1_2020 VALUES LESS THAN (4) ENGINE = Dstore,
  SUBPARTITION q2_2020 VALUES LESS THAN (7) ENGINE = Dstore,
  SUBPARTITION q3_2020 VALUES LESS THAN (10) ENGINE = Dstore,
  SUBPARTITION q4_2020 VALUES LESS THAN (13) ENGINE = Dstore),
 PARTITION p_2021
 (SUBPARTITION q1_2021 VALUES LESS THAN (4) ENGINE = Dstore,
  SUBPARTITION q2_2021 VALUES LESS THAN (7) ENGINE = Dstore,
  SUBPARTITION q3_2021 VALUES LESS THAN (10) ENGINE = Dstore,
  SUBPARTITION q4_2021 VALUES LESS THAN (13) ENGINE = Dstore),
 PARTITION p_2022
 (SUBPARTITION q1_2022 VALUES LESS THAN (4) ENGINE = Dstore,
  SUBPARTITION q2_2022 VALUES LESS THAN (7) ENGINE = Dstore,
  SUBPARTITION q3_2022 VALUES LESS THAN (10) ENGINE = Dstore,
  SUBPARTITION q4_2022 VALUES LESS THAN (13) ENGINE = Dstore),
 PARTITION p_2025
 (SUBPARTITION q1_2015 VALUES LESS THAN (4) ENGINE = Dstore,
  SUBPARTITION q2_2015 VALUES LESS THAN (7) ENGINE = Dstore,
  SUBPARTITION q3_2015 VALUES LESS THAN (10) ENGINE = Dstore,
  SUBPARTITION q4_2015 VALUES LESS THAN (13) ENGINE = Dstore)) */
ALTER TABLE sales_range_range DROP PARTITION p_2025;
ERROR HY000: DROP PARTITION can only be used on RANGE/LIST partitions
SHOW CREATE TABLE sales_range_range;
Table	Create Table
sales_range_range	CREATE TABLE `sales_range_range` (
  `dept_no` int DEFAULT NULL,
  `part_no` int DEFAULT NULL,
  `country` varchar(20) DEFAULT NULL,
  `date` date DEFAULT NULL,
  `amount` int DEFAULT NULL
) ENGINE=Dstore DEFAULT CHARSET=utf8mb4 COLLATE=utf8mb4_0900_ai_ci
/*!50100 PARTITION BY KEY (`date`,amount)
SUBPARTITION BY RANGE (month(`date`))
(PARTITION p_2020
 (SUBPARTITION q1_2020 VALUES LESS THAN (4) ENGINE = Dstore,
  SUBPARTITION q2_2020 VALUES LESS THAN (7) ENGINE = Dstore,
  SUBPARTITION q3_2020 VALUES LESS THAN (10) ENGINE = Dstore,
  SUBPARTITION q4_2020 VALUES LESS THAN (13) ENGINE = Dstore),
 PARTITION p_2021
 (SUBPARTITION q1_2021 VALUES LESS THAN (4) ENGINE = Dstore,
  SUBPARTITION q2_2021 VALUES LESS THAN (7) ENGINE = Dstore,
  SUBPARTITION q3_2021 VALUES LESS THAN (10) ENGINE = Dstore,
  SUBPARTITION q4_2021 VALUES LESS THAN (13) ENGINE = Dstore),
 PARTITION p_2022
 (SUBPARTITION q1_2022 VALUES LESS THAN (4) ENGINE = Dstore,
  SUBPARTITION q2_2022 VALUES LESS THAN (7) ENGINE = Dstore,
  SUBPARTITION q3_2022 VALUES LESS THAN (10) ENGINE = Dstore,
  SUBPARTITION q4_2022 VALUES LESS THAN (13) ENGINE = Dstore),
 PARTITION p_2025
 (SUBPARTITION q1_2015 VALUES LESS THAN (4) ENGINE = Dstore,
  SUBPARTITION q2_2015 VALUES LESS THAN (7) ENGINE = Dstore,
  SUBPARTITION q3_2015 VALUES LESS THAN (10) ENGINE = Dstore,
  SUBPARTITION q4_2015 VALUES LESS THAN (13) ENGINE = Dstore)) */
ALTER TABLE sales_range_range REORGANIZE PARTITION p_2021 INTO (
PARTITION p_2021_1 (
SUBPARTITION q1_2021_1 VALUES LESS THAN(4),
SUBPARTITION q2_2021_1 VALUES LESS THAN(7),
SUBPARTITION q3_2021_1 VALUES LESS THAN(10),
SUBPARTITION q4_2021_1 VALUES LESS THAN(13)
),
PARTITION p_2021_2 (
SUBPARTITION q1_2021_2 VALUES LESS THAN(4),
SUBPARTITION q2_2021_2 VALUES LESS THAN(7),
SUBPARTITION q3_2021_2 VALUES LESS THAN(10),
SUBPARTITION q4_2021_2 VALUES LESS THAN(13)
)
);
ERROR HY000: REORGANIZE PARTITION can only be used to reorganize partitions not to change their numbers
ALTER TABLE sales_range_range REORGANIZE PARTITION p_2021 INTO (
PARTITION p_2021_1 (
SUBPARTITION q1_2021_1 VALUES LESS THAN(4),
SUBPARTITION q2_2021_1 VALUES LESS THAN(7),
SUBPARTITION q3_2021_1 VALUES LESS THAN(10),
SUBPARTITION q4_2021_1 VALUES LESS THAN(13)
)
);
SHOW CREATE TABLE sales_range_range;
Table	Create Table
sales_range_range	CREATE TABLE `sales_range_range` (
  `dept_no` int DEFAULT NULL,
  `part_no` int DEFAULT NULL,
  `country` varchar(20) DEFAULT NULL,
  `date` date DEFAULT NULL,
  `amount` int DEFAULT NULL
) ENGINE=Dstore DEFAULT CHARSET=utf8mb4 COLLATE=utf8mb4_0900_ai_ci
/*!50100 PARTITION BY KEY (`date`,amount)
SUBPARTITION BY RANGE (month(`date`))
(PARTITION p_2020
 (SUBPARTITION q1_2020 VALUES LESS THAN (4) ENGINE = Dstore,
  SUBPARTITION q2_2020 VALUES LESS THAN (7) ENGINE = Dstore,
  SUBPARTITION q3_2020 VALUES LESS THAN (10) ENGINE = Dstore,
  SUBPARTITION q4_2020 VALUES LESS THAN (13) ENGINE = Dstore),
 PARTITION p_2021_1
 (SUBPARTITION q1_2021_1 VALUES LESS THAN (4) ENGINE = Dstore,
  SUBPARTITION q2_2021_1 VALUES LESS THAN (7) ENGINE = Dstore,
  SUBPARTITION q3_2021_1 VALUES LESS THAN (10) ENGINE = Dstore,
  SUBPARTITION q4_2021_1 VALUES LESS THAN (13) ENGINE = Dstore),
 PARTITION p_2022
 (SUBPARTITION q1_2022 VALUES LESS THAN (4) ENGINE = Dstore,
  SUBPARTITION q2_2022 VALUES LESS THAN (7) ENGINE = Dstore,
  SUBPARTITION q3_2022 VALUES LESS THAN (10) ENGINE = Dstore,
  SUBPARTITION q4_2022 VALUES LESS THAN (13) ENGINE = Dstore),
 PARTITION p_2025
 (SUBPARTITION q1_2015 VALUES LESS THAN (4) ENGINE = Dstore,
  SUBPARTITION q2_2015 VALUES LESS THAN (7) ENGINE = Dstore,
  SUBPARTITION q3_2015 VALUES LESS THAN (10) ENGINE = Dstore,
  SUBPARTITION q4_2015 VALUES LESS THAN (13) ENGINE = Dstore)) */
INSERT INTO sales_range_range(date) VALUES('2020-04-05'),('2020-08-06'),('2021-05-06');
SELECT * FROM sales_range_range;
dept_no	part_no	country	date	amount
NULL	NULL	NULL	2020-04-05	NULL
NULL	NULL	NULL	2021-05-06	NULL
NULL	NULL	NULL	2020-08-06	NULL
ALTER TABLE sales_range_range ANALYZE PARTITION q2_2021_1, q1_2022;
Table	Op	Msg_type	Msg_text
test.sales_range_range	analyze	status	OK
ALTER TABLE sales_range_range CHECK PARTITION q2_2021_1, q1_2022;
Table	Op	Msg_type	Msg_text
test.sales_range_range	check	status	OK
ALTER TABLE sales_range_range OPTIMIZE PARTITION q2_2021_1, q1_2022;
Table	Op	Msg_type	Msg_text
test.sales_range_range	optimize	note	Table does not support optimize on partitions. All partitions will be rebuilt and analyzed.
test.sales_range_range	optimize	status	OK
"REBUILD only adapts to partition but not SUBPARTITION"
ALTER TABLE sales_range_range REBUILD PARTITION p_2021_1;
ALTER TABLE sales_range_range REPAIR PARTITION q2_2021_1, q1_2022;
Table	Op	Msg_type	Msg_text
test.sales_range_range	repair	status	OK
ALTER TABLE sales_range_range TRUNCATE PARTITION q2_2021_1;
SELECT * FROM sales_range_range;
dept_no	part_no	country	date	amount
NULL	NULL	NULL	2020-08-06	NULL
ALTER TABLE sales_range_range TRUNCATE PARTITION p_2021_1;
SELECT * FROM sales_range_range;
dept_no	part_no	country	date	amount
ALTER TABLE sales_range_range REMOVE PARTITIONING;
SHOW CREATE TABLE sales_range_range;
Table	Create Table
sales_range_range	CREATE TABLE `sales_range_range` (
  `dept_no` int DEFAULT NULL,
  `part_no` int DEFAULT NULL,
  `country` varchar(20) DEFAULT NULL,
  `date` date DEFAULT NULL,
  `amount` int DEFAULT NULL
) ENGINE=Dstore DEFAULT CHARSET=utf8mb4 COLLATE=utf8mb4_0900_ai_ci
SELECT * FROM sales_range_range;
dept_no	part_no	country	date	amount
DROP TABLE sales_range_range;
CREATE TABLE sales_range_range
(
dept_no     INT,
part_no     INT,
country     varchar(20),
date        DATE,
amount      INT
)
PARTITION BY  KEY(date)
SUBPARTITION BY RANGE(month(date))
(
PARTITION p_2020 (
SUBPARTITION q1_2020 VALUES LESS THAN(4),
SUBPARTITION q2_2020 VALUES LESS THAN(7)
),
PARTITION p_2021 (
SUBPARTITION q1_2020 VALUES LESS THAN(4),
SUBPARTITION q2_2021 VALUES LESS THAN(7)
)
);
ERROR HY000: Duplicate partition name q1_2020
CREATE TABLE sales_range_range
(
dept_no     INT,
part_no     INT,
country     varchar(20),
date        DATE,
amount      INT
)
PARTITION BY  KEY(date)
SUBPARTITION BY RANGE(month(date))
(
PARTITION p_2020 (
SUBPARTITION q1_2020 VALUES LESS THAN(4),
SUBPARTITION q2_2020 VALUES LESS THAN(7)
),
PARTITION p_2021 (
SUBPARTITION q1_2021 VALUES LESS THAN(4)
)
);
ERROR 42000: Wrong number of subpartitions defined, mismatch with previous setting near '(
SUBPARTITION q1_2021 VALUES LESS THAN(4)
)
)' at line 16
CREATE TABLE sales_range_range3
(
dept_no     INT,
part_no     INT,
country     varchar(20),
date        DATE,
amount      INT
)
PARTITION BY  KEY(date)
SUBPARTITION BY RANGE(month(date))
(
PARTITION p_2020 
);
ERROR HY000: For RANGE partitions each partition must be defined
CREATE TABLE sales_range_range
(
dept_no     INT,
part_no     INT,
country     varchar(20),
date        DATE,
amount      INT
)
PARTITION BY  KEY(date)
SUBPARTITION BY RANGE(month(date))
(
PARTITION p_2020 (
SUBPARTITION q1_2020 VALUES LESS THAN(4),
SUBPARTITION q2_2020 VALUES LESS THAN(7)
),
PARTITION p_2021 (
SUBPARTITION q1_2021 VALUES LESS THAN(4),
SUBPARTITION q2_2021 VALUES LESS THAN(7)
)
);
INSERT INTO sales_range_range(date) VALUES('2021-5-23'),('2010-2-23');
ALTER TABLE sales_range_range ANALYZE PARTITION p_2020, p_2021;
Table	Op	Msg_type	Msg_text
test.sales_range_range	analyze	status	OK
SELECT partition_name, SUBPARTITION_name, table_rows from information_schema.partitions where table_name = 'sales_range_range';
PARTITION_NAME	SUBPARTITION_NAME	TABLE_ROWS
p_2020	q1_2020	1
p_2020	q2_2020	1
p_2021	q1_2021	0
p_2021	q2_2021	0
DROP TABLE sales_range_range;
CREATE TABLE sales_range_range
(
dept_no     INT,
part_no     INT,
country     varchar(20),
date        DATE,
amount      INT
)
PARTITION BY  KEY(date)
SUBPARTITION BY RANGE(month(date))
(
PARTITION p_2020(
SUBPARTITION q1_2020 VALUES LESS THAN(4),
SUBPARTITION q2_2020 VALUES LESS THAN(7)
),
PARTITION p_2021 (
SUBPARTITION q1_2021 VALUES LESS THAN(8),
SUBPARTITION q2_2021 VALUES LESS THAN(13)
)
);
DROP TABLE sales_range_range;
CREATE TABLE sales_range_columns_range
(
dept_no     INT,
part_no     INT,
country     varchar(20),
date        DATE,
amount      INT
)
PARTITION BY  KEY (dept_no, part_no)
SUBPARTITION BY RANGE COLUMNS(am)
(
PARTITION p1 (
SUBPARTITION q1_2019 VALUES LESS THAN(4),
SUBPARTITION q2_2019 VALUES LESS THAN(7)
),
PARTITION p2 (
SUBPARTITION q1_2020 VALUES LESS THAN(4),
SUBPARTITION q2_2020 VALUES LESS THAN(7)
)
);
ERROR HY000: Field in list of fields for partition function not found in table
CREATE TABLE sales_range_range
(
dept_no     INT,
part_no     INT,
country     varchar(20),
date        DATE,
amount      INT
)
PARTITION BY  KEY(date)
SUBPARTITION BY RANGE(month(date))
(
PARTITION p_2020 (
SUBPARTITION q1_2020 VALUES LESS THAN(4),
SUBPARTITION q2_2020 VALUES LESS THAN(7)
),
PARTITION p_2021 (
SUBPARTITION q1_2021 VALUES LESS THAN(8),
SUBPARTITION q2_2021 VALUES LESS THAN(13)
)
);
INSERT INTO sales_range_range PARTITION (p_2020) VALUES (1, 1, 'china', '2012-01-12', 1);
INSERT INTO sales_range_range PARTITION (q2_2020) VALUES (1, 1, 'china', '2012-08-12', 1);
ERROR HY000: Table has no partition for value 8
INSERT INTO sales_range_range PARTITION (p_2020,q2_2020) VALUES (1, 1, 'china', '2012-08-12', 1);
ERROR HY000: Table has no partition for value 8
SELECT * from sales_range_range;
dept_no	part_no	country	date	amount
1	1	china	2012-01-12	1
UPDATE sales_range_range partition(q1_2020) SET dept_no = dept_no + 1;
SELECT * from sales_range_range;
dept_no	part_no	country	date	amount
2	1	china	2012-01-12	1
DELETE FROM sales_range_range partition(q1_2020);
SELECT * from sales_range_range;
dept_no	part_no	country	date	amount
DROP TABLE sales_range_range;
CREATE TABLE sales_range_range
(
dept_no     INT,
part_no     INT,
country     varchar(20),
date        DATE,
amount      INT
)
PARTITION BY  KEY(date)
SUBPARTITION BY RANGE(month(date))
(
PARTITION p_2020(
SUBPARTITION q1_2020 VALUES LESS THAN(4),
SUBPARTITION q2_2020 VALUES LESS THAN(7)
),
PARTITION p_2021 (
SUBPARTITION q1_2021 VALUES LESS THAN(8),
SUBPARTITION q2_2021 VALUES LESS THAN(13)
)
);
ALTER TABLE sales_range_range ADD PARTITION (
PARTITION p_2022 (
SUBPARTITION q1_2022 VALUES LESS THAN(4),
SUBPARTITION q2_2022 VALUES LESS THAN(7),
SUBPARTITION q2_2022 VALUES LESS THAN(10),
SUBPARTITION q2_2022 VALUES LESS THAN(13)
)
);
ERROR HY000: Trying to Add partition(s) with wrong number of subpartitions
ALTER TABLE sales_range_range ADD PARTITION (
partition p_2022 (
SUBPARTITION q2_2022 VALUES LESS THAN(10),
SUBPARTITION q2_2022 VALUES LESS THAN(13)
)
);
ERROR HY000: Duplicate partition name q2_2022
ALTER TABLE sales_range_range add partition (
partition p_2022 (
SUBPARTITION q1_2022 VALUES LESS THAN(15),
SUBPARTITION q2_2022 VALUES LESS THAN(13)
)
);
ERROR HY000: VALUES LESS THAN value must be strictly increasing for each partition
ALTER TABLE sales_range_range add partition (
partition p_max (
SUBPARTITION q1_max VALUES LESS THAN(4),
SUBPARTITION q3_max VALUES LESS THAN(MAXVALUE) 
)
);
ALTER TABLE sales_range_range add partition (
partition p_2024 (
SUBPARTITION q3_2025 VALUES LESS THAN(10),
SUBPARTITION q4_2025 VALUES LESS THAN(13)
)
);
DROP table sales_range_range;
CREATE TABLE t1 (
`a` int ,
`b` int ,
Primary Key(a, b));
INSERT INTO t1 values(1,1),(2,1),(3,1),(4,1),(111,111),(3333,333);
ALTER TABLE t1 partition by  KEY(a) (
partition p0,
partition p1,
partition p2
);
ALTER TABLE t1 ANALYZE PARTITION p0, p1, p2;
Table	Op	Msg_type	Msg_text
test.t1	analyze	status	OK
select partition_name, SUBPARTITION_name, TABLE_rows from information_schema.partitions where table_name = 't1';
PARTITION_NAME	SUBPARTITION_NAME	TABLE_ROWS
p0	NULL	2
p1	NULL	2
p2	NULL	2
SELECT * FROM t1 partition(p0);
a	b
4	1
111	111
ALTER TABLE t1 partition by  KEY(a) SUBPARTITION by range(b) (
partition p0(
SUBPARTITION p0sp0 VALUES LESS THAN(6),
SUBPARTITION p0sp1 VALUES LESS THAN(1000)
),
partition p1(
SUBPARTITION p1sp0 VALUES LESS THAN(6),
SUBPARTITION p1sp1 VALUES LESS THAN(1000)
),
partition p2(
SUBPARTITION p2sp0 VALUES LESS THAN(6),
SUBPARTITION p2sp1 VALUES LESS THAN(1000)
)
);
DROP TABLE t1;
CREATE TABLE t1 (
`a` int ,
`b` int ,
Primary Key(a, b));
INSERT INTO t1 values(1,1),(2,1),(3,1),(4,1),(111,111),(3333,333);
ALTER TABLE t1 partition by  KEY(a) SUBPARTITION by range(b) (
partition p0(
SUBPARTITION p0sp0 VALUES LESS THAN(6),
SUBPARTITION p0sp1 VALUES LESS THAN(1000)
),
partition p1(
SUBPARTITION p1sp0 VALUES LESS THAN(6),
SUBPARTITION p1sp1 VALUES LESS THAN(1000)
),
partition p2(
SUBPARTITION p2sp0 VALUES LESS THAN(6),
SUBPARTITION p2sp1 VALUES LESS THAN(1000)
)
);
ALTER TABLE t1 ANALYZE PARTITION p0, p1, p2;
Table	Op	Msg_type	Msg_text
test.t1	analyze	status	OK
select partition_name, SUBPARTITION_name, TABLE_rows from information_schema.partitions where table_name = 't1';
PARTITION_NAME	SUBPARTITION_NAME	TABLE_ROWS
p0	p0sp0	1
p0	p0sp1	1
p1	p1sp0	1
p1	p1sp1	1
p2	p2sp0	2
p2	p2sp1	0
ALTER TABLE t1 partition by  KEY(a) SUBPARTITION by range(b) (
partition p0(
SUBPARTITION p0sp0 VALUES LESS THAN(6),
SUBPARTITION p0sp1 VALUES LESS THAN(1000)
),
partition p1(
SUBPARTITION p1sp0 VALUES LESS THAN(6),
SUBPARTITION p1sp1 VALUES LESS THAN(1000)
)
);
ALTER TABLE t1 ANALYZE PARTITION p0, p1;
Table	Op	Msg_type	Msg_text
test.t1	analyze	status	OK
select partition_name, SUBPARTITION_name, TABLE_rows from information_schema.partitions where table_name = 't1';
PARTITION_NAME	SUBPARTITION_NAME	TABLE_ROWS
p0	p0sp0	2
p0	p0sp1	1
p1	p1sp0	2
p1	p1sp1	1
ALTER TABLE t1 DROP partition p0sp0;
ERROR HY000: DROP PARTITION can only be used on RANGE/LIST partitions
ALTER TABLE t1 DROP partition p2;
ERROR HY000: DROP PARTITION can only be used on RANGE/LIST partitions
SHOW CREATE TABLE t1;
Table	Create Table
t1	CREATE TABLE `t1` (
  `a` int NOT NULL,
  `b` int NOT NULL,
  PRIMARY KEY (`a`,`b`)
) ENGINE=Dstore DEFAULT CHARSET=utf8mb4 COLLATE=utf8mb4_0900_ai_ci
/*!50100 PARTITION BY KEY (a)
SUBPARTITION BY RANGE (`b`)
(PARTITION p0
 (SUBPARTITION p0sp0 VALUES LESS THAN (6) ENGINE = Dstore,
  SUBPARTITION p0sp1 VALUES LESS THAN (1000) ENGINE = Dstore),
 PARTITION p1
 (SUBPARTITION p1sp0 VALUES LESS THAN (6) ENGINE = Dstore,
  SUBPARTITION p1sp1 VALUES LESS THAN (1000) ENGINE = Dstore)) */
SELECT * FROM t1 partition(p1sp1);
a	b
3333	333
ALTER TABLE t1 truncate partition p1sp1;
SHOW CREATE TABLE t1;
Table	Create Table
t1	CREATE TABLE `t1` (
  `a` int NOT NULL,
  `b` int NOT NULL,
  PRIMARY KEY (`a`,`b`)
) ENGINE=Dstore DEFAULT CHARSET=utf8mb4 COLLATE=utf8mb4_0900_ai_ci
/*!50100 PARTITION BY KEY (a)
SUBPARTITION BY RANGE (`b`)
(PARTITION p0
 (SUBPARTITION p0sp0 VALUES LESS THAN (6) ENGINE = Dstore,
  SUBPARTITION p0sp1 VALUES LESS THAN (1000) ENGINE = Dstore),
 PARTITION p1
 (SUBPARTITION p1sp0 VALUES LESS THAN (6) ENGINE = Dstore,
  SUBPARTITION p1sp1 VALUES LESS THAN (1000) ENGINE = Dstore)) */
SELECT * FROM t1 partition(p1sp1);
a	b
SELECT * FROM t1 partition(p1);
a	b
2	1
4	1
ALTER TABLE t1 truncate partition p1;
SHOW CREATE TABLE t1;
Table	Create Table
t1	CREATE TABLE `t1` (
  `a` int NOT NULL,
  `b` int NOT NULL,
  PRIMARY KEY (`a`,`b`)
) ENGINE=Dstore DEFAULT CHARSET=utf8mb4 COLLATE=utf8mb4_0900_ai_ci
/*!50100 PARTITION BY KEY (a)
SUBPARTITION BY RANGE (`b`)
(PARTITION p0
 (SUBPARTITION p0sp0 VALUES LESS THAN (6) ENGINE = Dstore,
  SUBPARTITION p0sp1 VALUES LESS THAN (1000) ENGINE = Dstore),
 PARTITION p1
 (SUBPARTITION p1sp0 VALUES LESS THAN (6) ENGINE = Dstore,
  SUBPARTITION p1sp1 VALUES LESS THAN (1000) ENGINE = Dstore)) */
SELECT * FROM t1 partition(p1);
a	b
DROP TABLE t1;
CREATE TABLE t1 (
`a` int ,
`b` int ,
Primary Key(a, b));
INSERT INTO t1 values(1,1),(2,1),(3,1),(4,1),(111,111),(3333,333);
ALTER TABLE t1 partition by  KEY(a) SUBPARTITION by range(b) (
partition p0(
SUBPARTITION p0sp0 VALUES LESS THAN(6),
SUBPARTITION p0sp1 VALUES LESS THAN(1000)
),
partition p1(
SUBPARTITION p1sp0 VALUES LESS THAN(6),
SUBPARTITION p1sp1 VALUES LESS THAN(1000)
),
partition p2(
SUBPARTITION p2sp0 VALUES LESS THAN(6),
SUBPARTITION p2sp1 VALUES LESS THAN(1000)
)
);
ALTER TABLE t1 reorganize partition p2 INTO
(
partition p2(
SUBPARTITION p2sp0 VALUES LESS THAN(100),
SUBPARTITION p2sp1 VALUES LESS THAN(1000)
)
);
SHOW CREATE TABLE t1;
Table	Create Table
t1	CREATE TABLE `t1` (
  `a` int NOT NULL,
  `b` int NOT NULL,
  PRIMARY KEY (`a`,`b`)
) ENGINE=Dstore DEFAULT CHARSET=utf8mb4 COLLATE=utf8mb4_0900_ai_ci
/*!50100 PARTITION BY KEY (a)
SUBPARTITION BY RANGE (`b`)
(PARTITION p0
 (SUBPARTITION p0sp0 VALUES LESS THAN (6) ENGINE = Dstore,
  SUBPARTITION p0sp1 VALUES LESS THAN (1000) ENGINE = Dstore),
 PARTITION p1
 (SUBPARTITION p1sp0 VALUES LESS THAN (6) ENGINE = Dstore,
  SUBPARTITION p1sp1 VALUES LESS THAN (1000) ENGINE = Dstore),
 PARTITION p2
 (SUBPARTITION p2sp0 VALUES LESS THAN (100) ENGINE = Dstore,
  SUBPARTITION p2sp1 VALUES LESS THAN (1000) ENGINE = Dstore)) */
ALTER TABLE t1 reorganize partition p0,p1 into
(
partition p0(
SUBPARTITION p0sp0 VALUES LESS THAN(100),
SUBPARTITION p0sp1 VALUES LESS THAN(1000)
)
);
ERROR HY000: REORGANIZE PARTITION can only be used to reorganize partitions not to change their numbers
ALTER TABLE t1 reorganize partition p0 into
(
partition p0(
SUBPARTITION p0sp0 VALUES LESS THAN(100),
SUBPARTITION p0sp1 VALUES LESS THAN(1000)
),
partition p1(
SUBPARTITION p1sp0 VALUES LESS THAN(100),
SUBPARTITION p1sp1 VALUES LESS THAN(1000)
)
);
ERROR HY000: REORGANIZE PARTITION can only be used to reorganize partitions not to change their numbers
SHOW CREATE TABLE t1;
Table	Create Table
t1	CREATE TABLE `t1` (
  `a` int NOT NULL,
  `b` int NOT NULL,
  PRIMARY KEY (`a`,`b`)
) ENGINE=Dstore DEFAULT CHARSET=utf8mb4 COLLATE=utf8mb4_0900_ai_ci
/*!50100 PARTITION BY KEY (a)
SUBPARTITION BY RANGE (`b`)
(PARTITION p0
 (SUBPARTITION p0sp0 VALUES LESS THAN (6) ENGINE = Dstore,
  SUBPARTITION p0sp1 VALUES LESS THAN (1000) ENGINE = Dstore),
 PARTITION p1
 (SUBPARTITION p1sp0 VALUES LESS THAN (6) ENGINE = Dstore,
  SUBPARTITION p1sp1 VALUES LESS THAN (1000) ENGINE = Dstore),
 PARTITION p2
 (SUBPARTITION p2sp0 VALUES LESS THAN (100) ENGINE = Dstore,
  SUBPARTITION p2sp1 VALUES LESS THAN (1000) ENGINE = Dstore)) */
DROP TABLE t1;
CREATE TABLE tsp (
`a` int ,
`b` int ,
Primary Key(a, b));
INSERT INTO tsp values(1,1),(2,1),(3,1),(4,1),(111,111),(3333,333);
ALTER TABLE tsp partition by  KEY(a) SUBPARTITION by range(b) (
partition p0 (
SUBPARTITION p0sp0 VALUES LESS THAN(6),
SUBPARTITION p0sp1 VALUES LESS THAN(1000)
),
partition p1 (
SUBPARTITION p1sp0 VALUES LESS THAN(6),
SUBPARTITION p1sp1 VALUES LESS THAN(1000)
),
partition p2 (
SUBPARTITION p2sp0 VALUES LESS THAN(6),
SUBPARTITION p2sp1 VALUES LESS THAN(1000)
)
);
create TABLE t like tsp;
ALTER TABLE t remove partitioning;
SELECT * FROM tsp partition(p2sp1);
a	b
ALTER TABLE tsp EXCHANGE PARTITION p2sp1 WITH TABLE t;
SHOW CREATE TABLE t;
Table	Create Table
t	CREATE TABLE `t` (
  `a` int NOT NULL,
  `b` int NOT NULL,
  PRIMARY KEY (`a`,`b`)
) ENGINE=Dstore DEFAULT CHARSET=utf8mb4 COLLATE=utf8mb4_0900_ai_ci
SHOW CREATE TABLE tsp;
Table	Create Table
tsp	CREATE TABLE `tsp` (
  `a` int NOT NULL,
  `b` int NOT NULL,
  PRIMARY KEY (`a`,`b`)
) ENGINE=Dstore DEFAULT CHARSET=utf8mb4 COLLATE=utf8mb4_0900_ai_ci
/*!50100 PARTITION BY KEY (a)
SUBPARTITION BY RANGE (`b`)
(PARTITION p0
 (SUBPARTITION p0sp0 VALUES LESS THAN (6) ENGINE = Dstore,
  SUBPARTITION p0sp1 VALUES LESS THAN (1000) ENGINE = Dstore),
 PARTITION p1
 (SUBPARTITION p1sp0 VALUES LESS THAN (6) ENGINE = Dstore,
  SUBPARTITION p1sp1 VALUES LESS THAN (1000) ENGINE = Dstore),
 PARTITION p2
 (SUBPARTITION p2sp0 VALUES LESS THAN (6) ENGINE = Dstore,
  SUBPARTITION p2sp1 VALUES LESS THAN (1000) ENGINE = Dstore)) */
SELECT * FROM tsp partition(p2sp1);
a	b
SELECT * FROM t;
a	b
DELETE FROM t;
INSERT INTO t values(1023,2000);
ALTER TABLE tsp EXCHANGE PARTITION p2sp1 WITH TABLE t;
ERROR HY000: Table has no partition for value 2000
ALTER TABLE tsp EXCHANGE PARTITION p2sp1 WITH TABLE t without VALIDATION;
SELECT * FROM tsp PARTITION(p2sp1);
a	b
1023	2000
SELECT * FROM t;
a	b
DROP TABLE t,tsp;
CREATE TABLE range_range
(
dept_no     INT,
part_no     INT,
country     varchar(20),
date        DATE,
amount      INT
)
PARTITION BY  KEY(date)
SUBPARTITION BY RANGE(month(date))
(
PARTITION p_2020 (
SUBPARTITION q1_2020 VALUES LESS THAN(4),
SUBPARTITION q2_2020 VALUES LESS THAN(7),
SUBPARTITION q3_2020 VALUES LESS THAN(10),
SUBPARTITION q4_2020 VALUES LESS THAN(13)
),
PARTITION p_2021 (
SUBPARTITION q1_2021 VALUES LESS THAN(4),
SUBPARTITION q2_2021 VALUES LESS THAN(7),
SUBPARTITION q3_2021 VALUES LESS THAN(10),
SUBPARTITION q4_2021 VALUES LESS THAN(13)
)
);
INSERT INTO range_range(date) VALUES('2020-04-12'),('2019-06-12'),('2019-08-12'),('2019-10-12'),('2021-06-12'),('2021-08-12'),('2021-10-12');
SELECT * FROM range_range;
dept_no	part_no	country	date	amount
NULL	NULL	NULL	2020-04-12	NULL
NULL	NULL	NULL	2019-06-12	NULL
NULL	NULL	NULL	2021-06-12	NULL
NULL	NULL	NULL	2019-08-12	NULL
NULL	NULL	NULL	2021-08-12	NULL
NULL	NULL	NULL	2019-10-12	NULL
NULL	NULL	NULL	2021-10-12	NULL
SHOW CREATE TABLE range_range;
Table	Create Table
range_range	CREATE TABLE `range_range` (
  `dept_no` int DEFAULT NULL,
  `part_no` int DEFAULT NULL,
  `country` varchar(20) DEFAULT NULL,
  `date` date DEFAULT NULL,
  `amount` int DEFAULT NULL
) ENGINE=Dstore DEFAULT CHARSET=utf8mb4 COLLATE=utf8mb4_0900_ai_ci
/*!50100 PARTITION BY KEY (`date`)
SUBPARTITION BY RANGE (month(`date`))
(PARTITION p_2020
 (SUBPARTITION q1_2020 VALUES LESS THAN (4) ENGINE = Dstore,
  SUBPARTITION q2_2020 VALUES LESS THAN (7) ENGINE = Dstore,
  SUBPARTITION q3_2020 VALUES LESS THAN (10) ENGINE = Dstore,
  SUBPARTITION q4_2020 VALUES LESS THAN (13) ENGINE = Dstore),
 PARTITION p_2021
 (SUBPARTITION q1_2021 VALUES LESS THAN (4) ENGINE = Dstore,
  SUBPARTITION q2_2021 VALUES LESS THAN (7) ENGINE = Dstore,
  SUBPARTITION q3_2021 VALUES LESS THAN (10) ENGINE = Dstore,
  SUBPARTITION q4_2021 VALUES LESS THAN (13) ENGINE = Dstore)) */
ALTER TABLE range_range ANALYZE PARTITION p_2020,q3_2021;
Table	Op	Msg_type	Msg_text
test.range_range	analyze	status	OK
SELECT * FROM range_range partition(p_2021);
dept_no	part_no	country	date	amount
SHOW CREATE TABLE range_range;
Table	Create Table
range_range	CREATE TABLE `range_range` (
  `dept_no` int DEFAULT NULL,
  `part_no` int DEFAULT NULL,
  `country` varchar(20) DEFAULT NULL,
  `date` date DEFAULT NULL,
  `amount` int DEFAULT NULL
) ENGINE=Dstore DEFAULT CHARSET=utf8mb4 COLLATE=utf8mb4_0900_ai_ci
/*!50100 PARTITION BY KEY (`date`)
SUBPARTITION BY RANGE (month(`date`))
(PARTITION p_2020
 (SUBPARTITION q1_2020 VALUES LESS THAN (4) ENGINE = Dstore,
  SUBPARTITION q2_2020 VALUES LESS THAN (7) ENGINE = Dstore,
  SUBPARTITION q3_2020 VALUES LESS THAN (10) ENGINE = Dstore,
  SUBPARTITION q4_2020 VALUES LESS THAN (13) ENGINE = Dstore),
 PARTITION p_2021
 (SUBPARTITION q1_2021 VALUES LESS THAN (4) ENGINE = Dstore,
  SUBPARTITION q2_2021 VALUES LESS THAN (7) ENGINE = Dstore,
  SUBPARTITION q3_2021 VALUES LESS THAN (10) ENGINE = Dstore,
  SUBPARTITION q4_2021 VALUES LESS THAN (13) ENGINE = Dstore)) */
DROP TABLE range_range;
CREATE TABLE range_range
(
dept_no     INT,
part_no     INT,
country     varchar(20),
date        DATE,
amount      INT
)
PARTITION BY  KEY(date)
SUBPARTITION BY RANGE(month(date))
(
PARTITION p_2020 (
SUBPARTITION q1_2020 VALUES LESS THAN(4),
SUBPARTITION q2_2020 VALUES LESS THAN(7),
SUBPARTITION q3_2020 VALUES LESS THAN(10),
SUBPARTITION q4_2020 VALUES LESS THAN(13)
),
PARTITION p_2021 (
SUBPARTITION q1_2021 VALUES LESS THAN(4),
SUBPARTITION q2_2021 VALUES LESS THAN(7),
SUBPARTITION q3_2021 VALUES LESS THAN(10),
SUBPARTITION q4_2021 VALUES LESS THAN(13)
)
);
INSERT INTO range_range(date) VALUES('2020-04-12'),('2019-06-12'),('2019-08-12'),('2019-10-12'),('2021-06-12'),('2021-08-12'),('2021-10-12');
SELECT * FROM range_range;
dept_no	part_no	country	date	amount
NULL	NULL	NULL	2020-04-12	NULL
NULL	NULL	NULL	2019-06-12	NULL
NULL	NULL	NULL	2021-06-12	NULL
NULL	NULL	NULL	2019-08-12	NULL
NULL	NULL	NULL	2021-08-12	NULL
NULL	NULL	NULL	2019-10-12	NULL
NULL	NULL	NULL	2021-10-12	NULL
SHOW CREATE TABLE range_range;
Table	Create Table
range_range	CREATE TABLE `range_range` (
  `dept_no` int DEFAULT NULL,
  `part_no` int DEFAULT NULL,
  `country` varchar(20) DEFAULT NULL,
  `date` date DEFAULT NULL,
  `amount` int DEFAULT NULL
) ENGINE=Dstore DEFAULT CHARSET=utf8mb4 COLLATE=utf8mb4_0900_ai_ci
/*!50100 PARTITION BY KEY (`date`)
SUBPARTITION BY RANGE (month(`date`))
(PARTITION p_2020
 (SUBPARTITION q1_2020 VALUES LESS THAN (4) ENGINE = Dstore,
  SUBPARTITION q2_2020 VALUES LESS THAN (7) ENGINE = Dstore,
  SUBPARTITION q3_2020 VALUES LESS THAN (10) ENGINE = Dstore,
  SUBPARTITION q4_2020 VALUES LESS THAN (13) ENGINE = Dstore),
 PARTITION p_2021
 (SUBPARTITION q1_2021 VALUES LESS THAN (4) ENGINE = Dstore,
  SUBPARTITION q2_2021 VALUES LESS THAN (7) ENGINE = Dstore,
  SUBPARTITION q3_2021 VALUES LESS THAN (10) ENGINE = Dstore,
  SUBPARTITION q4_2021 VALUES LESS THAN (13) ENGINE = Dstore)) */
ALTER TABLE range_range CHECK PARTITION p_2020,q3_2021;
Table	Op	Msg_type	Msg_text
test.range_range	check	status	OK
SELECT * FROM range_range partition(p_2021);
dept_no	part_no	country	date	amount
SHOW CREATE TABLE range_range;
Table	Create Table
range_range	CREATE TABLE `range_range` (
  `dept_no` int DEFAULT NULL,
  `part_no` int DEFAULT NULL,
  `country` varchar(20) DEFAULT NULL,
  `date` date DEFAULT NULL,
  `amount` int DEFAULT NULL
) ENGINE=Dstore DEFAULT CHARSET=utf8mb4 COLLATE=utf8mb4_0900_ai_ci
/*!50100 PARTITION BY KEY (`date`)
SUBPARTITION BY RANGE (month(`date`))
(PARTITION p_2020
 (SUBPARTITION q1_2020 VALUES LESS THAN (4) ENGINE = Dstore,
  SUBPARTITION q2_2020 VALUES LESS THAN (7) ENGINE = Dstore,
  SUBPARTITION q3_2020 VALUES LESS THAN (10) ENGINE = Dstore,
  SUBPARTITION q4_2020 VALUES LESS THAN (13) ENGINE = Dstore),
 PARTITION p_2021
 (SUBPARTITION q1_2021 VALUES LESS THAN (4) ENGINE = Dstore,
  SUBPARTITION q2_2021 VALUES LESS THAN (7) ENGINE = Dstore,
  SUBPARTITION q3_2021 VALUES LESS THAN (10) ENGINE = Dstore,
  SUBPARTITION q4_2021 VALUES LESS THAN (13) ENGINE = Dstore)) */
DROP TABLE range_range;
CREATE TABLE range_range
(
dept_no     INT,
part_no     INT,
country     varchar(20),
date        DATE,
amount      INT
)
PARTITION BY  KEY(date)
SUBPARTITION BY RANGE(month(date))
(
PARTITION p_2020 (
SUBPARTITION q1_2020 VALUES LESS THAN(4),
SUBPARTITION q2_2020 VALUES LESS THAN(7),
SUBPARTITION q3_2020 VALUES LESS THAN(10),
SUBPARTITION q4_2020 VALUES LESS THAN(13)
),
PARTITION p_2021 (
SUBPARTITION q1_2021 VALUES LESS THAN(4),
SUBPARTITION q2_2021 VALUES LESS THAN(7),
SUBPARTITION q3_2021 VALUES LESS THAN(10),
SUBPARTITION q4_2021 VALUES LESS THAN(13)
)
);
INSERT INTO range_range(date) VALUES('2020-04-12'),('2019-06-12'),('2019-08-12'),('2019-10-12'),('2021-06-12'),('2021-08-12'),('2021-10-12');
SELECT * FROM range_range;
dept_no	part_no	country	date	amount
NULL	NULL	NULL	2020-04-12	NULL
NULL	NULL	NULL	2019-06-12	NULL
NULL	NULL	NULL	2021-06-12	NULL
NULL	NULL	NULL	2019-08-12	NULL
NULL	NULL	NULL	2021-08-12	NULL
NULL	NULL	NULL	2019-10-12	NULL
NULL	NULL	NULL	2021-10-12	NULL
SHOW CREATE TABLE range_range;
Table	Create Table
range_range	CREATE TABLE `range_range` (
  `dept_no` int DEFAULT NULL,
  `part_no` int DEFAULT NULL,
  `country` varchar(20) DEFAULT NULL,
  `date` date DEFAULT NULL,
  `amount` int DEFAULT NULL
) ENGINE=Dstore DEFAULT CHARSET=utf8mb4 COLLATE=utf8mb4_0900_ai_ci
/*!50100 PARTITION BY KEY (`date`)
SUBPARTITION BY RANGE (month(`date`))
(PARTITION p_2020
 (SUBPARTITION q1_2020 VALUES LESS THAN (4) ENGINE = Dstore,
  SUBPARTITION q2_2020 VALUES LESS THAN (7) ENGINE = Dstore,
  SUBPARTITION q3_2020 VALUES LESS THAN (10) ENGINE = Dstore,
  SUBPARTITION q4_2020 VALUES LESS THAN (13) ENGINE = Dstore),
 PARTITION p_2021
 (SUBPARTITION q1_2021 VALUES LESS THAN (4) ENGINE = Dstore,
  SUBPARTITION q2_2021 VALUES LESS THAN (7) ENGINE = Dstore,
  SUBPARTITION q3_2021 VALUES LESS THAN (10) ENGINE = Dstore,
  SUBPARTITION q4_2021 VALUES LESS THAN (13) ENGINE = Dstore)) */
ALTER TABLE range_range OPTIMIZE PARTITION p_2020,q3_2021;
Table	Op	Msg_type	Msg_text
test.range_range	optimize	note	Table does not support optimize on partitions. All partitions will be rebuilt and analyzed.
test.range_range	optimize	status	OK
SELECT * FROM range_range partition(p_2021);
dept_no	part_no	country	date	amount
SHOW CREATE TABLE range_range;
Table	Create Table
range_range	CREATE TABLE `range_range` (
  `dept_no` int DEFAULT NULL,
  `part_no` int DEFAULT NULL,
  `country` varchar(20) DEFAULT NULL,
  `date` date DEFAULT NULL,
  `amount` int DEFAULT NULL
) ENGINE=Dstore DEFAULT CHARSET=utf8mb4 COLLATE=utf8mb4_0900_ai_ci
/*!50100 PARTITION BY KEY (`date`)
SUBPARTITION BY RANGE (month(`date`))
(PARTITION p_2020
 (SUBPARTITION q1_2020 VALUES LESS THAN (4) ENGINE = Dstore,
  SUBPARTITION q2_2020 VALUES LESS THAN (7) ENGINE = Dstore,
  SUBPARTITION q3_2020 VALUES LESS THAN (10) ENGINE = Dstore,
  SUBPARTITION q4_2020 VALUES LESS THAN (13) ENGINE = Dstore),
 PARTITION p_2021
 (SUBPARTITION q1_2021 VALUES LESS THAN (4) ENGINE = Dstore,
  SUBPARTITION q2_2021 VALUES LESS THAN (7) ENGINE = Dstore,
  SUBPARTITION q3_2021 VALUES LESS THAN (10) ENGINE = Dstore,
  SUBPARTITION q4_2021 VALUES LESS THAN (13) ENGINE = Dstore)) */
DROP TABLE range_range;
CREATE TABLE range_range
(
dept_no     INT,
part_no     INT,
country     varchar(20),
date        DATE,
amount      INT
)
PARTITION BY  KEY(date)
SUBPARTITION BY RANGE(month(date))
(
PARTITION p_2020 (
SUBPARTITION q1_2020 VALUES LESS THAN(4),
SUBPARTITION q2_2020 VALUES LESS THAN(7),
SUBPARTITION q3_2020 VALUES LESS THAN(10),
SUBPARTITION q4_2020 VALUES LESS THAN(13)
),
PARTITION p_2021 (
SUBPARTITION q1_2021 VALUES LESS THAN(4),
SUBPARTITION q2_2021 VALUES LESS THAN(7),
SUBPARTITION q3_2021 VALUES LESS THAN(10),
SUBPARTITION q4_2021 VALUES LESS THAN(13)
)
);
INSERT INTO range_range(date) VALUES('2020-04-12'),('2019-06-12'),('2019-08-12'),('2019-10-12'),('2021-06-12'),('2021-08-12'),('2021-10-12');
SELECT * FROM range_range;
dept_no	part_no	country	date	amount
NULL	NULL	NULL	2020-04-12	NULL
NULL	NULL	NULL	2019-06-12	NULL
NULL	NULL	NULL	2021-06-12	NULL
NULL	NULL	NULL	2019-08-12	NULL
NULL	NULL	NULL	2021-08-12	NULL
NULL	NULL	NULL	2019-10-12	NULL
NULL	NULL	NULL	2021-10-12	NULL
SHOW CREATE TABLE range_range;
Table	Create Table
range_range	CREATE TABLE `range_range` (
  `dept_no` int DEFAULT NULL,
  `part_no` int DEFAULT NULL,
  `country` varchar(20) DEFAULT NULL,
  `date` date DEFAULT NULL,
  `amount` int DEFAULT NULL
) ENGINE=Dstore DEFAULT CHARSET=utf8mb4 COLLATE=utf8mb4_0900_ai_ci
/*!50100 PARTITION BY KEY (`date`)
SUBPARTITION BY RANGE (month(`date`))
(PARTITION p_2020
 (SUBPARTITION q1_2020 VALUES LESS THAN (4) ENGINE = Dstore,
  SUBPARTITION q2_2020 VALUES LESS THAN (7) ENGINE = Dstore,
  SUBPARTITION q3_2020 VALUES LESS THAN (10) ENGINE = Dstore,
  SUBPARTITION q4_2020 VALUES LESS THAN (13) ENGINE = Dstore),
 PARTITION p_2021
 (SUBPARTITION q1_2021 VALUES LESS THAN (4) ENGINE = Dstore,
  SUBPARTITION q2_2021 VALUES LESS THAN (7) ENGINE = Dstore,
  SUBPARTITION q3_2021 VALUES LESS THAN (10) ENGINE = Dstore,
  SUBPARTITION q4_2021 VALUES LESS THAN (13) ENGINE = Dstore)) */
ALTER TABLE range_range REBUILD PARTITION p_2020,q3_2021;
ERROR HY000: Error in list of partitions to REBUILD
ALTER TABLE range_range REBUILD PARTITION p_2020;
SELECT * FROM range_range partition(p_2021);
dept_no	part_no	country	date	amount
SHOW CREATE TABLE range_range;
Table	Create Table
range_range	CREATE TABLE `range_range` (
  `dept_no` int DEFAULT NULL,
  `part_no` int DEFAULT NULL,
  `country` varchar(20) DEFAULT NULL,
  `date` date DEFAULT NULL,
  `amount` int DEFAULT NULL
) ENGINE=Dstore DEFAULT CHARSET=utf8mb4 COLLATE=utf8mb4_0900_ai_ci
/*!50100 PARTITION BY KEY (`date`)
SUBPARTITION BY RANGE (month(`date`))
(PARTITION p_2020
 (SUBPARTITION q1_2020 VALUES LESS THAN (4) ENGINE = Dstore,
  SUBPARTITION q2_2020 VALUES LESS THAN (7) ENGINE = Dstore,
  SUBPARTITION q3_2020 VALUES LESS THAN (10) ENGINE = Dstore,
  SUBPARTITION q4_2020 VALUES LESS THAN (13) ENGINE = Dstore),
 PARTITION p_2021
 (SUBPARTITION q1_2021 VALUES LESS THAN (4) ENGINE = Dstore,
  SUBPARTITION q2_2021 VALUES LESS THAN (7) ENGINE = Dstore,
  SUBPARTITION q3_2021 VALUES LESS THAN (10) ENGINE = Dstore,
  SUBPARTITION q4_2021 VALUES LESS THAN (13) ENGINE = Dstore)) */
DROP TABLE range_range;
CREATE TABLE range_range
(
dept_no     INT,
part_no     INT,
country     varchar(20),
date        DATE,
amount      INT
)
PARTITION BY  KEY(date)
SUBPARTITION BY RANGE(month(date))
(
PARTITION p_2020 (
SUBPARTITION q1_2020 VALUES LESS THAN(4),
SUBPARTITION q2_2020 VALUES LESS THAN(7),
SUBPARTITION q3_2020 VALUES LESS THAN(10),
SUBPARTITION q4_2020 VALUES LESS THAN(13)
),
PARTITION p_2021 (
SUBPARTITION q1_2021 VALUES LESS THAN(4),
SUBPARTITION q2_2021 VALUES LESS THAN(7),
SUBPARTITION q3_2021 VALUES LESS THAN(10),
SUBPARTITION q4_2021 VALUES LESS THAN(13)
)
);
INSERT INTO range_range(date) VALUES('2020-04-12'),('2019-06-12'),('2019-08-12'),('2019-10-12'),('2021-06-12'),('2021-08-12'),('2021-10-12');
SELECT * FROM range_range;
dept_no	part_no	country	date	amount
NULL	NULL	NULL	2020-04-12	NULL
NULL	NULL	NULL	2019-06-12	NULL
NULL	NULL	NULL	2021-06-12	NULL
NULL	NULL	NULL	2019-08-12	NULL
NULL	NULL	NULL	2021-08-12	NULL
NULL	NULL	NULL	2019-10-12	NULL
NULL	NULL	NULL	2021-10-12	NULL
SHOW CREATE TABLE range_range;
Table	Create Table
range_range	CREATE TABLE `range_range` (
  `dept_no` int DEFAULT NULL,
  `part_no` int DEFAULT NULL,
  `country` varchar(20) DEFAULT NULL,
  `date` date DEFAULT NULL,
  `amount` int DEFAULT NULL
) ENGINE=Dstore DEFAULT CHARSET=utf8mb4 COLLATE=utf8mb4_0900_ai_ci
/*!50100 PARTITION BY KEY (`date`)
SUBPARTITION BY RANGE (month(`date`))
(PARTITION p_2020
 (SUBPARTITION q1_2020 VALUES LESS THAN (4) ENGINE = Dstore,
  SUBPARTITION q2_2020 VALUES LESS THAN (7) ENGINE = Dstore,
  SUBPARTITION q3_2020 VALUES LESS THAN (10) ENGINE = Dstore,
  SUBPARTITION q4_2020 VALUES LESS THAN (13) ENGINE = Dstore),
 PARTITION p_2021
 (SUBPARTITION q1_2021 VALUES LESS THAN (4) ENGINE = Dstore,
  SUBPARTITION q2_2021 VALUES LESS THAN (7) ENGINE = Dstore,
  SUBPARTITION q3_2021 VALUES LESS THAN (10) ENGINE = Dstore,
  SUBPARTITION q4_2021 VALUES LESS THAN (13) ENGINE = Dstore)) */
ALTER TABLE range_range REPAIR PARTITION p_2020,q3_2021;
Table	Op	Msg_type	Msg_text
test.range_range	repair	status	OK
SELECT * FROM range_range partition(p_2021);
dept_no	part_no	country	date	amount
SHOW CREATE TABLE range_range;
Table	Create Table
range_range	CREATE TABLE `range_range` (
  `dept_no` int DEFAULT NULL,
  `part_no` int DEFAULT NULL,
  `country` varchar(20) DEFAULT NULL,
  `date` date DEFAULT NULL,
  `amount` int DEFAULT NULL
) ENGINE=Dstore DEFAULT CHARSET=utf8mb4 COLLATE=utf8mb4_0900_ai_ci
/*!50100 PARTITION BY KEY (`date`)
SUBPARTITION BY RANGE (month(`date`))
(PARTITION p_2020
 (SUBPARTITION q1_2020 VALUES LESS THAN (4) ENGINE = Dstore,
  SUBPARTITION q2_2020 VALUES LESS THAN (7) ENGINE = Dstore,
  SUBPARTITION q3_2020 VALUES LESS THAN (10) ENGINE = Dstore,
  SUBPARTITION q4_2020 VALUES LESS THAN (13) ENGINE = Dstore),
 PARTITION p_2021
 (SUBPARTITION q1_2021 VALUES LESS THAN (4) ENGINE = Dstore,
  SUBPARTITION q2_2021 VALUES LESS THAN (7) ENGINE = Dstore,
  SUBPARTITION q3_2021 VALUES LESS THAN (10) ENGINE = Dstore,
  SUBPARTITION q4_2021 VALUES LESS THAN (13) ENGINE = Dstore)) */
DROP TABLE range_range;
CREATE TABLE range_range
(
dept_no     INT,
part_no     INT,
country     varchar(20),
date        DATE,
amount      INT
)
PARTITION BY  KEY(date)
SUBPARTITION BY RANGE(month(date))
(
PARTITION p_2020 (
SUBPARTITION q1_2020 VALUES LESS THAN(4),
SUBPARTITION q2_2020 VALUES LESS THAN(7),
SUBPARTITION q3_2020 VALUES LESS THAN(10),
SUBPARTITION q4_2020 VALUES LESS THAN(13)
),
PARTITION p_2021 (
SUBPARTITION q1_2021 VALUES LESS THAN(4),
SUBPARTITION q2_2021 VALUES LESS THAN(7),
SUBPARTITION q3_2021 VALUES LESS THAN(10),
SUBPARTITION q4_2021 VALUES LESS THAN(13)
)
);
INSERT INTO range_range(date) VALUES('2020-04-12'),('2019-06-12'),('2019-08-12'),('2019-10-12'),('2021-06-12'),('2021-08-12'),('2021-10-12');
SHOW CREATE TABLE range_range;
Table	Create Table
range_range	CREATE TABLE `range_range` (
  `dept_no` int DEFAULT NULL,
  `part_no` int DEFAULT NULL,
  `country` varchar(20) DEFAULT NULL,
  `date` date DEFAULT NULL,
  `amount` int DEFAULT NULL
) ENGINE=Dstore DEFAULT CHARSET=utf8mb4 COLLATE=utf8mb4_0900_ai_ci
/*!50100 PARTITION BY KEY (`date`)
SUBPARTITION BY RANGE (month(`date`))
(PARTITION p_2020
 (SUBPARTITION q1_2020 VALUES LESS THAN (4) ENGINE = Dstore,
  SUBPARTITION q2_2020 VALUES LESS THAN (7) ENGINE = Dstore,
  SUBPARTITION q3_2020 VALUES LESS THAN (10) ENGINE = Dstore,
  SUBPARTITION q4_2020 VALUES LESS THAN (13) ENGINE = Dstore),
 PARTITION p_2021
 (SUBPARTITION q1_2021 VALUES LESS THAN (4) ENGINE = Dstore,
  SUBPARTITION q2_2021 VALUES LESS THAN (7) ENGINE = Dstore,
  SUBPARTITION q3_2021 VALUES LESS THAN (10) ENGINE = Dstore,
  SUBPARTITION q4_2021 VALUES LESS THAN (13) ENGINE = Dstore)) */
ALTER TABLE range_range remove partitioning;
SHOW CREATE TABLE range_range;
Table	Create Table
range_range	CREATE TABLE `range_range` (
  `dept_no` int DEFAULT NULL,
  `part_no` int DEFAULT NULL,
  `country` varchar(20) DEFAULT NULL,
  `date` date DEFAULT NULL,
  `amount` int DEFAULT NULL
) ENGINE=Dstore DEFAULT CHARSET=utf8mb4 COLLATE=utf8mb4_0900_ai_ci
SELECT * FROM range_range;
dept_no	part_no	country	date	amount
NULL	NULL	NULL	2020-04-12	NULL
NULL	NULL	NULL	2019-06-12	NULL
NULL	NULL	NULL	2021-06-12	NULL
NULL	NULL	NULL	2019-08-12	NULL
NULL	NULL	NULL	2021-08-12	NULL
NULL	NULL	NULL	2019-10-12	NULL
NULL	NULL	NULL	2021-10-12	NULL
DROP TABLE range_range;
CREATE TABLE range_range
(
dept_no     INT,
part_no     INT,
country     varchar(20),
date        DATE,
amount      INT
)
PARTITION BY  KEY(date)
SUBPARTITION BY RANGE(month(date))
(
PARTITION p_2020 (
SUBPARTITION q1_2020 VALUES LESS THAN(4),
SUBPARTITION q2_2020 VALUES LESS THAN(7),
SUBPARTITION q3_2020 VALUES LESS THAN(10),
SUBPARTITION q4_2020 VALUES LESS THAN(13)
),
PARTITION p_2021 (
SUBPARTITION q1_2021 VALUES LESS THAN(4),
SUBPARTITION q2_2021 VALUES LESS THAN(7),
SUBPARTITION q3_2021 VALUES LESS THAN(10),
SUBPARTITION q4_2021 VALUES LESS THAN(13)
)
);
ALTER TABLE range_range COALESCE PARTITION 1;
DROP TABLE range_range;
CREATE TABLE t1(a int, b int) PARTITION BY  KEY(a)(
partition p1,
partition p2
);
ALTER TABLE t1 ADD PARTITION (PARTITION p3 (SUBPARTITION p3p0));
ERROR HY000: Partition management on a not partitioned table is not possible
ALTER TABLE t1 ADD PARTITION (PARTITION p3 (SUBPARTITION p3p0 VALUES LESS THAN(4)));
ERROR HY000: Partition management on a not partitioned table is not possible
CREATE TABLE t2(a int, b int);
ALTER TABLE t2 ADD PARTITION (PARTITION p0);
ERROR HY000: Partition management on a not partitioned table is not possible
DROP TABLE t1, t2;
CREATE TABLE t1(a int, b int) PARTITION BY  KEY(a) SUBPARTITION BY range(b) (
partition p1,
partition p2
);
ERROR HY000: For RANGE partitions each partition must be defined
CREATE TABLE t1(a int, b int) PARTITION BY  KEY(a)(
partition p1,
partition p2
);
ALTER TABLE t1 ADD PARTITION (PARTITION p3 (SUBPARTITION p3p0));
ERROR HY000: Partition management on a not partitioned table is not possible
ALTER TABLE t1 ADD PARTITION (PARTITION p3 VALUES LESS THAN (1));
ERROR HY000: Only RANGE PARTITIONING can use VALUES LESS THAN in partition definition
DROP TABLE t1;
CREATE TABLE t3 (
id INT NOT NULL,
store_id INT NOT NULL
)
PARTITION BY  KEY (store_id) 
SUBPARTITION BY RANGE(id) (
PARTITION p0 (
subpartition q1 values less than (4),
subpartition q2 values less than (10)
),  
PARTITION p1 (
subpartition q3 values less than (15),
subpartition q4 values less than (20)
)
);
ALTER TABLE t3 ADD PARTITION (PARTITION p3 (subpartition q5 values less than(19), subpartition q6 values less than(19)));
ERROR HY000: VALUES LESS THAN value must be strictly increasing for each partition
DROP TABLE t3;
CREATE TABLE t1(a int, b int) PARTITION BY  KEY(a) SUBPARTITION BY range(b) (
partition p1 (subpartition p1sp0 values less than(3),
subpartition p1sp1 values less than (5)),
partition p2 (subpartition p2sp0 values less than(4),
subpartition p2sp1 values less than (9))
);
INSERT INTO t1 VALUES(1,2),(2,4),(5,3),(6,8);
EXPLAIN SELECT * FROM t1 WHERE a < 1;
id	select_type	table	partitions	type	possible_keys	key	key_len	ref	rows	filtered	Extra
1	SIMPLE	t1	p1_p1sp0,p1_p1sp1,p2_p2sp0,p2_p2sp1	ALL	NULL	NULL	NULL	NULL	#	#	Using where; Using pushed condition (`test`.`t1`.`a` < 1)
Warnings:
Note	1003	/* select#1 */ select `test`.`t1`.`a` AS `a`,`test`.`t1`.`b` AS `b` from `test`.`t1` where (`test`.`t1`.`a` < 1)
ALTER TABLE t1 ADD index idx(a);
SELECT * FROM t1 WHERE a < 1;
a	b
EXPLAIN SELECT * FROM t1 WHERE a = 2;
id	select_type	table	partitions	type	possible_keys	key	key_len	ref	rows	filtered	Extra
1	SIMPLE	t1	p2_p2sp0,p2_p2sp1	ref	idx	idx	5	const	#	#	NULL
Warnings:
Note	1003	/* select#1 */ select `test`.`t1`.`a` AS `a`,`test`.`t1`.`b` AS `b` from `test`.`t1` where (`test`.`t1`.`a` = 2)
SELECT * FROM t1 WHERE a = 2;
a	b
2	4
ALTER TABLE t1 ADD index idx1(a, b);
EXPLAIN SELECT * FROM t1 WHERE a = 2 and b = 4;
id	select_type	table	partitions	type	possible_keys	key	key_len	ref	rows	filtered	Extra
1	SIMPLE	t1	p2_p2sp1	ref	idx,idx1	idx	5	const	#	#	Using where
Warnings:
Note	1003	/* select#1 */ select `test`.`t1`.`a` AS `a`,`test`.`t1`.`b` AS `b` from `test`.`t1` where ((`test`.`t1`.`b` = 4) and (`test`.`t1`.`a` = 2))
SELECT * FROM t1 WHERE a = 2 and b = 4;
a	b
2	4
EXPLAIN SELECT * FROM t1 WHERE b = 4;
id	select_type	table	partitions	type	possible_keys	key	key_len	ref	rows	filtered	Extra
1	SIMPLE	t1	p1_p1sp1,p2_p2sp1	index	idx1	idx1	10	NULL	#	#	Using where; Using index
Warnings:
Note	1003	/* select#1 */ select `test`.`t1`.`a` AS `a`,`test`.`t1`.`b` AS `b` from `test`.`t1` where (`test`.`t1`.`b` = 4)
SELECT * FROM t1 WHERE b = 4;
a	b
2	4
ALTER TABLE t1 DROP INDEX idx;
ALTER TABLE t1 DROP INDEX idx1;
ALTER TABLE t1 ADD index idx2(b);
SELECT * FROM t1 WHERE a = 2;
a	b
2	4
SELECT * FROM t1 WHERE b = 4;
a	b
2	4
DROP TABLE t1;
SET global rds_extended_partitions_enabled = @saved_rds_extended_partitions_enabled;
SET @saved_rds_extended_partitions_enabled=@@rds_extended_partitions_enabled;
SET global rds_extended_partitions_enabled = true;
#
# Verify hash-range
#
CREATE TABLE t3 (
id INT NOT NULL,
store_id INT NOT NULL
)
PARTITION BY LINEAR KEY (store_id) 
SUBPARTITION BY RANGE(id) (
PARTITION p0 (
SUBPARTITION q1 VALUES LESS THAN (4),
SUBPARTITION q2 VALUES LESS THAN (10)
),
PARTITION p1 (
SUBPARTITION q3 VALUES LESS THAN (15),
SUBPARTITION q4 VALUES LESS THAN (20)
)
);
INSERT INTO t3 VALUES(1,3);
INSERT INTO t3 VALUES(14, 9);
ERROR HY000: Table has no partition for value 14
INSERT INTO t3 VALUES(9, 8);
ALTER TABLE t3 ADD PARTITION (PARTITION p3 (SUBPARTITION q5 VALUES LESS THAN(15), SUBPARTITION q6 VALUES LESS THAN(19)));
SHOW CREATE TABLE t3;
Table	Create Table
t3	CREATE TABLE `t3` (
  `id` int NOT NULL,
  `store_id` int NOT NULL
) ENGINE=Dstore DEFAULT CHARSET=utf8mb4 COLLATE=utf8mb4_0900_ai_ci
/*!50100 PARTITION BY LINEAR KEY (store_id)
SUBPARTITION BY RANGE (`id`)
(PARTITION p0
 (SUBPARTITION q1 VALUES LESS THAN (4) ENGINE = Dstore,
  SUBPARTITION q2 VALUES LESS THAN (10) ENGINE = Dstore),
 PARTITION p1
 (SUBPARTITION q3 VALUES LESS THAN (15) ENGINE = Dstore,
  SUBPARTITION q4 VALUES LESS THAN (20) ENGINE = Dstore),
 PARTITION p3
 (SUBPARTITION q5 VALUES LESS THAN (15) ENGINE = Dstore,
  SUBPARTITION q6 VALUES LESS THAN (19) ENGINE = Dstore)) */
ALTER TABLE t3 DROP PARTITION p0;
ERROR HY000: DROP PARTITION can only be used on RANGE/LIST partitions
SELECT * FROM t3;
id	store_id
9	8
1	3
DROP TABLE t3;
CREATE TABLE sales_range_range
(
dept_no     INT,
part_no     INT,
country     varchar(20),
date        DATE,
amount      INT
)
PARTITION BY LINEAR KEY(date, amount)
SUBPARTITION BY RANGE(month(date))
(
PARTITION p_2020 (
SUBPARTITION q1_2020 VALUES LESS THAN(4),
SUBPARTITION q2_2020 VALUES LESS THAN(7),
SUBPARTITION q3_2020 VALUES LESS THAN(10),
SUBPARTITION q4_2020 VALUES LESS THAN(13)
),
PARTITION p_2021 (
SUBPARTITION q1_2021 VALUES LESS THAN(4),
SUBPARTITION q2_2021 VALUES LESS THAN(7),
SUBPARTITION q3_2021 VALUES LESS THAN(10),
SUBPARTITION q4_2021 VALUES LESS THAN(13)
),
PARTITION p_2022 (
SUBPARTITION q1_2022 VALUES LESS THAN(4),
SUBPARTITION q2_2022 VALUES LESS THAN(7),
SUBPARTITION q3_2022 VALUES LESS THAN(10),
SUBPARTITION q4_2022 VALUES LESS THAN(13)
)
);
ALTER TABLE sales_range_range ADD PARTITION (
PARTITION p_2025  (
SUBPARTITION q1_2015 VALUES LESS THAN(4),
SUBPARTITION q2_2015 VALUES LESS THAN(7),
SUBPARTITION q3_2015 VALUES LESS THAN(10),
SUBPARTITION q4_2015 VALUES LESS THAN(13)
)
);
SHOW CREATE TABLE sales_range_range;
Table	Create Table
sales_range_range	CREATE TABLE `sales_range_range` (
  `dept_no` int DEFAULT NULL,
  `part_no` int DEFAULT NULL,
  `country` varchar(20) DEFAULT NULL,
  `date` date DEFAULT NULL,
  `amount` int DEFAULT NULL
) ENGINE=Dstore DEFAULT CHARSET=utf8mb4 COLLATE=utf8mb4_0900_ai_ci
/*!50100 PARTITION BY LINEAR KEY (`date`,amount)
SUBPARTITION BY RANGE (month(`date`))
(PARTITION p_2020
 (SUBPARTITION q1_2020 VALUES LESS THAN (4) ENGINE = Dstore,
  SUBPARTITION q2_2020 VALUES LESS THAN (7) ENGINE = Dstore,
  SUBPARTITION q3_2020 VALUES LESS THAN (10) ENGINE = Dstore,
  SUBPARTITION q4_2020 VALUES LESS THAN (13) ENGINE = Dstore),
 PARTITION p_2021
 (SUBPARTITION q1_2021 VALUES LESS THAN (4) ENGINE = Dstore,
  SUBPARTITION q2_2021 VALUES LESS THAN (7) ENGINE = Dstore,
  SUBPARTITION q3_2021 VALUES LESS THAN (10) ENGINE = Dstore,
  SUBPARTITION q4_2021 VALUES LESS THAN (13) ENGINE = Dstore),
 PARTITION p_2022
 (SUBPARTITION q1_2022 VALUES LESS THAN (4) ENGINE = Dstore,
  SUBPARTITION q2_2022 VALUES LESS THAN (7) ENGINE = Dstore,
  SUBPARTITION q3_2022 VALUES LESS THAN (10) ENGINE = Dstore,
  SUBPARTITION q4_2022 VALUES LESS THAN (13) ENGINE = Dstore),
 PARTITION p_2025
 (SUBPARTITION q1_2015 VALUES LESS THAN (4) ENGINE = Dstore,
  SUBPARTITION q2_2015 VALUES LESS THAN (7) ENGINE = Dstore,
  SUBPARTITION q3_2015 VALUES LESS THAN (10) ENGINE = Dstore,
  SUBPARTITION q4_2015 VALUES LESS THAN (13) ENGINE = Dstore)) */
ALTER TABLE sales_range_range DROP PARTITION p_2025;
ERROR HY000: DROP PARTITION can only be used on RANGE/LIST partitions
SHOW CREATE TABLE sales_range_range;
Table	Create Table
sales_range_range	CREATE TABLE `sales_range_range` (
  `dept_no` int DEFAULT NULL,
  `part_no` int DEFAULT NULL,
  `country` varchar(20) DEFAULT NULL,
  `date` date DEFAULT NULL,
  `amount` int DEFAULT NULL
) ENGINE=Dstore DEFAULT CHARSET=utf8mb4 COLLATE=utf8mb4_0900_ai_ci
/*!50100 PARTITION BY LINEAR KEY (`date`,amount)
SUBPARTITION BY RANGE (month(`date`))
(PARTITION p_2020
 (SUBPARTITION q1_2020 VALUES LESS THAN (4) ENGINE = Dstore,
  SUBPARTITION q2_2020 VALUES LESS THAN (7) ENGINE = Dstore,
  SUBPARTITION q3_2020 VALUES LESS THAN (10) ENGINE = Dstore,
  SUBPARTITION q4_2020 VALUES LESS THAN (13) ENGINE = Dstore),
 PARTITION p_2021
 (SUBPARTITION q1_2021 VALUES LESS THAN (4) ENGINE = Dstore,
  SUBPARTITION q2_2021 VALUES LESS THAN (7) ENGINE = Dstore,
  SUBPARTITION q3_2021 VALUES LESS THAN (10) ENGINE = Dstore,
  SUBPARTITION q4_2021 VALUES LESS THAN (13) ENGINE = Dstore),
 PARTITION p_2022
 (SUBPARTITION q1_2022 VALUES LESS THAN (4) ENGINE = Dstore,
  SUBPARTITION q2_2022 VALUES LESS THAN (7) ENGINE = Dstore,
  SUBPARTITION q3_2022 VALUES LESS THAN (10) ENGINE = Dstore,
  SUBPARTITION q4_2022 VALUES LESS THAN (13) ENGINE = Dstore),
 PARTITION p_2025
 (SUBPARTITION q1_2015 VALUES LESS THAN (4) ENGINE = Dstore,
  SUBPARTITION q2_2015 VALUES LESS THAN (7) ENGINE = Dstore,
  SUBPARTITION q3_2015 VALUES LESS THAN (10) ENGINE = Dstore,
  SUBPARTITION q4_2015 VALUES LESS THAN (13) ENGINE = Dstore)) */
ALTER TABLE sales_range_range REORGANIZE PARTITION p_2021 INTO (
PARTITION p_2021_1 (
SUBPARTITION q1_2021_1 VALUES LESS THAN(4),
SUBPARTITION q2_2021_1 VALUES LESS THAN(7),
SUBPARTITION q3_2021_1 VALUES LESS THAN(10),
SUBPARTITION q4_2021_1 VALUES LESS THAN(13)
),
PARTITION p_2021_2 (
SUBPARTITION q1_2021_2 VALUES LESS THAN(4),
SUBPARTITION q2_2021_2 VALUES LESS THAN(7),
SUBPARTITION q3_2021_2 VALUES LESS THAN(10),
SUBPARTITION q4_2021_2 VALUES LESS THAN(13)
)
);
ERROR HY000: REORGANIZE PARTITION can only be used to reorganize partitions not to change their numbers
ALTER TABLE sales_range_range REORGANIZE PARTITION p_2021 INTO (
PARTITION p_2021_1 (
SUBPARTITION q1_2021_1 VALUES LESS THAN(4),
SUBPARTITION q2_2021_1 VALUES LESS THAN(7),
SUBPARTITION q3_2021_1 VALUES LESS THAN(10),
SUBPARTITION q4_2021_1 VALUES LESS THAN(13)
)
);
SHOW CREATE TABLE sales_range_range;
Table	Create Table
sales_range_range	CREATE TABLE `sales_range_range` (
  `dept_no` int DEFAULT NULL,
  `part_no` int DEFAULT NULL,
  `country` varchar(20) DEFAULT NULL,
  `date` date DEFAULT NULL,
  `amount` int DEFAULT NULL
) ENGINE=Dstore DEFAULT CHARSET=utf8mb4 COLLATE=utf8mb4_0900_ai_ci
/*!50100 PARTITION BY LINEAR KEY (`date`,amount)
SUBPARTITION BY RANGE (month(`date`))
(PARTITION p_2020
 (SUBPARTITION q1_2020 VALUES LESS THAN (4) ENGINE = Dstore,
  SUBPARTITION q2_2020 VALUES LESS THAN (7) ENGINE = Dstore,
  SUBPARTITION q3_2020 VALUES LESS THAN (10) ENGINE = Dstore,
  SUBPARTITION q4_2020 VALUES LESS THAN (13) ENGINE = Dstore),
 PARTITION p_2021_1
 (SUBPARTITION q1_2021_1 VALUES LESS THAN (4) ENGINE = Dstore,
  SUBPARTITION q2_2021_1 VALUES LESS THAN (7) ENGINE = Dstore,
  SUBPARTITION q3_2021_1 VALUES LESS THAN (10) ENGINE = Dstore,
  SUBPARTITION q4_2021_1 VALUES LESS THAN (13) ENGINE = Dstore),
 PARTITION p_2022
 (SUBPARTITION q1_2022 VALUES LESS THAN (4) ENGINE = Dstore,
  SUBPARTITION q2_2022 VALUES LESS THAN (7) ENGINE = Dstore,
  SUBPARTITION q3_2022 VALUES LESS THAN (10) ENGINE = Dstore,
  SUBPARTITION q4_2022 VALUES LESS THAN (13) ENGINE = Dstore),
 PARTITION p_2025
 (SUBPARTITION q1_2015 VALUES LESS THAN (4) ENGINE = Dstore,
  SUBPARTITION q2_2015 VALUES LESS THAN (7) ENGINE = Dstore,
  SUBPARTITION q3_2015 VALUES LESS THAN (10) ENGINE = Dstore,
  SUBPARTITION q4_2015 VALUES LESS THAN (13) ENGINE = Dstore)) */
INSERT INTO sales_range_range(date) VALUES('2020-04-05'),('2020-08-06'),('2021-05-06');
SELECT * FROM sales_range_range;
dept_no	part_no	country	date	amount
NULL	NULL	NULL	2020-04-05	NULL
NULL	NULL	NULL	2021-05-06	NULL
NULL	NULL	NULL	2020-08-06	NULL
ALTER TABLE sales_range_range ANALYZE PARTITION q2_2021_1, q1_2022;
Table	Op	Msg_type	Msg_text
test.sales_range_range	analyze	status	OK
ALTER TABLE sales_range_range CHECK PARTITION q2_2021_1, q1_2022;
Table	Op	Msg_type	Msg_text
test.sales_range_range	check	status	OK
ALTER TABLE sales_range_range OPTIMIZE PARTITION q2_2021_1, q1_2022;
Table	Op	Msg_type	Msg_text
test.sales_range_range	optimize	note	Table does not support optimize on partitions. All partitions will be rebuilt and analyzed.
test.sales_range_range	optimize	status	OK
"REBUILD only adapts to partition but not SUBPARTITION"
ALTER TABLE sales_range_range REBUILD PARTITION p_2021_1;
ALTER TABLE sales_range_range REPAIR PARTITION q2_2021_1, q1_2022;
Table	Op	Msg_type	Msg_text
test.sales_range_range	repair	status	OK
ALTER TABLE sales_range_range TRUNCATE PARTITION q2_2021_1;
SELECT * FROM sales_range_range;
dept_no	part_no	country	date	amount
NULL	NULL	NULL	2020-08-06	NULL
ALTER TABLE sales_range_range TRUNCATE PARTITION p_2021_1;
SELECT * FROM sales_range_range;
dept_no	part_no	country	date	amount
ALTER TABLE sales_range_range REMOVE PARTITIONING;
SHOW CREATE TABLE sales_range_range;
Table	Create Table
sales_range_range	CREATE TABLE `sales_range_range` (
  `dept_no` int DEFAULT NULL,
  `part_no` int DEFAULT NULL,
  `country` varchar(20) DEFAULT NULL,
  `date` date DEFAULT NULL,
  `amount` int DEFAULT NULL
) ENGINE=Dstore DEFAULT CHARSET=utf8mb4 COLLATE=utf8mb4_0900_ai_ci
SELECT * FROM sales_range_range;
dept_no	part_no	country	date	amount
DROP TABLE sales_range_range;
CREATE TABLE sales_range_range
(
dept_no     INT,
part_no     INT,
country     varchar(20),
date        DATE,
amount      INT
)
PARTITION BY LINEAR KEY(date)
SUBPARTITION BY RANGE(month(date))
(
PARTITION p_2020 (
SUBPARTITION q1_2020 VALUES LESS THAN(4),
SUBPARTITION q2_2020 VALUES LESS THAN(7)
),
PARTITION p_2021 (
SUBPARTITION q1_2020 VALUES LESS THAN(4),
SUBPARTITION q2_2021 VALUES LESS THAN(7)
)
);
ERROR HY000: Duplicate partition name q1_2020
CREATE TABLE sales_range_range
(
dept_no     INT,
part_no     INT,
country     varchar(20),
date        DATE,
amount      INT
)
PARTITION BY LINEAR KEY(date)
SUBPARTITION BY RANGE(month(date))
(
PARTITION p_2020 (
SUBPARTITION q1_2020 VALUES LESS THAN(4),
SUBPARTITION q2_2020 VALUES LESS THAN(7)
),
PARTITION p_2021 (
SUBPARTITION q1_2021 VALUES LESS THAN(4)
)
);
ERROR 42000: Wrong number of subpartitions defined, mismatch with previous setting near '(
SUBPARTITION q1_2021 VALUES LESS THAN(4)
)
)' at line 16
CREATE TABLE sales_range_range3
(
dept_no     INT,
part_no     INT,
country     varchar(20),
date        DATE,
amount      INT
)
PARTITION BY LINEAR KEY(date)
SUBPARTITION BY RANGE(month(date))
(
PARTITION p_2020 
);
ERROR HY000: For RANGE partitions each partition must be defined
CREATE TABLE sales_range_range
(
dept_no     INT,
part_no     INT,
country     varchar(20),
date        DATE,
amount      INT
)
PARTITION BY LINEAR KEY(date)
SUBPARTITION BY RANGE(month(date))
(
PARTITION p_2020 (
SUBPARTITION q1_2020 VALUES LESS THAN(4),
SUBPARTITION q2_2020 VALUES LESS THAN(7)
),
PARTITION p_2021 (
SUBPARTITION q1_2021 VALUES LESS THAN(4),
SUBPARTITION q2_2021 VALUES LESS THAN(7)
)
);
INSERT INTO sales_range_range(date) VALUES('2021-5-23'),('2010-2-23');
ALTER TABLE sales_range_range ANALYZE PARTITION p_2020, p_2021;
Table	Op	Msg_type	Msg_text
test.sales_range_range	analyze	status	OK
SELECT partition_name, SUBPARTITION_name, table_rows from information_schema.partitions where table_name = 'sales_range_range';
PARTITION_NAME	SUBPARTITION_NAME	TABLE_ROWS
p_2020	q1_2020	1
p_2020	q2_2020	1
p_2021	q1_2021	0
p_2021	q2_2021	0
DROP TABLE sales_range_range;
CREATE TABLE sales_range_range
(
dept_no     INT,
part_no     INT,
country     varchar(20),
date        DATE,
amount      INT
)
PARTITION BY LINEAR KEY(date)
SUBPARTITION BY RANGE(month(date))
(
PARTITION p_2020(
SUBPARTITION q1_2020 VALUES LESS THAN(4),
SUBPARTITION q2_2020 VALUES LESS THAN(7)
),
PARTITION p_2021 (
SUBPARTITION q1_2021 VALUES LESS THAN(8),
SUBPARTITION q2_2021 VALUES LESS THAN(13)
)
);
DROP TABLE sales_range_range;
CREATE TABLE sales_range_columns_range
(
dept_no     INT,
part_no     INT,
country     varchar(20),
date        DATE,
amount      INT
)
PARTITION BY LINEAR KEY (dept_no, part_no)
SUBPARTITION BY RANGE COLUMNS(am)
(
PARTITION p1 (
SUBPARTITION q1_2019 VALUES LESS THAN(4),
SUBPARTITION q2_2019 VALUES LESS THAN(7)
),
PARTITION p2 (
SUBPARTITION q1_2020 VALUES LESS THAN(4),
SUBPARTITION q2_2020 VALUES LESS THAN(7)
)
);
ERROR HY000: Field in list of fields for partition function not found in table
CREATE TABLE sales_range_range
(
dept_no     INT,
part_no     INT,
country     varchar(20),
date        DATE,
amount      INT
)
PARTITION BY LINEAR KEY(date)
SUBPARTITION BY RANGE(month(date))
(
PARTITION p_2020 (
SUBPARTITION q1_2020 VALUES LESS THAN(4),
SUBPARTITION q2_2020 VALUES LESS THAN(7)
),
PARTITION p_2021 (
SUBPARTITION q1_2021 VALUES LESS THAN(8),
SUBPARTITION q2_2021 VALUES LESS THAN(13)
)
);
INSERT INTO sales_range_range PARTITION (p_2020) VALUES (1, 1, 'china', '2012-01-12', 1);
INSERT INTO sales_range_range PARTITION (q2_2020) VALUES (1, 1, 'china', '2012-08-12', 1);
ERROR HY000: Table has no partition for value 8
INSERT INTO sales_range_range PARTITION (p_2020,q2_2020) VALUES (1, 1, 'china', '2012-08-12', 1);
ERROR HY000: Table has no partition for value 8
SELECT * from sales_range_range;
dept_no	part_no	country	date	amount
1	1	china	2012-01-12	1
UPDATE sales_range_range partition(q1_2020) SET dept_no = dept_no + 1;
SELECT * from sales_range_range;
dept_no	part_no	country	date	amount
2	1	china	2012-01-12	1
DELETE FROM sales_range_range partition(q1_2020);
SELECT * from sales_range_range;
dept_no	part_no	country	date	amount
DROP TABLE sales_range_range;
CREATE TABLE sales_range_range
(
dept_no     INT,
part_no     INT,
country     varchar(20),
date        DATE,
amount      INT
)
PARTITION BY LINEAR KEY(date)
SUBPARTITION BY RANGE(month(date))
(
PARTITION p_2020(
SUBPARTITION q1_2020 VALUES LESS THAN(4),
SUBPARTITION q2_2020 VALUES LESS THAN(7)
),
PARTITION p_2021 (
SUBPARTITION q1_2021 VALUES LESS THAN(8),
SUBPARTITION q2_2021 VALUES LESS THAN(13)
)
);
ALTER TABLE sales_range_range ADD PARTITION (
PARTITION p_2022 (
SUBPARTITION q1_2022 VALUES LESS THAN(4),
SUBPARTITION q2_2022 VALUES LESS THAN(7),
SUBPARTITION q2_2022 VALUES LESS THAN(10),
SUBPARTITION q2_2022 VALUES LESS THAN(13)
)
);
ERROR HY000: Trying to Add partition(s) with wrong number of subpartitions
ALTER TABLE sales_range_range ADD PARTITION (
partition p_2022 (
SUBPARTITION q2_2022 VALUES LESS THAN(10),
SUBPARTITION q2_2022 VALUES LESS THAN(13)
)
);
ERROR HY000: Duplicate partition name q2_2022
ALTER TABLE sales_range_range add partition (
partition p_2022 (
SUBPARTITION q1_2022 VALUES LESS THAN(15),
SUBPARTITION q2_2022 VALUES LESS THAN(13)
)
);
ERROR HY000: VALUES LESS THAN value must be strictly increasing for each partition
ALTER TABLE sales_range_range add partition (
partition p_max (
SUBPARTITION q1_max VALUES LESS THAN(4),
SUBPARTITION q3_max VALUES LESS THAN(MAXVALUE) 
)
);
ALTER TABLE sales_range_range add partition (
partition p_2024 (
SUBPARTITION q3_2025 VALUES LESS THAN(10),
SUBPARTITION q4_2025 VALUES LESS THAN(13)
)
);
DROP table sales_range_range;
CREATE TABLE t1 (
`a` int ,
`b` int ,
Primary Key(a, b));
INSERT INTO t1 values(1,1),(2,1),(3,1),(4,1),(111,111),(3333,333);
ALTER TABLE t1 partition by LINEAR KEY(a) (
partition p0,
partition p1,
partition p2
);
ALTER TABLE t1 ANALYZE PARTITION p0, p1, p2;
Table	Op	Msg_type	Msg_text
test.t1	analyze	status	OK
select partition_name, SUBPARTITION_name, TABLE_rows from information_schema.partitions where table_name = 't1';
PARTITION_NAME	SUBPARTITION_NAME	TABLE_ROWS
p0	NULL	1
p1	NULL	3
p2	NULL	2
SELECT * FROM t1 partition(p0);
a	b
1	1
ALTER TABLE t1 partition by LINEAR KEY(a) SUBPARTITION by range(b) (
partition p0(
SUBPARTITION p0sp0 VALUES LESS THAN(6),
SUBPARTITION p0sp1 VALUES LESS THAN(1000)
),
partition p1(
SUBPARTITION p1sp0 VALUES LESS THAN(6),
SUBPARTITION p1sp1 VALUES LESS THAN(1000)
),
partition p2(
SUBPARTITION p2sp0 VALUES LESS THAN(6),
SUBPARTITION p2sp1 VALUES LESS THAN(1000)
)
);
DROP TABLE t1;
CREATE TABLE t1 (
`a` int ,
`b` int ,
Primary Key(a, b));
INSERT INTO t1 values(1,1),(2,1),(3,1),(4,1),(111,111),(3333,333);
ALTER TABLE t1 partition by LINEAR KEY(a) SUBPARTITION by range(b) (
partition p0(
SUBPARTITION p0sp0 VALUES LESS THAN(6),
SUBPARTITION p0sp1 VALUES LESS THAN(1000)
),
partition p1(
SUBPARTITION p1sp0 VALUES LESS THAN(6),
SUBPARTITION p1sp1 VALUES LESS THAN(1000)
),
partition p2(
SUBPARTITION p2sp0 VALUES LESS THAN(6),
SUBPARTITION p2sp1 VALUES LESS THAN(1000)
)
);
ALTER TABLE t1 ANALYZE PARTITION p0, p1, p2;
Table	Op	Msg_type	Msg_text
test.t1	analyze	status	OK
select partition_name, SUBPARTITION_name, TABLE_rows from information_schema.partitions where table_name = 't1';
PARTITION_NAME	SUBPARTITION_NAME	TABLE_ROWS
p0	p0sp0	1
p0	p0sp1	0
p1	p1sp0	2
p1	p1sp1	1
p2	p2sp0	1
p2	p2sp1	1
ALTER TABLE t1 partition by LINEAR KEY(a) SUBPARTITION by range(b) (
partition p0(
SUBPARTITION p0sp0 VALUES LESS THAN(6),
SUBPARTITION p0sp1 VALUES LESS THAN(1000)
),
partition p1(
SUBPARTITION p1sp0 VALUES LESS THAN(6),
SUBPARTITION p1sp1 VALUES LESS THAN(1000)
)
);
ALTER TABLE t1 ANALYZE PARTITION p0, p1;
Table	Op	Msg_type	Msg_text
test.t1	analyze	status	OK
select partition_name, SUBPARTITION_name, TABLE_rows from information_schema.partitions where table_name = 't1';
PARTITION_NAME	SUBPARTITION_NAME	TABLE_ROWS
p0	p0sp0	2
p0	p0sp1	1
p1	p1sp0	2
p1	p1sp1	1
ALTER TABLE t1 DROP partition p0sp0;
ERROR HY000: DROP PARTITION can only be used on RANGE/LIST partitions
ALTER TABLE t1 DROP partition p2;
ERROR HY000: DROP PARTITION can only be used on RANGE/LIST partitions
SHOW CREATE TABLE t1;
Table	Create Table
t1	CREATE TABLE `t1` (
  `a` int NOT NULL,
  `b` int NOT NULL,
  PRIMARY KEY (`a`,`b`)
) ENGINE=Dstore DEFAULT CHARSET=utf8mb4 COLLATE=utf8mb4_0900_ai_ci
/*!50100 PARTITION BY LINEAR KEY (a)
SUBPARTITION BY RANGE (`b`)
(PARTITION p0
 (SUBPARTITION p0sp0 VALUES LESS THAN (6) ENGINE = Dstore,
  SUBPARTITION p0sp1 VALUES LESS THAN (1000) ENGINE = Dstore),
 PARTITION p1
 (SUBPARTITION p1sp0 VALUES LESS THAN (6) ENGINE = Dstore,
  SUBPARTITION p1sp1 VALUES LESS THAN (1000) ENGINE = Dstore)) */
SELECT * FROM t1 partition(p1sp1);
a	b
3333	333
ALTER TABLE t1 truncate partition p1sp1;
SHOW CREATE TABLE t1;
Table	Create Table
t1	CREATE TABLE `t1` (
  `a` int NOT NULL,
  `b` int NOT NULL,
  PRIMARY KEY (`a`,`b`)
) ENGINE=Dstore DEFAULT CHARSET=utf8mb4 COLLATE=utf8mb4_0900_ai_ci
/*!50100 PARTITION BY LINEAR KEY (a)
SUBPARTITION BY RANGE (`b`)
(PARTITION p0
 (SUBPARTITION p0sp0 VALUES LESS THAN (6) ENGINE = Dstore,
  SUBPARTITION p0sp1 VALUES LESS THAN (1000) ENGINE = Dstore),
 PARTITION p1
 (SUBPARTITION p1sp0 VALUES LESS THAN (6) ENGINE = Dstore,
  SUBPARTITION p1sp1 VALUES LESS THAN (1000) ENGINE = Dstore)) */
SELECT * FROM t1 partition(p1sp1);
a	b
SELECT * FROM t1 partition(p1);
a	b
2	1
4	1
ALTER TABLE t1 truncate partition p1;
SHOW CREATE TABLE t1;
Table	Create Table
t1	CREATE TABLE `t1` (
  `a` int NOT NULL,
  `b` int NOT NULL,
  PRIMARY KEY (`a`,`b`)
) ENGINE=Dstore DEFAULT CHARSET=utf8mb4 COLLATE=utf8mb4_0900_ai_ci
/*!50100 PARTITION BY LINEAR KEY (a)
SUBPARTITION BY RANGE (`b`)
(PARTITION p0
 (SUBPARTITION p0sp0 VALUES LESS THAN (6) ENGINE = Dstore,
  SUBPARTITION p0sp1 VALUES LESS THAN (1000) ENGINE = Dstore),
 PARTITION p1
 (SUBPARTITION p1sp0 VALUES LESS THAN (6) ENGINE = Dstore,
  SUBPARTITION p1sp1 VALUES LESS THAN (1000) ENGINE = Dstore)) */
SELECT * FROM t1 partition(p1);
a	b
DROP TABLE t1;
CREATE TABLE t1 (
`a` int ,
`b` int ,
Primary Key(a, b));
INSERT INTO t1 values(1,1),(2,1),(3,1),(4,1),(111,111),(3333,333);
ALTER TABLE t1 partition by LINEAR KEY(a) SUBPARTITION by range(b) (
partition p0(
SUBPARTITION p0sp0 VALUES LESS THAN(6),
SUBPARTITION p0sp1 VALUES LESS THAN(1000)
),
partition p1(
SUBPARTITION p1sp0 VALUES LESS THAN(6),
SUBPARTITION p1sp1 VALUES LESS THAN(1000)
),
partition p2(
SUBPARTITION p2sp0 VALUES LESS THAN(6),
SUBPARTITION p2sp1 VALUES LESS THAN(1000)
)
);
ALTER TABLE t1 reorganize partition p2 INTO
(
partition p2(
SUBPARTITION p2sp0 VALUES LESS THAN(100),
SUBPARTITION p2sp1 VALUES LESS THAN(1000)
)
);
SHOW CREATE TABLE t1;
Table	Create Table
t1	CREATE TABLE `t1` (
  `a` int NOT NULL,
  `b` int NOT NULL,
  PRIMARY KEY (`a`,`b`)
) ENGINE=Dstore DEFAULT CHARSET=utf8mb4 COLLATE=utf8mb4_0900_ai_ci
/*!50100 PARTITION BY LINEAR KEY (a)
SUBPARTITION BY RANGE (`b`)
(PARTITION p0
 (SUBPARTITION p0sp0 VALUES LESS THAN (6) ENGINE = Dstore,
  SUBPARTITION p0sp1 VALUES LESS THAN (1000) ENGINE = Dstore),
 PARTITION p1
 (SUBPARTITION p1sp0 VALUES LESS THAN (6) ENGINE = Dstore,
  SUBPARTITION p1sp1 VALUES LESS THAN (1000) ENGINE = Dstore),
 PARTITION p2
 (SUBPARTITION p2sp0 VALUES LESS THAN (100) ENGINE = Dstore,
  SUBPARTITION p2sp1 VALUES LESS THAN (1000) ENGINE = Dstore)) */
ALTER TABLE t1 reorganize partition p0,p1 into
(
partition p0(
SUBPARTITION p0sp0 VALUES LESS THAN(100),
SUBPARTITION p0sp1 VALUES LESS THAN(1000)
)
);
ERROR HY000: REORGANIZE PARTITION can only be used to reorganize partitions not to change their numbers
ALTER TABLE t1 reorganize partition p0 into
(
partition p0(
SUBPARTITION p0sp0 VALUES LESS THAN(100),
SUBPARTITION p0sp1 VALUES LESS THAN(1000)
),
partition p1(
SUBPARTITION p1sp0 VALUES LESS THAN(100),
SUBPARTITION p1sp1 VALUES LESS THAN(1000)
)
);
ERROR HY000: REORGANIZE PARTITION can only be used to reorganize partitions not to change their numbers
SHOW CREATE TABLE t1;
Table	Create Table
t1	CREATE TABLE `t1` (
  `a` int NOT NULL,
  `b` int NOT NULL,
  PRIMARY KEY (`a`,`b`)
) ENGINE=Dstore DEFAULT CHARSET=utf8mb4 COLLATE=utf8mb4_0900_ai_ci
/*!50100 PARTITION BY LINEAR KEY (a)
SUBPARTITION BY RANGE (`b`)
(PARTITION p0
 (SUBPARTITION p0sp0 VALUES LESS THAN (6) ENGINE = Dstore,
  SUBPARTITION p0sp1 VALUES LESS THAN (1000) ENGINE = Dstore),
 PARTITION p1
 (SUBPARTITION p1sp0 VALUES LESS THAN (6) ENGINE = Dstore,
  SUBPARTITION p1sp1 VALUES LESS THAN (1000) ENGINE = Dstore),
 PARTITION p2
 (SUBPARTITION p2sp0 VALUES LESS THAN (100) ENGINE = Dstore,
  SUBPARTITION p2sp1 VALUES LESS THAN (1000) ENGINE = Dstore)) */
DROP TABLE t1;
CREATE TABLE tsp (
`a` int ,
`b` int ,
Primary Key(a, b));
INSERT INTO tsp values(1,1),(2,1),(3,1),(4,1),(111,111),(3333,333);
ALTER TABLE tsp partition by LINEAR KEY(a) SUBPARTITION by range(b) (
partition p0 (
SUBPARTITION p0sp0 VALUES LESS THAN(6),
SUBPARTITION p0sp1 VALUES LESS THAN(1000)
),
partition p1 (
SUBPARTITION p1sp0 VALUES LESS THAN(6),
SUBPARTITION p1sp1 VALUES LESS THAN(1000)
),
partition p2 (
SUBPARTITION p2sp0 VALUES LESS THAN(6),
SUBPARTITION p2sp1 VALUES LESS THAN(1000)
)
);
create TABLE t like tsp;
ALTER TABLE t remove partitioning;
SELECT * FROM tsp partition(p2sp1);
a	b
111	111
ALTER TABLE tsp EXCHANGE PARTITION p2sp1 WITH TABLE t;
SHOW CREATE TABLE t;
Table	Create Table
t	CREATE TABLE `t` (
  `a` int NOT NULL,
  `b` int NOT NULL,
  PRIMARY KEY (`a`,`b`)
) ENGINE=Dstore DEFAULT CHARSET=utf8mb4 COLLATE=utf8mb4_0900_ai_ci
SHOW CREATE TABLE tsp;
Table	Create Table
tsp	CREATE TABLE `tsp` (
  `a` int NOT NULL,
  `b` int NOT NULL,
  PRIMARY KEY (`a`,`b`)
) ENGINE=Dstore DEFAULT CHARSET=utf8mb4 COLLATE=utf8mb4_0900_ai_ci
/*!50100 PARTITION BY LINEAR KEY (a)
SUBPARTITION BY RANGE (`b`)
(PARTITION p0
 (SUBPARTITION p0sp0 VALUES LESS THAN (6) ENGINE = Dstore,
  SUBPARTITION p0sp1 VALUES LESS THAN (1000) ENGINE = Dstore),
 PARTITION p1
 (SUBPARTITION p1sp0 VALUES LESS THAN (6) ENGINE = Dstore,
  SUBPARTITION p1sp1 VALUES LESS THAN (1000) ENGINE = Dstore),
 PARTITION p2
 (SUBPARTITION p2sp0 VALUES LESS THAN (6) ENGINE = Dstore,
  SUBPARTITION p2sp1 VALUES LESS THAN (1000) ENGINE = Dstore)) */
SELECT * FROM tsp partition(p2sp1);
a	b
SELECT * FROM t;
a	b
111	111
DELETE FROM t;
INSERT INTO t values(1023,2000);
ALTER TABLE tsp EXCHANGE PARTITION p2sp1 WITH TABLE t;
ERROR HY000: Table has no partition for value 2000
ALTER TABLE tsp EXCHANGE PARTITION p2sp1 WITH TABLE t without VALIDATION;
SELECT * FROM tsp PARTITION(p2sp1);
a	b
1023	2000
SELECT * FROM t;
a	b
DROP TABLE t,tsp;
CREATE TABLE range_range
(
dept_no     INT,
part_no     INT,
country     varchar(20),
date        DATE,
amount      INT
)
PARTITION BY LINEAR KEY(date)
SUBPARTITION BY RANGE(month(date))
(
PARTITION p_2020 (
SUBPARTITION q1_2020 VALUES LESS THAN(4),
SUBPARTITION q2_2020 VALUES LESS THAN(7),
SUBPARTITION q3_2020 VALUES LESS THAN(10),
SUBPARTITION q4_2020 VALUES LESS THAN(13)
),
PARTITION p_2021 (
SUBPARTITION q1_2021 VALUES LESS THAN(4),
SUBPARTITION q2_2021 VALUES LESS THAN(7),
SUBPARTITION q3_2021 VALUES LESS THAN(10),
SUBPARTITION q4_2021 VALUES LESS THAN(13)
)
);
INSERT INTO range_range(date) VALUES('2020-04-12'),('2019-06-12'),('2019-08-12'),('2019-10-12'),('2021-06-12'),('2021-08-12'),('2021-10-12');
SELECT * FROM range_range;
dept_no	part_no	country	date	amount
NULL	NULL	NULL	2020-04-12	NULL
NULL	NULL	NULL	2019-06-12	NULL
NULL	NULL	NULL	2021-06-12	NULL
NULL	NULL	NULL	2019-08-12	NULL
NULL	NULL	NULL	2021-08-12	NULL
NULL	NULL	NULL	2019-10-12	NULL
NULL	NULL	NULL	2021-10-12	NULL
SHOW CREATE TABLE range_range;
Table	Create Table
range_range	CREATE TABLE `range_range` (
  `dept_no` int DEFAULT NULL,
  `part_no` int DEFAULT NULL,
  `country` varchar(20) DEFAULT NULL,
  `date` date DEFAULT NULL,
  `amount` int DEFAULT NULL
) ENGINE=Dstore DEFAULT CHARSET=utf8mb4 COLLATE=utf8mb4_0900_ai_ci
/*!50100 PARTITION BY LINEAR KEY (`date`)
SUBPARTITION BY RANGE (month(`date`))
(PARTITION p_2020
 (SUBPARTITION q1_2020 VALUES LESS THAN (4) ENGINE = Dstore,
  SUBPARTITION q2_2020 VALUES LESS THAN (7) ENGINE = Dstore,
  SUBPARTITION q3_2020 VALUES LESS THAN (10) ENGINE = Dstore,
  SUBPARTITION q4_2020 VALUES LESS THAN (13) ENGINE = Dstore),
 PARTITION p_2021
 (SUBPARTITION q1_2021 VALUES LESS THAN (4) ENGINE = Dstore,
  SUBPARTITION q2_2021 VALUES LESS THAN (7) ENGINE = Dstore,
  SUBPARTITION q3_2021 VALUES LESS THAN (10) ENGINE = Dstore,
  SUBPARTITION q4_2021 VALUES LESS THAN (13) ENGINE = Dstore)) */
ALTER TABLE range_range ANALYZE PARTITION p_2020,q3_2021;
Table	Op	Msg_type	Msg_text
test.range_range	analyze	status	OK
SELECT * FROM range_range partition(p_2021);
dept_no	part_no	country	date	amount
SHOW CREATE TABLE range_range;
Table	Create Table
range_range	CREATE TABLE `range_range` (
  `dept_no` int DEFAULT NULL,
  `part_no` int DEFAULT NULL,
  `country` varchar(20) DEFAULT NULL,
  `date` date DEFAULT NULL,
  `amount` int DEFAULT NULL
) ENGINE=Dstore DEFAULT CHARSET=utf8mb4 COLLATE=utf8mb4_0900_ai_ci
/*!50100 PARTITION BY LINEAR KEY (`date`)
SUBPARTITION BY RANGE (month(`date`))
(PARTITION p_2020
 (SUBPARTITION q1_2020 VALUES LESS THAN (4) ENGINE = Dstore,
  SUBPARTITION q2_2020 VALUES LESS THAN (7) ENGINE = Dstore,
  SUBPARTITION q3_2020 VALUES LESS THAN (10) ENGINE = Dstore,
  SUBPARTITION q4_2020 VALUES LESS THAN (13) ENGINE = Dstore),
 PARTITION p_2021
 (SUBPARTITION q1_2021 VALUES LESS THAN (4) ENGINE = Dstore,
  SUBPARTITION q2_2021 VALUES LESS THAN (7) ENGINE = Dstore,
  SUBPARTITION q3_2021 VALUES LESS THAN (10) ENGINE = Dstore,
  SUBPARTITION q4_2021 VALUES LESS THAN (13) ENGINE = Dstore)) */
DROP TABLE range_range;
CREATE TABLE range_range
(
dept_no     INT,
part_no     INT,
country     varchar(20),
date        DATE,
amount      INT
)
PARTITION BY LINEAR KEY(date)
SUBPARTITION BY RANGE(month(date))
(
PARTITION p_2020 (
SUBPARTITION q1_2020 VALUES LESS THAN(4),
SUBPARTITION q2_2020 VALUES LESS THAN(7),
SUBPARTITION q3_2020 VALUES LESS THAN(10),
SUBPARTITION q4_2020 VALUES LESS THAN(13)
),
PARTITION p_2021 (
SUBPARTITION q1_2021 VALUES LESS THAN(4),
SUBPARTITION q2_2021 VALUES LESS THAN(7),
SUBPARTITION q3_2021 VALUES LESS THAN(10),
SUBPARTITION q4_2021 VALUES LESS THAN(13)
)
);
INSERT INTO range_range(date) VALUES('2020-04-12'),('2019-06-12'),('2019-08-12'),('2019-10-12'),('2021-06-12'),('2021-08-12'),('2021-10-12');
SELECT * FROM range_range;
dept_no	part_no	country	date	amount
NULL	NULL	NULL	2020-04-12	NULL
NULL	NULL	NULL	2019-06-12	NULL
NULL	NULL	NULL	2021-06-12	NULL
NULL	NULL	NULL	2019-08-12	NULL
NULL	NULL	NULL	2021-08-12	NULL
NULL	NULL	NULL	2019-10-12	NULL
NULL	NULL	NULL	2021-10-12	NULL
SHOW CREATE TABLE range_range;
Table	Create Table
range_range	CREATE TABLE `range_range` (
  `dept_no` int DEFAULT NULL,
  `part_no` int DEFAULT NULL,
  `country` varchar(20) DEFAULT NULL,
  `date` date DEFAULT NULL,
  `amount` int DEFAULT NULL
) ENGINE=Dstore DEFAULT CHARSET=utf8mb4 COLLATE=utf8mb4_0900_ai_ci
/*!50100 PARTITION BY LINEAR KEY (`date`)
SUBPARTITION BY RANGE (month(`date`))
(PARTITION p_2020
 (SUBPARTITION q1_2020 VALUES LESS THAN (4) ENGINE = Dstore,
  SUBPARTITION q2_2020 VALUES LESS THAN (7) ENGINE = Dstore,
  SUBPARTITION q3_2020 VALUES LESS THAN (10) ENGINE = Dstore,
  SUBPARTITION q4_2020 VALUES LESS THAN (13) ENGINE = Dstore),
 PARTITION p_2021
 (SUBPARTITION q1_2021 VALUES LESS THAN (4) ENGINE = Dstore,
  SUBPARTITION q2_2021 VALUES LESS THAN (7) ENGINE = Dstore,
  SUBPARTITION q3_2021 VALUES LESS THAN (10) ENGINE = Dstore,
  SUBPARTITION q4_2021 VALUES LESS THAN (13) ENGINE = Dstore)) */
ALTER TABLE range_range CHECK PARTITION p_2020,q3_2021;
Table	Op	Msg_type	Msg_text
test.range_range	check	status	OK
SELECT * FROM range_range partition(p_2021);
dept_no	part_no	country	date	amount
SHOW CREATE TABLE range_range;
Table	Create Table
range_range	CREATE TABLE `range_range` (
  `dept_no` int DEFAULT NULL,
  `part_no` int DEFAULT NULL,
  `country` varchar(20) DEFAULT NULL,
  `date` date DEFAULT NULL,
  `amount` int DEFAULT NULL
) ENGINE=Dstore DEFAULT CHARSET=utf8mb4 COLLATE=utf8mb4_0900_ai_ci
/*!50100 PARTITION BY LINEAR KEY (`date`)
SUBPARTITION BY RANGE (month(`date`))
(PARTITION p_2020
 (SUBPARTITION q1_2020 VALUES LESS THAN (4) ENGINE = Dstore,
  SUBPARTITION q2_2020 VALUES LESS THAN (7) ENGINE = Dstore,
  SUBPARTITION q3_2020 VALUES LESS THAN (10) ENGINE = Dstore,
  SUBPARTITION q4_2020 VALUES LESS THAN (13) ENGINE = Dstore),
 PARTITION p_2021
 (SUBPARTITION q1_2021 VALUES LESS THAN (4) ENGINE = Dstore,
  SUBPARTITION q2_2021 VALUES LESS THAN (7) ENGINE = Dstore,
  SUBPARTITION q3_2021 VALUES LESS THAN (10) ENGINE = Dstore,
  SUBPARTITION q4_2021 VALUES LESS THAN (13) ENGINE = Dstore)) */
DROP TABLE range_range;
CREATE TABLE range_range
(
dept_no     INT,
part_no     INT,
country     varchar(20),
date        DATE,
amount      INT
)
PARTITION BY LINEAR KEY(date)
SUBPARTITION BY RANGE(month(date))
(
PARTITION p_2020 (
SUBPARTITION q1_2020 VALUES LESS THAN(4),
SUBPARTITION q2_2020 VALUES LESS THAN(7),
SUBPARTITION q3_2020 VALUES LESS THAN(10),
SUBPARTITION q4_2020 VALUES LESS THAN(13)
),
PARTITION p_2021 (
SUBPARTITION q1_2021 VALUES LESS THAN(4),
SUBPARTITION q2_2021 VALUES LESS THAN(7),
SUBPARTITION q3_2021 VALUES LESS THAN(10),
SUBPARTITION q4_2021 VALUES LESS THAN(13)
)
);
INSERT INTO range_range(date) VALUES('2020-04-12'),('2019-06-12'),('2019-08-12'),('2019-10-12'),('2021-06-12'),('2021-08-12'),('2021-10-12');
SELECT * FROM range_range;
dept_no	part_no	country	date	amount
NULL	NULL	NULL	2020-04-12	NULL
NULL	NULL	NULL	2019-06-12	NULL
NULL	NULL	NULL	2021-06-12	NULL
NULL	NULL	NULL	2019-08-12	NULL
NULL	NULL	NULL	2021-08-12	NULL
NULL	NULL	NULL	2019-10-12	NULL
NULL	NULL	NULL	2021-10-12	NULL
SHOW CREATE TABLE range_range;
Table	Create Table
range_range	CREATE TABLE `range_range` (
  `dept_no` int DEFAULT NULL,
  `part_no` int DEFAULT NULL,
  `country` varchar(20) DEFAULT NULL,
  `date` date DEFAULT NULL,
  `amount` int DEFAULT NULL
) ENGINE=Dstore DEFAULT CHARSET=utf8mb4 COLLATE=utf8mb4_0900_ai_ci
/*!50100 PARTITION BY LINEAR KEY (`date`)
SUBPARTITION BY RANGE (month(`date`))
(PARTITION p_2020
 (SUBPARTITION q1_2020 VALUES LESS THAN (4) ENGINE = Dstore,
  SUBPARTITION q2_2020 VALUES LESS THAN (7) ENGINE = Dstore,
  SUBPARTITION q3_2020 VALUES LESS THAN (10) ENGINE = Dstore,
  SUBPARTITION q4_2020 VALUES LESS THAN (13) ENGINE = Dstore),
 PARTITION p_2021
 (SUBPARTITION q1_2021 VALUES LESS THAN (4) ENGINE = Dstore,
  SUBPARTITION q2_2021 VALUES LESS THAN (7) ENGINE = Dstore,
  SUBPARTITION q3_2021 VALUES LESS THAN (10) ENGINE = Dstore,
  SUBPARTITION q4_2021 VALUES LESS THAN (13) ENGINE = Dstore)) */
ALTER TABLE range_range OPTIMIZE PARTITION p_2020,q3_2021;
Table	Op	Msg_type	Msg_text
test.range_range	optimize	note	Table does not support optimize on partitions. All partitions will be rebuilt and analyzed.
test.range_range	optimize	status	OK
SELECT * FROM range_range partition(p_2021);
dept_no	part_no	country	date	amount
SHOW CREATE TABLE range_range;
Table	Create Table
range_range	CREATE TABLE `range_range` (
  `dept_no` int DEFAULT NULL,
  `part_no` int DEFAULT NULL,
  `country` varchar(20) DEFAULT NULL,
  `date` date DEFAULT NULL,
  `amount` int DEFAULT NULL
) ENGINE=Dstore DEFAULT CHARSET=utf8mb4 COLLATE=utf8mb4_0900_ai_ci
/*!50100 PARTITION BY LINEAR KEY (`date`)
SUBPARTITION BY RANGE (month(`date`))
(PARTITION p_2020
 (SUBPARTITION q1_2020 VALUES LESS THAN (4) ENGINE = Dstore,
  SUBPARTITION q2_2020 VALUES LESS THAN (7) ENGINE = Dstore,
  SUBPARTITION q3_2020 VALUES LESS THAN (10) ENGINE = Dstore,
  SUBPARTITION q4_2020 VALUES LESS THAN (13) ENGINE = Dstore),
 PARTITION p_2021
 (SUBPARTITION q1_2021 VALUES LESS THAN (4) ENGINE = Dstore,
  SUBPARTITION q2_2021 VALUES LESS THAN (7) ENGINE = Dstore,
  SUBPARTITION q3_2021 VALUES LESS THAN (10) ENGINE = Dstore,
  SUBPARTITION q4_2021 VALUES LESS THAN (13) ENGINE = Dstore)) */
DROP TABLE range_range;
CREATE TABLE range_range
(
dept_no     INT,
part_no     INT,
country     varchar(20),
date        DATE,
amount      INT
)
PARTITION BY LINEAR KEY(date)
SUBPARTITION BY RANGE(month(date))
(
PARTITION p_2020 (
SUBPARTITION q1_2020 VALUES LESS THAN(4),
SUBPARTITION q2_2020 VALUES LESS THAN(7),
SUBPARTITION q3_2020 VALUES LESS THAN(10),
SUBPARTITION q4_2020 VALUES LESS THAN(13)
),
PARTITION p_2021 (
SUBPARTITION q1_2021 VALUES LESS THAN(4),
SUBPARTITION q2_2021 VALUES LESS THAN(7),
SUBPARTITION q3_2021 VALUES LESS THAN(10),
SUBPARTITION q4_2021 VALUES LESS THAN(13)
)
);
INSERT INTO range_range(date) VALUES('2020-04-12'),('2019-06-12'),('2019-08-12'),('2019-10-12'),('2021-06-12'),('2021-08-12'),('2021-10-12');
SELECT * FROM range_range;
dept_no	part_no	country	date	amount
NULL	NULL	NULL	2020-04-12	NULL
NULL	NULL	NULL	2019-06-12	NULL
NULL	NULL	NULL	2021-06-12	NULL
NULL	NULL	NULL	2019-08-12	NULL
NULL	NULL	NULL	2021-08-12	NULL
NULL	NULL	NULL	2019-10-12	NULL
NULL	NULL	NULL	2021-10-12	NULL
SHOW CREATE TABLE range_range;
Table	Create Table
range_range	CREATE TABLE `range_range` (
  `dept_no` int DEFAULT NULL,
  `part_no` int DEFAULT NULL,
  `country` varchar(20) DEFAULT NULL,
  `date` date DEFAULT NULL,
  `amount` int DEFAULT NULL
) ENGINE=Dstore DEFAULT CHARSET=utf8mb4 COLLATE=utf8mb4_0900_ai_ci
/*!50100 PARTITION BY LINEAR KEY (`date`)
SUBPARTITION BY RANGE (month(`date`))
(PARTITION p_2020
 (SUBPARTITION q1_2020 VALUES LESS THAN (4) ENGINE = Dstore,
  SUBPARTITION q2_2020 VALUES LESS THAN (7) ENGINE = Dstore,
  SUBPARTITION q3_2020 VALUES LESS THAN (10) ENGINE = Dstore,
  SUBPARTITION q4_2020 VALUES LESS THAN (13) ENGINE = Dstore),
 PARTITION p_2021
 (SUBPARTITION q1_2021 VALUES LESS THAN (4) ENGINE = Dstore,
  SUBPARTITION q2_2021 VALUES LESS THAN (7) ENGINE = Dstore,
  SUBPARTITION q3_2021 VALUES LESS THAN (10) ENGINE = Dstore,
  SUBPARTITION q4_2021 VALUES LESS THAN (13) ENGINE = Dstore)) */
ALTER TABLE range_range REBUILD PARTITION p_2020,q3_2021;
ERROR HY000: Error in list of partitions to REBUILD
ALTER TABLE range_range REBUILD PARTITION p_2020;
SELECT * FROM range_range partition(p_2021);
dept_no	part_no	country	date	amount
SHOW CREATE TABLE range_range;
Table	Create Table
range_range	CREATE TABLE `range_range` (
  `dept_no` int DEFAULT NULL,
  `part_no` int DEFAULT NULL,
  `country` varchar(20) DEFAULT NULL,
  `date` date DEFAULT NULL,
  `amount` int DEFAULT NULL
) ENGINE=Dstore DEFAULT CHARSET=utf8mb4 COLLATE=utf8mb4_0900_ai_ci
/*!50100 PARTITION BY LINEAR KEY (`date`)
SUBPARTITION BY RANGE (month(`date`))
(PARTITION p_2020
 (SUBPARTITION q1_2020 VALUES LESS THAN (4) ENGINE = Dstore,
  SUBPARTITION q2_2020 VALUES LESS THAN (7) ENGINE = Dstore,
  SUBPARTITION q3_2020 VALUES LESS THAN (10) ENGINE = Dstore,
  SUBPARTITION q4_2020 VALUES LESS THAN (13) ENGINE = Dstore),
 PARTITION p_2021
 (SUBPARTITION q1_2021 VALUES LESS THAN (4) ENGINE = Dstore,
  SUBPARTITION q2_2021 VALUES LESS THAN (7) ENGINE = Dstore,
  SUBPARTITION q3_2021 VALUES LESS THAN (10) ENGINE = Dstore,
  SUBPARTITION q4_2021 VALUES LESS THAN (13) ENGINE = Dstore)) */
DROP TABLE range_range;
CREATE TABLE range_range
(
dept_no     INT,
part_no     INT,
country     varchar(20),
date        DATE,
amount      INT
)
PARTITION BY LINEAR KEY(date)
SUBPARTITION BY RANGE(month(date))
(
PARTITION p_2020 (
SUBPARTITION q1_2020 VALUES LESS THAN(4),
SUBPARTITION q2_2020 VALUES LESS THAN(7),
SUBPARTITION q3_2020 VALUES LESS THAN(10),
SUBPARTITION q4_2020 VALUES LESS THAN(13)
),
PARTITION p_2021 (
SUBPARTITION q1_2021 VALUES LESS THAN(4),
SUBPARTITION q2_2021 VALUES LESS THAN(7),
SUBPARTITION q3_2021 VALUES LESS THAN(10),
SUBPARTITION q4_2021 VALUES LESS THAN(13)
)
);
INSERT INTO range_range(date) VALUES('2020-04-12'),('2019-06-12'),('2019-08-12'),('2019-10-12'),('2021-06-12'),('2021-08-12'),('2021-10-12');
SELECT * FROM range_range;
dept_no	part_no	country	date	amount
NULL	NULL	NULL	2020-04-12	NULL
NULL	NULL	NULL	2019-06-12	NULL
NULL	NULL	NULL	2021-06-12	NULL
NULL	NULL	NULL	2019-08-12	NULL
NULL	NULL	NULL	2021-08-12	NULL
NULL	NULL	NULL	2019-10-12	NULL
NULL	NULL	NULL	2021-10-12	NULL
SHOW CREATE TABLE range_range;
Table	Create Table
range_range	CREATE TABLE `range_range` (
  `dept_no` int DEFAULT NULL,
  `part_no` int DEFAULT NULL,
  `country` varchar(20) DEFAULT NULL,
  `date` date DEFAULT NULL,
  `amount` int DEFAULT NULL
) ENGINE=Dstore DEFAULT CHARSET=utf8mb4 COLLATE=utf8mb4_0900_ai_ci
/*!50100 PARTITION BY LINEAR KEY (`date`)
SUBPARTITION BY RANGE (month(`date`))
(PARTITION p_2020
 (SUBPARTITION q1_2020 VALUES LESS THAN (4) ENGINE = Dstore,
  SUBPARTITION q2_2020 VALUES LESS THAN (7) ENGINE = Dstore,
  SUBPARTITION q3_2020 VALUES LESS THAN (10) ENGINE = Dstore,
  SUBPARTITION q4_2020 VALUES LESS THAN (13) ENGINE = Dstore),
 PARTITION p_2021
 (SUBPARTITION q1_2021 VALUES LESS THAN (4) ENGINE = Dstore,
  SUBPARTITION q2_2021 VALUES LESS THAN (7) ENGINE = Dstore,
  SUBPARTITION q3_2021 VALUES LESS THAN (10) ENGINE = Dstore,
  SUBPARTITION q4_2021 VALUES LESS THAN (13) ENGINE = Dstore)) */
ALTER TABLE range_range REPAIR PARTITION p_2020,q3_2021;
Table	Op	Msg_type	Msg_text
test.range_range	repair	status	OK
SELECT * FROM range_range partition(p_2021);
dept_no	part_no	country	date	amount
SHOW CREATE TABLE range_range;
Table	Create Table
range_range	CREATE TABLE `range_range` (
  `dept_no` int DEFAULT NULL,
  `part_no` int DEFAULT NULL,
  `country` varchar(20) DEFAULT NULL,
  `date` date DEFAULT NULL,
  `amount` int DEFAULT NULL
) ENGINE=Dstore DEFAULT CHARSET=utf8mb4 COLLATE=utf8mb4_0900_ai_ci
/*!50100 PARTITION BY LINEAR KEY (`date`)
SUBPARTITION BY RANGE (month(`date`))
(PARTITION p_2020
 (SUBPARTITION q1_2020 VALUES LESS THAN (4) ENGINE = Dstore,
  SUBPARTITION q2_2020 VALUES LESS THAN (7) ENGINE = Dstore,
  SUBPARTITION q3_2020 VALUES LESS THAN (10) ENGINE = Dstore,
  SUBPARTITION q4_2020 VALUES LESS THAN (13) ENGINE = Dstore),
 PARTITION p_2021
 (SUBPARTITION q1_2021 VALUES LESS THAN (4) ENGINE = Dstore,
  SUBPARTITION q2_2021 VALUES LESS THAN (7) ENGINE = Dstore,
  SUBPARTITION q3_2021 VALUES LESS THAN (10) ENGINE = Dstore,
  SUBPARTITION q4_2021 VALUES LESS THAN (13) ENGINE = Dstore)) */
DROP TABLE range_range;
CREATE TABLE range_range
(
dept_no     INT,
part_no     INT,
country     varchar(20),
date        DATE,
amount      INT
)
PARTITION BY LINEAR KEY(date)
SUBPARTITION BY RANGE(month(date))
(
PARTITION p_2020 (
SUBPARTITION q1_2020 VALUES LESS THAN(4),
SUBPARTITION q2_2020 VALUES LESS THAN(7),
SUBPARTITION q3_2020 VALUES LESS THAN(10),
SUBPARTITION q4_2020 VALUES LESS THAN(13)
),
PARTITION p_2021 (
SUBPARTITION q1_2021 VALUES LESS THAN(4),
SUBPARTITION q2_2021 VALUES LESS THAN(7),
SUBPARTITION q3_2021 VALUES LESS THAN(10),
SUBPARTITION q4_2021 VALUES LESS THAN(13)
)
);
INSERT INTO range_range(date) VALUES('2020-04-12'),('2019-06-12'),('2019-08-12'),('2019-10-12'),('2021-06-12'),('2021-08-12'),('2021-10-12');
SHOW CREATE TABLE range_range;
Table	Create Table
range_range	CREATE TABLE `range_range` (
  `dept_no` int DEFAULT NULL,
  `part_no` int DEFAULT NULL,
  `country` varchar(20) DEFAULT NULL,
  `date` date DEFAULT NULL,
  `amount` int DEFAULT NULL
) ENGINE=Dstore DEFAULT CHARSET=utf8mb4 COLLATE=utf8mb4_0900_ai_ci
/*!50100 PARTITION BY LINEAR KEY (`date`)
SUBPARTITION BY RANGE (month(`date`))
(PARTITION p_2020
 (SUBPARTITION q1_2020 VALUES LESS THAN (4) ENGINE = Dstore,
  SUBPARTITION q2_2020 VALUES LESS THAN (7) ENGINE = Dstore,
  SUBPARTITION q3_2020 VALUES LESS THAN (10) ENGINE = Dstore,
  SUBPARTITION q4_2020 VALUES LESS THAN (13) ENGINE = Dstore),
 PARTITION p_2021
 (SUBPARTITION q1_2021 VALUES LESS THAN (4) ENGINE = Dstore,
  SUBPARTITION q2_2021 VALUES LESS THAN (7) ENGINE = Dstore,
  SUBPARTITION q3_2021 VALUES LESS THAN (10) ENGINE = Dstore,
  SUBPARTITION q4_2021 VALUES LESS THAN (13) ENGINE = Dstore)) */
ALTER TABLE range_range remove partitioning;
SHOW CREATE TABLE range_range;
Table	Create Table
range_range	CREATE TABLE `range_range` (
  `dept_no` int DEFAULT NULL,
  `part_no` int DEFAULT NULL,
  `country` varchar(20) DEFAULT NULL,
  `date` date DEFAULT NULL,
  `amount` int DEFAULT NULL
) ENGINE=Dstore DEFAULT CHARSET=utf8mb4 COLLATE=utf8mb4_0900_ai_ci
SELECT * FROM range_range;
dept_no	part_no	country	date	amount
NULL	NULL	NULL	2020-04-12	NULL
NULL	NULL	NULL	2019-06-12	NULL
NULL	NULL	NULL	2021-06-12	NULL
NULL	NULL	NULL	2019-08-12	NULL
NULL	NULL	NULL	2021-08-12	NULL
NULL	NULL	NULL	2019-10-12	NULL
NULL	NULL	NULL	2021-10-12	NULL
DROP TABLE range_range;
CREATE TABLE range_range
(
dept_no     INT,
part_no     INT,
country     varchar(20),
date        DATE,
amount      INT
)
PARTITION BY LINEAR KEY(date)
SUBPARTITION BY RANGE(month(date))
(
PARTITION p_2020 (
SUBPARTITION q1_2020 VALUES LESS THAN(4),
SUBPARTITION q2_2020 VALUES LESS THAN(7),
SUBPARTITION q3_2020 VALUES LESS THAN(10),
SUBPARTITION q4_2020 VALUES LESS THAN(13)
),
PARTITION p_2021 (
SUBPARTITION q1_2021 VALUES LESS THAN(4),
SUBPARTITION q2_2021 VALUES LESS THAN(7),
SUBPARTITION q3_2021 VALUES LESS THAN(10),
SUBPARTITION q4_2021 VALUES LESS THAN(13)
)
);
ALTER TABLE range_range COALESCE PARTITION 1;
DROP TABLE range_range;
CREATE TABLE t1(a int, b int) PARTITION BY LINEAR KEY(a)(
partition p1,
partition p2
);
ALTER TABLE t1 ADD PARTITION (PARTITION p3 (SUBPARTITION p3p0));
ERROR HY000: Partition management on a not partitioned table is not possible
ALTER TABLE t1 ADD PARTITION (PARTITION p3 (SUBPARTITION p3p0 VALUES LESS THAN(4)));
ERROR HY000: Partition management on a not partitioned table is not possible
CREATE TABLE t2(a int, b int);
ALTER TABLE t2 ADD PARTITION (PARTITION p0);
ERROR HY000: Partition management on a not partitioned table is not possible
DROP TABLE t1, t2;
CREATE TABLE t1(a int, b int) PARTITION BY LINEAR KEY(a) SUBPARTITION BY range(b) (
partition p1,
partition p2
);
ERROR HY000: For RANGE partitions each partition must be defined
CREATE TABLE t1(a int, b int) PARTITION BY LINEAR KEY(a)(
partition p1,
partition p2
);
ALTER TABLE t1 ADD PARTITION (PARTITION p3 (SUBPARTITION p3p0));
ERROR HY000: Partition management on a not partitioned table is not possible
ALTER TABLE t1 ADD PARTITION (PARTITION p3 VALUES LESS THAN (1));
ERROR HY000: Only RANGE PARTITIONING can use VALUES LESS THAN in partition definition
DROP TABLE t1;
CREATE TABLE t3 (
id INT NOT NULL,
store_id INT NOT NULL
)
PARTITION BY LINEAR KEY (store_id) 
SUBPARTITION BY RANGE(id) (
PARTITION p0 (
subpartition q1 values less than (4),
subpartition q2 values less than (10)
),  
PARTITION p1 (
subpartition q3 values less than (15),
subpartition q4 values less than (20)
)
);
ALTER TABLE t3 ADD PARTITION (PARTITION p3 (subpartition q5 values less than(19), subpartition q6 values less than(19)));
ERROR HY000: VALUES LESS THAN value must be strictly increasing for each partition
DROP TABLE t3;
CREATE TABLE t1(a int, b int) PARTITION BY LINEAR KEY(a) SUBPARTITION BY range(b) (
partition p1 (subpartition p1sp0 values less than(3),
subpartition p1sp1 values less than (5)),
partition p2 (subpartition p2sp0 values less than(4),
subpartition p2sp1 values less than (9))
);
INSERT INTO t1 VALUES(1,2),(2,4),(5,3),(6,8);
EXPLAIN SELECT * FROM t1 WHERE a < 1;
id	select_type	table	partitions	type	possible_keys	key	key_len	ref	rows	filtered	Extra
1	SIMPLE	t1	p1_p1sp0,p1_p1sp1,p2_p2sp0,p2_p2sp1	ALL	NULL	NULL	NULL	NULL	#	#	Using where; Using pushed condition (`test`.`t1`.`a` < 1)
Warnings:
Note	1003	/* select#1 */ select `test`.`t1`.`a` AS `a`,`test`.`t1`.`b` AS `b` from `test`.`t1` where (`test`.`t1`.`a` < 1)
ALTER TABLE t1 ADD index idx(a);
SELECT * FROM t1 WHERE a < 1;
a	b
EXPLAIN SELECT * FROM t1 WHERE a = 2;
id	select_type	table	partitions	type	possible_keys	key	key_len	ref	rows	filtered	Extra
1	SIMPLE	t1	p2_p2sp0,p2_p2sp1	ref	idx	idx	5	const	#	#	NULL
Warnings:
Note	1003	/* select#1 */ select `test`.`t1`.`a` AS `a`,`test`.`t1`.`b` AS `b` from `test`.`t1` where (`test`.`t1`.`a` = 2)
SELECT * FROM t1 WHERE a = 2;
a	b
2	4
ALTER TABLE t1 ADD index idx1(a, b);
EXPLAIN SELECT * FROM t1 WHERE a = 2 and b = 4;
id	select_type	table	partitions	type	possible_keys	key	key_len	ref	rows	filtered	Extra
1	SIMPLE	t1	p2_p2sp1	ref	idx,idx1	idx	5	const	#	#	Using where
Warnings:
Note	1003	/* select#1 */ select `test`.`t1`.`a` AS `a`,`test`.`t1`.`b` AS `b` from `test`.`t1` where ((`test`.`t1`.`b` = 4) and (`test`.`t1`.`a` = 2))
SELECT * FROM t1 WHERE a = 2 and b = 4;
a	b
2	4
EXPLAIN SELECT * FROM t1 WHERE b = 4;
id	select_type	table	partitions	type	possible_keys	key	key_len	ref	rows	filtered	Extra
1	SIMPLE	t1	p1_p1sp1,p2_p2sp1	index	idx1	idx1	10	NULL	#	#	Using where; Using index
Warnings:
Note	1003	/* select#1 */ select `test`.`t1`.`a` AS `a`,`test`.`t1`.`b` AS `b` from `test`.`t1` where (`test`.`t1`.`b` = 4)
SELECT * FROM t1 WHERE b = 4;
a	b
2	4
ALTER TABLE t1 DROP INDEX idx;
ALTER TABLE t1 DROP INDEX idx1;
ALTER TABLE t1 ADD index idx2(b);
SELECT * FROM t1 WHERE a = 2;
a	b
2	4
SELECT * FROM t1 WHERE b = 4;
a	b
2	4
DROP TABLE t1;
SET global rds_extended_partitions_enabled = @saved_rds_extended_partitions_enabled;
