#
# common settings
#
SET GLOBAL lock_wait_timeout=10;
SET GLOBAL rds_ddl_lock_wait_timeout=1;
#
# prepare table t1 with one row
#
#
# determine ddl command
#
#
# Testing
#
# conn1: a ddl blocking operation
START TRANSACTION;
select * from t1;
col1	col2	col3	col4	col5	col6	to_be_deleted
2	4	3	5	PENDING	1	7
# conn2: DDL
alter table t1 LOCK=EXCLUSIVE, ALGORITHM=INPLACE, AUTO_INCREMENT 10;
# conn3: DMLs
insert into t1 values (3,4,3,5,"ACTIVE",1,7);
select * from t1;
col1	col2	col3	col4	col5	col6	to_be_deleted
2	4	3	5	PENDING	1	7
3	4	3	5	ACTIVE	1	7
update t1 set col5='DISABLED' where col1 = 2;
select * from t1;
col1	col2	col3	col4	col5	col6	to_be_deleted
2	4	3	5	DISABLED	1	7
3	4	3	5	ACTIVE	1	7
delete from t1 where col5='DISABLED';
select * from t1;
col1	col2	col3	col4	col5	col6	to_be_deleted
3	4	3	5	ACTIVE	1	7
# conn2: DDL
ERROR HY000: Lock wait timeout exceeded; try restarting transaction
# Table definition is not as expected!
# conn1: commit
COMMIT;
select * from t1;
col1	col2	col3	col4	col5	col6	to_be_deleted
3	4	3	5	ACTIVE	1	7
#
# teardown
#
drop table t1;
SET GLOBAL lock_wait_timeout = 31536000;
SET GLOBAL rds_ddl_lock_wait_timeout = 31536000;
#
# common settings
#
SET GLOBAL lock_wait_timeout=10;
SET GLOBAL rds_ddl_lock_wait_timeout=1;
#
# prepare table t1 with one row
#
#
# determine ddl command
#
#
# Testing
#
# conn1: a ddl blocking operation
START TRANSACTION;
select * from t1;
col1	col2	col3	col4	col5	col6	to_be_deleted
2	4	3	5	PENDING	1	7
# conn2: DDL
alter table t1 LOCK=EXCLUSIVE, ALGORITHM=INPLACE, CHARACTER SET latin1;
# conn3: DMLs
insert into t1 values (3,4,3,5,"ACTIVE",1,7);
select * from t1;
col1	col2	col3	col4	col5	col6	to_be_deleted
2	4	3	5	PENDING	1	7
3	4	3	5	ACTIVE	1	7
update t1 set col5='DISABLED' where col1 = 2;
select * from t1;
col1	col2	col3	col4	col5	col6	to_be_deleted
2	4	3	5	DISABLED	1	7
3	4	3	5	ACTIVE	1	7
delete from t1 where col5='DISABLED';
select * from t1;
col1	col2	col3	col4	col5	col6	to_be_deleted
3	4	3	5	ACTIVE	1	7
# conn2: DDL
ERROR HY000: Lock wait timeout exceeded; try restarting transaction
# Table definition is not as expected!
# conn1: commit
COMMIT;
select * from t1;
col1	col2	col3	col4	col5	col6	to_be_deleted
3	4	3	5	ACTIVE	1	7
#
# teardown
#
drop table t1;
SET GLOBAL lock_wait_timeout = 31536000;
SET GLOBAL rds_ddl_lock_wait_timeout = 31536000;
#
# common settings
#
SET GLOBAL lock_wait_timeout=10;
SET GLOBAL rds_ddl_lock_wait_timeout=1;
#
# prepare table t1 with one row
#
#
# determine ddl command
#
#
# Testing
#
# conn1: a ddl blocking operation
START TRANSACTION;
select * from t1;
col1	col2	col3	col4	col5	col6	to_be_deleted
2	4	3	5	PENDING	1	7
# conn2: DDL
alter table t1 LOCK=EXCLUSIVE, ALGORITHM=INPLACE, CHECKSUM 1;
# conn3: DMLs
insert into t1 values (3,4,3,5,"ACTIVE",1,7);
select * from t1;
col1	col2	col3	col4	col5	col6	to_be_deleted
2	4	3	5	PENDING	1	7
3	4	3	5	ACTIVE	1	7
update t1 set col5='DISABLED' where col1 = 2;
select * from t1;
col1	col2	col3	col4	col5	col6	to_be_deleted
2	4	3	5	DISABLED	1	7
3	4	3	5	ACTIVE	1	7
delete from t1 where col5='DISABLED';
select * from t1;
col1	col2	col3	col4	col5	col6	to_be_deleted
3	4	3	5	ACTIVE	1	7
# conn2: DDL
ERROR HY000: Lock wait timeout exceeded; try restarting transaction
# Table definition is not as expected!
# conn1: commit
COMMIT;
select * from t1;
col1	col2	col3	col4	col5	col6	to_be_deleted
3	4	3	5	ACTIVE	1	7
#
# teardown
#
drop table t1;
SET GLOBAL lock_wait_timeout = 31536000;
SET GLOBAL rds_ddl_lock_wait_timeout = 31536000;
#
# common settings
#
SET GLOBAL lock_wait_timeout=10;
SET GLOBAL rds_ddl_lock_wait_timeout=1;
#
# prepare table t1 with one row
#
#
# determine ddl command
#
#
# Testing
#
# conn1: a ddl blocking operation
START TRANSACTION;
select * from t1;
col1	col2	col3	col4	col5	col6	to_be_deleted
2	4	3	5	PENDING	1	7
# conn2: DDL
alter table t1 LOCK=EXCLUSIVE, ALGORITHM=INPLACE, COLLATE latin1_bin;
# conn3: DMLs
insert into t1 values (3,4,3,5,"ACTIVE",1,7);
select * from t1;
col1	col2	col3	col4	col5	col6	to_be_deleted
2	4	3	5	PENDING	1	7
3	4	3	5	ACTIVE	1	7
update t1 set col5='DISABLED' where col1 = 2;
select * from t1;
col1	col2	col3	col4	col5	col6	to_be_deleted
2	4	3	5	DISABLED	1	7
3	4	3	5	ACTIVE	1	7
delete from t1 where col5='DISABLED';
select * from t1;
col1	col2	col3	col4	col5	col6	to_be_deleted
3	4	3	5	ACTIVE	1	7
# conn2: DDL
ERROR HY000: Lock wait timeout exceeded; try restarting transaction
# Table definition is not as expected!
# conn1: commit
COMMIT;
select * from t1;
col1	col2	col3	col4	col5	col6	to_be_deleted
3	4	3	5	ACTIVE	1	7
#
# teardown
#
drop table t1;
SET GLOBAL lock_wait_timeout = 31536000;
SET GLOBAL rds_ddl_lock_wait_timeout = 31536000;
#
# common settings
#
SET GLOBAL lock_wait_timeout=10;
SET GLOBAL rds_ddl_lock_wait_timeout=1;
#
# prepare table t1 with one row
#
#
# determine ddl command
#
#
# Testing
#
# conn1: a ddl blocking operation
START TRANSACTION;
select * from t1;
col1	col2	col3	col4	col5	col6	to_be_deleted
2	4	3	5	PENDING	1	7
# conn2: DDL
alter table t1 LOCK=EXCLUSIVE, ALGORITHM=INPLACE, COMMENT 'string';
# conn3: DMLs
insert into t1 values (3,4,3,5,"ACTIVE",1,7);
select * from t1;
col1	col2	col3	col4	col5	col6	to_be_deleted
2	4	3	5	PENDING	1	7
3	4	3	5	ACTIVE	1	7
update t1 set col5='DISABLED' where col1 = 2;
select * from t1;
col1	col2	col3	col4	col5	col6	to_be_deleted
2	4	3	5	DISABLED	1	7
3	4	3	5	ACTIVE	1	7
delete from t1 where col5='DISABLED';
select * from t1;
col1	col2	col3	col4	col5	col6	to_be_deleted
3	4	3	5	ACTIVE	1	7
# conn2: DDL
ERROR HY000: Lock wait timeout exceeded; try restarting transaction
# Table definition is not as expected!
# conn1: commit
COMMIT;
select * from t1;
col1	col2	col3	col4	col5	col6	to_be_deleted
3	4	3	5	ACTIVE	1	7
#
# teardown
#
drop table t1;
SET GLOBAL lock_wait_timeout = 31536000;
SET GLOBAL rds_ddl_lock_wait_timeout = 31536000;
#
# common settings
#
SET GLOBAL lock_wait_timeout=10;
SET GLOBAL rds_ddl_lock_wait_timeout=1;
#
# prepare table t1 with one row
#
#
# determine ddl command
#
#
# Testing
#
# conn1: a ddl blocking operation
START TRANSACTION;
select * from t1;
col1	col2	col3	col4	col5	col6	to_be_deleted
2	4	3	5	PENDING	1	7
# conn2: DDL
alter table t1 LOCK=EXCLUSIVE, ALGORITHM=INPLACE, COMPRESSION 'ZLIB';
# conn3: DMLs
insert into t1 values (3,4,3,5,"ACTIVE",1,7);
select * from t1;
col1	col2	col3	col4	col5	col6	to_be_deleted
2	4	3	5	PENDING	1	7
3	4	3	5	ACTIVE	1	7
update t1 set col5='DISABLED' where col1 = 2;
select * from t1;
col1	col2	col3	col4	col5	col6	to_be_deleted
2	4	3	5	DISABLED	1	7
3	4	3	5	ACTIVE	1	7
delete from t1 where col5='DISABLED';
select * from t1;
col1	col2	col3	col4	col5	col6	to_be_deleted
3	4	3	5	ACTIVE	1	7
# conn2: DDL
ERROR HY000: Lock wait timeout exceeded; try restarting transaction
# Table definition is not as expected!
# conn1: commit
COMMIT;
select * from t1;
col1	col2	col3	col4	col5	col6	to_be_deleted
3	4	3	5	ACTIVE	1	7
#
# teardown
#
drop table t1;
SET GLOBAL lock_wait_timeout = 31536000;
SET GLOBAL rds_ddl_lock_wait_timeout = 31536000;
#
# common settings
#
SET GLOBAL lock_wait_timeout=10;
SET GLOBAL rds_ddl_lock_wait_timeout=1;
#
# prepare table t1 with one row
#
#
# determine ddl command
#
#
# Testing
#
# conn1: a ddl blocking operation
START TRANSACTION;
select * from t1;
col1	col2	col3	col4	col5	col6	to_be_deleted
2	4	3	5	PENDING	1	7
# conn2: DDL
alter table t1 LOCK=EXCLUSIVE, ALGORITHM=INPLACE, CONNECTION 'connect_string';
# conn3: DMLs
insert into t1 values (3,4,3,5,"ACTIVE",1,7);
select * from t1;
col1	col2	col3	col4	col5	col6	to_be_deleted
2	4	3	5	PENDING	1	7
3	4	3	5	ACTIVE	1	7
update t1 set col5='DISABLED' where col1 = 2;
select * from t1;
col1	col2	col3	col4	col5	col6	to_be_deleted
2	4	3	5	DISABLED	1	7
3	4	3	5	ACTIVE	1	7
delete from t1 where col5='DISABLED';
select * from t1;
col1	col2	col3	col4	col5	col6	to_be_deleted
3	4	3	5	ACTIVE	1	7
# conn2: DDL
ERROR HY000: Lock wait timeout exceeded; try restarting transaction
# Table definition is not as expected!
# conn1: commit
COMMIT;
select * from t1;
col1	col2	col3	col4	col5	col6	to_be_deleted
3	4	3	5	ACTIVE	1	7
#
# teardown
#
drop table t1;
SET GLOBAL lock_wait_timeout = 31536000;
SET GLOBAL rds_ddl_lock_wait_timeout = 31536000;
#
# common settings
#
SET GLOBAL lock_wait_timeout=10;
SET GLOBAL rds_ddl_lock_wait_timeout=1;
#
# prepare table t1 with one row
#
#
# determine ddl command
#
#
# Testing
#
# conn1: a ddl blocking operation
START TRANSACTION;
select * from t1;
col1	col2	col3	col4	col5	col6	to_be_deleted
2	4	3	5	PENDING	1	7
# conn2: DDL
alter table t1 LOCK=EXCLUSIVE, ALGORITHM=INPLACE, DATA DIRECTORY '/tmp';
# conn3: DMLs
insert into t1 values (3,4,3,5,"ACTIVE",1,7);
select * from t1;
col1	col2	col3	col4	col5	col6	to_be_deleted
2	4	3	5	PENDING	1	7
3	4	3	5	ACTIVE	1	7
update t1 set col5='DISABLED' where col1 = 2;
select * from t1;
col1	col2	col3	col4	col5	col6	to_be_deleted
2	4	3	5	DISABLED	1	7
3	4	3	5	ACTIVE	1	7
delete from t1 where col5='DISABLED';
select * from t1;
col1	col2	col3	col4	col5	col6	to_be_deleted
3	4	3	5	ACTIVE	1	7
# conn2: DDL
ERROR HY000: Lock wait timeout exceeded; try restarting transaction
# Table definition is not as expected!
# conn1: commit
COMMIT;
select * from t1;
col1	col2	col3	col4	col5	col6	to_be_deleted
3	4	3	5	ACTIVE	1	7
#
# teardown
#
drop table t1;
SET GLOBAL lock_wait_timeout = 31536000;
SET GLOBAL rds_ddl_lock_wait_timeout = 31536000;
#
# common settings
#
SET GLOBAL lock_wait_timeout=10;
SET GLOBAL rds_ddl_lock_wait_timeout=1;
#
# prepare table t1 with one row
#
#
# determine ddl command
#
#
# Testing
#
# conn1: a ddl blocking operation
START TRANSACTION;
select * from t1;
col1	col2	col3	col4	col5	col6	to_be_deleted
2	4	3	5	PENDING	1	7
# conn2: DDL
alter table t1 LOCK=EXCLUSIVE, ALGORITHM=INPLACE, ENGINE=Innodb;
# conn3: DMLs
insert into t1 values (3,4,3,5,"ACTIVE",1,7);
select * from t1;
col1	col2	col3	col4	col5	col6	to_be_deleted
2	4	3	5	PENDING	1	7
3	4	3	5	ACTIVE	1	7
update t1 set col5='DISABLED' where col1 = 2;
select * from t1;
col1	col2	col3	col4	col5	col6	to_be_deleted
2	4	3	5	DISABLED	1	7
3	4	3	5	ACTIVE	1	7
delete from t1 where col5='DISABLED';
select * from t1;
col1	col2	col3	col4	col5	col6	to_be_deleted
3	4	3	5	ACTIVE	1	7
# conn2: DDL
ERROR HY000: Lock wait timeout exceeded; try restarting transaction
# Table definition is not as expected!
# conn1: commit
COMMIT;
select * from t1;
col1	col2	col3	col4	col5	col6	to_be_deleted
3	4	3	5	ACTIVE	1	7
#
# teardown
#
drop table t1;
SET GLOBAL lock_wait_timeout = 31536000;
SET GLOBAL rds_ddl_lock_wait_timeout = 31536000;
#
# common settings
#
SET GLOBAL lock_wait_timeout=10;
SET GLOBAL rds_ddl_lock_wait_timeout=1;
#
# prepare table t1 with one row
#
#
# determine ddl command
#
#
# Testing
#
# conn1: a ddl blocking operation
START TRANSACTION;
select * from t1;
col1	col2	col3	col4	col5	col6	to_be_deleted
2	4	3	5	PENDING	1	7
# conn2: DDL
alter table t1 LOCK=EXCLUSIVE, ALGORITHM=INPLACE, ROW_FORMAT = REDUNDANT;
# conn3: DMLs
insert into t1 values (3,4,3,5,"ACTIVE",1,7);
select * from t1;
col1	col2	col3	col4	col5	col6	to_be_deleted
2	4	3	5	PENDING	1	7
3	4	3	5	ACTIVE	1	7
update t1 set col5='DISABLED' where col1 = 2;
select * from t1;
col1	col2	col3	col4	col5	col6	to_be_deleted
2	4	3	5	DISABLED	1	7
3	4	3	5	ACTIVE	1	7
delete from t1 where col5='DISABLED';
select * from t1;
col1	col2	col3	col4	col5	col6	to_be_deleted
3	4	3	5	ACTIVE	1	7
# conn2: DDL
ERROR HY000: Lock wait timeout exceeded; try restarting transaction
# Table definition is not as expected!
# conn1: commit
COMMIT;
select * from t1;
col1	col2	col3	col4	col5	col6	to_be_deleted
3	4	3	5	ACTIVE	1	7
#
# teardown
#
drop table t1;
SET GLOBAL lock_wait_timeout = 31536000;
SET GLOBAL rds_ddl_lock_wait_timeout = 31536000;
#
# common settings
#
SET GLOBAL lock_wait_timeout=10;
SET GLOBAL rds_ddl_lock_wait_timeout=1;
#
# prepare table t1 with one row
#
#
# determine ddl command
#
#
# Testing
#
# conn1: a ddl blocking operation
START TRANSACTION;
select * from t1;
col1	col2	col3	col4	col5	col6	to_be_deleted
2	4	3	5	PENDING	1	7
# conn2: DDL
alter table t1 LOCK=EXCLUSIVE, ALGORITHM=INPLACE, STATS_AUTO_RECALC = 1;
# conn3: DMLs
insert into t1 values (3,4,3,5,"ACTIVE",1,7);
select * from t1;
col1	col2	col3	col4	col5	col6	to_be_deleted
2	4	3	5	PENDING	1	7
3	4	3	5	ACTIVE	1	7
update t1 set col5='DISABLED' where col1 = 2;
select * from t1;
col1	col2	col3	col4	col5	col6	to_be_deleted
2	4	3	5	DISABLED	1	7
3	4	3	5	ACTIVE	1	7
delete from t1 where col5='DISABLED';
select * from t1;
col1	col2	col3	col4	col5	col6	to_be_deleted
3	4	3	5	ACTIVE	1	7
# conn2: DDL
ERROR HY000: Lock wait timeout exceeded; try restarting transaction
# Table definition is not as expected!
# conn1: commit
COMMIT;
select * from t1;
col1	col2	col3	col4	col5	col6	to_be_deleted
3	4	3	5	ACTIVE	1	7
#
# teardown
#
drop table t1;
SET GLOBAL lock_wait_timeout = 31536000;
SET GLOBAL rds_ddl_lock_wait_timeout = 31536000;
#
# common settings
#
SET GLOBAL lock_wait_timeout=10;
SET GLOBAL rds_ddl_lock_wait_timeout=1;
#
# prepare table t1 with one row
#
#
# determine ddl command
#
#
# Testing
#
# conn1: a ddl blocking operation
START TRANSACTION;
select * from t1;
col1	col2	col3	col4	col5	col6	to_be_deleted
2	4	3	5	PENDING	1	7
# conn2: DDL
alter table t1 LOCK=EXCLUSIVE, ALGORITHM=INPLACE, STATS_PERSISTENT = 1;
# conn3: DMLs
insert into t1 values (3,4,3,5,"ACTIVE",1,7);
select * from t1;
col1	col2	col3	col4	col5	col6	to_be_deleted
2	4	3	5	PENDING	1	7
3	4	3	5	ACTIVE	1	7
update t1 set col5='DISABLED' where col1 = 2;
select * from t1;
col1	col2	col3	col4	col5	col6	to_be_deleted
2	4	3	5	DISABLED	1	7
3	4	3	5	ACTIVE	1	7
delete from t1 where col5='DISABLED';
select * from t1;
col1	col2	col3	col4	col5	col6	to_be_deleted
3	4	3	5	ACTIVE	1	7
# conn2: DDL
ERROR HY000: Lock wait timeout exceeded; try restarting transaction
# Table definition is not as expected!
# conn1: commit
COMMIT;
select * from t1;
col1	col2	col3	col4	col5	col6	to_be_deleted
3	4	3	5	ACTIVE	1	7
#
# teardown
#
drop table t1;
SET GLOBAL lock_wait_timeout = 31536000;
SET GLOBAL rds_ddl_lock_wait_timeout = 31536000;
#
# common settings
#
SET GLOBAL lock_wait_timeout=10;
SET GLOBAL rds_ddl_lock_wait_timeout=1;
#
# prepare table t1 with one row
#
#
# determine ddl command
#
#
# Testing
#
# conn1: a ddl blocking operation
START TRANSACTION;
select * from t1;
col1	col2	col3	col4	col5	col6	to_be_deleted
2	4	3	5	PENDING	1	7
# conn2: DDL
alter table t1 LOCK=EXCLUSIVE, ALGORITHM=INPLACE, STATS_SAMPLE_PAGES = 14;
# conn3: DMLs
insert into t1 values (3,4,3,5,"ACTIVE",1,7);
select * from t1;
col1	col2	col3	col4	col5	col6	to_be_deleted
2	4	3	5	PENDING	1	7
3	4	3	5	ACTIVE	1	7
update t1 set col5='DISABLED' where col1 = 2;
select * from t1;
col1	col2	col3	col4	col5	col6	to_be_deleted
2	4	3	5	DISABLED	1	7
3	4	3	5	ACTIVE	1	7
delete from t1 where col5='DISABLED';
select * from t1;
col1	col2	col3	col4	col5	col6	to_be_deleted
3	4	3	5	ACTIVE	1	7
# conn2: DDL
ERROR HY000: Lock wait timeout exceeded; try restarting transaction
# Table definition is not as expected!
# conn1: commit
COMMIT;
select * from t1;
col1	col2	col3	col4	col5	col6	to_be_deleted
3	4	3	5	ACTIVE	1	7
#
# teardown
#
drop table t1;
SET GLOBAL lock_wait_timeout = 31536000;
SET GLOBAL rds_ddl_lock_wait_timeout = 31536000;
#
# common settings
#
SET GLOBAL lock_wait_timeout=10;
SET GLOBAL rds_ddl_lock_wait_timeout=1;
#
# prepare table t1 with one row
#
#
# determine ddl command
#
#
# Testing
#
# conn1: a ddl blocking operation
START TRANSACTION;
select * from t1;
col1	col2	col3	col4	col5	col6	to_be_deleted
2	4	3	5	PENDING	1	7
# conn2: DDL
alter table t1 LOCK=EXCLUSIVE, ALGORITHM=INPLACE, PASSWORD = 'string';
# conn3: DMLs
insert into t1 values (3,4,3,5,"ACTIVE",1,7);
select * from t1;
col1	col2	col3	col4	col5	col6	to_be_deleted
2	4	3	5	PENDING	1	7
3	4	3	5	ACTIVE	1	7
update t1 set col5='DISABLED' where col1 = 2;
select * from t1;
col1	col2	col3	col4	col5	col6	to_be_deleted
2	4	3	5	DISABLED	1	7
3	4	3	5	ACTIVE	1	7
delete from t1 where col5='DISABLED';
select * from t1;
col1	col2	col3	col4	col5	col6	to_be_deleted
3	4	3	5	ACTIVE	1	7
# conn2: DDL
ERROR HY000: Lock wait timeout exceeded; try restarting transaction
# Table definition is not as expected!
# conn1: commit
COMMIT;
select * from t1;
col1	col2	col3	col4	col5	col6	to_be_deleted
3	4	3	5	ACTIVE	1	7
#
# teardown
#
drop table t1;
SET GLOBAL lock_wait_timeout = 31536000;
SET GLOBAL rds_ddl_lock_wait_timeout = 31536000;
