use test;
# 
# 1. A single BLOB column.
# 
CREATE TABLE blob_text_test1 (
id INT AUTO_INCREMENT PRIMARY KEY,
blob_col BLOB
) engine=Dstore;
INSERT INTO blob_text_test1 (blob_col) VALUES (REPEAT('A', 120));
SELECT LENGTH(blob_col) from blob_text_test1;
LENGTH(blob_col)
120
UPDATE blob_text_test1 SET blob_col = 'Updated TinyText' WHERE id = 1;
SELECT LENGTH(blob_col) from blob_text_test1;
LENGTH(blob_col)
16
UPDATE blob_text_test1 SET blob_col = REPEAT('A', 3000) WHERE id = 1;
SELECT LENGTH(blob_col) from blob_text_test1 where id = 1;
LENGTH(blob_col)
3000
INSERT INTO blob_text_test1 (blob_col) VALUES (REPEAT('A', 3000));
SELECT LENGTH(blob_col) from blob_text_test1;
LENGTH(blob_col)
3000
3000
UPDATE blob_text_test1 SET blob_col = REPEAT('A', 3100) WHERE id = 2;
SELECT LENGTH(blob_col) from blob_text_test1;
LENGTH(blob_col)
3000
3100
UPDATE blob_text_test1 SET blob_col = 'Updated TinyText' WHERE id = 2;
SELECT LENGTH(blob_col) from blob_text_test1 where id = 1;
LENGTH(blob_col)
3000
DELETE FROM blob_text_test1 WHERE id = 2;
SELECT * from blob_text_test1;
id	blob_col
1	AAAAAAAAAAAAAAAAAAAAAAAAAAAAAAAAAAAAAAAAAAAAAAAAAAAAAAAAAAAAAAAAAAAAAAAAAAAAAAAAAAAAAAAAAAAAAAAAAAAAAAAAAAAAAAAAAAAAAAAAAAAAAAAAAAAAAAAAAAAAAAAAAAAAAAAAAAAAAAAAAAAAAAAAAAAAAAAAAAAAAAAAAAAAAAAAAAAAAAAAAAAAAAAAAAAAAAAAAAAAAAAAAAAAAAAAAAAAAAAAAAAAAAAAAAAAAAAAAAAAAAAAAAAAAAAAAAAAAAAAAAAAAAAAAAAAAAAAAAAAAAAAAAAAAAAAAAAAAAAAAAAAAAAAAAAAAAAAAAAAAAAAAAAAAAAAAAAAAAAAAAAAAAAAAAAAAAAAAAAAAAAAAAAAAAAAAAAAAAAAAAAAAAAAAAAAAAAAAAAAAAAAAAAAAAAAAAAAAAAAAAAAAAAAAAAAAAAAAAAAAAAAAAAAAAAAAAAAAAAAAAAAAAAAAAAAAAAAAAAAAAAAAAAAAAAAAAAAAAAAAAAAAAAAAAAAAAAAAAAAAAAAAAAAAAAAAAAAAAAAAAAAAAAAAAAAAAAAAAAAAAAAAAAAAAAAAAAAAAAAAAAAAAAAAAAAAAAAAAAAAAAAAAAAAAAAAAAAAAAAAAAAAAAAAAAAAAAAAAAAAAAAAAAAAAAAAAAAAAAAAAAAAAAAAAAAAAAAAAAAAAAAAAAAAAAAAAAAAAAAAAAAAAAAAAAAAAAAAAAAAAAAAAAAAAAAAAAAAAAAAAAAAAAAAAAAAAAAAAAAAAAAAAAAAAAAAAAAAAAAAAAAAAAAAAAAAAAAAAAAAAAAAAAAAAAAAAAAAAAAAAAAAAAAAAAAAAAAAAAAAAAAAAAAAAAAAAAAAAAAAAAAAAAAAAAAAAAAAAAAAAAAAAAAAAAAAAAAAAAAAAAAAAAAAAAAAAAAAAAAAAAAAAAAAAAAAAAAAAAAAAAAAAAAAAAAAAAAAAAAAAAAAAAAAAAAAAAAAAAAAAAAAAAAAAAAAAAAAAAAAAAAAAAAAAAAAAAAAAAAAAAAAAAAAAAAAAAAAAAAAAAAAAAAAAAAAAAAAAAAAAAAAAAAAAAAAAAAAAAAAAAAAAAAAAAAAAAAAAAAAAAAAAAAAAAAAAAAAAAAAAAAAAAAAAAAAAAAAAAAAAAAAAAAAAAAAAAAAAAAAAAAAAAAAAAAAAAAAAAAAAAAAAAAAAAAAAAAAAAAAAAAAAAAAAAAAAAAAAAAAAAAAAAAAAAAAAAAAAAAAAAAAAAAAAAAAAAAAAAAAAAAAAAAAAAAAAAAAAAAAAAAAAAAAAAAAAAAAAAAAAAAAAAAAAAAAAAAAAAAAAAAAAAAAAAAAAAAAAAAAAAAAAAAAAAAAAAAAAAAAAAAAAAAAAAAAAAAAAAAAAAAAAAAAAAAAAAAAAAAAAAAAAAAAAAAAAAAAAAAAAAAAAAAAAAAAAAAAAAAAAAAAAAAAAAAAAAAAAAAAAAAAAAAAAAAAAAAAAAAAAAAAAAAAAAAAAAAAAAAAAAAAAAAAAAAAAAAAAAAAAAAAAAAAAAAAAAAAAAAAAAAAAAAAAAAAAAAAAAAAAAAAAAAAAAAAAAAAAAAAAAAAAAAAAAAAAAAAAAAAAAAAAAAAAAAAAAAAAAAAAAAAAAAAAAAAAAAAAAAAAAAAAAAAAAAAAAAAAAAAAAAAAAAAAAAAAAAAAAAAAAAAAAAAAAAAAAAAAAAAAAAAAAAAAAAAAAAAAAAAAAAAAAAAAAAAAAAAAAAAAAAAAAAAAAAAAAAAAAAAAAAAAAAAAAAAAAAAAAAAAAAAAAAAAAAAAAAAAAAAAAAAAAAAAAAAAAAAAAAAAAAAAAAAAAAAAAAAAAAAAAAAAAAAAAAAAAAAAAAAAAAAAAAAAAAAAAAAAAAAAAAAAAAAAAAAAAAAAAAAAAAAAAAAAAAAAAAAAAAAAAAAAAAAAAAAAAAAAAAAAAAAAAAAAAAAAAAAAAAAAAAAAAAAAAAAAAAAAAAAAAAAAAAAAAAAAAAAAAAAAAAAAAAAAAAAAAAAAAAAAAAAAAAAAAAAAAAAAAAAAAAAAAAAAAAAAAAAAAAAAAAAAAAAAAAAAAAAAAAAAAAAAAAAAAAAAAAAAAAAAAAAAAAAAAAAAAAAAAAAAAAAAAAAAAAAAAAAAAAAAAAAAAAAAAAAAAAAAAAAAAAAAAAAAAAAAAAAAAAAAAAAAAAAAAAAAAAAAAAAAAAAAAAAAAAAAAAAAAAAAAAAAAAAAAAAAAAAAAAAAAAAAAAAAAAAAAAAAAAAAAAAAAAAAAAAAAAAAAAAAAAAAAAAAAAAAAAAAAAAAAAAAAAAAAAAAAAAAAAAAAAAAAAAAAAAAAAAAAAAAAAAAAAAAAAAAAAAAAAAAAAAAAAAAAAAAAAAAAAAAAAAAAAAAAAAAAAAAAAAAAAAAAAAAAAAAAAAAAAAAAAAAAAAAAAAAAAAAAAAAAAAAAAAAAAAAAAAAAAAAAAAAAAAAAAAAAAAAAAAAAAAAAAAAAAAAAAAAAAAAAAAAAAAAAAAAAAAAAAAAAAAAAAAAAAAAAAAAAAAAAAAAAAAAAAAAAAAAAAAAAAAAAAAAAAAAAAAAAAAAAAAAAAAAAAAAAAAAAAAAAAAAAAAAAAAAAAAAAAAAAAAAAAAAAAAAAAAAAAAAAAAAAAAAAAAAAAAAAAAAAAAAAAAAAAAAAAAAAAAAAAAAAAAAAAAAAAAAAAAAAAAAAAAAAAAAAAAAAAAAAAAAAAAAAAAAAAAAAAAAAAAAAAAAAAAAAAAAAAAAAAAAAAAAAAAAAAAAAAAAAAAAAAAAAAAAAAAAAAAAAAAAAAAAAAAAAAAAAAAAAAAAAAAAAAAAAAAAAAAAAAAAAAAAAAAAAAAAAAAAAAAAAAAAAAAAAAAAAAAAAAAAAAAAAAAAAAAAAAAAAAAAAAAAAAAAAAAAAAAAAAAAAAAAAAAAAAAAAAAAAAAAAAAAAAAAAAAAAAAAAAAAAAAAAAAAAAAAAA
CREATE TABLE blob_text_test2 (
id INT,
blob_col BLOB
) engine=Dstore;
INSERT INTO blob_text_test2 (id, blob_col) VALUES (1, REPEAT('A', 120));
SELECT LENGTH(blob_col) from blob_text_test2;
LENGTH(blob_col)
120
UPDATE blob_text_test2 SET blob_col = 'Updated TinyText' WHERE id = 1;
SELECT LENGTH(blob_col) from blob_text_test2;
LENGTH(blob_col)
16
UPDATE blob_text_test2 SET blob_col = REPEAT('A', 3000) WHERE id = 1;
SELECT LENGTH(blob_col) from blob_text_test2 where id = 1;
LENGTH(blob_col)
3000
INSERT INTO blob_text_test2 (id, blob_col) VALUES (2, REPEAT('A', 3000));
SELECT LENGTH(blob_col) from blob_text_test2;
LENGTH(blob_col)
3000
3000
UPDATE blob_text_test2 SET blob_col = REPEAT('A', 3100) WHERE id = 2;
SELECT LENGTH(blob_col) from blob_text_test2;
LENGTH(blob_col)
3000
3100
UPDATE blob_text_test2 SET blob_col = 'Updated TinyText' WHERE id = 2;
SELECT LENGTH(blob_col) from blob_text_test2 where id = 1;
LENGTH(blob_col)
3000
DELETE FROM blob_text_test2 WHERE id = 2;
SELECT * from blob_text_test2;
id	blob_col
1	AAAAAAAAAAAAAAAAAAAAAAAAAAAAAAAAAAAAAAAAAAAAAAAAAAAAAAAAAAAAAAAAAAAAAAAAAAAAAAAAAAAAAAAAAAAAAAAAAAAAAAAAAAAAAAAAAAAAAAAAAAAAAAAAAAAAAAAAAAAAAAAAAAAAAAAAAAAAAAAAAAAAAAAAAAAAAAAAAAAAAAAAAAAAAAAAAAAAAAAAAAAAAAAAAAAAAAAAAAAAAAAAAAAAAAAAAAAAAAAAAAAAAAAAAAAAAAAAAAAAAAAAAAAAAAAAAAAAAAAAAAAAAAAAAAAAAAAAAAAAAAAAAAAAAAAAAAAAAAAAAAAAAAAAAAAAAAAAAAAAAAAAAAAAAAAAAAAAAAAAAAAAAAAAAAAAAAAAAAAAAAAAAAAAAAAAAAAAAAAAAAAAAAAAAAAAAAAAAAAAAAAAAAAAAAAAAAAAAAAAAAAAAAAAAAAAAAAAAAAAAAAAAAAAAAAAAAAAAAAAAAAAAAAAAAAAAAAAAAAAAAAAAAAAAAAAAAAAAAAAAAAAAAAAAAAAAAAAAAAAAAAAAAAAAAAAAAAAAAAAAAAAAAAAAAAAAAAAAAAAAAAAAAAAAAAAAAAAAAAAAAAAAAAAAAAAAAAAAAAAAAAAAAAAAAAAAAAAAAAAAAAAAAAAAAAAAAAAAAAAAAAAAAAAAAAAAAAAAAAAAAAAAAAAAAAAAAAAAAAAAAAAAAAAAAAAAAAAAAAAAAAAAAAAAAAAAAAAAAAAAAAAAAAAAAAAAAAAAAAAAAAAAAAAAAAAAAAAAAAAAAAAAAAAAAAAAAAAAAAAAAAAAAAAAAAAAAAAAAAAAAAAAAAAAAAAAAAAAAAAAAAAAAAAAAAAAAAAAAAAAAAAAAAAAAAAAAAAAAAAAAAAAAAAAAAAAAAAAAAAAAAAAAAAAAAAAAAAAAAAAAAAAAAAAAAAAAAAAAAAAAAAAAAAAAAAAAAAAAAAAAAAAAAAAAAAAAAAAAAAAAAAAAAAAAAAAAAAAAAAAAAAAAAAAAAAAAAAAAAAAAAAAAAAAAAAAAAAAAAAAAAAAAAAAAAAAAAAAAAAAAAAAAAAAAAAAAAAAAAAAAAAAAAAAAAAAAAAAAAAAAAAAAAAAAAAAAAAAAAAAAAAAAAAAAAAAAAAAAAAAAAAAAAAAAAAAAAAAAAAAAAAAAAAAAAAAAAAAAAAAAAAAAAAAAAAAAAAAAAAAAAAAAAAAAAAAAAAAAAAAAAAAAAAAAAAAAAAAAAAAAAAAAAAAAAAAAAAAAAAAAAAAAAAAAAAAAAAAAAAAAAAAAAAAAAAAAAAAAAAAAAAAAAAAAAAAAAAAAAAAAAAAAAAAAAAAAAAAAAAAAAAAAAAAAAAAAAAAAAAAAAAAAAAAAAAAAAAAAAAAAAAAAAAAAAAAAAAAAAAAAAAAAAAAAAAAAAAAAAAAAAAAAAAAAAAAAAAAAAAAAAAAAAAAAAAAAAAAAAAAAAAAAAAAAAAAAAAAAAAAAAAAAAAAAAAAAAAAAAAAAAAAAAAAAAAAAAAAAAAAAAAAAAAAAAAAAAAAAAAAAAAAAAAAAAAAAAAAAAAAAAAAAAAAAAAAAAAAAAAAAAAAAAAAAAAAAAAAAAAAAAAAAAAAAAAAAAAAAAAAAAAAAAAAAAAAAAAAAAAAAAAAAAAAAAAAAAAAAAAAAAAAAAAAAAAAAAAAAAAAAAAAAAAAAAAAAAAAAAAAAAAAAAAAAAAAAAAAAAAAAAAAAAAAAAAAAAAAAAAAAAAAAAAAAAAAAAAAAAAAAAAAAAAAAAAAAAAAAAAAAAAAAAAAAAAAAAAAAAAAAAAAAAAAAAAAAAAAAAAAAAAAAAAAAAAAAAAAAAAAAAAAAAAAAAAAAAAAAAAAAAAAAAAAAAAAAAAAAAAAAAAAAAAAAAAAAAAAAAAAAAAAAAAAAAAAAAAAAAAAAAAAAAAAAAAAAAAAAAAAAAAAAAAAAAAAAAAAAAAAAAAAAAAAAAAAAAAAAAAAAAAAAAAAAAAAAAAAAAAAAAAAAAAAAAAAAAAAAAAAAAAAAAAAAAAAAAAAAAAAAAAAAAAAAAAAAAAAAAAAAAAAAAAAAAAAAAAAAAAAAAAAAAAAAAAAAAAAAAAAAAAAAAAAAAAAAAAAAAAAAAAAAAAAAAAAAAAAAAAAAAAAAAAAAAAAAAAAAAAAAAAAAAAAAAAAAAAAAAAAAAAAAAAAAAAAAAAAAAAAAAAAAAAAAAAAAAAAAAAAAAAAAAAAAAAAAAAAAAAAAAAAAAAAAAAAAAAAAAAAAAAAAAAAAAAAAAAAAAAAAAAAAAAAAAAAAAAAAAAAAAAAAAAAAAAAAAAAAAAAAAAAAAAAAAAAAAAAAAAAAAAAAAAAAAAAAAAAAAAAAAAAAAAAAAAAAAAAAAAAAAAAAAAAAAAAAAAAAAAAAAAAAAAAAAAAAAAAAAAAAAAAAAAAAAAAAAAAAAAAAAAAAAAAAAAAAAAAAAAAAAAAAAAAAAAAAAAAAAAAAAAAAAAAAAAAAAAAAAAAAAAAAAAAAAAAAAAAAAAAAAAAAAAAAAAAAAAAAAAAAAAAAAAAAAAAAAAAAAAAAAAAAAAAAAAAAAAAAAAAAAAAAAAAAAAAAAAAAAAAAAAAAAAAAAAAAAAAAAAAAAAAAAAAAAAAAAAAAAAAAAAAAAAAAAAAAAAAAAAAAAAAAAAAAAAAAAAAAAAAAAAAAAAAAAAAAAAAAAAAAAAAAAAAAAAAAAAAAAAAAAAAAAAAAAAAAAAAAAAAAAAAAAAAAAAAAAAAAAAAAAAAAAAAAAAAAAAAAAAAAAAAAAAAAAAAAAAAAAAAAAAAAAAAAAAAAAAAAAAAAAAAAAAAAAAAAAAAAAAAAAAAAAAAAAAAAAAAAAAAAAAAAAAAAAAAAAAAAAAAAAAAAAAAAAAAAAAAAAAAAAAAAAAAAAAAAAAAAAAAAAAAAAAAAAAAAAAAAAAAAAAAAAAAAAAAAAAAAAAAAAAAAAAAAAAAAAAAAAAAAAAAAAAAAAAAAAAAAAA
# 
# 2. Multiple BLOB columns.
# 
CREATE TABLE blob_text_test3 (
id INT AUTO_INCREMENT PRIMARY KEY,
tiny_blob_col TINYBLOB,
blob_col BLOB
) engine=Dstore;
INSERT INTO blob_text_test3 (tiny_blob_col, blob_col) VALUES (REPEAT('A', 255), REPEAT('B', 3000));
SELECT LENGTH(tiny_blob_col), LENGTH(blob_col) from blob_text_test3;
LENGTH(tiny_blob_col)	LENGTH(blob_col)
255	3000
UPDATE blob_text_test3 SET blob_col = 'Updated TinyText' WHERE id = 1;
SELECT LENGTH(tiny_blob_col), LENGTH(blob_col) from blob_text_test3;
LENGTH(tiny_blob_col)	LENGTH(blob_col)
255	16
UPDATE blob_text_test3 SET blob_col = REPEAT('A', 3000) WHERE id = 1;
SELECT LENGTH(tiny_blob_col),LENGTH(blob_col) from blob_text_test3 where id = 1;
LENGTH(tiny_blob_col)	LENGTH(blob_col)
255	3000
INSERT INTO blob_text_test3 (tiny_blob_col, blob_col) VALUES (2, REPEAT('A', 3000));
SELECT LENGTH(tiny_blob_col), LENGTH(blob_col) from blob_text_test3;
LENGTH(tiny_blob_col)	LENGTH(blob_col)
255	3000
1	3000
UPDATE blob_text_test3 SET blob_col = REPEAT('A', 3100) WHERE id = 2;
SELECT LENGTH(tiny_blob_col), LENGTH(blob_col) from blob_text_test3;
LENGTH(tiny_blob_col)	LENGTH(blob_col)
255	3000
1	3100
UPDATE blob_text_test3 SET blob_col = 'Updated TinyText' WHERE id = 2;
SELECT LENGTH(tiny_blob_col), LENGTH(blob_col) from blob_text_test3 where id = 1;
LENGTH(tiny_blob_col)	LENGTH(blob_col)
255	3000
DELETE FROM blob_text_test3 WHERE id = 2;
SELECT * from blob_text_test3;
id	tiny_blob_col	blob_col
1	AAAAAAAAAAAAAAAAAAAAAAAAAAAAAAAAAAAAAAAAAAAAAAAAAAAAAAAAAAAAAAAAAAAAAAAAAAAAAAAAAAAAAAAAAAAAAAAAAAAAAAAAAAAAAAAAAAAAAAAAAAAAAAAAAAAAAAAAAAAAAAAAAAAAAAAAAAAAAAAAAAAAAAAAAAAAAAAAAAAAAAAAAAAAAAAAAAAAAAAAAAAAAAAAAAAAAAAAAAAAAAAAAAAAAAAAAAAAAAAAAAAAAAAAAAAAAAA	AAAAAAAAAAAAAAAAAAAAAAAAAAAAAAAAAAAAAAAAAAAAAAAAAAAAAAAAAAAAAAAAAAAAAAAAAAAAAAAAAAAAAAAAAAAAAAAAAAAAAAAAAAAAAAAAAAAAAAAAAAAAAAAAAAAAAAAAAAAAAAAAAAAAAAAAAAAAAAAAAAAAAAAAAAAAAAAAAAAAAAAAAAAAAAAAAAAAAAAAAAAAAAAAAAAAAAAAAAAAAAAAAAAAAAAAAAAAAAAAAAAAAAAAAAAAAAAAAAAAAAAAAAAAAAAAAAAAAAAAAAAAAAAAAAAAAAAAAAAAAAAAAAAAAAAAAAAAAAAAAAAAAAAAAAAAAAAAAAAAAAAAAAAAAAAAAAAAAAAAAAAAAAAAAAAAAAAAAAAAAAAAAAAAAAAAAAAAAAAAAAAAAAAAAAAAAAAAAAAAAAAAAAAAAAAAAAAAAAAAAAAAAAAAAAAAAAAAAAAAAAAAAAAAAAAAAAAAAAAAAAAAAAAAAAAAAAAAAAAAAAAAAAAAAAAAAAAAAAAAAAAAAAAAAAAAAAAAAAAAAAAAAAAAAAAAAAAAAAAAAAAAAAAAAAAAAAAAAAAAAAAAAAAAAAAAAAAAAAAAAAAAAAAAAAAAAAAAAAAAAAAAAAAAAAAAAAAAAAAAAAAAAAAAAAAAAAAAAAAAAAAAAAAAAAAAAAAAAAAAAAAAAAAAAAAAAAAAAAAAAAAAAAAAAAAAAAAAAAAAAAAAAAAAAAAAAAAAAAAAAAAAAAAAAAAAAAAAAAAAAAAAAAAAAAAAAAAAAAAAAAAAAAAAAAAAAAAAAAAAAAAAAAAAAAAAAAAAAAAAAAAAAAAAAAAAAAAAAAAAAAAAAAAAAAAAAAAAAAAAAAAAAAAAAAAAAAAAAAAAAAAAAAAAAAAAAAAAAAAAAAAAAAAAAAAAAAAAAAAAAAAAAAAAAAAAAAAAAAAAAAAAAAAAAAAAAAAAAAAAAAAAAAAAAAAAAAAAAAAAAAAAAAAAAAAAAAAAAAAAAAAAAAAAAAAAAAAAAAAAAAAAAAAAAAAAAAAAAAAAAAAAAAAAAAAAAAAAAAAAAAAAAAAAAAAAAAAAAAAAAAAAAAAAAAAAAAAAAAAAAAAAAAAAAAAAAAAAAAAAAAAAAAAAAAAAAAAAAAAAAAAAAAAAAAAAAAAAAAAAAAAAAAAAAAAAAAAAAAAAAAAAAAAAAAAAAAAAAAAAAAAAAAAAAAAAAAAAAAAAAAAAAAAAAAAAAAAAAAAAAAAAAAAAAAAAAAAAAAAAAAAAAAAAAAAAAAAAAAAAAAAAAAAAAAAAAAAAAAAAAAAAAAAAAAAAAAAAAAAAAAAAAAAAAAAAAAAAAAAAAAAAAAAAAAAAAAAAAAAAAAAAAAAAAAAAAAAAAAAAAAAAAAAAAAAAAAAAAAAAAAAAAAAAAAAAAAAAAAAAAAAAAAAAAAAAAAAAAAAAAAAAAAAAAAAAAAAAAAAAAAAAAAAAAAAAAAAAAAAAAAAAAAAAAAAAAAAAAAAAAAAAAAAAAAAAAAAAAAAAAAAAAAAAAAAAAAAAAAAAAAAAAAAAAAAAAAAAAAAAAAAAAAAAAAAAAAAAAAAAAAAAAAAAAAAAAAAAAAAAAAAAAAAAAAAAAAAAAAAAAAAAAAAAAAAAAAAAAAAAAAAAAAAAAAAAAAAAAAAAAAAAAAAAAAAAAAAAAAAAAAAAAAAAAAAAAAAAAAAAAAAAAAAAAAAAAAAAAAAAAAAAAAAAAAAAAAAAAAAAAAAAAAAAAAAAAAAAAAAAAAAAAAAAAAAAAAAAAAAAAAAAAAAAAAAAAAAAAAAAAAAAAAAAAAAAAAAAAAAAAAAAAAAAAAAAAAAAAAAAAAAAAAAAAAAAAAAAAAAAAAAAAAAAAAAAAAAAAAAAAAAAAAAAAAAAAAAAAAAAAAAAAAAAAAAAAAAAAAAAAAAAAAAAAAAAAAAAAAAAAAAAAAAAAAAAAAAAAAAAAAAAAAAAAAAAAAAAAAAAAAAAAAAAAAAAAAAAAAAAAAAAAAAAAAAAAAAAAAAAAAAAAAAAAAAAAAAAAAAAAAAAAAAAAAAAAAAAAAAAAAAAAAAAAAAAAAAAAAAAAAAAAAAAAAAAAAAAAAAAAAAAAAAAAAAAAAAAAAAAAAAAAAAAAAAAAAAAAAAAAAAAAAAAAAAAAAAAAAAAAAAAAAAAAAAAAAAAAAAAAAAAAAAAAAAAAAAAAAAAAAAAAAAAAAAAAAAAAAAAAAAAAAAAAAAAAAAAAAAAAAAAAAAAAAAAAAAAAAAAAAAAAAAAAAAAAAAAAAAAAAAAAAAAAAAAAAAAAAAAAAAAAAAAAAAAAAAAAAAAAAAAAAAAAAAAAAAAAAAAAAAAAAAAAAAAAAAAAAAAAAAAAAAAAAAAAAAAAAAAAAAAAAAAAAAAAAAAAAAAAAAAAAAAAAAAAAAAAAAAAAAAAAAAAAAAAAAAAAAAAAAAAAAAAAAAAAAAAAAAAAAAAAAAAAAAAAAAAAAAAAAAAAAAAAAAAAAAAAAAAAAAAAAAAAAAAAAAAAAAAAAAAAAAAAAAAAAAAAAAAAAAAAAAAAAAAAAAAAAAAAAAAAAAAAAAAAAAAAAAAAAAAAAAAAAAAAAAAAAAAAAAAAAAAAAAAAAAAAAAAAAAAAAAAAAAAAAAAAAAAAAAAAAAAAAAAAAAAAAAAAAAAAAAAAAAAAAAAAAAAAAAAAAAAAAAAAAAAAAAAAAAAAAAAAAAAAAAAAAAAAAAAAAAAAAAAAAAAAAAAAAAAAAAAAAAAAAAAAAAAAAAAAAAAAAAAAAAAAAAAAAAAAAAAAAAAAAAAAAAAAAAAAAAAAAAAAAAAAAAAAAAAAAAAAAAAAAAAAAAAAAAAAAAAAAAAAAAAAAAAAAAAAAAAAAAAAAAAAAAAAAAAAAAAAAAAAAAAAAAAAAAAAAAAAAAAAAAAAAAAAAAAAAAAAAAAAAAAAAAAAAAAAAAAAAAAAAAAAAAAAAAAAAAAAAAAAAAAAAAAAAAAAAAAAAAAAAAAAAA
SET SESSION DEBUG='+d,data_type_conversion_injection';
CREATE TABLE blob_text_test4 (
id INT PRIMARY KEY AUTO_INCREMENT,
tinyblob_col TINYBLOB,
tinytext_col TINYTEXT,
blob_col BLOB,
text_col TEXT
) engine=Dstore;
SET SESSION DEBUG='-d,data_type_conversion_injection';
INSERT INTO blob_text_test4 (tinyblob_col, tinytext_col, blob_col, text_col) 
VALUES (NULL, NULL, NULL, NULL),
('', '', '', ''),
('Data', 'Data', UNHEX('5000'), 'Data');
SELECT * FROM blob_text_test4;
id	tinyblob_col	tinytext_col	blob_col	text_col
1	NULL	NULL	NULL	NULL
2				
3	Data	Data	P 	Data
INSERT INTO blob_text_test4 (tinyblob_col, tinytext_col, blob_col, text_col) 
VALUES (REPEAT('A', 255), REPEAT('B', 255), REPEAT('C', 65535), REPEAT('D', 65535));
SELECT id, LENGTH(text_col) FROM blob_text_test4 WHERE CHAR_LENGTH(text_col) > 1000;
id	LENGTH(text_col)
4	65535
SELECT id, LENGTH(HEX(text_col)) FROM blob_text_test4 WHERE text_col LIKE '%SQL%';
id	LENGTH(HEX(text_col))
SELECT LENGTH(HEX(text_col)) FROM blob_text_test4 WHERE id = 4;
LENGTH(HEX(text_col))
131070
SELECT OCTET_LENGTH(text_col), CHAR_LENGTH(text_col) FROM blob_text_test4;
OCTET_LENGTH(text_col)	CHAR_LENGTH(text_col)
NULL	NULL
0	0
4	4
65535	65535
SELECT id, HEX(SUBSTRING(blob_col, 1, 4)) AS hex_data FROM blob_text_test4;
id	hex_data
1	NULL
2	
3	5000
4	43434343
SELECT id, SUBSTRING(text_col, 1, 10) AS text_preview FROM blob_text_test4;
id	text_preview
1	NULL
2	
3	Data
4	DDDDDDDDDD
SELECT id, CHAR_LENGTH(tinytext_col) AS text_length FROM blob_text_test4 WHERE CHAR_LENGTH(tinytext_col) > 50;
id	text_length
4	255
SELECT id, text_col FROM blob_text_test4 WHERE text_col LIKE '%specific substring%';
id	text_col
ANALYZE TABLE blob_text_test4 UPDATE HISTOGRAM ON id;
Table	Op	Msg_type	Msg_text
test.blob_text_test4	histogram	status	Histogram statistics created for column 'id'.
UPDATE blob_text_test4 SET text_col = REPEAT('C', 5000), text_col = REPEAT('D', 10000) WHERE id = 3;
UPDATE blob_text_test4 SET text_col = REPEAT('N', 255), text_col = REPEAT('S', 3000) WHERE id = 4;
DELETE FROM blob_text_test4 WHERE id = 14;
TRUNCATE TABLE blob_text_test4;
# 
# 3. Table structure includes secondary indexes.
# 
CREATE TABLE `blob_text_test5` (
id int DEFAULT NULL,
id2 int DEFAULT NULL,
blob_col BLOB,
KEY `idx_id` (`id`)
);
INSERT INTO blob_text_test5 (id, id2, blob_col) VALUES (1, 1, REPEAT('A', 3000)), (2, 2, REPEAT('B', 100)), (3, 3, REPEAT('C', 100)), (4, 4, REPEAT('D', 100));
UPDATE blob_text_test5 set id=5 where id = 1;
UPDATE blob_text_test5 set id=10 where id = 5;
ALTER TABLE blob_text_test5 ADD INDEX idx(id2), ALGORITHM = INPLACE;
INSERT INTO blob_text_test4 (tinyblob_col) VALUES(REPEAT('G',256));
ERROR 22001: Data too long for column 'tinyblob_col' at row 1
INSERT INTO blob_text_test4 (text_col) VALUES(REPEAT('G',65536));
ERROR 22001: Data too long for column 'text_col' at row 1
UPDATE blob_text_test4 SET tinytext_col = REPEAT('G',256) WHERE id = 1;
INSERT INTO blob_text_test4 (tinyblob_col, tinytext_col, blob_col, text_col) 
VALUES (REPEAT('A', 255), REPEAT('B', 255), REPEAT('C', 65535), REPEAT('D', 65535));
UPDATE blob_text_test4 SET tinytext_col = REPEAT('G',256) WHERE id = 1;
ERROR 22001: Data too long for column 'tinytext_col' at row 1
UPDATE blob_text_test4 SET blob_col = REPEAT('G',65536) WHERE id = 1;
ERROR 22001: Data too long for column 'blob_col' at row 1
# 
# 5. MVCC
# 
create table blob_text_test6(id int, blob_col blob) engine=Dstore;
SET TRANSACTION ISOLATION LEVEL REPEATABLE READ;
begin;
insert into blob_text_test6 values(1, repeat('Q', 3000));
SET TRANSACTION ISOLATION LEVEL REPEATABLE READ;
begin;
insert into blob_text_test6 values(2, repeat('A', 3500));
select id, LENGTH(blob_col) from blob_text_test6;
id	LENGTH(blob_col)
2	3500
commit;
select id, LENGTH(blob_col) from blob_text_test6;
id	LENGTH(blob_col)
2	3500
commit;
select id, LENGTH(blob_col) from blob_text_test6;
id	LENGTH(blob_col)
1	3000
2	3500
create table blob_text_test7(id int, blob_col blob) engine=Dstore;
SET TRANSACTION ISOLATION LEVEL READ COMMITTED;
begin;
insert into blob_text_test7 values(1, repeat('Q', 3000));
SET TRANSACTION ISOLATION LEVEL READ COMMITTED;
begin;
insert into blob_text_test7 values(2, repeat('A', 3500));
select id, LENGTH(blob_col) from blob_text_test7;
id	LENGTH(blob_col)
2	3500
commit;
select id, LENGTH(blob_col) from blob_text_test7;
id	LENGTH(blob_col)
1	3000
2	3500
commit;
# 
# 6. BUG2025042432854
# 
CALL mtr.add_suppression(".*TupleWithLob is nullptr in*");
CALL mtr.add_suppression(".*CdeZalloc fail*");
CALL mtr.add_suppression(".*memcpy_s fail*");
CREATE TABLE blob_text_test8 (
id INT AUTO_INCREMENT PRIMARY KEY,
blob_col BLOB
) engine=Dstore;
INSERT INTO blob_text_test8 (blob_col) VALUES (REPEAT('A', 3000));
SET SESSION DEBUG='+d,read_full_row_null_pointer_injection';
UPDATE blob_text_test8 SET blob_col = REPEAT('B', 3020) WHERE id = 1;
ERROR HY000: Got error 168 - 'Unknown (generic) error from engine' from storage engine
SET SESSION DEBUG='-d,read_full_row_null_pointer_injection';
SET SESSION DEBUG='+d,databuf_null_pointer_injection';
UPDATE blob_text_test8 SET blob_col = REPEAT('B', 3020) WHERE id = 1;
ERROR HY000: Got error 168 - 'Unknown (generic) error from engine' from storage engine
SET SESSION DEBUG='-d,databuf_null_pointer_injection';
SET SESSION DEBUG='+d,memcpy_error_injection';
UPDATE blob_text_test8 SET blob_col = REPEAT('B', 3020) WHERE id = 1;
ERROR HY000: Got error 168 - 'Unknown (generic) error from engine' from storage engine
SET SESSION DEBUG='-d,memcpy_error_injection';
CREATE TABLE `blob_text_test9` (
id int DEFAULT NULL,
id2 int DEFAULT NULL,
blob_col BLOB,
KEY `idx_id` (`id`)
);
INSERT INTO blob_text_test9 (id, id2, blob_col) VALUES (1, 1, REPEAT('A', 3000)), (2, 2, REPEAT('B', 100)), (3, 3, REPEAT('C', 100)), (4, 4, REPEAT('D', 100));
SET SESSION DEBUG='+d,rnd_pos_null_pointer_injection';
UPDATE blob_text_test9 set id=5 where id = 1;
ERROR HY000: Got error 168 - 'Unknown (generic) error from engine' from storage engine
SET SESSION DEBUG='-d,rnd_pos_null_pointer_injection';
CALL mtr.add_suppression(".*Ctid is nullptr in ReadFullRow function*");
CREATE TABLE blob_text_test10 (
id INT AUTO_INCREMENT PRIMARY KEY,
blob_col BLOB
) engine=Dstore;
INSERT INTO blob_text_test10 (blob_col) VALUES (REPEAT('A', 120));
SET SESSION DEBUG='+d,read_full_row_ctid_nullptr_injection';
UPDATE blob_text_test10 SET blob_col = REPEAT('B', 3000) WHERE id = 1;
ERROR HY000: Got error 168 - 'Unknown (generic) error from engine' from storage engine
SET SESSION DEBUG='-d,read_full_row_ctid_nullptr_injection';
CREATE TABLE blob_text_test11 (
id INT AUTO_INCREMENT PRIMARY KEY,
blob_col BLOB
) engine=Dstore;
INSERT INTO blob_text_test11 (blob_col) VALUES (REPEAT('A', 3000));
select * from blob_text_test11;
id	blob_col
1	AAAAAAAAAAAAAAAAAAAAAAAAAAAAAAAAAAAAAAAAAAAAAAAAAAAAAAAAAAAAAAAAAAAAAAAAAAAAAAAAAAAAAAAAAAAAAAAAAAAAAAAAAAAAAAAAAAAAAAAAAAAAAAAAAAAAAAAAAAAAAAAAAAAAAAAAAAAAAAAAAAAAAAAAAAAAAAAAAAAAAAAAAAAAAAAAAAAAAAAAAAAAAAAAAAAAAAAAAAAAAAAAAAAAAAAAAAAAAAAAAAAAAAAAAAAAAAAAAAAAAAAAAAAAAAAAAAAAAAAAAAAAAAAAAAAAAAAAAAAAAAAAAAAAAAAAAAAAAAAAAAAAAAAAAAAAAAAAAAAAAAAAAAAAAAAAAAAAAAAAAAAAAAAAAAAAAAAAAAAAAAAAAAAAAAAAAAAAAAAAAAAAAAAAAAAAAAAAAAAAAAAAAAAAAAAAAAAAAAAAAAAAAAAAAAAAAAAAAAAAAAAAAAAAAAAAAAAAAAAAAAAAAAAAAAAAAAAAAAAAAAAAAAAAAAAAAAAAAAAAAAAAAAAAAAAAAAAAAAAAAAAAAAAAAAAAAAAAAAAAAAAAAAAAAAAAAAAAAAAAAAAAAAAAAAAAAAAAAAAAAAAAAAAAAAAAAAAAAAAAAAAAAAAAAAAAAAAAAAAAAAAAAAAAAAAAAAAAAAAAAAAAAAAAAAAAAAAAAAAAAAAAAAAAAAAAAAAAAAAAAAAAAAAAAAAAAAAAAAAAAAAAAAAAAAAAAAAAAAAAAAAAAAAAAAAAAAAAAAAAAAAAAAAAAAAAAAAAAAAAAAAAAAAAAAAAAAAAAAAAAAAAAAAAAAAAAAAAAAAAAAAAAAAAAAAAAAAAAAAAAAAAAAAAAAAAAAAAAAAAAAAAAAAAAAAAAAAAAAAAAAAAAAAAAAAAAAAAAAAAAAAAAAAAAAAAAAAAAAAAAAAAAAAAAAAAAAAAAAAAAAAAAAAAAAAAAAAAAAAAAAAAAAAAAAAAAAAAAAAAAAAAAAAAAAAAAAAAAAAAAAAAAAAAAAAAAAAAAAAAAAAAAAAAAAAAAAAAAAAAAAAAAAAAAAAAAAAAAAAAAAAAAAAAAAAAAAAAAAAAAAAAAAAAAAAAAAAAAAAAAAAAAAAAAAAAAAAAAAAAAAAAAAAAAAAAAAAAAAAAAAAAAAAAAAAAAAAAAAAAAAAAAAAAAAAAAAAAAAAAAAAAAAAAAAAAAAAAAAAAAAAAAAAAAAAAAAAAAAAAAAAAAAAAAAAAAAAAAAAAAAAAAAAAAAAAAAAAAAAAAAAAAAAAAAAAAAAAAAAAAAAAAAAAAAAAAAAAAAAAAAAAAAAAAAAAAAAAAAAAAAAAAAAAAAAAAAAAAAAAAAAAAAAAAAAAAAAAAAAAAAAAAAAAAAAAAAAAAAAAAAAAAAAAAAAAAAAAAAAAAAAAAAAAAAAAAAAAAAAAAAAAAAAAAAAAAAAAAAAAAAAAAAAAAAAAAAAAAAAAAAAAAAAAAAAAAAAAAAAAAAAAAAAAAAAAAAAAAAAAAAAAAAAAAAAAAAAAAAAAAAAAAAAAAAAAAAAAAAAAAAAAAAAAAAAAAAAAAAAAAAAAAAAAAAAAAAAAAAAAAAAAAAAAAAAAAAAAAAAAAAAAAAAAAAAAAAAAAAAAAAAAAAAAAAAAAAAAAAAAAAAAAAAAAAAAAAAAAAAAAAAAAAAAAAAAAAAAAAAAAAAAAAAAAAAAAAAAAAAAAAAAAAAAAAAAAAAAAAAAAAAAAAAAAAAAAAAAAAAAAAAAAAAAAAAAAAAAAAAAAAAAAAAAAAAAAAAAAAAAAAAAAAAAAAAAAAAAAAAAAAAAAAAAAAAAAAAAAAAAAAAAAAAAAAAAAAAAAAAAAAAAAAAAAAAAAAAAAAAAAAAAAAAAAAAAAAAAAAAAAAAAAAAAAAAAAAAAAAAAAAAAAAAAAAAAAAAAAAAAAAAAAAAAAAAAAAAAAAAAAAAAAAAAAAAAAAAAAAAAAAAAAAAAAAAAAAAAAAAAAAAAAAAAAAAAAAAAAAAAAAAAAAAAAAAAAAAAAAAAAAAAAAAAAAAAAAAAAAAAAAAAAAAAAAAAAAAAAAAAAAAAAAAAAAAAAAAAAAAAAAAAAAAAAAAAAAAAAAAAAAAAAAAAAAAAAAAAAAAAAAAAAAAAAAAAAAAAAAAAAAAAAAAAAAAAAAAAAAAAAAAAAAAAAAAAAAAAAAAAAAAAAAAAAAAAAAAAAAAAAAAAAAAAAAAAAAAAAAAAAAAAAAAAAAAAAAAAAAAAAAAAAAAAAAAAAAAAAAAAAAAAAAAAAAAAAAAAAAAAAAAAAAAAAAAAAAAAAAAAAAAAAAAAAAAAAAAAAAAAAAAAAAAAAAAAAAAAAAAAAAAAAAAAAAAAAAAAAAAAAAAAAAAAAAAAAAAAAAAAAAAAAAAAAAAAAAAAAAAAAAAAAAAAAAAAAAAAAAAAAAAAAAAAAAAAAAAAAAAAAAAAAAAAAAAAAAAAAAAAAAAAAAAAAAAAAAAAAAAAAAAAAAAAAAAAAAAAAAAAAAAAAAAAAAAAAAAAAAAAAAAAAAAAAAAAAAAAAAAAAAAAAAAAAAAAAAAAAAAAAAAAAAAAAAAAAAAAAAAAAAAAAAAAAAAAAAAAAAAAAAAAAAAAAAAAAAAAAAAAAAAAAAAAAAAAAAAAAAAAAAAAAAAAAAAAAAAAAAAAAAAAAAAAAAAAAAAAAAAAAAAAAAAAAAAAAAAAAAAAAAAAAAAAAAAAAAAAAAAAAAAAAAAAAAAAAAAAAAAAAAAAAAAAAAAAAAAAAAAAAAAAAAAAAAAAAAAAAAAAAAAAAAAAAAAAAAAAAAAAAAAAAAAAAAAAAAAAAAAAAAAAAAAAAAAAAAAAAAAAAAAAAAAAAAAAAAAAAAAAAAAAAAAAAAAAAAAAAAAAAAAAAAAAAAAAAAAAAAAAAAAAAAAAAAAAAAAAAAAAAAAAAAAAAAAAAAAAAAAAAAAAAAAAAAAAAAAAAAAAAAAAAAAAAAAAAAAAAAAAAAAAAAAAAAAAAAAAAAAA
CREATE TABLE blob_text_test12 (
id INT AUTO_INCREMENT PRIMARY KEY,
blob_col BLOB
) engine=Dstore;
INSERT INTO blob_text_test12 (blob_col) VALUES (REPEAT('A', 3000));
SET SESSION DEBUG='+d,rnd_next_lobtuple_pointer_injection';
select * from blob_text_test12;
ERROR HY000: Got error 168 - 'Unknown (generic) error from engine' from storage engine
SET SESSION DEBUG='-d,rnd_next_lobtuple_pointer_injection';
CREATE TABLE blob_text_test13 (
id INT AUTO_INCREMENT PRIMARY KEY,
blob_col BLOB
) engine=Dstore;
INSERT INTO blob_text_test13 (blob_col) VALUES (REPEAT('A', 3000));
ANALYZE TABLE blob_text_test13 UPDATE HISTOGRAM ON id;
Table	Op	Msg_type	Msg_text
test.blob_text_test13	histogram	status	Histogram statistics created for column 'id'.
CREATE TABLE blob_text_test14 (
id INT AUTO_INCREMENT PRIMARY KEY,
blob_col BLOB
) engine=Dstore;
INSERT INTO blob_text_test14 (blob_col) VALUES (REPEAT('A', 3000));
ANALYZE TABLE blob_text_test14 UPDATE HISTOGRAM ON id;
Table	Op	Msg_type	Msg_text
test.blob_text_test14	histogram	status	Histogram statistics created for column 'id'.
CALL mtr.add_suppression(".*lock newest tuple failed.*");
CALL mtr.add_suppression(".*lock table failed, realTuple is null");
CREATE TABLE blob_text_test15 (
id INT AUTO_INCREMENT PRIMARY KEY,
blob_col BLOB
) engine=Dstore;
INSERT INTO blob_text_test15 (blob_col) VALUES (REPEAT('A', 3000)), (REPEAT('B', 3000));
SET SESSION DEBUG='+d,cde_lcktuple_updated_injection';
delete from blob_text_test15 limit 1;
SET SESSION DEBUG='-d,cde_lcktuple_updated_injection';
CREATE TABLE blob_text_test16 (
id INT AUTO_INCREMENT PRIMARY KEY,
blob_col BLOB
) engine=Dstore;
CALL mtr.add_suppression(".*insert dstore index tuple fail*");
SET SESSION DEBUG='+d,insert_index_errorcode_injection';
INSERT INTO blob_text_test16 (blob_col) VALUES (REPEAT('A', 3000)), (REPEAT('B', 3000));
ERROR HY000: Out of memory; check if mysqld or some other process uses all available memory; if not, you may have to use 'ulimit' to allow mysqld to use more memory or you can add more swap space
SET SESSION DEBUG='-d,insert_index_errorcode_injection';
SET @@global.max_allowed_packet = 1073741824;
# 
# 7. Testing MEDIUMTEXT, LONGTEXT, MEDIUMBLOB, and LONGBLOB data types.
# 
CREATE TABLE blob_text_test17 (
id INT AUTO_INCREMENT PRIMARY KEY,
mt_content MEDIUMTEXT,
lt_content LONGTEXT,
mb_data MEDIUMBLOB,
lb_data LONGBLOB,
created_at TIMESTAMP DEFAULT CURRENT_TIMESTAMP
);
INSERT INTO blob_text_test17 (mb_data) VALUES (REPEAT('A', 16777215));
INSERT INTO blob_text_test17 (lb_data) VALUES (REPEAT('B', 1069547496));
SELECT id, LENGTH(mt_content) as mt_len, LENGTH(lt_content) as lt_len, LENGTH(mb_data) as mb_len, LENGTH(lb_data) as lb_len FROM blob_text_test17;
id	mt_len	lt_len	mb_len	lb_len
1	NULL	NULL	16777215	NULL
2	NULL	NULL	NULL	1069547496
INSERT INTO blob_text_test17 (mb_data) VALUES(REPEAT('G', 16777216));
ERROR 22001: Data too long for column 'mb_data' at row 1
INSERT INTO blob_text_test17 (lt_content) VALUES(REPEAT('G', 1069547497));
ERROR 42000: The storage engine for the table doesn't support the data length of 1069547497 bytes for LONGTEXT column. Maximum supported length is 1069547496 bytes.
CREATE TABLE blob_text_test18 (id INT,long_blob_col LONGBLOB, long_text_col LONGBLOB);
INSERT INTO blob_text_test18 (id, long_blob_col, long_text_col) VALUES (2, REPEAT('A', 1069544496), REPEAT('B', 3020));
SELECT id,length(long_blob_col), length(long_text_col) from blob_text_test18;
id	length(long_blob_col)	length(long_text_col)
2	1069544496	3020
UPDATE blob_text_test18 set long_text_col=REPEAT('C', 3020) where id = 2;
UPDATE blob_text_test18 set long_blob_col=REPEAT('C', 3020) where id = 2;
INSERT INTO blob_text_test18 (id, long_blob_col, long_text_col) VALUES (2, REPEAT('A', 200000000), REPEAT('B', 3020));
INSERT INTO blob_text_test18 (id, long_blob_col, long_text_col) VALUES (3, REPEAT('A', 300000000), REPEAT('B', 3020));
SELECT id,length(long_blob_col), length(long_text_col) from blob_text_test18;
id	length(long_blob_col)	length(long_text_col)
2	3020	3020
2	200000000	3020
3	300000000	3020
# 
# 8. Test tuple size exceeding the limit.
# 
CALL mtr.add_suppression(".*form dstore heap tuple fail.*");
CALL mtr.add_suppression(".*insert_heap fail.*");
CREATE TABLE blob_text_test19 (
id INT AUTO_INCREMENT PRIMARY KEY,
tiny_blob_col TINYBLOB,
tiny_text_col TINYTEXT,
blob_col BLOB,
text_col TEXT,
medium_blob_col MEDIUMBLOB,
medium_text_col MEDIUMTEXT,
long_blob_col LONGBLOB,
long_text_col LONGTEXT
);
INSERT INTO blob_text_test19 (tiny_blob_col, tiny_text_col, blob_col, text_col, medium_blob_col, medium_text_col, long_blob_col, long_text_col)
VALUES
(REPEAT('A', 255), REPEAT('B', 255), REPEAT('C', 65535), REPEAT('D', 65535), REPEAT('E', 16777215), REPEAT('F', 16777215), REPEAT('G', 1069547496), REPEAT('H', 1069547496));
ERROR HY000: Storage engine Dstore: row size too large. The maximum row size is 1073741823 bytes.
# 
# 9. Testing the scenario where a table contains LOB-type columns but the query does not involve these columns.
# 
CREATE TABLE blob_text_test20 (
`id_col` int NOT NULL AUTO_INCREMENT,
`bigint_col` bigint NOT NULL,
`datetime_col` datetime(6) DEFAULT NULL,
`varchar_col` varchar(255) CHARACTER SET utf8mb4 COLLATE utf8mb4_bin NOT NULL,
`blob_col` blob,
`mediumblob_col` blob NOT NULL,
`year_col` year DEFAULT NULL,
`enum_col` enum('aaa','bbb','ccc') CHARACTER SET utf8mb3 COLLATE utf8mb3_general_ci NOT NULL,
`set_col` set('111','222','333') CHARACTER SET utf8mb3 COLLATE utf8mb3_general_ci NOT NULL,
`char_col` char(1) DEFAULT NULL,
PRIMARY KEY (`id_col`,`bigint_col`),
KEY `ndx_char_varchar_col` (`datetime_col`,`varchar_col`(4) DESC)
);
Warnings:
Warning	1287	'utf8mb3' is deprecated and will be removed in a future release. Please use utf8mb4 instead
Warning	3778	'utf8mb3_general_ci' is a collation of the deprecated character set UTF8MB3. Please consider using UTF8MB4 with an appropriate collation instead.
Warning	1287	'utf8mb3' is deprecated and will be removed in a future release. Please use utf8mb4 instead
Warning	3778	'utf8mb3_general_ci' is a collation of the deprecated character set UTF8MB3. Please consider using UTF8MB4 with an appropriate collation instead.
INSERT INTO blob_text_test20 (
`bigint_col`, 
`datetime_col`, 
`varchar_col`, 
`blob_col`, 
`mediumblob_col`, 
`year_col`, 
`enum_col`, 
`set_col`, 
`char_col`
) VALUES 
(1001, '2023-01-15 10:30:25.123456', 'Hello World', REPEAT('A', 300), REPEAT('G', 3000), 2023, 'aaa', '111', 'A'),
(1002, '2023-02-20 14:45:30.654321', 'Test data two', REPEAT('B', 3000), REPEAT('H', 300), 2022, 'bbb', '111,222', 'B'),
(1003, '2023-03-25 09:15:45.987654', 'Sample text three', REPEAT('', 300), REPEAT('R', 300), 2021, 'ccc', '222,333', 'C'),
(1004, '2023-04-10 16:20:15.456789', 'Database record', REPEAT('D', 30000), REPEAT('G', 3000), 2020, 'aaa', '111,333', 'D'),
(1005, '2023-05-05 11:55:40.321987', 'Final entry data', NULL, REPEAT('J', 3000), 2023, 'bbb', '333', 'E');
SELECT `id_col`, `varchar_col`, `char_col`, `enum_col`, `set_col` FROM blob_text_test20  WHERE `enum_col` IN ('aaa');
id_col	varchar_col	char_col	enum_col	set_col
1	Hello World	A	aaa	111
4	Database record	D	aaa	111,333
# 
# 10. Drop table.
# 
DROP TABLE blob_text_test1;
DROP TABLE blob_text_test2;
DROP TABLE blob_text_test3;
DROP TABLE blob_text_test4;
DROP TABLE blob_text_test5;
DROP TABLE blob_text_test6;
DROP TABLE blob_text_test7;
DROP TABLE blob_text_test8;
DROP TABLE blob_text_test9;
DROP TABLE blob_text_test10;
DROP TABLE blob_text_test11;
DROP TABLE blob_text_test12;
DROP TABLE blob_text_test13;
DROP TABLE blob_text_test14;
DROP TABLE blob_text_test15;
DROP TABLE blob_text_test16;
DROP TABLE blob_text_test17;
DROP TABLE blob_text_test18;
DROP TABLE blob_text_test19;
DROP TABLE blob_text_test20;
set @@global.max_allowed_packet=default;
USE test;
CREATE TABLE t1 (
`rid` bigint unsigned NOT NULL AUTO_INCREMENT,
`nid` bigint DEFAULT NULL,
`level` int DEFAULT NULL,
`vip` int DEFAULT NULL,
`vip_exp` int DEFAULT NULL,
`reg_channel` int DEFAULT NULL,
`guild_id` bigint unsigned DEFAULT '0',
`guild_open` tinyint(1) DEFAULT '0',
`forbid_login_time` bigint DEFAULT NULL,
`forbid_talk_time` bigint DEFAULT NULL,
`ctime` bigint DEFAULT NULL,
`mtime` datetime(3) DEFAULT NULL,
`last_offline_time` bigint DEFAULT NULL,
`friend_open` tinyint(1) DEFAULT '0',
`user_data_str` blob,
`name` varchar(64) DEFAULT NULL,
`db_fix_version` int DEFAULT '0',
PRIMARY KEY (`rid`),
KEY `idx_users_99_nid` (`nid`),
KEY `idx_users_99_level` (`level`),
KEY `idx_users_99_ctime` (`ctime`),
KEY `idx_users_99_mtime` (`mtime`),
KEY `idx_users_99_last_offline_time` (`last_offline_time`),
KEY `idx_users_99_name` (`name`)
);
Warnings:
Warning	1681	Integer display width is deprecated and will be removed in a future release.
Warning	1681	Integer display width is deprecated and will be removed in a future release.
INSERT INTO `t1` (   `nid`, `level`, `vip`, `vip_exp`, `reg_channel`, `guild_id`, `guild_open`,    `forbid_login_time`, `forbid_talk_time`, `ctime`, `mtime`, `last_offline_time`,    `friend_open`, `user_data_str`, `name`, `db_fix_version` ) VALUES (   1002, 2, 0, 0, 1, 0, 0, NULL, NULL, 1696447496, '2023-10-05 12:34:56.789', NULL, 0,    CONCAT(     REPEAT('Test Data ', 1024),     REPEAT('More Data ', 1024)   ),   'TestUser2', 0 );
BEGIN;
BEGIN;
UPDATE t1 SET level=level+1 WHERE rid=4393751671200;
DELETE FROM t1 WHERE rid=4393751671201;;
COMMIT;
COMMIT;
DROP TABLE t1;
#
# BUG2026020238486 When the LOB is less than 2K, the memory of tupleWithLob is freed repeatedly.
#
CREATE TABLE t1 (
employee_id VARCHAR(32) PRIMARY KEY NOT NULL,
email VARCHAR(150),
brief_description VARCHAR(60000) CHARSET latin1,
j JSON DEFAULT NULL
);
INSERT INTO t1 (employee_id, email,  brief_description,j) VALUES
('U001', 'zhangsan@example.com', repeat('I am zhangsan', 30),'"2019-1-1"'),
('U002', 'lisi@example.com',repeat('A', 60000), '"2019-01-02"'),
('U003', 'wangwu@example.com',  repeat('I am wangwu', 60), CAST(DATE'2019-1-3' AS JSON)),
('U004', 'zhaoliu@example.com',  repeat('Make zhaoliu great again!', 60), CAST(DATE'2020-1-5' AS JSON)),
('U005', 'qianqi@example.com',  repeat('waaaaagh!', 5000), CAST(DATE'2020-1-30' AS JSON));
UPDATE t1 SET brief_description = repeat('I am zhangsan', 10) WHERE employee_id = 'U001';
UPDATE t1 SET brief_description = repeat('I am zhangsan', 1000) WHERE employee_id = 'U001';
UPDATE t1 SET brief_description = repeat('I am zhangsan', 10) WHERE employee_id = 'U001';
UPDATE t1 SET brief_description = repeat('I am zhangsan', 2000) WHERE employee_id = 'U001';
UPDATE t1 SET brief_description = repeat('I am zhangsan', 3000) WHERE employee_id = 'U001';
UPDATE t1 SET brief_description = repeat('I am zhangsan', 20) WHERE employee_id = 'U001';
UPDATE t1 SET brief_description = repeat('I am zhangsan', 300) WHERE employee_id = 'U001';
select * from t1 where employee_id = 'U001';
employee_id	email	brief_description	j
U001	zhangsan@example.com	I am zhangsanI am zhangsanI am zhangsanI am zhangsanI am zhangsanI am zhangsanI am zhangsanI am zhangsanI am zhangsanI am zhangsanI am zhangsanI am zhangsanI am zhangsanI am zhangsanI am zhangsanI am zhangsanI am zhangsanI am zhangsanI am zhangsanI am zhangsanI am zhangsanI am zhangsanI am zhangsanI am zhangsanI am zhangsanI am zhangsanI am zhangsanI am zhangsanI am zhangsanI am zhangsanI am zhangsanI am zhangsanI am zhangsanI am zhangsanI am zhangsanI am zhangsanI am zhangsanI am zhangsanI am zhangsanI am zhangsanI am zhangsanI am zhangsanI am zhangsanI am zhangsanI am zhangsanI am zhangsanI am zhangsanI am zhangsanI am zhangsanI am zhangsanI am zhangsanI am zhangsanI am zhangsanI am zhangsanI am zhangsanI am zhangsanI am zhangsanI am zhangsanI am zhangsanI am zhangsanI am zhangsanI am zhangsanI am zhangsanI am zhangsanI am zhangsanI am zhangsanI am zhangsanI am zhangsanI am zhangsanI am zhangsanI am zhangsanI am zhangsanI am zhangsanI am zhangsanI am zhangsanI am zhangsanI am zhangsanI am zhangsanI am zhangsanI am zhangsanI am zhangsanI am zhangsanI am zhangsanI am zhangsanI am zhangsanI am zhangsanI am zhangsanI am zhangsanI am zhangsanI am zhangsanI am zhangsanI am zhangsanI am zhangsanI am zhangsanI am zhangsanI am zhangsanI am zhangsanI am zhangsanI am zhangsanI am zhangsanI am zhangsanI am zhangsanI am zhangsanI am zhangsanI am zhangsanI am zhangsanI am zhangsanI am zhangsanI am zhangsanI am zhangsanI am zhangsanI am zhangsanI am zhangsanI am zhangsanI am zhangsanI am zhangsanI am zhangsanI am zhangsanI am zhangsanI am zhangsanI am zhangsanI am zhangsanI am zhangsanI am zhangsanI am zhangsanI am zhangsanI am zhangsanI am zhangsanI am zhangsanI am zhangsanI am zhangsanI am zhangsanI am zhangsanI am zhangsanI am zhangsanI am zhangsanI am zhangsanI am zhangsanI am zhangsanI am zhangsanI am zhangsanI am zhangsanI am zhangsanI am zhangsanI am zhangsanI am zhangsanI am zhangsanI am zhangsanI am zhangsanI am zhangsanI am zhangsanI am zhangsanI am zhangsanI am zhangsanI am zhangsanI am zhangsanI am zhangsanI am zhangsanI am zhangsanI am zhangsanI am zhangsanI am zhangsanI am zhangsanI am zhangsanI am zhangsanI am zhangsanI am zhangsanI am zhangsanI am zhangsanI am zhangsanI am zhangsanI am zhangsanI am zhangsanI am zhangsanI am zhangsanI am zhangsanI am zhangsanI am zhangsanI am zhangsanI am zhangsanI am zhangsanI am zhangsanI am zhangsanI am zhangsanI am zhangsanI am zhangsanI am zhangsanI am zhangsanI am zhangsanI am zhangsanI am zhangsanI am zhangsanI am zhangsanI am zhangsanI am zhangsanI am zhangsanI am zhangsanI am zhangsanI am zhangsanI am zhangsanI am zhangsanI am zhangsanI am zhangsanI am zhangsanI am zhangsanI am zhangsanI am zhangsanI am zhangsanI am zhangsanI am zhangsanI am zhangsanI am zhangsanI am zhangsanI am zhangsanI am zhangsanI am zhangsanI am zhangsanI am zhangsanI am zhangsanI am zhangsanI am zhangsanI am zhangsanI am zhangsanI am zhangsanI am zhangsanI am zhangsanI am zhangsanI am zhangsanI am zhangsanI am zhangsanI am zhangsanI am zhangsanI am zhangsanI am zhangsanI am zhangsanI am zhangsanI am zhangsanI am zhangsanI am zhangsanI am zhangsanI am zhangsanI am zhangsanI am zhangsanI am zhangsanI am zhangsanI am zhangsanI am zhangsanI am zhangsanI am zhangsanI am zhangsanI am zhangsanI am zhangsanI am zhangsanI am zhangsanI am zhangsanI am zhangsanI am zhangsanI am zhangsanI am zhangsanI am zhangsanI am zhangsanI am zhangsanI am zhangsanI am zhangsanI am zhangsanI am zhangsanI am zhangsanI am zhangsanI am zhangsanI am zhangsanI am zhangsanI am zhangsanI am zhangsanI am zhangsanI am zhangsanI am zhangsanI am zhangsanI am zhangsanI am zhangsanI am zhangsanI am zhangsanI am zhangsanI am zhangsanI am zhangsanI am zhangsanI am zhangsanI am zhangsanI am zhangsanI am zhangsanI am zhangsanI am zhangsanI am zhangsanI am zhangsanI am zhangsanI am zhangsanI am zhangsanI am zhangsanI am zhangsanI am zhangsanI am zhangsan	"2019-1-1"
UPDATE t1 SET brief_description = repeat('I am zhangsan', 1000) WHERE employee_id = 'U001';
select * from t1 where employee_id = 'U001';
employee_id	email	brief_description	j
U001	zhangsan@example.com	I am zhangsanI am zhangsanI am zhangsanI am zhangsanI am zhangsanI am zhangsanI am zhangsanI am zhangsanI am zhangsanI am zhangsanI am zhangsanI am zhangsanI am zhangsanI am zhangsanI am zhangsanI am zhangsanI am zhangsanI am zhangsanI am zhangsanI am zhangsanI am zhangsanI am zhangsanI am zhangsanI am zhangsanI am zhangsanI am zhangsanI am zhangsanI am zhangsanI am zhangsanI am zhangsanI am zhangsanI am zhangsanI am zhangsanI am zhangsanI am zhangsanI am zhangsanI am zhangsanI am zhangsanI am zhangsanI am zhangsanI am zhangsanI am zhangsanI am zhangsanI am zhangsanI am zhangsanI am zhangsanI am zhangsanI am zhangsanI am zhangsanI am zhangsanI am zhangsanI am zhangsanI am zhangsanI am zhangsanI am zhangsanI am zhangsanI am zhangsanI am zhangsanI am zhangsanI am zhangsanI am zhangsanI am zhangsanI am zhangsanI am zhangsanI am zhangsanI am zhangsanI am zhangsanI am zhangsanI am zhangsanI am zhangsanI am zhangsanI am zhangsanI am zhangsanI am zhangsanI am zhangsanI am zhangsanI am zhangsanI am zhangsanI am zhangsanI am zhangsanI am zhangsanI am zhangsanI am zhangsanI am zhangsanI am zhangsanI am zhangsanI am zhangsanI am zhangsanI am zhangsanI am zhangsanI am zhangsanI am zhangsanI am zhangsanI am zhangsanI am zhangsanI am zhangsanI am zhangsanI am zhangsanI am zhangsanI am zhangsanI am zhangsanI am zhangsanI am zhangsanI am zhangsanI am zhangsanI am zhangsanI am zhangsanI am zhangsanI am zhangsanI am zhangsanI am zhangsanI am zhangsanI am zhangsanI am zhangsanI am zhangsanI am zhangsanI am zhangsanI am zhangsanI am zhangsanI am zhangsanI am zhangsanI am zhangsanI am zhangsanI am zhangsanI am zhangsanI am zhangsanI am zhangsanI am zhangsanI am zhangsanI am zhangsanI am zhangsanI am zhangsanI am zhangsanI am zhangsanI am zhangsanI am zhangsanI am zhangsanI am zhangsanI am zhangsanI am zhangsanI am zhangsanI am zhangsanI am zhangsanI am zhangsanI am zhangsanI am zhangsanI am zhangsanI am zhangsanI am zhangsanI am zhangsanI am zhangsanI am zhangsanI am zhangsanI am zhangsanI am zhangsanI am zhangsanI am zhangsanI am zhangsanI am zhangsanI am zhangsanI am zhangsanI am zhangsanI am zhangsanI am zhangsanI am zhangsanI am zhangsanI am zhangsanI am zhangsanI am zhangsanI am zhangsanI am zhangsanI am zhangsanI am zhangsanI am zhangsanI am zhangsanI am zhangsanI am zhangsanI am zhangsanI am zhangsanI am zhangsanI am zhangsanI am zhangsanI am zhangsanI am zhangsanI am zhangsanI am zhangsanI am zhangsanI am zhangsanI am zhangsanI am zhangsanI am zhangsanI am zhangsanI am zhangsanI am zhangsanI am zhangsanI am zhangsanI am zhangsanI am zhangsanI am zhangsanI am zhangsanI am zhangsanI am zhangsanI am zhangsanI am zhangsanI am zhangsanI am zhangsanI am zhangsanI am zhangsanI am zhangsanI am zhangsanI am zhangsanI am zhangsanI am zhangsanI am zhangsanI am zhangsanI am zhangsanI am zhangsanI am zhangsanI am zhangsanI am zhangsanI am zhangsanI am zhangsanI am zhangsanI am zhangsanI am zhangsanI am zhangsanI am zhangsanI am zhangsanI am zhangsanI am zhangsanI am zhangsanI am zhangsanI am zhangsanI am zhangsanI am zhangsanI am zhangsanI am zhangsanI am zhangsanI am zhangsanI am zhangsanI am zhangsanI am zhangsanI am zhangsanI am zhangsanI am zhangsanI am zhangsanI am zhangsanI am zhangsanI am zhangsanI am zhangsanI am zhangsanI am zhangsanI am zhangsanI am zhangsanI am zhangsanI am zhangsanI am zhangsanI am zhangsanI am zhangsanI am zhangsanI am zhangsanI am zhangsanI am zhangsanI am zhangsanI am zhangsanI am zhangsanI am zhangsanI am zhangsanI am zhangsanI am zhangsanI am zhangsanI am zhangsanI am zhangsanI am zhangsanI am zhangsanI am zhangsanI am zhangsanI am zhangsanI am zhangsanI am zhangsanI am zhangsanI am zhangsanI am zhangsanI am zhangsanI am zhangsanI am zhangsanI am zhangsanI am zhangsanI am zhangsanI am zhangsanI am zhangsanI am zhangsanI am zhangsanI am zhangsanI am zhangsanI am zhangsanI am zhangsanI am zhangsanI am zhangsanI am zhangsanI am zhangsanI am zhangsanI am zhangsanI am zhangsanI am zhangsanI am zhangsanI am zhangsanI am zhangsanI am zhangsanI am zhangsanI am zhangsanI am zhangsanI am zhangsanI am zhangsanI am zhangsanI am zhangsanI am zhangsanI am zhangsanI am zhangsanI am zhangsanI am zhangsanI am zhangsanI am zhangsanI am zhangsanI am zhangsanI am zhangsanI am zhangsanI am zhangsanI am zhangsanI am zhangsanI am zhangsanI am zhangsanI am zhangsanI am zhangsanI am zhangsanI am zhangsanI am zhangsanI am zhangsanI am zhangsanI am zhangsanI am zhangsanI am zhangsanI am zhangsanI am zhangsanI am zhangsanI am zhangsanI am zhangsanI am zhangsanI am zhangsanI am zhangsanI am zhangsanI am zhangsanI am zhangsanI am zhangsanI am zhangsanI am zhangsanI am zhangsanI am zhangsanI am zhangsanI am zhangsanI am zhangsanI am zhangsanI am zhangsanI am zhangsanI am zhangsanI am zhangsanI am zhangsanI am zhangsanI am zhangsanI am zhangsanI am zhangsanI am zhangsanI am zhangsanI am zhangsanI am zhangsanI am zhangsanI am zhangsanI am zhangsanI am zhangsanI am zhangsanI am zhangsanI am zhangsanI am zhangsanI am zhangsanI am zhangsanI am zhangsanI am zhangsanI am zhangsanI am zhangsanI am zhangsanI am zhangsanI am zhangsanI am zhangsanI am zhangsanI am zhangsanI am zhangsanI am zhangsanI am zhangsanI am zhangsanI am zhangsanI am zhangsanI am zhangsanI am zhangsanI am zhangsanI am zhangsanI am zhangsanI am zhangsanI am zhangsanI am zhangsanI am zhangsanI am zhangsanI am zhangsanI am zhangsanI am zhangsanI am zhangsanI am zhangsanI am zhangsanI am zhangsanI am zhangsanI am zhangsanI am zhangsanI am zhangsanI am zhangsanI am zhangsanI am zhangsanI am zhangsanI am zhangsanI am zhangsanI am zhangsanI am zhangsanI am zhangsanI am zhangsanI am zhangsanI am zhangsanI am zhangsanI am zhangsanI am zhangsanI am zhangsanI am zhangsanI am zhangsanI am zhangsanI am zhangsanI am zhangsanI am zhangsanI am zhangsanI am zhangsanI am zhangsanI am zhangsanI am zhangsanI am zhangsanI am zhangsanI am zhangsanI am zhangsanI am zhangsanI am zhangsanI am zhangsanI am zhangsanI am zhangsanI am zhangsanI am zhangsanI am zhangsanI am zhangsanI am zhangsanI am zhangsanI am zhangsanI am zhangsanI am zhangsanI am zhangsanI am zhangsanI am zhangsanI am zhangsanI am zhangsanI am zhangsanI am zhangsanI am zhangsanI am zhangsanI am zhangsanI am zhangsanI am zhangsanI am zhangsanI am zhangsanI am zhangsanI am zhangsanI am zhangsanI am zhangsanI am zhangsanI am zhangsanI am zhangsanI am zhangsanI am zhangsanI am zhangsanI am zhangsanI am zhangsanI am zhangsanI am zhangsanI am zhangsanI am zhangsanI am zhangsanI am zhangsanI am zhangsanI am zhangsanI am zhangsanI am zhangsanI am zhangsanI am zhangsanI am zhangsanI am zhangsanI am zhangsanI am zhangsanI am zhangsanI am zhangsanI am zhangsanI am zhangsanI am zhangsanI am zhangsanI am zhangsanI am zhangsanI am zhangsanI am zhangsanI am zhangsanI am zhangsanI am zhangsanI am zhangsanI am zhangsanI am zhangsanI am zhangsanI am zhangsanI am zhangsanI am zhangsanI am zhangsanI am zhangsanI am zhangsanI am zhangsanI am zhangsanI am zhangsanI am zhangsanI am zhangsanI am zhangsanI am zhangsanI am zhangsanI am zhangsanI am zhangsanI am zhangsanI am zhangsanI am zhangsanI am zhangsanI am zhangsanI am zhangsanI am zhangsanI am zhangsanI am zhangsanI am zhangsanI am zhangsanI am zhangsanI am zhangsanI am zhangsanI am zhangsanI am zhangsanI am zhangsanI am zhangsanI am zhangsanI am zhangsanI am zhangsanI am zhangsanI am zhangsanI am zhangsanI am zhangsanI am zhangsanI am zhangsanI am zhangsanI am zhangsanI am zhangsanI am zhangsanI am zhangsanI am zhangsanI am zhangsanI am zhangsanI am zhangsanI am zhangsanI am zhangsanI am zhangsanI am zhangsanI am zhangsanI am zhangsanI am zhangsanI am zhangsanI am zhangsanI am zhangsanI am zhangsanI am zhangsanI am zhangsanI am zhangsanI am zhangsanI am zhangsanI am zhangsanI am zhangsanI am zhangsanI am zhangsanI am zhangsanI am zhangsanI am zhangsanI am zhangsanI am zhangsanI am zhangsanI am zhangsanI am zhangsanI am zhangsanI am zhangsanI am zhangsanI am zhangsanI am zhangsanI am zhangsanI am zhangsanI am zhangsanI am zhangsanI am zhangsanI am zhangsanI am zhangsanI am zhangsanI am zhangsanI am zhangsanI am zhangsanI am zhangsanI am zhangsanI am zhangsanI am zhangsanI am zhangsanI am zhangsanI am zhangsanI am zhangsanI am zhangsanI am zhangsanI am zhangsanI am zhangsanI am zhangsanI am zhangsanI am zhangsanI am zhangsanI am zhangsanI am zhangsanI am zhangsanI am zhangsanI am zhangsanI am zhangsanI am zhangsanI am zhangsanI am zhangsanI am zhangsanI am zhangsanI am zhangsanI am zhangsanI am zhangsanI am zhangsanI am zhangsanI am zhangsanI am zhangsanI am zhangsanI am zhangsanI am zhangsanI am zhangsanI am zhangsanI am zhangsanI am zhangsanI am zhangsanI am zhangsanI am zhangsanI am zhangsanI am zhangsanI am zhangsanI am zhangsanI am zhangsanI am zhangsanI am zhangsanI am zhangsanI am zhangsanI am zhangsanI am zhangsanI am zhangsanI am zhangsanI am zhangsanI am zhangsanI am zhangsanI am zhangsanI am zhangsanI am zhangsanI am zhangsanI am zhangsanI am zhangsanI am zhangsanI am zhangsanI am zhangsanI am zhangsanI am zhangsanI am zhangsanI am zhangsanI am zhangsanI am zhangsanI am zhangsanI am zhangsanI am zhangsanI am zhangsanI am zhangsanI am zhangsanI am zhangsanI am zhangsanI am zhangsanI am zhangsanI am zhangsanI am zhangsanI am zhangsanI am zhangsanI am zhangsanI am zhangsanI am zhangsanI am zhangsanI am zhangsanI am zhangsanI am zhangsanI am zhangsanI am zhangsanI am zhangsanI am zhangsanI am zhangsanI am zhangsanI am zhangsanI am zhangsanI am zhangsanI am zhangsanI am zhangsanI am zhangsanI am zhangsanI am zhangsanI am zhangsanI am zhangsanI am zhangsanI am zhangsanI am zhangsanI am zhangsanI am zhangsanI am zhangsanI am zhangsanI am zhangsanI am zhangsanI am zhangsanI am zhangsanI am zhangsanI am zhangsanI am zhangsanI am zhangsanI am zhangsanI am zhangsanI am zhangsanI am zhangsanI am zhangsanI am zhangsanI am zhangsanI am zhangsanI am zhangsanI am zhangsanI am zhangsanI am zhangsanI am zhangsanI am zhangsanI am zhangsanI am zhangsanI am zhangsanI am zhangsanI am zhangsanI am zhangsanI am zhangsanI am zhangsanI am zhangsanI am zhangsanI am zhangsanI am zhangsanI am zhangsanI am zhangsanI am zhangsanI am zhangsanI am zhangsanI am zhangsanI am zhangsanI am zhangsanI am zhangsanI am zhangsanI am zhangsanI am zhangsanI am zhangsanI am zhangsanI am zhangsanI am zhangsanI am zhangsanI am zhangsanI am zhangsanI am zhangsanI am zhangsanI am zhangsanI am zhangsanI am zhangsanI am zhangsanI am zhangsanI am zhangsanI am zhangsanI am zhangsanI am zhangsanI am zhangsanI am zhangsanI am zhangsanI am zhangsanI am zhangsanI am zhangsanI am zhangsanI am zhangsanI am zhangsanI am zhangsanI am zhangsanI am zhangsanI am zhangsanI am zhangsanI am zhangsanI am zhangsanI am zhangsanI am zhangsanI am zhangsanI am zhangsanI am zhangsanI am zhangsanI am zhangsanI am zhangsanI am zhangsanI am zhangsanI am zhangsanI am zhangsanI am zhangsanI am zhangsanI am zhangsanI am zhangsanI am zhangsanI am zhangsanI am zhangsanI am zhangsanI am zhangsanI am zhangsanI am zhangsanI am zhangsanI am zhangsanI am zhangsanI am zhangsanI am zhangsanI am zhangsanI am zhangsanI am zhangsanI am zhangsanI am zhangsanI am zhangsanI am zhangsanI am zhangsanI am zhangsanI am zhangsanI am zhangsanI am zhangsanI am zhangsanI am zhangsanI am zhangsanI am zhangsanI am zhangsanI am zhangsanI am zhangsanI am zhangsanI am zhangsanI am zhangsanI am zhangsanI am zhangsanI am zhangsanI am zhangsanI am zhangsanI am zhangsanI am zhangsanI am zhangsanI am zhangsanI am zhangsanI am zhangsanI am zhangsanI am zhangsanI am zhangsanI am zhangsanI am zhangsanI am zhangsanI am zhangsanI am zhangsanI am zhangsanI am zhangsanI am zhangsanI am zhangsanI am zhangsanI am zhangsanI am zhangsanI am zhangsanI am zhangsanI am zhangsanI am zhangsanI am zhangsanI am zhangsanI am zhangsanI am zhangsanI am zhangsanI am zhangsanI am zhangsanI am zhangsanI am zhangsanI am zhangsanI am zhangsanI am zhangsanI am zhangsanI am zhangsanI am zhangsanI am zhangsanI am zhangsanI am zhangsanI am zhangsanI am zhangsanI am zhangsanI am zhangsanI am zhangsanI am zhangsanI am zhangsanI am zhangsanI am zhangsanI am zhangsanI am zhangsanI am zhangsanI am zhangsanI am zhangsanI am zhangsanI am zhangsanI am zhangsanI am zhangsanI am zhangsanI am zhangsanI am zhangsanI am zhangsanI am zhangsanI am zhangsanI am zhangsanI am zhangsanI am zhangsanI am zhangsanI am zhangsanI am zhangsanI am zhangsanI am zhangsanI am zhangsanI am zhangsanI am zhangsanI am zhangsanI am zhangsanI am zhangsanI am zhangsanI am zhangsanI am zhangsanI am zhangsanI am zhangsanI am zhangsanI am zhangsanI am zhangsanI am zhangsanI am zhangsanI am zhangsanI am zhangsanI am zhangsanI am zhangsanI am zhangsanI am zhangsanI am zhangsanI am zhangsanI am zhangsanI am zhangsanI am zhangsanI am zhangsanI am zhangsanI am zhangsanI am zhangsanI am zhangsanI am zhangsanI am zhangsanI am zhangsanI am zhangsanI am zhangsanI am zhangsanI am zhangsanI am zhangsanI am zhangsanI am zhangsanI am zhangsanI am zhangsanI am zhangsanI am zhangsanI am zhangsanI am zhangsanI am zhangsan	"2019-1-1"
DROP TABLE t1;
