call mtr.add_suppression("Dictionary_client acquire failed for table.*");
CREATE TABLE parent (a INT PRIMARY KEY, b INT NOT NULL) ENGINE = dstore;
INSERT INTO parent VALUES(1,2),(2,3);
CREATE INDEX tb ON parent(b);
INSERT INTO parent VALUES(10,20),(20,30);
CREATE TABLE child (a1 INT PRIMARY KEY, a2 INT) ENGINE = dstore;
CREATE INDEX tb ON child(a2);
INSERT INTO child VALUES(10,20);
ALTER TABLE child ADD FOREIGN KEY(a2) REFERENCES parent(b),
ALGORITHM = INPLACE;
ERROR 0A000: ALGORITHM=INPLACE is not supported. Reason: Adding foreign keys needs foreign_key_checks=OFF. Try ALGORITHM=COPY.
SET foreign_key_checks = 0;
ALTER TABLE child ADD CONSTRAINT fk_1 FOREIGN KEY (a2)
REFERENCES parent(b) ON DELETE SET NULL ON UPDATE CASCADE,
ALGORITHM = INPLACE;
ALTER TABLE child ADD CONSTRAINT fk_1 FOREIGN KEY (a2)
REFERENCES parent(b) ON DELETE SET NULL ON UPDATE CASCADE,
ALGORITHM = INPLACE;
ERROR HY000: Duplicate foreign key constraint name 'fk_1'
SET foreign_key_checks = 1;
INSERT INTO child VALUES(1,2),(2,3);
INSERT INTO child VALUES(4,4);
ERROR 23000: Cannot add or update a child row: a foreign key constraint fails (`test`.`child`, CONSTRAINT `fk_1` FOREIGN KEY (`a2`) REFERENCES `parent` (`b`) ON DELETE SET NULL ON UPDATE CASCADE)
SELECT * FROM parent;
a	b
1	2
2	3
10	20
20	30
SET foreign_key_checks = 0;
ALTER TABLE child ADD CONSTRAINT fk_20 FOREIGN KEY (a1, a2)
REFERENCES parent(a, b) ON DELETE CASCADE ON UPDATE CASCADE,
ALGORITHM = INPLACE;
ERROR HY000: Failed to add the foreign key constraint. Missing index for constraint 'fk_20' in the referenced table 'parent'
SHOW WARNINGS;
Level	Code	Message
Error	1822	Failed to add the foreign key constraint. Missing index for constraint 'fk_20' in the referenced table 'parent'
SHOW ERRORS;
Level	Code	Message
Error	1822	Failed to add the foreign key constraint. Missing index for constraint 'fk_20' in the referenced table 'parent'
CREATE INDEX idx1 on parent(a, b);
ALTER TABLE child ADD CONSTRAINT fk_10 FOREIGN KEY (a1, a2)
REFERENCES parent(a, b) ON DELETE CASCADE ON UPDATE CASCADE,
ALGORITHM = INPLACE;
ALTER TABLE child ADD CONSTRAINT fk_2 FOREIGN KEY (a1, a2)
REFERENCES parent(a, b) ON DELETE CASCADE ON UPDATE CASCADE, ADD INDEX idx1(a1,a2),
ALGORITHM = INPLACE;
ALTER TABLE child ADD CONSTRAINT fk_3 FOREIGN KEY (a1, a2)
REFERENCES parent(a, b) ON DELETE CASCADE ON UPDATE CASCADE;
SET foreign_key_checks = 1;
INSERT INTO child VALUES(5,4);
ERROR 23000: Cannot add or update a child row: a foreign key constraint fails (`test`.`child`, CONSTRAINT `fk_1` FOREIGN KEY (`a2`) REFERENCES `parent` (`b`) ON DELETE SET NULL ON UPDATE CASCADE)
SHOW CREATE TABLE child;
Table	Create Table
child	CREATE TABLE `child` (
  `a1` int NOT NULL,
  `a2` int DEFAULT NULL,
  PRIMARY KEY (`a1`),
  KEY `tb` (`a2`),
  KEY `idx1` (`a1`,`a2`),
  CONSTRAINT `fk_1` FOREIGN KEY (`a2`) REFERENCES `parent` (`b`) ON DELETE SET NULL ON UPDATE CASCADE,
  CONSTRAINT `fk_10` FOREIGN KEY (`a1`, `a2`) REFERENCES `parent` (`a`, `b`) ON DELETE CASCADE ON UPDATE CASCADE,
  CONSTRAINT `fk_2` FOREIGN KEY (`a1`, `a2`) REFERENCES `parent` (`a`, `b`) ON DELETE CASCADE ON UPDATE CASCADE,
  CONSTRAINT `fk_3` FOREIGN KEY (`a1`, `a2`) REFERENCES `parent` (`a`, `b`) ON DELETE CASCADE ON UPDATE CASCADE
) ENGINE=Dstore DEFAULT CHARSET=utf8mb4 COLLATE=utf8mb4_0900_ai_ci
DELETE FROM parent where a = 1;
SELECT * FROM child;
a1	a2
1	NULL
2	3
10	20
SET foreign_key_checks = 0;
SET DEBUG = '+d,dstore_test_open_ref_fail';
ALTER TABLE child ADD CONSTRAINT fk_4 FOREIGN KEY (a1, a2)
REFERENCES parent(a, b) ON DELETE CASCADE ON UPDATE CASCADE,
ALGORITHM = INPLACE;
SET DEBUG = '-d,dstore_test_open_ref_fail';
INSERT INTO child VALUES(5,4);
SET foreign_key_checks = 1;
INSERT INTO child VALUES(6,5);
ERROR 23000: Cannot add or update a child row: a foreign key constraint fails (`test`.`child`, CONSTRAINT `fk_1` FOREIGN KEY (`a2`) REFERENCES `parent` (`b`) ON DELETE SET NULL ON UPDATE CASCADE)
SET foreign_key_checks = 0;
CREATE TABLE `#parent` (a INT PRIMARY KEY, b INT NOT NULL) ENGINE = dstore;
CREATE INDEX tb ON `#parent`(a, b);
CREATE TABLE `#child` (a1 INT PRIMARY KEY, a2 INT) ENGINE = dstore;
CREATE INDEX tb ON `#child`(a1, a2);
SET DEBUG = '+d,dstore_test_no_foreign_idx';
ALTER TABLE `#child` ADD CONSTRAINT fk_40 FOREIGN KEY (a1, a2)
REFERENCES `#parent`(a, b) ON DELETE CASCADE ON UPDATE CASCADE,
ALGORITHM = INPLACE;
ERROR HY000: Failed to add the foreign key constraint. Missing index for constraint 'fk_40' in the foreign table '#child'
SHOW ERRORS;
Level	Code	Message
Error	1821	Failed to add the foreign key constraint. Missing index for constraint 'fk_40' in the foreign table '#child'
SET DEBUG = '-d,dstore_test_no_foreign_idx';
SET DEBUG = '+d,dstore_test_no_reference_idx';
ALTER TABLE child ADD CONSTRAINT fk_42 FOREIGN KEY (a1, a2)
REFERENCES parent(a, b) ON DELETE CASCADE ON UPDATE CASCADE,
ALGORITHM = INPLACE;
ERROR HY000: Failed to add the foreign key constraint. Missing index for constraint 'fk_42' in the referenced table 'parent'
SHOW ERRORS;
Level	Code	Message
Error	1822	Failed to add the foreign key constraint. Missing index for constraint 'fk_42' in the referenced table 'parent'
SET DEBUG = '-d,dstore_test_no_reference_idx';
SET DEBUG = '+d,dstore_test_wrong_fk_option';
ALTER TABLE child ADD CONSTRAINT fk_42 FOREIGN KEY (a1, a2)
REFERENCES parent(a, b) ON DELETE CASCADE ON UPDATE CASCADE,
ALGORITHM = INPLACE;
ERROR HY000: Failed to add the foreign key constraint on table 'child'. Incorrect options in FOREIGN KEY constraint 'test/fk_42'
SET DEBUG = '-d,dstore_test_wrong_fk_option';
DROP TABLE `#child`;
DROP TABLE `#parent`;
SET foreign_key_checks = 0;
ALTER TABLE child ADD CONSTRAINT fk_5 FOREIGN KEY (a2) REFERENCES parent(b)
ON DELETE SET NULL ON UPDATE CASCADE,
ADD CONSTRAINT fk_6 FOREIGN KEY (a1, a2)
REFERENCES parent(a, b) ON DELETE CASCADE ON UPDATE CASCADE,
ALGORITHM = INPLACE;
DROP TABLE child;
DROP TABLE parent;
CREATE TABLE parent (a INT PRIMARY KEY, b INT NOT NULL) ENGINE = dstore;
INSERT INTO parent VALUES(1,2),(2,3);
CREATE INDEX tb ON parent(b);
INSERT INTO parent VALUES(10,20),(20,30);
CREATE TABLE child (a1 INT PRIMARY KEY, a2 INT) ENGINE = dstore;
CREATE INDEX tb ON child(a2);
INSERT INTO child VALUES(10,20);
SET foreign_key_checks = 0;
ALTER TABLE child DROP INDEX tb, ADD CONSTRAINT fk_4 FOREIGN KEY (a2)
REFERENCES parent(b) ON DELETE CASCADE ON UPDATE CASCADE,
ALGORITHM = INPLACE;
SHOW CREATE TABLE child;
Table	Create Table
child	CREATE TABLE `child` (
  `a1` int NOT NULL,
  `a2` int DEFAULT NULL,
  PRIMARY KEY (`a1`),
  KEY `fk_4` (`a2`),
  CONSTRAINT `fk_4` FOREIGN KEY (`a2`) REFERENCES `parent` (`b`) ON DELETE CASCADE ON UPDATE CASCADE
) ENGINE=Dstore DEFAULT CHARSET=utf8mb4 COLLATE=utf8mb4_0900_ai_ci
SET foreign_key_checks = 1;
DROP TABLE child;
DROP TABLE parent;
CREATE TABLE parent (a INT PRIMARY KEY, b INT NOT NULL) ENGINE = dstore;
INSERT INTO parent VALUES(1,2),(2,3);
CREATE INDEX tb ON parent(b);
INSERT INTO parent VALUES(10,20),(20,30);
CREATE TABLE child (a1 INT PRIMARY KEY, a2 INT) ENGINE = dstore;
CREATE INDEX tb ON child(a2);
SET foreign_key_checks = 0;
ALTER TABLE child CHANGE a2 a3 INT,
ADD CONSTRAINT fk_1 FOREIGN KEY (a2) REFERENCES parent(b)
ON DELETE SET NULL ON UPDATE CASCADE,
ALGORITHM = INPLACE;
ERROR 42000: Key column 'a2' doesn't exist in table
ALTER TABLE child CHANGE a2 a3 INT,
ADD CONSTRAINT fk_1 FOREIGN KEY (a3) REFERENCES parent(b)
ON DELETE SET NULL ON UPDATE CASCADE,
ALGORITHM = INPLACE;
DROP TABLE child;
DROP TABLE parent;
CREATE TABLE parent (a INT PRIMARY KEY, b INT NOT NULL) ENGINE = dstore;
INSERT INTO parent VALUES(1,2),(2,3);
CREATE INDEX tb ON parent(b);
INSERT INTO parent VALUES(10,20),(20,30);
CREATE TABLE child (a1 INT NOT NULL, a2 INT) ENGINE = dstore;
CREATE INDEX tb ON child(a2);
SET foreign_key_checks = 0;
ALTER TABLE child ADD PRIMARY KEY idx (a3), CHANGE a1 a3 INT,
ADD CONSTRAINT fk_1 FOREIGN KEY (a2) REFERENCES parent(b)
ON DELETE SET NULL ON UPDATE CASCADE,
ALGORITHM = INPLACE;
SHOW CREATE TABLE child;
Table	Create Table
child	CREATE TABLE `child` (
  `a3` int NOT NULL,
  `a2` int DEFAULT NULL,
  PRIMARY KEY (`a3`),
  KEY `tb` (`a2`),
  CONSTRAINT `fk_1` FOREIGN KEY (`a2`) REFERENCES `parent` (`b`) ON DELETE SET NULL ON UPDATE CASCADE
) ENGINE=Dstore DEFAULT CHARSET=utf8mb4 COLLATE=utf8mb4_0900_ai_ci
DROP TABLE child;
CREATE TABLE child (a1 INT NOT NULL, a2 INT) ENGINE = dstore;
ALTER TABLE child ADD PRIMARY KEY idx (a1),
ADD CONSTRAINT fk_1 FOREIGN KEY (a2) REFERENCES parent(b)
ON DELETE SET NULL ON UPDATE CASCADE,
ALGORITHM = INPLACE;
SHOW CREATE TABLE child;
Table	Create Table
child	CREATE TABLE `child` (
  `a1` int NOT NULL,
  `a2` int DEFAULT NULL,
  PRIMARY KEY (`a1`),
  KEY `fk_1` (`a2`),
  CONSTRAINT `fk_1` FOREIGN KEY (`a2`) REFERENCES `parent` (`b`) ON DELETE SET NULL ON UPDATE CASCADE
) ENGINE=Dstore DEFAULT CHARSET=utf8mb4 COLLATE=utf8mb4_0900_ai_ci
DROP TABLE child;
CREATE TABLE child (a1 INT NOT NULL, a2 INT) ENGINE = dstore;
ALTER TABLE child CHANGE a1 a3 INT,
ADD CONSTRAINT fk_1 FOREIGN KEY (a3) REFERENCES parent(b)
ON DELETE SET NULL ON UPDATE CASCADE,
ALGORITHM = INPLACE;
DROP TABLE child;
CREATE TABLE child (a1 INT NOT NULL, a2 INT) ENGINE = dstore;
ALTER TABLE child ADD PRIMARY KEY idx (a3), CHANGE a1 a3 INT,
ADD CONSTRAINT fk_1 FOREIGN KEY (a3) REFERENCES parent(b)
ON DELETE SET NULL ON UPDATE CASCADE,
ALGORITHM = INPLACE;
ERROR HY000: Column 'a3' cannot be NOT NULL: needed in a foreign key constraint 'fk_1' SET NULL
DROP TABLE parent;
DROP TABLE child;
CREATE TABLE parent (a INT PRIMARY KEY, b INT NOT NULL, c INT) ENGINE = dstore;
INSERT INTO parent VALUES(1,2,3),(2,3,4);
CREATE INDEX tb ON parent(b);
CREATE TABLE child (a1 INT NOT NULL, a2 INT, a3 INT) ENGINE = dstore;
CREATE INDEX tb ON child(a2);
ALTER TABLE child
ADD CONSTRAINT fk_a FOREIGN KEY (a2) REFERENCES parent(b)
ON DELETE SET NULL ON UPDATE CASCADE,
ALGORITHM = INPLACE;
ALTER TABLE child
ADD CONSTRAINT fk_b FOREIGN KEY (a1) REFERENCES parent(a),
ALGORITHM = INPLACE;
ALTER TABLE child CHANGE a2 a2_new INT, CHANGE a1 a1_new INT NOT NULL;
SHOW CREATE TABLE child;
Table	Create Table
child	CREATE TABLE `child` (
  `a1_new` int NOT NULL,
  `a2_new` int DEFAULT NULL,
  `a3` int DEFAULT NULL,
  KEY `tb` (`a2_new`),
  KEY `fk_b` (`a1_new`),
  CONSTRAINT `fk_a` FOREIGN KEY (`a2_new`) REFERENCES `parent` (`b`) ON DELETE SET NULL ON UPDATE CASCADE,
  CONSTRAINT `fk_b` FOREIGN KEY (`a1_new`) REFERENCES `parent` (`a`)
) ENGINE=Dstore DEFAULT CHARSET=utf8mb4 COLLATE=utf8mb4_0900_ai_ci
ALTER TABLE child
ADD CONSTRAINT fk_new_1 FOREIGN KEY (a1_new) REFERENCES parent(b),
ADD CONSTRAINT fk_new_2 FOREIGN KEY (a2_new) REFERENCES parent(a),
ADD CONSTRAINT fk_new_3 FOREIGN KEY (a3) REFERENCES parent(c),
ALGORITHM = INPLACE;
ERROR HY000: Failed to add the foreign key constraint. Missing index for constraint 'fk_new_3' in the referenced table 'parent'
SHOW CREATE TABLE child;
Table	Create Table
child	CREATE TABLE `child` (
  `a1_new` int NOT NULL,
  `a2_new` int DEFAULT NULL,
  `a3` int DEFAULT NULL,
  KEY `tb` (`a2_new`),
  KEY `fk_b` (`a1_new`),
  CONSTRAINT `fk_a` FOREIGN KEY (`a2_new`) REFERENCES `parent` (`b`) ON DELETE SET NULL ON UPDATE CASCADE,
  CONSTRAINT `fk_b` FOREIGN KEY (`a1_new`) REFERENCES `parent` (`a`)
) ENGINE=Dstore DEFAULT CHARSET=utf8mb4 COLLATE=utf8mb4_0900_ai_ci
ALTER TABLE child
ADD CONSTRAINT fk_new_1 FOREIGN KEY (a1_new) REFERENCES parent(b),
ADD CONSTRAINT fk_new_2 FOREIGN KEY (a2_new) REFERENCES parent(a),
ADD CONSTRAINT fk_new_3 FOREIGN KEY (a3) REFERENCES parent(a),
ALGORITHM = INPLACE;
SHOW CREATE TABLE child;
Table	Create Table
child	CREATE TABLE `child` (
  `a1_new` int NOT NULL,
  `a2_new` int DEFAULT NULL,
  `a3` int DEFAULT NULL,
  KEY `tb` (`a2_new`),
  KEY `fk_new_1` (`a1_new`),
  KEY `fk_new_3` (`a3`),
  CONSTRAINT `fk_a` FOREIGN KEY (`a2_new`) REFERENCES `parent` (`b`) ON DELETE SET NULL ON UPDATE CASCADE,
  CONSTRAINT `fk_b` FOREIGN KEY (`a1_new`) REFERENCES `parent` (`a`),
  CONSTRAINT `fk_new_1` FOREIGN KEY (`a1_new`) REFERENCES `parent` (`b`),
  CONSTRAINT `fk_new_2` FOREIGN KEY (`a2_new`) REFERENCES `parent` (`a`),
  CONSTRAINT `fk_new_3` FOREIGN KEY (`a3`) REFERENCES `parent` (`a`)
) ENGINE=Dstore DEFAULT CHARSET=utf8mb4 COLLATE=utf8mb4_0900_ai_ci
DROP TABLE child;
CREATE TABLE child (a1 INT NOT NULL, a2 INT, a3 INT) ENGINE = dstore;
CREATE INDEX tb ON child(a2);
ALTER TABLE child ADD PRIMARY KEY idx (a1),
ADD CONSTRAINT fk_new_1 FOREIGN KEY (a1) REFERENCES parent(b),
ADD CONSTRAINT fk_new_2 FOREIGN KEY (a2) REFERENCES parent(a),
ADD CONSTRAINT fk_new_3 FOREIGN KEY (a3) REFERENCES parent(c),
ALGORITHM = INPLACE;
ERROR HY000: Failed to add the foreign key constraint. Missing index for constraint 'fk_new_3' in the referenced table 'parent'
SHOW CREATE TABLE child;
Table	Create Table
child	CREATE TABLE `child` (
  `a1` int NOT NULL,
  `a2` int DEFAULT NULL,
  `a3` int DEFAULT NULL,
  KEY `tb` (`a2`)
) ENGINE=Dstore DEFAULT CHARSET=utf8mb4 COLLATE=utf8mb4_0900_ai_ci
ALTER TABLE child ADD PRIMARY KEY idx (a1),
ADD CONSTRAINT fk_new_1 FOREIGN KEY (a1) REFERENCES parent(b),
ADD CONSTRAINT fk_new_2 FOREIGN KEY (a2) REFERENCES parent(a),
ADD CONSTRAINT fk_new_3 FOREIGN KEY (a3) REFERENCES parent(a),
ALGORITHM = INPLACE;
SHOW CREATE TABLE child;
Table	Create Table
child	CREATE TABLE `child` (
  `a1` int NOT NULL,
  `a2` int DEFAULT NULL,
  `a3` int DEFAULT NULL,
  PRIMARY KEY (`a1`),
  KEY `tb` (`a2`),
  KEY `fk_new_3` (`a3`),
  CONSTRAINT `fk_new_1` FOREIGN KEY (`a1`) REFERENCES `parent` (`b`),
  CONSTRAINT `fk_new_2` FOREIGN KEY (`a2`) REFERENCES `parent` (`a`),
  CONSTRAINT `fk_new_3` FOREIGN KEY (`a3`) REFERENCES `parent` (`a`)
) ENGINE=Dstore DEFAULT CHARSET=utf8mb4 COLLATE=utf8mb4_0900_ai_ci
SET foreign_key_checks = 1;
DROP TABLE child;
DROP TABLE parent;
CREATE TABLE Parent (a INT PRIMARY KEY, b INT NOT NULL) ENGINE = dstore;
INSERT INTO Parent VALUES(1,2),(2,3);
CREATE INDEX tb ON Parent(b);
INSERT INTO Parent VALUES(10,20),(20,30);
CREATE TABLE Child (a1 INT PRIMARY KEY, a2 INT) ENGINE = dstore;
CREATE INDEX tb ON Child(a2);
INSERT INTO Child VALUES(10,20);
SET foreign_key_checks = 0;
ALTER TABLE Child ADD CONSTRAINT fk_1 FOREIGN KEY (a2)
REFERENCES Parent(b) ON DELETE SET NULL ON UPDATE CASCADE,
ALGORITHM = INPLACE;
DROP TABLE Child;
DROP TABLE Parent;
CREATE TABLE `t2`(a int,c int,d int) ENGINE=dstore;
CREATE TABLE `t3`(a int,c int,d int) ENGINE=dstore;
CREATE INDEX idx ON t3(a);
ALTER TABLE `t2` ADD CONSTRAINT `fw` FOREIGN KEY (`c`) REFERENCES t3 (a);
ALTER TABLE `t2` ADD CONSTRAINT `e` foreign key (`d`) REFERENCES t3(a);
ALTER TABLE `t3` ADD CONSTRAINT `e` foreign key (`c`) REFERENCES `t2`(`c`) ON UPDATE SET NULL;
ERROR HY000: Duplicate foreign key constraint name 'e'
DROP TABLE t2;
DROP TABLE t3;
# Bug #17449901	 TABLE DISAPPEARS WHEN ALTERING
# WITH FOREIGN KEY CHECKS OFF
create table t1(f1 int,primary key(f1))engine=dstore;
create table t2(f2 int,f3 int,key t(f2,f3),foreign key(f2) references t1(f1))engine=dstore;
SET foreign_key_checks=0;
drop index t on t2;
ERROR HY000: Cannot drop index 't': needed in a foreign key constraint
drop table t2;
drop table t1;
create table t1(f1 int ,primary key(f1))engine=dstore;
create table t2(f2 int,f3 int, key t(f2),foreign key(f2) references t1(f1))engine=dstore;
SET foreign_key_checks = 0;
alter table t2 drop key t,algorithm=inplace;
ERROR HY000: Cannot drop index 't': needed in a foreign key constraint
show create table t2;
Table	Create Table
t2	CREATE TABLE `t2` (
  `f2` int DEFAULT NULL,
  `f3` int DEFAULT NULL,
  KEY `t` (`f2`),
  CONSTRAINT `t2_fk_1` FOREIGN KEY (`f2`) REFERENCES `t1` (`f1`)
) ENGINE=Dstore DEFAULT CHARSET=utf8mb4 COLLATE=utf8mb4_0900_ai_ci
drop table t2;
drop table t1;
create table t1(f1 int ,primary key(f1))engine=dstore;
create table t2(f2 int,f3 int, key t(f2),key t1(f2,f3),
foreign key(f2) references t1(f1))engine=dstore;
SET foreign_key_checks = 0;
alter table t2 drop key t,algorithm=inplace;
show create table t2;
Table	Create Table
t2	CREATE TABLE `t2` (
  `f2` int DEFAULT NULL,
  `f3` int DEFAULT NULL,
  KEY `t1` (`f2`,`f3`),
  CONSTRAINT `t2_fk_1` FOREIGN KEY (`f2`) REFERENCES `t1` (`f1`)
) ENGINE=Dstore DEFAULT CHARSET=utf8mb4 COLLATE=utf8mb4_0900_ai_ci
drop table t2;
drop table t1;
CREATE TABLE parent (a INT PRIMARY KEY, b INT) ENGINE = dstore;
INSERT INTO parent VALUES(1,2),(2,3);
CREATE INDEX tb ON parent(b);
CREATE TABLE child (a1 INT PRIMARY KEY, a2 INT) ENGINE = dstore;
INSERT INTO child VALUES(1,2),(2,3);
SET foreign_key_checks = 0;
ALTER TABLE child ADD CONSTRAINT fk_1 FOREIGN KEY (a2)
REFERENCES parent(b) ON DELETE SET NULL ON UPDATE SET NULL,
ALGORITHM = INPLACE;
SET foreign_key_checks = 1;
delete from parent where b=2;
select * from child;
a1	a2
1	NULL
2	3
drop table child,parent;
create table t1(f1 int , f2 int, f3 int)engine=dstore;
CREATE INDEX t1f1 ON t1(f1);
CREATE INDEX t1f2 ON t1(f2);
create table t2(f1 int, f2 int, f3 int)engine=dstore;
CREATE INDEX t2f1 ON t2(f1);
CREATE INDEX t2f2 ON t2(f2);
SET foreign_key_checks = 0;
ALTER TABLE t2 ADD CONSTRAINT fk_1 FOREIGN KEY (f1)
REFERENCES t1(f1) ON DELETE SET NULL ON UPDATE SET NULL,
ALGORITHM = INPLACE;
alter table t2 drop foreign key fk_1, add CONSTRAINT fk_2 FOREIGN KEY (f2)
REFERENCES t1(f2) ON DELETE SET NULL ON UPDATE SET NULL, add CONSTRAINT fk_3 FOREIGN KEY (f3)
REFERENCES t1(f3) ON DELETE SET NULL ON UPDATE SET NULL,ALGORITHM = INPLACE;
ERROR HY000: Failed to add the foreign key constraint. Missing index for constraint 'fk_3' in the referenced table 't1'
drop table t2;
drop table t1;
create table t1(f1 int , f2 int, f3 int)engine=dstore;
CREATE INDEX t1f1 ON t1(f1);
create table t2(f1 int, f2 int, f3 int)engine=dstore;
CREATE INDEX t2f1 ON t2(f1);
CREATE INDEX t2f2 ON t2(f2,f3);
insert into t2 values (1,1,1);
insert into t2 values (1,2,2);
SET foreign_key_checks = 0;
ALTER TABLE t2 ADD CONSTRAINT fk_1 FOREIGN KEY (f1)
REFERENCES t1(f1) ON DELETE SET NULL ON UPDATE SET NULL,
ADD UNIQUE INDEX(f1),ALGORITHM = INPLACE;
ERROR 23000: Duplicate entry '1' for key 't2.f1'
drop table t2;
drop table t1;
SET @@foreign_key_checks= 0;
CREATE TABLE t1(a INT PRIMARY KEY, b INT, FOREIGN KEY (b) REFERENCES non(a));
SET DEBUG = '+d,dstore_inplace_alter_database_is_nullptr';
ALTER TABLE t1 ADD FOREIGN KEY (b) REFERENCES non(a);
SET DEBUG = '-d,dstore_inplace_alter_database_is_nullptr';
DROP TABLE t1;
# Bug #BUG2026012754803	 crashes after enabling the table recycle bin.
# WITH rds_recycle_bin_mode ON
SET rds_recycle_bin_mode = ON;
CREATE TABLE parent (a INT PRIMARY KEY, b INT NOT NULL, c INT) ENGINE = dstore;
INSERT INTO parent VALUES(1,2,3),(2,3,4);
CREATE INDEX tb ON parent(b);
CREATE TABLE child (a1 INT NOT NULL, a2 INT, a3 INT) ENGINE = dstore;
CREATE INDEX tb ON child(a2);
ALTER TABLE child
ADD CONSTRAINT fk_a FOREIGN KEY (a2) REFERENCES parent(b)
ON DELETE SET NULL ON UPDATE CASCADE,
ALGORITHM = INPLACE;
ALTER TABLE child
ADD CONSTRAINT fk_b FOREIGN KEY (a1) REFERENCES parent(a),
ALGORITHM = INPLACE;
DROP TABLE child;
CREATE TABLE child (a1 INT NOT NULL, a2 INT, a3 INT) ENGINE = dstore;
CREATE INDEX tb ON child(a2);
ALTER TABLE child ADD PRIMARY KEY idx (a1),
ADD CONSTRAINT fk_new_1 FOREIGN KEY (a1) REFERENCES parent(b),
ADD CONSTRAINT fk_new_2 FOREIGN KEY (a2) REFERENCES parent(a),
ADD CONSTRAINT fk_new_3 FOREIGN KEY (a3) REFERENCES parent(a),
ALGORITHM = INPLACE;
DROP TABLE child;
DROP TABLE parent;
SET rds_recycle_bin_mode = OFF;
