SET @saved_binlog_format= @@SESSION.binlog_format;
Warnings:
Warning	1287	'@@binlog_format' is deprecated and will be removed in a future release.
drop table if exists t_34455;
create table t_34455 (
a int not null,
foreign key (a) references t3 (a) match full match partial);
ERROR 42000: You have an error in your SQL syntax; check the manual that corresponds to your MySQL server version for the right syntax to use near 'match partial)' at line 3
create table t_34455 (
a int not null,
foreign key (a) references t3 (a) on delete set default match full);
ERROR 42000: You have an error in your SQL syntax; check the manual that corresponds to your MySQL server version for the right syntax to use near 'match full)' at line 3
create table t_34455 (
a int not null,
foreign key (a) references t3 (a) on update set default match full);
ERROR 42000: You have an error in your SQL syntax; check the manual that corresponds to your MySQL server version for the right syntax to use near 'match full)' at line 3
create table t_34455 (
a int not null,
foreign key (a) references t3 (a)
on delete set default on delete set default);
ERROR 42000: You have an error in your SQL syntax; check the manual that corresponds to your MySQL server version for the right syntax to use near 'delete set default)' at line 4
create table t_34455 (
a int not null,
foreign key (a) references t3 (a)
on update set default on update set default);
ERROR 42000: You have an error in your SQL syntax; check the manual that corresponds to your MySQL server version for the right syntax to use near 'update set default)' at line 4
create table t_34455 (a int not null);
alter table t_34455
add foreign key (a) references t3 (a) match full match partial);
ERROR 42000: You have an error in your SQL syntax; check the manual that corresponds to your MySQL server version for the right syntax to use near 'match partial)' at line 2
alter table t_34455
add foreign key (a) references t3 (a) on delete set default match full);
ERROR 42000: You have an error in your SQL syntax; check the manual that corresponds to your MySQL server version for the right syntax to use near 'match full)' at line 2
alter table t_34455
add foreign key (a) references t3 (a) on update set default match full);
ERROR 42000: You have an error in your SQL syntax; check the manual that corresponds to your MySQL server version for the right syntax to use near 'match full)' at line 2
alter table t_34455
add foreign key (a) references t3 (a)
on delete set default on delete set default);
ERROR 42000: You have an error in your SQL syntax; check the manual that corresponds to your MySQL server version for the right syntax to use near 'delete set default)' at line 3
alter table t_34455
add foreign key (a) references t3 (a)
on update set default on update set default);
ERROR 42000: You have an error in your SQL syntax; check the manual that corresponds to your MySQL server version for the right syntax to use near 'update set default)' at line 3
drop table t_34455;
#
# WL#6929: Move FOREIGN KEY constraints to the global data dictionary
#
# Extra coverage of @@foreign_key_checks
#
SET @@foreign_key_checks= 0;
CREATE TABLE t1(a INT PRIMARY KEY, b INT, FOREIGN KEY (b) REFERENCES non(a));
ALTER TABLE t1 ADD FOREIGN KEY (b) REFERENCES non(a);
DROP TABLE t1;
CREATE TABLE t1(a INT PRIMARY KEY);
CREATE TABLE t2(a INT PRIMARY KEY, b INT, FOREIGN KEY (b) REFERENCES t1(a));
DROP TABLE t1;
DROP TABLE t2;
SET @@foreign_key_checks= 1;
CREATE TABLE t1(a INT PRIMARY KEY, b INT, FOREIGN KEY (b) REFERENCES non(a));
ERROR HY000: Failed to open the referenced table 'non'
CREATE TABLE t1(a INT PRIMARY KEY, b INT REFERENCES non(a));
SHOW CREATE TABLE t1;
Table	Create Table
t1	CREATE TABLE `t1` (
  `a` int NOT NULL,
  `b` int DEFAULT NULL,
  PRIMARY KEY (`a`)
) ENGINE=Dstore DEFAULT CHARSET=utf8mb4 COLLATE=utf8mb4_0900_ai_ci
ALTER TABLE t1 ADD FOREIGN KEY (b) REFERENCES non(a);
ERROR HY000: Failed to open the referenced table 'non'
DROP TABLE t1;
CREATE TABLE t1(a INT PRIMARY KEY);
CREATE TABLE t2(a INT PRIMARY KEY, b INT, FOREIGN KEY (b) REFERENCES t1(a));
DROP TABLE t1;
ERROR HY000: Cannot drop table 't1' referenced by a foreign key constraint 't2_fk_1' on table 't2'.
DROP TABLE t2, t1;
SET @@foreign_key_checks= DEFAULT;
# Test coverage of identifier length related to foreign keys.
#
CREATE TABLE t1(a INT PRIMARY KEY);
CREATE TABLE t2(a INT PRIMARY KEY, b INT);
ALTER TABLE t2 ADD CONSTRAINT
name567890123456789012345678901234567890123456789012345678901234
FOREIGN KEY
name567890123456789012345678901234567890123456789012345678901234
(b) REFERENCES t1(a);
SHOW CREATE TABLE t2;
Table	Create Table
t2	CREATE TABLE `t2` (
  `a` int NOT NULL,
  `b` int DEFAULT NULL,
  PRIMARY KEY (`a`),
  KEY `name567890123456789012345678901234567890123456789012345678901234` (`b`),
  CONSTRAINT `name567890123456789012345678901234567890123456789012345678901234` FOREIGN KEY (`b`) REFERENCES `t1` (`a`)
) ENGINE=Dstore DEFAULT CHARSET=utf8mb4 COLLATE=utf8mb4_0900_ai_ci
SELECT CONSTRAINT_NAME FROM INFORMATION_SCHEMA.KEY_COLUMN_USAGE WHERE REFERENCED_TABLE_NAME = 't1';
CONSTRAINT_NAME
name567890123456789012345678901234567890123456789012345678901234
DROP TABLE t2;
CREATE TABLE t2(a INT PRIMARY KEY, b INT);
ALTER TABLE t2 ADD FOREIGN KEY
name5678901234567890123456789012345678901234567890123456789012345
(b) REFERENCES t1(a);
ERROR 42000: Identifier name 'name5678901234567890123456789012345678901234567890123456789012345' is too long
ALTER TABLE t2 ADD CONSTRAINT
name5678901234567890123456789012345678901234567890123456789012345
FOREIGN KEY (b) REFERENCES t1(a);
ERROR 42000: Identifier name 'name5678901234567890123456789012345678901234567890123456789012345' is too long
DROP TABLE t2;
CREATE TABLE t2(a INT PRIMARY KEY, b INT UNIQUE);
ALTER TABLE t2 ADD FOREIGN KEY
name5678901234567890123456789012345678901234567890123456789012345
(b) REFERENCES t1(a);
ERROR 42000: Identifier name 'name5678901234567890123456789012345678901234567890123456789012345' is too long
ALTER TABLE t2 ADD CONSTRAINT
name5678901234567890123456789012345678901234567890123456789012345
FOREIGN KEY (b) REFERENCES t1(a);
ERROR 42000: Identifier name 'name5678901234567890123456789012345678901234567890123456789012345' is too long
DROP TABLE t2;
DROP TABLE t1;
CREATE TABLE t1(a INT PRIMARY KEY, b INT,
FOREIGN KEY(b) REFERENCES name5678901234567890123456789012345678901234567890123456789012345.t2(a));
ERROR 42000: Identifier name 'name5678901234567890123456789012345678901234567890123456789012345' is too long
CREATE TABLE t1(a INT PRIMARY KEY, b INT,
FOREIGN KEY(b) REFERENCES name5678901234567890123456789012345678901234567890123456789012345(a));
ERROR 42000: Incorrect table name 'name5678901234567890123456789012345678901234567890123456789012345'
CREATE TABLE t1(a INT PRIMARY KEY, b INT,
FOREIGN KEY(b) REFERENCES t2(name5678901234567890123456789012345678901234567890123456789012345));
ERROR 42000: Incorrect column name 'name5678901234567890123456789012345678901234567890123456789012345'
SET @@foreign_key_checks= 0;
CREATE TABLE t1(a INT PRIMARY KEY, b INT,
FOREIGN KEY(b) REFERENCES name5678901234567890123456789012345678901234567890123456789012345.t2(a));
ERROR 42000: Identifier name 'name5678901234567890123456789012345678901234567890123456789012345' is too long
CREATE TABLE t1(a INT PRIMARY KEY, b INT,
FOREIGN KEY(b) REFERENCES name5678901234567890123456789012345678901234567890123456789012345(a));
ERROR 42000: Incorrect table name 'name5678901234567890123456789012345678901234567890123456789012345'
CREATE TABLE t1(a INT PRIMARY KEY, b INT,
FOREIGN KEY(b) REFERENCES t2(name5678901234567890123456789012345678901234567890123456789012345));
ERROR 42000: Incorrect column name 'name5678901234567890123456789012345678901234567890123456789012345'
SET @@foreign_key_checks= DEFAULT;
#
# Bug#24666169: I_S.TABLE_CONSTRAINTS.CONSTRAINT_NAME IS NOT UPDATED
#               AFTER RENAME TABLE
#
SET @@foreign_key_checks= 1;
#
# Tests for FK name behavior.
CREATE TABLE t1(c1 INT PRIMARY KEY);
CREATE TABLE t2(c1 INT, FOREIGN KEY (c1) REFERENCES t1(c1));
ALTER TABLE t2 RENAME TO t3;
SHOW CREATE TABLE t3;
Table	Create Table
t3	CREATE TABLE `t3` (
  `c1` int DEFAULT NULL,
  KEY `c1` (`c1`),
  CONSTRAINT `t3_fk_1` FOREIGN KEY (`c1`) REFERENCES `t1` (`c1`)
) ENGINE=Dstore DEFAULT CHARSET=utf8mb4 COLLATE=utf8mb4_0900_ai_ci
INSERT INTO t3 VALUES(1);
ERROR 23000: Cannot add or update a child row: a foreign key constraint fails (`test`.`t3`, CONSTRAINT `t3_fk_1` FOREIGN KEY (`c1`) REFERENCES `t1` (`c1`))
ALTER TABLE t3 RENAME TO t4, ALGORITHM= INPLACE;
SHOW CREATE TABLE t4;
Table	Create Table
t4	CREATE TABLE `t4` (
  `c1` int DEFAULT NULL,
  KEY `c1` (`c1`),
  CONSTRAINT `t4_fk_1` FOREIGN KEY (`c1`) REFERENCES `t1` (`c1`)
) ENGINE=Dstore DEFAULT CHARSET=utf8mb4 COLLATE=utf8mb4_0900_ai_ci
INSERT INTO t4 VALUES(1);
ERROR 23000: Cannot add or update a child row: a foreign key constraint fails (`test`.`t4`, CONSTRAINT `t4_fk_1` FOREIGN KEY (`c1`) REFERENCES `t1` (`c1`))
ALTER TABLE t4 RENAME TO t5;
SHOW CREATE TABLE t5;
Table	Create Table
t5	CREATE TABLE `t5` (
  `c1` int DEFAULT NULL,
  KEY `c1` (`c1`),
  CONSTRAINT `t5_fk_1` FOREIGN KEY (`c1`) REFERENCES `t1` (`c1`)
) ENGINE=Dstore DEFAULT CHARSET=utf8mb4 COLLATE=utf8mb4_0900_ai_ci
INSERT INTO t5 VALUES(1);
ERROR 23000: Cannot add or update a child row: a foreign key constraint fails (`test`.`t5`, CONSTRAINT `t5_fk_1` FOREIGN KEY (`c1`) REFERENCES `t1` (`c1`))
RENAME TABLE t5 to t6;
SHOW CREATE TABLE t6;
Table	Create Table
t6	CREATE TABLE `t6` (
  `c1` int DEFAULT NULL,
  KEY `c1` (`c1`),
  CONSTRAINT `t6_fk_1` FOREIGN KEY (`c1`) REFERENCES `t1` (`c1`)
) ENGINE=Dstore DEFAULT CHARSET=utf8mb4 COLLATE=utf8mb4_0900_ai_ci
INSERT INTO t6 VALUES(1);
ERROR 23000: Cannot add or update a child row: a foreign key constraint fails (`test`.`t6`, CONSTRAINT `t6_fk_1` FOREIGN KEY (`c1`) REFERENCES `t1` (`c1`))
DROP TABLE t6, t1;
#
# Tests of FK name generation
CREATE TABLE t1(a INT PRIMARY KEY);
CREATE TABLE t2(a INT, b INT, FOREIGN KEY(a) REFERENCES t1(a));
SELECT constraint_name FROM information_schema.referential_constraints
WHERE table_name = 't2' ORDER BY constraint_name;
CONSTRAINT_NAME
t2_fk_1
SELECT constraint_name FROM information_schema.table_constraints
WHERE table_name = 't2' ORDER BY constraint_name;
CONSTRAINT_NAME
t2_fk_1
# Add FK
ALTER TABLE t2 ADD FOREIGN KEY(b) REFERENCES t1(a);
SELECT constraint_name FROM information_schema.referential_constraints
WHERE table_name = 't2' ORDER BY constraint_name;
CONSTRAINT_NAME
t2_fk_1
t2_fk_2
SELECT constraint_name FROM information_schema.table_constraints
WHERE table_name = 't2' ORDER BY constraint_name;
CONSTRAINT_NAME
t2_fk_1
t2_fk_2
# Remove first FK and add a new FK.
ALTER TABLE t2 DROP FOREIGN KEY t2_fk_1;
ALTER TABLE t2 ADD FOREIGN KEY(a) REFERENCES t1(a);
SELECT constraint_name FROM information_schema.referential_constraints
WHERE table_name = 't2' ORDER BY constraint_name;
CONSTRAINT_NAME
t2_fk_2
t2_fk_3
SELECT constraint_name FROM information_schema.table_constraints
WHERE table_name = 't2' ORDER BY constraint_name;
CONSTRAINT_NAME
t2_fk_2
t2_fk_3
# Rename table in different ways.
ALTER TABLE t2 RENAME TO t3;
SELECT constraint_name FROM information_schema.referential_constraints
WHERE table_name = 't3' ORDER BY constraint_name;
CONSTRAINT_NAME
t3_fk_2
t3_fk_3
SELECT constraint_name FROM information_schema.table_constraints
WHERE table_name = 't3' ORDER BY constraint_name;
CONSTRAINT_NAME
t3_fk_2
t3_fk_3
ALTER TABLE t3 RENAME TO t4, ALGORITHM= INPLACE;
SELECT constraint_name FROM information_schema.referential_constraints
WHERE table_name = 't4' ORDER BY constraint_name;
CONSTRAINT_NAME
t4_fk_2
t4_fk_3
SELECT constraint_name FROM information_schema.table_constraints
WHERE table_name = 't4' ORDER BY constraint_name;
CONSTRAINT_NAME
t4_fk_2
t4_fk_3
ALTER TABLE t4 RENAME TO t5;
SELECT constraint_name FROM information_schema.referential_constraints
WHERE table_name = 't5' ORDER BY constraint_name;
CONSTRAINT_NAME
t5_fk_2
t5_fk_3
SELECT constraint_name FROM information_schema.table_constraints
WHERE table_name = 't5' ORDER BY constraint_name;
CONSTRAINT_NAME
t5_fk_2
t5_fk_3
RENAME TABLE t5 TO t6;
SELECT constraint_name FROM information_schema.referential_constraints
WHERE table_name = 't6' ORDER BY constraint_name;
CONSTRAINT_NAME
t6_fk_2
t6_fk_3
SELECT constraint_name FROM information_schema.table_constraints
WHERE table_name = 't6' ORDER BY constraint_name;
CONSTRAINT_NAME
t6_fk_2
t6_fk_3
# Simulate dump+restore and test rename
DROP TABLE t6;
CREATE TABLE `t6` (
`a` int(11) DEFAULT NULL,
`b` int(11) DEFAULT NULL,
KEY `b` (`b`),
KEY `a` (`a`),
CONSTRAINT `t6_fk_2` FOREIGN KEY (`b`) REFERENCES `t1` (`a`),
CONSTRAINT `t6_fk_3` FOREIGN KEY (`a`) REFERENCES `t1` (`a`)
) ENGINE=Dstore DEFAULT CHARSET=latin1;
Warnings:
Warning	1681	Integer display width is deprecated and will be removed in a future release.
Warning	1681	Integer display width is deprecated and will be removed in a future release.
SELECT constraint_name FROM information_schema.referential_constraints
WHERE table_name = 't6' ORDER BY constraint_name;
CONSTRAINT_NAME
t6_fk_2
t6_fk_3
SELECT constraint_name FROM information_schema.table_constraints
WHERE table_name = 't6' ORDER BY constraint_name;
CONSTRAINT_NAME
t6_fk_2
t6_fk_3
RENAME TABLE t6 TO t2;
SELECT constraint_name FROM information_schema.referential_constraints
WHERE table_name = 't2' ORDER BY constraint_name;
CONSTRAINT_NAME
t2_fk_2
t2_fk_3
SELECT constraint_name FROM information_schema.table_constraints
WHERE table_name = 't2' ORDER BY constraint_name;
CONSTRAINT_NAME
t2_fk_2
t2_fk_3
# Remove all FKs and add one back
ALTER TABLE t2 DROP FOREIGN KEY t2_fk_2, DROP FOREIGN KEY t2_fk_3;
ALTER TABLE t2 ADD FOREIGN KEY(a) REFERENCES t1(a);
SELECT constraint_name FROM information_schema.referential_constraints
WHERE table_name = 't2' ORDER BY constraint_name;
CONSTRAINT_NAME
t2_fk_1
SELECT constraint_name FROM information_schema.table_constraints
WHERE table_name = 't2' ORDER BY constraint_name;
CONSTRAINT_NAME
t2_fk_1
# Add a foreign key with close to generated name
ALTER TABLE t2 ADD CONSTRAINT t3_fk_2 FOREIGN KEY(b) REFERENCES t1(a);
SELECT constraint_name FROM information_schema.referential_constraints
WHERE table_name = 't2' ORDER BY constraint_name;
CONSTRAINT_NAME
t2_fk_1
t3_fk_2
SELECT constraint_name FROM information_schema.table_constraints
WHERE table_name = 't2' ORDER BY constraint_name;
CONSTRAINT_NAME
t2_fk_1
t3_fk_2
# Then rename so that the given name now matches a generated name
RENAME TABLE t2 TO t3;
SELECT constraint_name FROM information_schema.referential_constraints
WHERE table_name = 't3' ORDER BY constraint_name;
CONSTRAINT_NAME
t3_fk_1
t3_fk_2
SELECT constraint_name FROM information_schema.table_constraints
WHERE table_name = 't3' ORDER BY constraint_name;
CONSTRAINT_NAME
t3_fk_1
t3_fk_2
# Finally rename it again. The given name is now seen as generated and renamed.
RENAME TABLE t3 TO t4;
SELECT constraint_name FROM information_schema.referential_constraints
WHERE table_name = 't4' ORDER BY constraint_name;
CONSTRAINT_NAME
t4_fk_1
t4_fk_2
SELECT constraint_name FROM information_schema.table_constraints
WHERE table_name = 't4' ORDER BY constraint_name;
CONSTRAINT_NAME
t4_fk_1
t4_fk_2
DROP TABLE t4;
# Make a foreign key with given name matching a generated name
CREATE TABLE t2(a INT, b INT);
ALTER TABLE t2 ADD CONSTRAINT t2_fk_1 FOREIGN KEY(a) REFERENCES t1(a);
ALTER TABLE t2 ADD FOREIGN KEY(b) REFERENCES t1(a);
SELECT constraint_name FROM information_schema.referential_constraints
WHERE table_name = 't2' ORDER BY constraint_name;
CONSTRAINT_NAME
t2_fk_1
t2_fk_2
SELECT constraint_name FROM information_schema.table_constraints
WHERE table_name = 't2' ORDER BY constraint_name;
CONSTRAINT_NAME
t2_fk_1
t2_fk_2
DROP TABLE t2;
# Test FK name case sensitivity
CREATE TABLE t2(a INT, b INT);
ALTER TABLE t2 ADD CONSTRAINT FK FOREIGN KEY(a) REFERENCES t1(a);
SELECT constraint_name FROM information_schema.referential_constraints
WHERE table_name = 't2' ORDER BY constraint_name;
CONSTRAINT_NAME
FK
SELECT constraint_name FROM information_schema.table_constraints
WHERE table_name = 't2' ORDER BY constraint_name;
CONSTRAINT_NAME
FK
ALTER TABLE t2 ADD CONSTRAINT fk FOREIGN KEY(b) REFERENCES t1(a);
ERROR 42000: Duplicate key name 'fk'
ALTER TABLE t2 DROP FOREIGN KEY FK;
# Name matching generated name, but different case.
ALTER TABLE t2 ADD CONSTRAINT T2_FK_1 FOREIGN KEY(a) REFERENCES t1(a);
ALTER TABLE t2 ADD FOREIGN KEY(b) REFERENCES t1(a);
ERROR HY000: Duplicate foreign key constraint name 't2_fk_1'
ALTER TABLE t2 DROP FOREIGN KEY T2_FK_1;
DROP TABLE t2;
# Check long FK generated names due to long table names.
CREATE TABLE t2 (a INT, FOREIGN KEY (a) REFERENCES t1(a));
RENAME TABLE t2 TO t12345678901234567890123456789012345678901234567890123456;
SELECT constraint_name FROM information_schema.referential_constraints
WHERE table_name = 't12345678901234567890123456789012345678901234567890123456'
  ORDER BY constraint_name;
CONSTRAINT_NAME
t12345678901234567890123456789012345678901234567890123456_fk_1
SELECT constraint_name FROM information_schema.table_constraints
WHERE table_name = 't12345678901234567890123456789012345678901234567890123456'
  ORDER BY constraint_name;
CONSTRAINT_NAME
t12345678901234567890123456789012345678901234567890123456_fk_1
DROP TABLE t12345678901234567890123456789012345678901234567890123456;
CREATE TABLE t123456789012345678901234567890123456789012345678901234567890123(
a INT, CONSTRAINT fk FOREIGN KEY (a) REFERENCES t1(a));
DROP TABLE t123456789012345678901234567890123456789012345678901234567890123;
DROP TABLE t1;
# FK Referencing virtual column
CREATE TABLE t1(a INT PRIMARY KEY,
b INT GENERATED ALWAYS AS (a+1) VIRTUAL UNIQUE);
CREATE TABLE t2(a INT, FOREIGN KEY (a) REFERENCES t1(b));
ERROR HY000: Foreign key 't2_fk_1' uses virtual column 'b' which is not supported.
CREATE TABLE t2(a INT);
ALTER TABLE t2 ADD FOREIGN KEY(a) REFERENCES t1(b);
ERROR HY000: Foreign key 't2_fk_1' uses virtual column 'b' which is not supported.
DROP TABLE t1, t2;
# FK on generated stored column
CREATE TABLE t1(a INT PRIMARY KEY);
CREATE TABLE t2(a INT, b INT GENERATED ALWAYS AS (a+1) STORED UNIQUE);
CREATE TABLE t3(a INT, b INT GENERATED ALWAYS AS (a+1) STORED UNIQUE,
FOREIGN KEY (b) REFERENCES t1(a));
ALTER TABLE t2 ADD FOREIGN KEY(b) REFERENCES t1(a);
ALTER TABLE t2 DROP FOREIGN KEY t2_fk_1;
DROP TABLE t3;
CREATE TABLE t3(a INT, b INT GENERATED ALWAYS AS (a+1) STORED UNIQUE,
FOREIGN KEY (b) REFERENCES t1(a) ON UPDATE CASCADE);
ERROR HY000: Cannot define foreign key with ON UPDATE CASCADE clause on a generated column.
ALTER TABLE t2 ADD FOREIGN KEY(b) REFERENCES t1(a) ON UPDATE CASCADE;
ERROR HY000: Cannot define foreign key with ON UPDATE CASCADE clause on a generated column.
CREATE TABLE t3(a INT, b INT GENERATED ALWAYS AS (a+1) STORED UNIQUE,
FOREIGN KEY (b) REFERENCES t1(a) ON DELETE SET NULL);
ERROR HY000: Cannot define foreign key with ON DELETE SET NULL clause on a generated column.
ALTER TABLE t2 ADD FOREIGN KEY(b) REFERENCES t1(a) ON DELETE SET NULL;
ERROR HY000: Cannot define foreign key with ON DELETE SET NULL clause on a generated column.
CREATE TABLE t3(a INT, b INT GENERATED ALWAYS AS (a+1) STORED UNIQUE,
FOREIGN KEY (b) REFERENCES t1(a) ON UPDATE SET NULL);
ERROR HY000: Cannot define foreign key with ON UPDATE SET NULL clause on a generated column.
ALTER TABLE t2 ADD FOREIGN KEY(b) REFERENCES t1(a) ON UPDATE SET NULL;
ERROR HY000: Cannot define foreign key with ON UPDATE SET NULL clause on a generated column.
# FK on Base column of generated stored column.
CREATE TABLE t3(a INT, b INT GENERATED ALWAYS AS (a+1) STORED UNIQUE,
FOREIGN KEY (a) REFERENCES t1(a));
ALTER TABLE t2 ADD FOREIGN KEY(a) REFERENCES t1(a);
ALTER TABLE t2 DROP FOREIGN KEY t2_fk_1;
DROP TABLE t3;
CREATE TABLE t3(a INT, b INT GENERATED ALWAYS AS (a+1) STORED UNIQUE,
FOREIGN KEY (a) REFERENCES t1(a) ON UPDATE CASCADE);
ERROR HY000: Cannot add foreign key constraint
ALTER TABLE t2 ADD FOREIGN KEY(a) REFERENCES t1(a) ON UPDATE CASCADE;
ERROR HY000: Cannot add foreign key constraint
CREATE TABLE t3(a INT, b INT GENERATED ALWAYS AS (a+1) STORED UNIQUE,
FOREIGN KEY (a) REFERENCES t1(a) ON DELETE SET NULL);
ERROR HY000: Cannot add foreign key constraint
ALTER TABLE t2 ADD FOREIGN KEY(a) REFERENCES t1(a) ON DELETE SET NULL;
ERROR HY000: Cannot add foreign key constraint
CREATE TABLE t3(a INT, b INT GENERATED ALWAYS AS (a+1) STORED UNIQUE,
FOREIGN KEY (a) REFERENCES t1(a) ON UPDATE SET NULL);
ERROR HY000: Cannot add foreign key constraint
ALTER TABLE t2 ADD FOREIGN KEY(a) REFERENCES t1(a) ON UPDATE SET NULL;
ERROR HY000: Cannot add foreign key constraint
DROP TABLE t2, t1;
# FK on virtual column not supported.
CREATE TABLE t1(a INT PRIMARY KEY);
CREATE TABLE t2(a INT, b INT GENERATED ALWAYS AS (a+1) VIRTUAL UNIQUE,
FOREIGN KEY(b) REFERENCES t1(a));
ERROR HY000: Foreign key 't2_fk_1' uses virtual column 'b' which is not supported.
CREATE TABLE t2(a INT, b INT GENERATED ALWAYS AS (a+1) VIRTUAL UNIQUE);
ALTER TABLE t2 ADD FOREIGN KEY (b) REFERENCES t1(a);
ERROR HY000: Foreign key 't2_fk_1' uses virtual column 'b' which is not supported.
DROP TABLE t2;
CREATE TABLE t2(a INT, b INT, FOREIGN KEY(b) REFERENCES t1(a));
ALTER TABLE t2 MODIFY COLUMN b INT GENERATED ALWAYS AS (a+1) VIRTUAL;
ERROR HY000: 'Changing the STORED status' is not supported for generated columns.
DROP TABLE t2, t1;
# Trying to drop columns used in multi-column FKs.
CREATE TABLE t1(a INT PRIMARY KEY, b INT, INDEX(a, b));
CREATE TABLE t2(a INT, b INT, FOREIGN KEY(a, b) REFERENCES t1(a, b));
ALTER TABLE t2 DROP COLUMN a;
ERROR HY000: Cannot drop column 'a': needed in a foreign key constraint 't2_fk_1'
ALTER TABLE t2 DROP COLUMN b;
ERROR HY000: Cannot drop column 'b': needed in a foreign key constraint 't2_fk_1'
DROP TABLE t2;
# Use explicitly named index to check where index name is != column name.
CREATE TABLE t2(a INT, b INT, INDEX idx(a, b),
FOREIGN KEY(a, b) REFERENCES t1(a, b));
ALTER TABLE t2 DROP COLUMN a;
ERROR HY000: Cannot drop column 'a': needed in a foreign key constraint 't2_fk_1'
ALTER TABLE t2 DROP COLUMN b;
ERROR HY000: Cannot drop column 'b': needed in a foreign key constraint 't2_fk_1'
DROP TABLE t2, t1;
# Index with prefix cannot be used for supporting FK.
CREATE TABLE t1 (PK VARCHAR(100) PRIMARY KEY);
CREATE TABLE t2 (FK VARCHAR(100), FOREIGN KEY(FK) REFERENCES t1 (PK), KEY(FK));
ALTER TABLE t2 DROP INDEX FK, ADD INDEX FK2(FK(10));
ERROR HY000: Cannot drop index 'FK': needed in a foreign key constraint
DROP TABLE t2, t1;
# Bug#25817660: Combination of virtual index, foreign key and trigger
#               result in assert failure
#
# Bug#20021917: WORK AROUND FOR CHARSET CONVERSION WITH FKS CAN
# RESULT IN WRONG DATA
#
CREATE TABLE t1 (id INT AUTO_INCREMENT PRIMARY KEY, name VARCHAR(100) UNIQUE);
CREATE TABLE t2 (id INT AUTO_INCREMENT PRIMARY KEY, name VARCHAR(100), fname VARCHAR(100), FOREIGN KEY (fname) REFERENCES t1 (name) ON UPDATE CASCADE ON DELETE CASCADE);
SHOW CREATE TABLE t1;
Table	Create Table
t1	CREATE TABLE `t1` (
  `id` int NOT NULL AUTO_INCREMENT,
  `name` varchar(100) DEFAULT NULL,
  PRIMARY KEY (`id`),
  UNIQUE KEY `name` (`name`)
) ENGINE=Dstore DEFAULT CHARSET=utf8mb4 COLLATE=utf8mb4_0900_ai_ci
SHOW CREATE TABLE t2;
Table	Create Table
t2	CREATE TABLE `t2` (
  `id` int NOT NULL AUTO_INCREMENT,
  `name` varchar(100) DEFAULT NULL,
  `fname` varchar(100) DEFAULT NULL,
  PRIMARY KEY (`id`),
  KEY `fname` (`fname`),
  CONSTRAINT `t2_fk_1` FOREIGN KEY (`fname`) REFERENCES `t1` (`name`) ON DELETE CASCADE ON UPDATE CASCADE
) ENGINE=Dstore DEFAULT CHARSET=utf8mb4 COLLATE=utf8mb4_0900_ai_ci
ALTER TABLE t2 CONVERT TO CHARACTER SET latin1;
ERROR HY000: Referencing column 'fname' and referenced column 'name' in foreign key constraint 't2_fk_1' are incompatible.
SET foreign_key_checks= OFF;
ALTER TABLE t2 CONVERT TO CHARACTER SET latin1;
SET foreign_key_checks= ON;
SHOW CREATE TABLE t1;
Table	Create Table
t1	CREATE TABLE `t1` (
  `id` int NOT NULL AUTO_INCREMENT,
  `name` varchar(100) DEFAULT NULL,
  PRIMARY KEY (`id`),
  UNIQUE KEY `name` (`name`)
) ENGINE=Dstore DEFAULT CHARSET=utf8mb4 COLLATE=utf8mb4_0900_ai_ci
SHOW CREATE TABLE t2;
Table	Create Table
t2	CREATE TABLE `t2` (
  `id` int NOT NULL AUTO_INCREMENT,
  `name` varchar(100) DEFAULT NULL,
  `fname` varchar(100) DEFAULT NULL,
  PRIMARY KEY (`id`),
  KEY `fname` (`fname`),
  CONSTRAINT `t2_fk_1` FOREIGN KEY (`fname`) REFERENCES `t1` (`name`) ON DELETE CASCADE ON UPDATE CASCADE
) ENGINE=Dstore DEFAULT CHARSET=latin1
INSERT INTO t1(name) VALUES ('test1');
INSERT INTO t2(name, fname) VALUES ('test1', 'test1');
UPDATE t1 SET name=CONCAT('St', UNHEX('C3A5') ,'le') WHERE name = 'test1';
# Should not get any rows here
SELECT t1.name, t2.fname FROM t1, t2 WHERE t1.name <> t2.fname;
name	fname
Ståle	StÃ¥le
DROP TABLE t2;
DROP TABLE t1;
#
# WL#6049: Meta-data locking for FOREIGN KEY tables
#
# Test case to check MDL on tables related by FK constraints.
#
CREATE TABLE grandparent (gpf1 INT PRIMARY KEY, gpf2 INT);
INSERT INTO grandparent VALUES (1,10), (2,20);
CREATE TABLE parent (
pf1 INT PRIMARY KEY, pf2 INT, sleep_dummy INT,
CONSTRAINT pc1 FOREIGN KEY (pf2) REFERENCES grandparent (gpf1)
ON DELETE NO ACTION ON UPDATE NO ACTION);
INSERT INTO parent VALUES (1,1,0), (2,2,0);
CREATE TABLE child (
cf1 INT PRIMARY KEY, cf2 INT,
CONSTRAINT cc1 FOREIGN KEY (cf2) REFERENCES parent (pf1)
ON DELETE NO ACTION ON UPDATE NO ACTION);
INSERT INTO child VALUES (1,1), (2,2);
connect  con_A,localhost,root,,test;
SET @@session.lock_wait_timeout= 1;
UPDATE parent SET pf2= 2, sleep_dummy= SLEEP(2);
connection default;
set @conA_id = <conA>;
# Waiting for connection A to start udpate
SET @@session.lock_wait_timeout= 1;
# Updates not invoving the FK related column should succeed
UPDATE grandparent SET gpf2= 4;
UPDATE grandparent SET gpf2= 100 * gpf1;
# DDL on child will have conflicting locks.
ALTER TABLE child ADD COLUMN (i INT);
ERROR HY000: Lock wait timeout exceeded; try restarting transaction
SET @@session.lock_wait_timeout= DEFAULT;
connection con_A;
disconnect con_A;
connection default;
DROP TABLE child;
DROP TABLE parent;
DROP TABLE grandparent;
#
# Systemic test coverage for metadata locks related to foreign
# keys acquired by various DDL statements.
#
# Also provides coverage for data-dictionary cache invalidation
# and cases when we fail to acquire necessary locks.
SET @old_lock_wait_timeout= @@lock_wait_timeout;
connect  con1, localhost, root,,;
connect  con2, localhost, root,,;
SET @old_lock_wait_timeout= @@lock_wait_timeout;
connection default;
#
# 1) CREATE TABLE
#
# 1.1) CREATE TABLE must acquire X lock on parent table
#      (if table doesn't exist).
CREATE TABLE parent (pk INT PRIMARY KEY);
connection con1;
BEGIN;
SELECT * FROM parent;
pk
connection default;
CREATE TABLE child (fk INT, FOREIGN KEY (fk) REFERENCES parent(pk));;
connection con1;
# Wait until CREATE TABLE is blocked by con1 and then resume it.
COMMIT;
connection default;
# Reap CREATE TABLE
# 1.2) CREATE TABLE for existing table should not acquire X lock
#      parent table
connection con1;
BEGIN;
SELECT * FROM parent;
pk
connection default;
CREATE TABLE IF NOT EXISTS child (fk INT, FOREIGN KEY (fk) REFERENCES parent(pk));
Warnings:
Note	1050	Table 'child' already exists
connection con1;
COMMIT;
connection default;
DROP TABLE child;
# 1.3) CREATE TABLE which acquires lock on parent table and fails
#      due to lock timeout.
connection con1;
BEGIN;
SELECT * FROM parent;
pk
connection default;
SET @@lock_wait_timeout= 1;
CREATE TABLE child (fk INT, FOREIGN KEY (fk) REFERENCES parent(pk));
ERROR HY000: Lock wait timeout exceeded; try restarting transaction
SET @@lock_wait_timeout= @old_lock_wait_timeout;
connection con1;
COMMIT;
connection default;
DROP TABLE parent;
# 1.4) CREATE TABLE which adds parent to orphan child must acquire X
#      on child table.
SET FOREIGN_KEY_CHECKS=0;
CREATE TABLE child (fk INT, FOREIGN KEY (fk) REFERENCES parent(pk));
SET FOREIGN_KEY_CHECKS=1;
connection con1;
BEGIN;
SELECT * FROM child;
fk
connection default;
CREATE TABLE parent (pk INT PRIMARY KEY);;
connection con1;
# Wait until CREATE TABLE is blocked by con1 and then resume it.
COMMIT;
connection default;
# Reap CREATE TABLE
# 1.5) CREATE TABLE for existing table must not acquire X lock
#      on child table
connection con1;
BEGIN;
SELECT * FROM child;
fk
connection default;
CREATE TABLE IF NOT EXISTS parent (pk INT PRIMARY KEY);
Warnings:
Note	1050	Table 'parent' already exists
connection con1;
COMMIT;
connection default;
SET FOREIGN_KEY_CHECKS=0;
DROP TABLE parent;
SET FOREIGN_KEY_CHECKS=1;
# 1.6) CREATE TABLE which acquires lock on child table and fails
#      due to lock timeout.
connection con1;
BEGIN;
SELECT * FROM child;
fk
connection default;
SET @@lock_wait_timeout= 1;
CREATE TABLE parent (pk INT PRIMARY KEY);
ERROR HY000: Lock wait timeout exceeded; try restarting transaction
SET @@lock_wait_timeout= @old_lock_wait_timeout;
connection con1;
COMMIT;
connection default;
DROP TABLE child;
# 1.7) CREATE TABLE which adds FK should invalidate entries
#      in TC/TDC and DD caches for the parent table.
CREATE TABLE parent (pk INT PRIMARY KEY);
SELECT * FROM parent;
pk
connection con1;
CREATE TABLE child (fk INT, FOREIGN KEY (fk) REFERENCES parent(pk) ON DELETE CASCADE);
connection default;
LOCK TABLE parent WRITE;
connection con1;
# The above LOCK TABLE should have noticed new table definition
# and acquired SNRW lock on child table.
SELECT * FROM child;;
connection default;
# Wait until SELECT is blocked by default connection and then resume it.
UNLOCK TABLES;
connection con1;
# Reap SELECT
fk
connection default;
DROP TABLES child, parent;
#
# 2) CREATE TABLE ... LIKE
#
# 2.1) CREATE TABLE ... LIKE doesn't copy foreign keys
#      so it should not any locks on FK parent tables.
CREATE TABLE parent (pk INT PRIMARY KEY);
CREATE TABLE child (fk INT, FOREIGN KEY (fk) REFERENCES parent(pk));
connection con1;
LOCK TABLES parent WRITE;
connection default;
CREATE TABLE child2 LIKE child;
connection con1;
UNLOCK TABLES;
connection default;
# 2.2) CREATE TABLE LIKE which adds parent to orphan child must
#      acquire X on child table.
SET FOREIGN_KEY_CHECKS=0;
DROP TABLES child2, parent;
SET FOREIGN_KEY_CHECKS=1;
CREATE TABLE parent_source (pk INT PRIMARY KEY);
connection con1;
BEGIN;
SELECT * FROM child;
fk
connection default;
CREATE TABLE parent LIKE parent_source;;
connection con1;
# Wait until CREATE TABLE is blocked by con1 and then resume it.
COMMIT;
connection default;
# Reap CREATE TABLE
# 2.3) CREATE TABLE LIKE for existing table must not acquire X lock
#      on child table
connection con1;
BEGIN;
SELECT * FROM child;
fk
connection default;
CREATE TABLE IF NOT EXISTS parent LIKE parent_source;
Warnings:
Note	1050	Table 'parent' already exists
connection con1;
COMMIT;
connection default;
SET FOREIGN_KEY_CHECKS=0;
DROP TABLE parent;
SET FOREIGN_KEY_CHECKS=1;
# 2.4) CREATE TABLE LIKE which acquires lock on child table and fails
#      due to lock timeout.
connection con1;
BEGIN;
SELECT * FROM child;
fk
connection default;
SET @@lock_wait_timeout= 1;
CREATE TABLE IF NOT EXISTS parent LIKE parent_source;
ERROR HY000: Lock wait timeout exceeded; try restarting transaction
SET @@lock_wait_timeout= @old_lock_wait_timeout;
connection con1;
COMMIT;
connection default;
DROP TABLE child, parent_source;
#
# 3) CREATE TABLE ... SELECT
#
# 3.1) CREATE TABLE ... SELECT must start by acquiring SU lock on parent
#      table (if table doesn't exist).
CREATE TABLE parent (pk INT PRIMARY KEY);
CREATE TABLE source (fk INT);
INSERT INTO source VALUES (NULL);
connection con1;
BEGIN;
SELECT * FROM source FOR UPDATE;
fk
NULL
connection default;
SET @saved_binlog_format= @@SESSION.binlog_format;
Warnings:
Warning	1287	'@@binlog_format' is deprecated and will be removed in a future release.
SET @@SESSION.binlog_format=STATEMENT;
Warnings:
Warning	1287	'@@binlog_format' is deprecated and will be removed in a future release.
CREATE TABLE child (fk INT, FOREIGN KEY (fk) REFERENCES parent(pk)) SELECT fk FROM source;;
connection con1;
# Wait until CREATE TABLE is blocked by con1 because of row locks.
Timeout in wait_condition.inc for SELECT COUNT(*) = 1 FROM information_schema.processlist
WHERE state = "System lock" AND
info LIKE "CREATE TABLE child%"
# Demonstrate that CREATE TABLE holds SU lock on parent
# which allows DML but not DDL.
INSERT INTO parent VALUES (1);
connection con2;
SET @@lock_wait_timeout= 1;
ALTER TABLE parent ADD COLUMN a INT;
ERROR HY000: Lock wait timeout exceeded; try restarting transaction
SET @@lock_wait_timeout= @old_lock_wait_timeout;
connection con1;
# Resume CREATE TABLE.
COMMIT;
connection default;
# Reap CREATE TABLE
SET SESSION binlog_format= @saved_binlog_format;
Warnings:
Warning	1287	'@@binlog_format' is deprecated and will be removed in a future release.
DROP TABLES child, source;
# 3.2) CREATE TABLE ... SELECT should upgrade SU lock on parent to X
#      before commit (i.e eventually X lock should be acquired).
connection con1;
BEGIN;
SELECT * FROM parent;
pk
1
connection default;
SET @@SESSION.binlog_format=STATEMENT;
Warnings:
Warning	1287	'@@binlog_format' is deprecated and will be removed in a future release.
CREATE TABLE child (fk INT, FOREIGN KEY (fk) REFERENCES parent(pk)) SELECT NULL AS fk;;
connection con1;
# Wait until CREATE TABLE is blocked by con1 and then resume it.
COMMIT;
connection default;
# Reap CREATE TABLE
SET SESSION binlog_format= @saved_binlog_format;
Warnings:
Warning	1287	'@@binlog_format' is deprecated and will be removed in a future release.
# 3.3) CREATE TABLE ... SELECT for existing table should not acquire
#      any locks on parent table.
connection con1;
CREATE TABLE parent2 (pk INT PRIMARY KEY);
LOCK TABLE parent2 WRITE;
connection default;
SET @@SESSION.binlog_format=STATEMENT;
Warnings:
Warning	1287	'@@binlog_format' is deprecated and will be removed in a future release.
CREATE TABLE IF NOT EXISTS child (fk INT, FOREIGN KEY (fk) REFERENCES parent2(pk)) SELECT NULL AS fk;
Warnings:
Note	1050	Table 'child' already exists
SET SESSION binlog_format= @saved_binlog_format;
Warnings:
Warning	1287	'@@binlog_format' is deprecated and will be removed in a future release.
connection con1;
UNLOCK TABLES;
connection default;
DROP TABLE child;
DROP TABLE parent2;
# 3.4) CREATE TABLE ... SELECT which tries to acquire SU lock on parent
#      table and fails due to lock timeout.
connection con1;
LOCK TABLE parent WRITE;
connection default;
SET @@lock_wait_timeout= 1;
SET @@SESSION.binlog_format=STATEMENT;
Warnings:
Warning	1287	'@@binlog_format' is deprecated and will be removed in a future release.
CREATE TABLE child (fk INT, FOREIGN KEY (fk) REFERENCES parent(pk)) SELECT NULL AS fk;
ERROR HY000: Lock wait timeout exceeded; try restarting transaction
SET SESSION binlog_format= @saved_binlog_format;
Warnings:
Warning	1287	'@@binlog_format' is deprecated and will be removed in a future release.
SET @@lock_wait_timeout= @old_lock_wait_timeout;
connection con1;
UNLOCK TABLES;
# 3.5) CREATE TABLE ... SELECT which tries to upgrade to X lock on
#      parent table and fails due to lock timeout.
BEGIN;
SELECT * FROM parent;
pk
1
connection default;
SET @@lock_wait_timeout= 1;
SET @@SESSION.binlog_format=STATEMENT;
Warnings:
Warning	1287	'@@binlog_format' is deprecated and will be removed in a future release.
CREATE TABLE child (fk INT, FOREIGN KEY (fk) REFERENCES parent(pk)) SELECT NULL AS fk;
ERROR HY000: Lock wait timeout exceeded; try restarting transaction
SET SESSION binlog_format= @saved_binlog_format;
Warnings:
Warning	1287	'@@binlog_format' is deprecated and will be removed in a future release.
SET @@lock_wait_timeout= @old_lock_wait_timeout;
connection con1;
COMMIT;
connection default;
DROP TABLE parent;
