##############################################
# Test instant ADD COLUMN
##############################################
#
# Scenario 1:
# Create a small table, and add all kinds of new columns and verify
#
CREATE TABLE t1 (a INT NOT NULL AUTO_INCREMENT PRIMARY KEY, b INT);
INSERT INTO t1 VALUES(0, 1), (0, 2), (0, 3), (0, 4), (0, 5);
ALTER TABLE t1 ADD COLUMN c1 INT, ALGORITHM=INSTANT;
CHECK TABLE t1;
Table	Op	Msg_type	Msg_text
test.t1	check	note	The storage engine for the table doesn't support check
INSERT INTO t1(a, c1) VALUES(0, 1);
SELECT count(*) = max(a) FROM t1 WHERE c1 IS NULL;
count(*) = max(a)
1
SELECT c1 FROM t1 WHERE c1 = 1;
c1
1
ALTER TABLE t1 ADD COLUMN c2 INT NOT NULL DEFAULT 10;
CHECK TABLE t1;
Table	Op	Msg_type	Msg_text
test.t1	check	note	The storage engine for the table doesn't support check
INSERT INTO t1(a, c2) VALUES(0, 11);
SELECT count(*) = max(a) FROM t1 WHERE c2 = 10;
count(*) = max(a)
1
SELECT c2 FROM t1 WHERE c2 = 11;
c2
11
ALTER TABLE t1 ADD COLUMN d1 BIGINT, ALGORITHM=INSTANT;
CHECK TABLE t1;
Table	Op	Msg_type	Msg_text
test.t1	check	note	The storage engine for the table doesn't support check
INSERT INTO t1(a, d1) VALUES(0, 1);
SELECT count(*) = max(a) FROM t1 WHERE d1 IS NULL;
count(*) = max(a)
1
SELECT d1 FROM t1 WHERE d1 = 1;
d1
1
ALTER TABLE t1 ADD COLUMN d2 BIGINT NOT NULL DEFAULT 1234567890;
CHECK TABLE t1;
Table	Op	Msg_type	Msg_text
test.t1	check	note	The storage engine for the table doesn't support check
INSERT INTO t1(a, d2) VALUES(0, 1234);
SELECT count(*) = max(a) FROM t1 WHERE d2 = 1234567890;
count(*) = max(a)
1
SELECT d2 FROM t1 WHERE d2 = 1234;
d2
1234
ALTER TABLE t1 ADD COLUMN e1 SMALLINT, ALGORITHM=INSTANT;
CHECK TABLE t1;
Table	Op	Msg_type	Msg_text
test.t1	check	note	The storage engine for the table doesn't support check
INSERT INTO t1(a, e1) VALUES(0, 1);
SELECT count(*) = max(a) FROM t1 WHERE e1 IS NULL;
count(*) = max(a)
1
SELECT e1 FROM t1 WHERE e1 = 1;
e1
1
ALTER TABLE t1 ADD COLUMN e2 SMALLINT NOT NULL DEFAULT 10;
CHECK TABLE t1;
Table	Op	Msg_type	Msg_text
test.t1	check	note	The storage engine for the table doesn't support check
INSERT INTO t1(a, e2) VALUES(0, 11);
SELECT count(*) = max(a) FROM t1 WHERE e2 = 10;
count(*) = max(a)
1
SELECT e2 FROM t1 WHERE e2 = 11;
e2
11
ALTER TABLE t1 ADD COLUMN f1 TINYINT, ALGORITHM=INSTANT;
CHECK TABLE t1;
Table	Op	Msg_type	Msg_text
test.t1	check	note	The storage engine for the table doesn't support check
INSERT INTO t1(a, f1) VALUES(0, 1);
SELECT count(*) = max(a) FROM t1 WHERE f1 IS NULL;
count(*) = max(a)
1
SELECT f1 FROM t1 WHERE f1 = 1;
f1
1
ALTER TABLE t1 ADD COLUMN f2 TINYINT NOT NULL DEFAULT 123;
CHECK TABLE t1;
Table	Op	Msg_type	Msg_text
test.t1	check	note	The storage engine for the table doesn't support check
INSERT INTO t1(a, f2) VALUES(0, 12);
SELECT count(*) = max(a) FROM t1 WHERE f2 = 123;
count(*) = max(a)
1
SELECT f2 FROM t1 WHERE f2 = 12;
f2
12
ALTER TABLE t1 ADD COLUMN g1 MEDIUMINT, ALGORITHM=INSTANT;
CHECK TABLE t1;
Table	Op	Msg_type	Msg_text
test.t1	check	note	The storage engine for the table doesn't support check
INSERT INTO t1(a, g1) VALUES(0, 1);
SELECT count(*) = max(a) FROM t1 WHERE g1 IS NULL;
count(*) = max(a)
1
SELECT g1 FROM t1 WHERE g1 = 1;
g1
1
ALTER TABLE t1 ADD COLUMN g2 MEDIUMINT NOT NULL DEFAULT 12345;
CHECK TABLE t1;
Table	Op	Msg_type	Msg_text
test.t1	check	note	The storage engine for the table doesn't support check
INSERT INTO t1(a, g2) VALUES(0, 1234);
SELECT count(*) = max(a) FROM t1 WHERE g2 = 12345;
count(*) = max(a)
1
SELECT g2 FROM t1 WHERE g2 = 1234;
g2
1234
ALTER TABLE t1 ADD COLUMN h1 FLOAT, ALGORITHM=INSTANT;
CHECK TABLE t1;
Table	Op	Msg_type	Msg_text
test.t1	check	note	The storage engine for the table doesn't support check
INSERT INTO t1(a, h1) VALUES(0, 1.0);
SELECT count(*) = max(a) FROM t1 WHERE h1 IS NULL;
count(*) = max(a)
1
SELECT h1 FROM t1 WHERE h1 = 1;
h1
1
ALTER TABLE t1 ADD COLUMN h2 FLOAT NOT NULL DEFAULT 12.34;
CHECK TABLE t1;
Table	Op	Msg_type	Msg_text
test.t1	check	note	The storage engine for the table doesn't support check
INSERT INTO t1(a, h2) VALUES(0, 1.234);
SELECT count(*) = max(a) FROM t1 WHERE h2 = 12.34;
count(*) = max(a)
NULL
SELECT h2 FROM t1 WHERE h2 = 1.234;
h2
ALTER TABLE t1 ADD COLUMN i1 DECIMAL(5, 2), ADD COLUMN i2 double, ALGORITHM=INSTANT;
CHECK TABLE t1;
Table	Op	Msg_type	Msg_text
test.t1	check	note	The storage engine for the table doesn't support check
INSERT INTO t1(a, i1, i2) VALUES(0, 10.10, 20.20);
SELECT count(*) = max(a) FROM t1 WHERE i1 IS NULL;
count(*) = max(a)
1
SELECT count(*) = max(a) FROM t1 WHERE i2 IS NULL;
count(*) = max(a)
1
SELECT i1 FROM t1 WHERE i1 = 10.10;
i1
10.10
SELECT i2 FROM t1 WHERE i2 = 20.20;
i2
20.2
ALTER TABLE t1 ADD COLUMN j1 DECIMAL(5, 2) NOT NULL DEFAULT 100.00, ADD COLUMN j2 double NOT NULL DEFAULT 1000.5678;
CHECK TABLE t1;
Table	Op	Msg_type	Msg_text
test.t1	check	note	The storage engine for the table doesn't support check
INSERT INTO t1(a, j1, j2) VALUES(0, 90.90, 1000.1234);
SELECT count(*) = max(a) FROM t1 WHERE j1 = 100.00;
count(*) = max(a)
1
SELECT count(*) = max(a) FROM t1 WHERE j2 = 1000.5678;
count(*) = max(a)
1
SELECT j1 FROM t1 WHERE j1 = 90.90;
j1
90.90
SELECT j2 FROM t1 WHERE j2 = 1000.1234;
j2
1000.1234
ALTER TABLE t1 ADD COLUMN k1 BIT(8), ALGORITHM=INSTANT;
CHECK TABLE t1;
Table	Op	Msg_type	Msg_text
test.t1	check	note	The storage engine for the table doesn't support check
INSERT INTO t1(a, k1) VALUES(0, b'010101');
SELECT count(*) = max(a) FROM t1 WHERE k1 IS NULL;
count(*) = max(a)
1
SELECT hex(k1) FROM t1 WHERE k1 = b'010101';
hex(k1)
15
ALTER TABLE t1 ADD COLUMN k2 BIT(8) NOT NULL DEFAULT b'101010';
CHECK TABLE t1;
Table	Op	Msg_type	Msg_text
test.t1	check	note	The storage engine for the table doesn't support check
INSERT INTO t1(a, k2) VALUES(0, b'110011');
SELECT count(*) = max(a) FROM t1 WHERE k2 = b'101010';
count(*) = max(a)
1
SELECT hex(k2) FROM t1 WHERE k2 = b'110011';
hex(k2)
33
ALTER TABLE t1 ADD COLUMN l1 CHAR(50), ADD COLUMN l2 VARCHAR(100), ALGORITHM=DEFAULT;
CHECK TABLE t1;
Table	Op	Msg_type	Msg_text
test.t1	check	note	The storage engine for the table doesn't support check
INSERT INTO t1(a, l1, l2) VALUES(0, 'ABCD EFGH', 'abcdefg hijklmn ');
SELECT count(*) = max(a) FROM t1 WHERE l2 IS NULL;
count(*) = max(a)
1
SELECT count(*) = max(a) FROM t1 WHERE l1 IS NULL;
count(*) = max(a)
1
SELECT l1 FROM t1 WHERE l1 = 'ABCD EFGH';
l1
ABCD EFGH
SELECT l2 FROM t1 WHERE l2 = 'abcdefg hijklmn ';
l2
abcdefg hijklmn 
DROP TABLE t1;
CREATE TABLE t1 (a INT NOT NULL AUTO_INCREMENT PRIMARY KEY, b INT);
ALTER TABLE t1 ADD COLUMN m1 CHAR(50) default 'The fox jumps over', ADD COLUMN m2 VARCHAR(50) DEFAULT 'The fox jumps over the lazy dog.';
CHECK TABLE t1;
Table	Op	Msg_type	Msg_text
test.t1	check	note	The storage engine for the table doesn't support check
INSERT INTO t1(a, m1, m2) VALUES(0, 'over the lazy dog', 'The lazy dog jumps over the fox.');
SELECT count(*) = max(a) FROM t1 WHERE m1 = 'The fox jumps over';
count(*) = max(a)
NULL
SELECT count(*) = max(a) FROM t1 WHERE m2 like 'The fox jumps%';
count(*) = max(a)
NULL
SELECT m1 FROM t1 WHERE m1 = 'over the lazy dog';
m1
over the lazy dog
SELECT m2 FROM t1 WHERE m2 like '%the fox.';
m2
The lazy dog jumps over the fox.
ALTER TABLE t1 ADD COLUMN n1 BINARY(10), ADD COLUMN n2 VARBINARY(10), ALGORITHM=DEFAULT;
CHECK TABLE t1;
Table	Op	Msg_type	Msg_text
test.t1	check	note	The storage engine for the table doesn't support check
INSERT INTO t1(a, n1, n2) VALUES(0, 0x010203040506070809, 0x102030405060708090);
SELECT count(*) = max(a) FROM t1 WHERE n1 IS NULL;
count(*) = max(a)
1
SELECT count(*) = max(a) FROM t1 WHERE n2 IS NULL;
count(*) = max(a)
1
SELECT hex(n1) FROM t1 WHERE n1 = 0x01020304050607080900;
hex(n1)
01020304050607080900
SELECT hex(n2) FROM t1 WHERE n2 = 0x102030405060708090;
hex(n2)
102030405060708090
ALTER TABLE t1 ADD COLUMN o1 BINARY(10) DEFAULT 0x11223344, ADD COLUMN o2 VARBINARY(10) DEFAULT 0x55667788;
CHECK TABLE t1;
Table	Op	Msg_type	Msg_text
test.t1	check	note	The storage engine for the table doesn't support check
INSERT INTO t1(a, o1, o2) VALUES(0, 0x44332211, 0x88776655);
SELECT count(*) = max(a) FROM t1 WHERE o1 = 0x11223344000000000000;
count(*) = max(a)
1
SELECT count(*) = max(a) FROM t1 WHERE o2 = 0x55667788;
count(*) = max(a)
1
SELECT hex(o1) FROM t1 WHERE o1 = 0x44332211000000000000;
hex(o1)
44332211000000000000
SELECT hex(o2) FROM t1 WHERE o2 = 0x88776655;
hex(o2)
88776655
ALTER TABLE t1 ADD COLUMN p1 DATETIME, ALGORITHM=DEFAULT;
CHECK TABLE t1;
Table	Op	Msg_type	Msg_text
test.t1	check	note	The storage engine for the table doesn't support check
INSERT INTO t1(a, p1) VALUES(0, '2017-12-31 00:00:00');
SELECT count(*) = max(a) FROM t1 WHERE p1 IS NULL;
count(*) = max(a)
1
SELECT p1 FROM t1 WHERE p1 = '2017-12-31 00:00:00';
p1
2017-12-31 00:00:00
ALTER TABLE t1 ADD COLUMN p2 DATETIME NOT NULL DEFAULT '2017-12-31 01:02:03';
CHECK TABLE t1;
Table	Op	Msg_type	Msg_text
test.t1	check	note	The storage engine for the table doesn't support check
SELECT count(*) = max(a) FROM t1 GROUP BY p2;
count(*) = max(a)
1
INSERT INTO t1(a, p2) VALUES(0, now());
SELECT count(*) FROM t1 GROUP BY p2;
count(*)
4
1
ALTER TABLE t1 ADD COLUMN q1 ENUM ('value1','value2','value3'), ALGORITHM=INSTANT;
CHECK TABLE t1;
Table	Op	Msg_type	Msg_text
test.t1	check	note	The storage engine for the table doesn't support check
INSERT INTO t1(a, q1) VALUES(0, 1);
SELECT count(*) = max(a) FROM t1 WHERE q1 IS NULL;
count(*) = max(a)
1
SELECT q1 FROM t1 WHERE q1 = 1;
q1
value1
ALTER TABLE t1 ADD COLUMN r1 SET ('a','b','c'), ALGORITHM=INSTANT;
CHECK TABLE t1;
Table	Op	Msg_type	Msg_text
test.t1	check	note	The storage engine for the table doesn't support check
INSERT INTO t1(a, r1) VALUES(0, 'a');
SELECT count(*) = max(a) FROM t1 WHERE r1 IS NULL;
count(*) = max(a)
1
SELECT r1 FROM t1 WHERE r1 = 'a';
r1
a
ALTER TABLE t1 ADD COLUMN s1 BLOB, ADD COLUMN s2 TEXT, ALGORITHM=INSTANT;
ERROR HY000: BLOB Column can't be added with ALGORITHM=INSTANT. Try ALGORITHM=INPLACE/COPY.
ALTER TABLE t1 ADD COLUMN s1 BLOB, ADD COLUMN s2 TEXT, ALGORITHM=COPY;
INSERT INTO t1(a, s1, s2) VALUES(0, 0x0102030405, 'abcd qwerty');
SELECT count(*) = max(a) FROM t1 WHERE s1 IS NULL;
count(*) = max(a)
1
SELECT count(*) = max(a) FROM t1 WHERE s2 IS NULL;
count(*) = max(a)
1
SELECT hex(s1) FROM t1 WHERE s1 = 0x0102030405;
hex(s1)
0102030405
SELECT s2 FROM t1 WHERE s2 = 'abcd qwerty';
s2
abcd qwerty
ALTER TABLE t1 ADD COLUMN u1 BLOB NOT NULL, ADD COLUMN u2 TEXT NOT NULL;
CHECK TABLE t1;
Table	Op	Msg_type	Msg_text
test.t1	check	note	The storage engine for the table doesn't support check
INSERT INTO t1(a, u1, u2) VALUES(0, 0x0102030405, 'abcd qwerty');
SELECT count(*) = max(a) FROM t1 WHERE u1 = '';
count(*) = max(a)
1
SELECT count(*) = max(a) FROM t1 WHERE u2 = '';
count(*) = max(a)
1
SELECT hex(u1) FROM t1 WHERE u1 = 0x0102030405;
hex(u1)
0102030405
SELECT u2 FROM t1 WHERE u2 = 'abcd qwerty';
u2
abcd qwerty
CHECK TABLE t1;
Table	Op	Msg_type	Msg_text
test.t1	check	note	The storage engine for the table doesn't support check
SHOW CREATE TABLE t1;
Table	Create Table
t1	CREATE TABLE `t1` (
  `a` int NOT NULL AUTO_INCREMENT,
  `b` int DEFAULT NULL,
  `m1` char(50) DEFAULT 'The fox jumps over',
  `m2` varchar(50) DEFAULT 'The fox jumps over the lazy dog.',
  `n1` binary(10) DEFAULT NULL,
  `n2` varbinary(10) DEFAULT NULL,
  `o1` binary(10) DEFAULT '"3D\0\0\0\0\0\0',
  `o2` varbinary(10) DEFAULT 0x55667788,
  `p1` datetime DEFAULT NULL,
  `p2` datetime NOT NULL DEFAULT '2017-12-31 01:02:03',
  `q1` enum('value1','value2','value3') DEFAULT NULL,
  `r1` set('a','b','c') DEFAULT NULL,
  `s1` blob,
  `s2` text,
  `u1` blob NOT NULL,
  `u2` text NOT NULL,
  PRIMARY KEY (`a`)
) ENGINE=Dstore AUTO_INCREMENT=10 DEFAULT CHARSET=utf8mb4 COLLATE=utf8mb4_0900_ai_ci
DROP TABLE t1;
#
# Scenario 2:
# Create a small table, add some columns instantly, along with
# virtual columns
#
CREATE TABLE t1 (a INT NOT NULL AUTO_INCREMENT PRIMARY KEY, b INT);
INSERT INTO t1 VALUES(0, 1), (0, 2), (0, 3), (0, 4), (0, 5);
ALTER TABLE t1 ADD COLUMN c INT NOT NULL, ADD COLUMN d INT GENERATED ALWAYS AS ((b * 2)) VIRTUAL;
CHECK TABLE t1;
Table	Op	Msg_type	Msg_text
test.t1	check	note	The storage engine for the table doesn't support check
INSERT INTO t1(a, b, c) VALUES(0, 6, 20);
SELECT * FROM t1;
a	b	c	d
1	1	0	2
2	2	0	4
3	3	0	6
4	4	0	8
5	5	0	10
6	6	20	12
ALTER TABLE t1 ADD COLUMN e VARCHAR(100) DEFAULT 'ABCD EFGH', ADD COLUMN f INT GENERATED ALWAYS AS (LENGTH(e));
CHECK TABLE t1;
Table	Op	Msg_type	Msg_text
test.t1	check	note	The storage engine for the table doesn't support check
INSERT INTO t1(a, c, e) VALUES(0, 20, 'Hello'), (0, 20, 'World'), (0, 20, 'Hello World');
SELECT * FROM t1;
a	b	c	d	e	f
1	1	0	2	ABCD EFGH	9
2	2	0	4	ABCD EFGH	9
3	3	0	6	ABCD EFGH	9
4	4	0	8	ABCD EFGH	9
5	5	0	10	ABCD EFGH	9
6	6	20	12	ABCD EFGH	9
7	NULL	20	NULL	Hello	5
8	NULL	20	NULL	World	5
9	NULL	20	NULL	Hello World	11
ALTER TABLE t1 ADD COLUMN g VARCHAR(100) GENERATED ALWAYS AS (e), ADD COLUMN h BIGINT DEFAULT 10000, ADD COLUMN i BIGINT GENERATED ALWAYS AS (h * 2 + b);
CHECK TABLE t1;
Table	Op	Msg_type	Msg_text
test.t1	check	note	The storage engine for the table doesn't support check
SELECT * FROM t1;
a	b	c	d	e	f	g	h	i
1	1	0	2	ABCD EFGH	9	ABCD EFGH	10000	20001
2	2	0	4	ABCD EFGH	9	ABCD EFGH	10000	20002
3	3	0	6	ABCD EFGH	9	ABCD EFGH	10000	20003
4	4	0	8	ABCD EFGH	9	ABCD EFGH	10000	20004
5	5	0	10	ABCD EFGH	9	ABCD EFGH	10000	20005
6	6	20	12	ABCD EFGH	9	ABCD EFGH	10000	20006
7	NULL	20	NULL	Hello	5	Hello	10000	NULL
8	NULL	20	NULL	World	5	World	10000	NULL
9	NULL	20	NULL	Hello World	11	Hello World	10000	NULL
INSERT INTO t1(a, b, c, h) VALUES(0, 7, 40, 2000), (0, 7, 40, 20000);
SELECT * FROM t1;
a	b	c	d	e	f	g	h	i
1	1	0	2	ABCD EFGH	9	ABCD EFGH	10000	20001
10	7	40	14	ABCD EFGH	9	ABCD EFGH	2000	4007
11	7	40	14	ABCD EFGH	9	ABCD EFGH	20000	40007
2	2	0	4	ABCD EFGH	9	ABCD EFGH	10000	20002
3	3	0	6	ABCD EFGH	9	ABCD EFGH	10000	20003
4	4	0	8	ABCD EFGH	9	ABCD EFGH	10000	20004
5	5	0	10	ABCD EFGH	9	ABCD EFGH	10000	20005
6	6	20	12	ABCD EFGH	9	ABCD EFGH	10000	20006
7	NULL	20	NULL	Hello	5	Hello	10000	NULL
8	NULL	20	NULL	World	5	World	10000	NULL
9	NULL	20	NULL	Hello World	11	Hello World	10000	NULL
CHECK TABLE t1;
Table	Op	Msg_type	Msg_text
test.t1	check	note	The storage engine for the table doesn't support check
SHOW CREATE TABLE t1;
Table	Create Table
t1	CREATE TABLE `t1` (
  `a` int NOT NULL AUTO_INCREMENT,
  `b` int DEFAULT NULL,
  `c` int NOT NULL,
  `d` int GENERATED ALWAYS AS ((`b` * 2)) VIRTUAL,
  `e` varchar(100) DEFAULT 'ABCD EFGH',
  `f` int GENERATED ALWAYS AS (length(`e`)) VIRTUAL,
  `g` varchar(100) GENERATED ALWAYS AS (`e`) VIRTUAL,
  `h` bigint DEFAULT '10000',
  `i` bigint GENERATED ALWAYS AS (((`h` * 2) + `b`)) VIRTUAL,
  PRIMARY KEY (`a`)
) ENGINE=Dstore AUTO_INCREMENT=12 DEFAULT CHARSET=utf8mb4 COLLATE=utf8mb4_0900_ai_ci
DROP TABLE t1;
#
# Scenario 3:
# Create a small table, add some columns instantly, then change
# their default values, check original default values are correct
#
CREATE TABLE t1 (a INT NOT NULL AUTO_INCREMENT PRIMARY KEY, b INT);
INSERT INTO t1 VALUES(0, 1), (0, 2), (0, 3), (0, 4), (0, 5);
ALTER TABLE t1 ADD COLUMN c INT NOT NULL DEFAULT 100, ADD COLUMN d INT GENERATED ALWAYS AS ((c * 2 + b)) VIRTUAL, ADD COLUMN e VARCHAR(100) DEFAULT 'Hello world';
CHECK TABLE t1;
Table	Op	Msg_type	Msg_text
test.t1	check	note	The storage engine for the table doesn't support check
SELECT * FROM t1;
a	b	c	d	e
1	1	100	201	Hello world
2	2	100	202	Hello world
3	3	100	203	Hello world
4	4	100	204	Hello world
5	5	100	205	Hello world
INSERT INTO t1(a, b, c, e) VALUES(0, 6, 200, 'Good day'), (0, 7, 300, 'Good DAY');
SELECT * FROM t1;
a	b	c	d	e
1	1	100	201	Hello world
2	2	100	202	Hello world
3	3	100	203	Hello world
4	4	100	204	Hello world
5	5	100	205	Hello world
6	6	200	406	Good day
7	7	300	607	Good DAY
ALTER TABLE t1 ALTER COLUMN c SET DEFAULT 500;
SELECT * FROM t1;
a	b	c	d	e
1	1	100	201	Hello world
2	2	100	202	Hello world
3	3	100	203	Hello world
4	4	100	204	Hello world
5	5	100	205	Hello world
6	6	200	406	Good day
7	7	300	607	Good DAY
INSERT INTO t1(a, b) VALUES(0, 8), (0, 9);
SELECT * FROM t1;
a	b	c	d	e
1	1	100	201	Hello world
2	2	100	202	Hello world
3	3	100	203	Hello world
4	4	100	204	Hello world
5	5	100	205	Hello world
6	6	200	406	Good day
7	7	300	607	Good DAY
8	8	500	1008	Hello world
9	9	500	1009	Hello world
ALTER TABLE t1 ALTER COLUMN e SET DEFAULT 'HELLO MySQL!';
SELECT * FROM t1;
a	b	c	d	e
1	1	100	201	Hello world
2	2	100	202	Hello world
3	3	100	203	Hello world
4	4	100	204	Hello world
5	5	100	205	Hello world
6	6	200	406	Good day
7	7	300	607	Good DAY
8	8	500	1008	Hello world
9	9	500	1009	Hello world
INSERT INTO t1(a, b) VALUES(0, 10), (0, 20);
SELECT * FROM t1;
a	b	c	d	e
1	1	100	201	Hello world
10	10	500	1010	HELLO MySQL!
11	20	500	1020	HELLO MySQL!
2	2	100	202	Hello world
3	3	100	203	Hello world
4	4	100	204	Hello world
5	5	100	205	Hello world
6	6	200	406	Good day
7	7	300	607	Good DAY
8	8	500	1008	Hello world
9	9	500	1009	Hello world
CHECK TABLE t1;
Table	Op	Msg_type	Msg_text
test.t1	check	note	The storage engine for the table doesn't support check
SHOW CREATE TABLE t1;
Table	Create Table
t1	CREATE TABLE `t1` (
  `a` int NOT NULL AUTO_INCREMENT,
  `b` int DEFAULT NULL,
  `c` int NOT NULL DEFAULT '500',
  `d` int GENERATED ALWAYS AS (((`c` * 2) + `b`)) VIRTUAL,
  `e` varchar(100) DEFAULT 'HELLO MySQL!',
  PRIMARY KEY (`a`)
) ENGINE=Dstore AUTO_INCREMENT=12 DEFAULT CHARSET=utf8mb4 COLLATE=utf8mb4_0900_ai_ci
DROP TABLE t1;
#
# Scenario 4:
# Create a small table, add some columns instantly, then do DML
# on the table
#
CREATE TABLE t1 (a INT NOT NULL AUTO_INCREMENT PRIMARY KEY, b INT);
INSERT INTO t1 VALUES(0, 1), (0, 2), (0, 3), (0, 4), (0, 5);
ALTER TABLE t1 ADD COLUMN c INT NOT NULL DEFAULT 100, ADD COLUMN d INT GENERATED ALWAYS AS ((c * 2 + b)) VIRTUAL, ADD COLUMN e VARCHAR(100) DEFAULT 'Hello world';
CHECK TABLE t1;
Table	Op	Msg_type	Msg_text
test.t1	check	note	The storage engine for the table doesn't support check
UPDATE t1 SET c = 200 WHERE a > 3;
SELECT distinct(c) FROM t1;
c
100
200
INSERT INTO t1(b, c, e) SELECT b, c, e FROM t1;
INSERT INTO t1(b, c, e) SELECT b, c, e FROM t1;
INSERT INTO t1(b, c, e) SELECT b, c, e FROM t1;
DELETE FROM t1 WHERE c = 100;
UPDATE t1 SET c = 300;
SELECT distinct(c) FROM t1;
c
300
SELECT count(*) FROM t1;
count(*)
16
ALTER TABLE t1 ADD COLUMN t DATETIME DEFAULT CURRENT_TIMESTAMP;
CHECK TABLE t1;
Table	Op	Msg_type	Msg_text
test.t1	check	note	The storage engine for the table doesn't support check
UPDATE t1 SET e = 'Hello MySQL' WHERE a > 10;
UPDATE t1 SET e = 'Hello MySQL!!' WHERE a > 20;
SELECT distinct(e) FROM t1;
e
Hello MySQL
Hello MySQL!!
Hello world
UPDATE t1 SET c = 500 WHERE e LIKE '%world%';
SELECT c, e FROM t1 GROUP BY c, e;
c	e
300	Hello MySQL
300	Hello MySQL!!
500	Hello world
INSERT INTO t1(b, c, e) SELECT b, c, e FROM t1;
UPDATE t1 SET t = CURRENT_TIMESTAMP WHERE a < 50;
SELECT count(t) FROM t1 GROUP BY t;
count(t)
16
16
DELETE FROM t1 WHERE a < 50;
SELECT count(t) FROM t1 GROUP BY t;
count(t)
16
CHECK TABLE t1;
Table	Op	Msg_type	Msg_text
test.t1	check	note	The storage engine for the table doesn't support check
SHOW CREATE TABLE t1;
Table	Create Table
t1	CREATE TABLE `t1` (
  `a` int NOT NULL AUTO_INCREMENT,
  `b` int DEFAULT NULL,
  `c` int NOT NULL DEFAULT '100',
  `d` int GENERATED ALWAYS AS (((`c` * 2) + `b`)) VIRTUAL,
  `e` varchar(100) DEFAULT 'Hello world',
  `t` datetime DEFAULT CURRENT_TIMESTAMP,
  PRIMARY KEY (`a`)
) ENGINE=Dstore AUTO_INCREMENT=90 DEFAULT CHARSET=utf8mb4 COLLATE=utf8mb4_0900_ai_ci
DROP TABLE t1;
#
# Scenario 5:
# Create a small table, add some columns instantly, then do DDL
# to build indexes
#
CREATE TABLE t1 (a INT NOT NULL AUTO_INCREMENT PRIMARY KEY, b INT);
INSERT INTO t1 VALUES(0, 1), (0, 2), (0, 3), (0, 4), (0, 5);
ALTER TABLE t1 ADD COLUMN c INT NOT NULL DEFAULT 100, ADD COLUMN d INT GENERATED ALWAYS AS ((c * 2 + b)) VIRTUAL, ADD COLUMN e VARCHAR(100) DEFAULT 'Hello world';
CHECK TABLE t1;
Table	Op	Msg_type	Msg_text
test.t1	check	note	The storage engine for the table doesn't support check
ALTER TABLE t1 ADD KEY(c);
EXPLAIN SELECT c FROM t1;
id	select_type	table	partitions	type	possible_keys	key	key_len	ref	rows	filtered	Extra
1	SIMPLE	t1	NULL	index	NULL	c	#	NULL	#	100.00	Using index
Warnings:
Note	1003	/* select#1 */ select `test`.`t1`.`c` AS `c` from `test`.`t1`
SELECT c FROM t1 WHERE c != 100;
c
INSERT INTO t1(b, c, e) SELECT b, c, e FROM t1;
INSERT INTO t1(b, c, e) SELECT b, c, e FROM t1;
INSERT INTO t1(b, c, e) SELECT b, c, e FROM t1;
UPDATE t1 SET e = 'Hello MySQL' WHERE a > 30;
ALTER TABLE t1 ADD KEY(e);
EXPLAIN SELECT e FROM t1;
id	select_type	table	partitions	type	possible_keys	key	key_len	ref	rows	filtered	Extra
1	SIMPLE	t1	NULL	index	NULL	e	#	NULL	#	100.00	Using index
Warnings:
Note	1003	/* select#1 */ select `test`.`t1`.`e` AS `e` from `test`.`t1`
SELECT count(e) FROM t1 WHERE e LIKE '%MySQL%';
count(e)
17
SELECT count(e) FROM t1 WHERE e LIKE '%world%';
count(e)
23
ALTER TABLE t1 DROP PRIMARY KEY, ADD PRIMARY KEY(a, c);
SELECT a, c, e FROM t1 WHERE a > 25 AND a < 40;
a	c	e
28	100	Hello world
29	100	Hello world
30	100	Hello world
31	100	Hello MySQL
32	100	Hello MySQL
33	100	Hello MySQL
34	100	Hello MySQL
35	100	Hello MySQL
36	100	Hello MySQL
37	100	Hello MySQL
38	100	Hello MySQL
39	100	Hello MySQL
CHECK TABLE t1;
Table	Op	Msg_type	Msg_text
test.t1	check	note	The storage engine for the table doesn't support check
SHOW CREATE TABLE t1;
Table	Create Table
t1	CREATE TABLE `t1` (
  `a` int NOT NULL AUTO_INCREMENT,
  `b` int DEFAULT NULL,
  `c` int NOT NULL DEFAULT '100',
  `d` int GENERATED ALWAYS AS (((`c` * 2) + `b`)) VIRTUAL,
  `e` varchar(100) DEFAULT 'Hello world',
  PRIMARY KEY (`a`,`c`),
  KEY `c` (`c`),
  KEY `e` (`e`)
) ENGINE=Dstore AUTO_INCREMENT=59 DEFAULT CHARSET=utf8mb4 COLLATE=utf8mb4_0900_ai_ci
DROP TABLE t1;
#
# Scenario 6:
# Create a small table, add some columns instantly, then do DML
# on the table, and some simple rollback
#
CREATE TABLE t1 (a INT NOT NULL AUTO_INCREMENT PRIMARY KEY, b INT);
INSERT INTO t1 VALUES(0, 1), (0, 2), (0, 3), (0, 4), (0, 5);
ALTER TABLE t1 ADD COLUMN c INT NOT NULL DEFAULT 100, ADD COLUMN d INT GENERATED ALWAYS AS ((c * 2 + b)) VIRTUAL, ADD COLUMN e VARCHAR(100) DEFAULT 'Hello world';
CHECK TABLE t1;
Table	Op	Msg_type	Msg_text
test.t1	check	note	The storage engine for the table doesn't support check
START TRANSACTION;
INSERT INTO t1(a, b) VALUES(0, 6);
SELECT * FROM t1;
a	b	c	d	e
1	1	100	201	Hello world
2	2	100	202	Hello world
3	3	100	203	Hello world
4	4	100	204	Hello world
5	5	100	205	Hello world
6	6	100	206	Hello world
ROLLBACK;
SELECT * FROM t1;
a	b	c	d	e
1	1	100	201	Hello world
2	2	100	202	Hello world
3	3	100	203	Hello world
4	4	100	204	Hello world
5	5	100	205	Hello world
START TRANSACTION;
UPDATE t1 SET c = 500 WHERE a = 1;
UPDATE t1 SET b = 1000 WHERE a = 2;
SELECT a, b, c FROM t1 WHERE a = 1 OR a = 2;
a	b	c
1	1	500
2	1000	100
ROLLBACK;
SELECT a, b, c FROM t1;
a	b	c
1	1	100
2	2	100
3	3	100
4	4	100
5	5	100
START TRANSACTION;
DELETE FROM t1 WHERE a < 5;
INSERT INTO t1(a, b) VALUES(0, 6);
SELECT * FROM t1;
a	b	c	d	e
5	5	100	205	Hello world
7	6	100	206	Hello world
ROLLBACK;
SELECT * FROM t1;
a	b	c	d	e
1	1	100	201	Hello world
2	2	100	202	Hello world
3	3	100	203	Hello world
4	4	100	204	Hello world
5	5	100	205	Hello world
CHECK TABLE t1;
Table	Op	Msg_type	Msg_text
test.t1	check	note	The storage engine for the table doesn't support check
SHOW CREATE TABLE t1;
Table	Create Table
t1	CREATE TABLE `t1` (
  `a` int NOT NULL AUTO_INCREMENT,
  `b` int DEFAULT NULL,
  `c` int NOT NULL DEFAULT '100',
  `d` int GENERATED ALWAYS AS (((`c` * 2) + `b`)) VIRTUAL,
  `e` varchar(100) DEFAULT 'Hello world',
  PRIMARY KEY (`a`)
) ENGINE=Dstore AUTO_INCREMENT=8 DEFAULT CHARSET=utf8mb4 COLLATE=utf8mb4_0900_ai_ci
DROP TABLE t1;
CREATE TABLE t1(id INT PRIMARY KEY, c1 VARCHAR(4000), c2 VARCHAR(4000), c3 VARCHAR(1000));
INSERT INTO t1 VALUES(1, repeat('a', 4000), repeat('b', 4000), repeat('c', 1));
SELECT id, length(c1), length(c2), length(c3) FROM t1;
id	length(c1)	length(c2)	length(c3)
1	4000	4000	1
ALTER TABLE t1 ADD COLUMN c4 VARCHAR(500) NOT NULL DEFAULT 'dddddddddddddddddddddddddddddddddddddddddddddddddddddddddddddddddddddddddddddddddddddddddddddddddddddddddddddddddddddddddddddddddddddddddddddddddddddddddddddddddddddddddddddddddddddddddddddddddddddddddddddddddddddddddddddddddddddddddddddddddddddddddddddddddddddddddddddddddddddddddddddddddddddddddddddddddddddddddddddddddddddddddddddddddddddddddddddddddddddddddddddddddddddddddddddddddddddddddddddddddddddddddddddddddddddddddddddddddddddddddddddddddddddddddddddddddddddddddddddddddddddddddddddddddddd';
CHECK TABLE t1;
Table	Op	Msg_type	Msg_text
test.t1	check	note	The storage engine for the table doesn't support check
SELECT id, length(c1), length(c2), length(c3), length(c4) FROM t1;
id	length(c1)	length(c2)	length(c3)	length(c4)
1	4000	4000	1	500
START TRANSACTION;
UPDATE t1 SET c1 = repeat('x', 200) WHERE id = 1;
ROLLBACK;
SELECT id, length(c1), length(c2), length(c3), length(c4) FROM t1;
id	length(c1)	length(c2)	length(c3)	length(c4)
1	4000	4000	1	500
START TRANSACTION;
UPDATE t1 SET c4 = 'x' WHERE id = 1;
ROLLBACK;
SELECT id, length(c1), length(c2), length(c3), length(c4) FROM t1;
id	length(c1)	length(c2)	length(c3)	length(c4)
1	4000	4000	1	500
DROP TABLE t1;
#
# Scenario 7:
# Confirm some ADD COLUMN are instant, some are not
#
CREATE TABLE t1 (a INT NOT NULL AUTO_INCREMENT PRIMARY KEY, b INT);
INSERT INTO t1 VALUES(0, 1), (0, 2), (0, 3), (0, 4), (0, 5);
ALTER TABLE t1 ADD COLUMN c INT NOT NULL DEFAULT 100 AFTER b;
CHECK TABLE t1;
Table	Op	Msg_type	Msg_text
test.t1	check	note	The storage engine for the table doesn't support check
ALTER TABLE t1 ADD COLUMN d INT NOT NULL DEFAULT 100 AFTER b;
CHECK TABLE t1;
Table	Op	Msg_type	Msg_text
test.t1	check	note	The storage engine for the table doesn't support check
ALTER TABLE t1 ADD COLUMN e INT NOT NULL DEFAULT 100, ADD KEY(e);
CHECK TABLE t1;
Table	Op	Msg_type	Msg_text
test.t1	check	note	The storage engine for the table doesn't support check
ALTER TABLE t1 ADD COLUMN f INT NOT NULL DEFAULT 100, FORCE;
CHECK TABLE t1;
Table	Op	Msg_type	Msg_text
test.t1	check	note	The storage engine for the table doesn't support check
ALTER TABLE t1 ADD COLUMN g INT NOT NULL DEFAULT 100, ALGORITHM=COPY;
CHECK TABLE t1;
Table	Op	Msg_type	Msg_text
test.t1	check	note	The storage engine for the table doesn't support check
CHECK TABLE t1;
Table	Op	Msg_type	Msg_text
test.t1	check	note	The storage engine for the table doesn't support check
SHOW CREATE TABLE t1;
Table	Create Table
t1	CREATE TABLE `t1` (
  `a` int NOT NULL AUTO_INCREMENT,
  `b` int DEFAULT NULL,
  `d` int NOT NULL DEFAULT '100',
  `c` int NOT NULL DEFAULT '100',
  `e` int NOT NULL DEFAULT '100',
  `f` int NOT NULL DEFAULT '100',
  `g` int NOT NULL DEFAULT '100',
  PRIMARY KEY (`a`),
  KEY `e` (`e`)
) ENGINE=Dstore AUTO_INCREMENT=6 DEFAULT CHARSET=utf8mb4 COLLATE=utf8mb4_0900_ai_ci
DROP TABLE t1;
#
# Scenario 8:
# Check FK constraints on instantly added columns
#
CREATE TABLE t1 (a INT NOT NULL AUTO_INCREMENT PRIMARY KEY, b INT);
CREATE TABLE t2(a INT NOT NULL PRIMARY KEY, b INT, c INT, KEY(c));
INSERT INTO t1 VALUES(0, 1), (0, 2), (0, 3), (0, 4), (0, 5);
INSERT INTO t2 VALUES(1, 2, 3), (2, 3, 4), (3, 4, 5);
ALTER TABLE t1 ADD COLUMN c INT NOT NULL DEFAULT 3;
CHECK TABLE t1;
Table	Op	Msg_type	Msg_text
test.t1	check	note	The storage engine for the table doesn't support check
UPDATE t1 SET c = 4 WHERE a = 2;
UPDATE t1 SET c = 5 WHERE a = 3;
ALTER TABLE t1 ADD KEY(c);
ALTER TABLE t2 ADD FOREIGN KEY (c) REFERENCES t1(c) ON UPDATE CASCADE, ALGORITHM = COPY;
UPDATE t1 SET c = 10 WHERE a = 1;
SELECT c FROM t2;
c
10
4
5
UPDATE t1 SET c = 10;
SELECT c FROM t2;
c
10
10
10
CHECK TABLE t1;
Table	Op	Msg_type	Msg_text
test.t1	check	note	The storage engine for the table doesn't support check
SHOW CREATE TABLE t1;
Table	Create Table
t1	CREATE TABLE `t1` (
  `a` int NOT NULL AUTO_INCREMENT,
  `b` int DEFAULT NULL,
  `c` int NOT NULL DEFAULT '3',
  PRIMARY KEY (`a`),
  KEY `c` (`c`)
) ENGINE=Dstore AUTO_INCREMENT=6 DEFAULT CHARSET=utf8mb4 COLLATE=utf8mb4_0900_ai_ci
DROP TABLE t2;
DROP TABLE t1;
#
# Scenario 11:
# PRIMARY KEY with more than one column, at least to verify it works with REDUNDANT
#
CREATE TABLE t1 (a INT NOT NULL, b INT NOT NULL, PRIMARY KEY(a, b));;
INSERT INTO t1 VALUES(0, 1), (1, 2), (2, 3), (3, 4);
ALTER TABLE t1 ADD COLUMN c INT NOT NULL DEFAULT 5;
CHECK TABLE t1;
Table	Op	Msg_type	Msg_text
test.t1	check	note	The storage engine for the table doesn't support check
SELECT * FROM t1;
a	b	c
0	1	5
1	2	5
2	3	5
3	4	5
UPDATE t1 SET c = b WHERE b <= 2;
CHECK TABLE t1;
Table	Op	Msg_type	Msg_text
test.t1	check	note	The storage engine for the table doesn't support check
SELECT * FROM t1;
a	b	c
0	1	1
1	2	2
2	3	5
3	4	5
DROP TABLE t1;
#
# Scenario 16:
# Create a small table, and add INSTANT columns and verify with trigger
#
CREATE TABLE t1 (a INT NOT NULL AUTO_INCREMENT PRIMARY KEY, b INT);
CREATE TABLE t2 (a INT NOT NULL AUTO_INCREMENT PRIMARY KEY, b INT);
INSERT INTO t1 VALUES(0, 1), (0, 2), (0, 3), (0, 4), (0, 5);
INSERT INTO t2 VALUES(0, 1), (0, 2), (0, 3), (0, 4), (0, 5);
ALTER TABLE t1 ADD COLUMN c1 VARCHAR(10) NOT NULL DEFAULT 'aaaa', ALGORITHM = INSTANT;
CHECK TABLE t1;
Table	Op	Msg_type	Msg_text
test.t1	check	note	The storage engine for the table doesn't support check
CREATE TRIGGER t1_ai AFTER INSERT ON t1 FOR EACH ROW
INSERT INTO t2 VALUES(0,6);
INSERT INTO t1(a, c1) VALUES(0, 'bbbb');
SELECT count(*) = max(a) FROM t1 WHERE c1='aaaa';
count(*) = max(a)
1
SELECT c1 FROM t1 WHERE c1 = 'bbbb';
c1
bbbb
DROP TRIGGER t1_ai;
ALTER TABLE t2 ADD COLUMN c1 VARCHAR(10) NOT NULL DEFAULT 'cccc', ALGORITHM = INSTANT;
CHECK TABLE t1;
Table	Op	Msg_type	Msg_text
test.t1	check	note	The storage engine for the table doesn't support check
CREATE TRIGGER t2_ai AFTER INSERT ON t2 FOR EACH ROW
INSERT INTO t1(a,c1) VALUES(0,'eeee');
INSERT INTO t2(a, c1) VALUES(0, 'dddd');
SELECT count(*) = max(a) FROM t2 WHERE c1='cccc';
count(*) = max(a)
1
SELECT c1 FROM t2 WHERE c1 = 'dddd';
c1
dddd
DROP TRIGGER t2_ai;
CHECK TABLE t1;
Table	Op	Msg_type	Msg_text
test.t1	check	note	The storage engine for the table doesn't support check
CHECK TABLE t2;
Table	Op	Msg_type	Msg_text
test.t2	check	note	The storage engine for the table doesn't support check
SHOW CREATE TABLE t1;
Table	Create Table
t1	CREATE TABLE `t1` (
  `a` int NOT NULL AUTO_INCREMENT,
  `b` int DEFAULT NULL,
  `c1` varchar(10) NOT NULL DEFAULT 'aaaa',
  PRIMARY KEY (`a`)
) ENGINE=Dstore AUTO_INCREMENT=8 DEFAULT CHARSET=utf8mb4 COLLATE=utf8mb4_0900_ai_ci
SHOW CREATE TABLE t2;
Table	Create Table
t2	CREATE TABLE `t2` (
  `a` int NOT NULL AUTO_INCREMENT,
  `b` int DEFAULT NULL,
  `c1` varchar(10) NOT NULL DEFAULT 'cccc',
  PRIMARY KEY (`a`)
) ENGINE=Dstore AUTO_INCREMENT=8 DEFAULT CHARSET=utf8mb4 COLLATE=utf8mb4_0900_ai_ci
DROP TABLE t1,t2;
#
# Scenario 17:
# Create a small table, and add INSTANT columns and verify with storedprocedure
#
CREATE TABLE t1 (a INT NOT NULL AUTO_INCREMENT PRIMARY KEY, b INT);
INSERT INTO t1 VALUES(0, 1), (0, 2), (0, 3), (0, 4), (0, 5);
ALTER TABLE t1 ADD COLUMN c1 VARCHAR(10) NOT NULL DEFAULT 'aaaa', ALGORITHM = INSTANT;
CHECK TABLE t1;
Table	Op	Msg_type	Msg_text
test.t1	check	note	The storage engine for the table doesn't support check
CREATE PROCEDURE p1() INSERT INTO t1(a,c1) VALUES(0, 'bbbb');
CALL p1();
SELECT count(*) = max(a) FROM t1 WHERE c1='aaaa';
count(*) = max(a)
1
SELECT c1 FROM t1 WHERE c1 = 'bbbb';
c1
bbbb
DROP PROCEDURE p1;
CHECK TABLE t1;
Table	Op	Msg_type	Msg_text
test.t1	check	note	The storage engine for the table doesn't support check
SHOW CREATE TABLE t1;
Table	Create Table
t1	CREATE TABLE `t1` (
  `a` int NOT NULL AUTO_INCREMENT,
  `b` int DEFAULT NULL,
  `c1` varchar(10) NOT NULL DEFAULT 'aaaa',
  PRIMARY KEY (`a`)
) ENGINE=Dstore AUTO_INCREMENT=7 DEFAULT CHARSET=utf8mb4 COLLATE=utf8mb4_0900_ai_ci
DROP TABLE t1;
#
# Scenario 18:
# Create a small table, and add INSTANT columns and verify with view
#
CREATE TABLE t1 (a INT NOT NULL AUTO_INCREMENT PRIMARY KEY, b INT);
INSERT INTO t1 VALUES(0, 1), (0, 2), (0, 3), (0, 4), (0, 5);
ALTER TABLE t1 ADD COLUMN c1 VARCHAR(10) NOT NULL DEFAULT 'aaaa', ALGORITHM = INSTANT;
CHECK TABLE t1;
Table	Op	Msg_type	Msg_text
test.t1	check	note	The storage engine for the table doesn't support check
CREATE VIEW v1 AS SELECT * FROM t1;
INSERT INTO t1(a, c1) VALUES(0, 'bbbb');
SELECT count(*) = max(a) FROM t1 WHERE c1='aaaa';
count(*) = max(a)
1
SELECT c1 FROM t1 WHERE c1 = 'bbbb';
c1
bbbb
SELECT * FROM v1;
a	b	c1
1	1	aaaa
2	2	aaaa
3	3	aaaa
4	4	aaaa
5	5	aaaa
6	NULL	bbbb
DROP VIEW v1;
CHECK TABLE t1;
Table	Op	Msg_type	Msg_text
test.t1	check	note	The storage engine for the table doesn't support check
SHOW CREATE TABLE t1;
Table	Create Table
t1	CREATE TABLE `t1` (
  `a` int NOT NULL AUTO_INCREMENT,
  `b` int DEFAULT NULL,
  `c1` varchar(10) NOT NULL DEFAULT 'aaaa',
  PRIMARY KEY (`a`)
) ENGINE=Dstore AUTO_INCREMENT=7 DEFAULT CHARSET=utf8mb4 COLLATE=utf8mb4_0900_ai_ci
DROP TABLE t1;
#
# Scenario 19:
# Create a small table, and add INSTANT columns and drop it and verify
#
CREATE TABLE t1 (a INT NOT NULL AUTO_INCREMENT PRIMARY KEY, b INT);
INSERT INTO t1 VALUES(0, 1), (0, 2), (0, 3), (0, 4), (0, 5);
ALTER TABLE t1 ADD COLUMN c1 VARCHAR(10) NOT NULL DEFAULT 'aaaa', ALGORITHM = INSTANT;
CHECK TABLE t1;
Table	Op	Msg_type	Msg_text
test.t1	check	note	The storage engine for the table doesn't support check
INSERT INTO t1(a, c1) VALUES(0, 'bbbb');
SELECT count(*) = max(a) FROM t1 WHERE c1='aaaa';
count(*) = max(a)
1
SELECT c1 FROM t1 WHERE c1 = 'bbbb';
c1
bbbb
ALTER TABLE t1 DROP COLUMN c1;
CHECK TABLE t1;
Table	Op	Msg_type	Msg_text
test.t1	check	note	The storage engine for the table doesn't support check
CHECK TABLE t1;
Table	Op	Msg_type	Msg_text
test.t1	check	note	The storage engine for the table doesn't support check
SHOW CREATE TABLE t1;
Table	Create Table
t1	CREATE TABLE `t1` (
  `a` int NOT NULL AUTO_INCREMENT,
  `b` int DEFAULT NULL,
  PRIMARY KEY (`a`)
) ENGINE=Dstore AUTO_INCREMENT=7 DEFAULT CHARSET=utf8mb4 COLLATE=utf8mb4_0900_ai_ci
DROP TABLE t1;
#
# Scenario 20:
# Create a small table, and add INSTANT columns and rename table
#
CREATE TABLE t1 (a INT NOT NULL AUTO_INCREMENT PRIMARY KEY, b INT);
INSERT INTO t1 VALUES(0, 1), (0, 2), (0, 3), (0, 4), (0, 5);
ALTER TABLE t1 ADD COLUMN c1 VARCHAR(10) NOT NULL DEFAULT 'aaaa', ALGORITHM = INSTANT;
CHECK TABLE t1;
Table	Op	Msg_type	Msg_text
test.t1	check	note	The storage engine for the table doesn't support check
ALTER TABLE t1 RENAME t2;
INSERT INTO t2(a, c1) VALUES(0, 'bbbb');
SELECT count(*) = max(a) FROM t2 WHERE c1='aaaa';
count(*) = max(a)
1
SELECT c1 FROM t2 WHERE c1 = 'bbbb';
c1
bbbb
CHECK TABLE t2;
Table	Op	Msg_type	Msg_text
test.t2	check	note	The storage engine for the table doesn't support check
SHOW CREATE TABLE t2;
Table	Create Table
t2	CREATE TABLE `t2` (
  `a` int NOT NULL AUTO_INCREMENT,
  `b` int DEFAULT NULL,
  `c1` varchar(10) NOT NULL DEFAULT 'aaaa',
  PRIMARY KEY (`a`)
) ENGINE=Dstore AUTO_INCREMENT=7 DEFAULT CHARSET=utf8mb4 COLLATE=utf8mb4_0900_ai_ci
DROP TABLE t2;
#
# Scenario 21:
# Create a small table, and add INSTANT columns and change its data type INSTANTly won't work
#
CREATE TABLE t1 (a INT NOT NULL AUTO_INCREMENT PRIMARY KEY, b INT);
INSERT INTO t1 VALUES(0, 1), (0, 2), (0, 3), (0, 4), (0, 5);
ALTER TABLE t1 ADD COLUMN c1 VARCHAR(10) NOT NULL DEFAULT 'aaaa', ALGORITHM = INSTANT;
CHECK TABLE t1;
Table	Op	Msg_type	Msg_text
test.t1	check	note	The storage engine for the table doesn't support check
INSERT INTO t1(a, c1) VALUES(0, 'bbbb');
SELECT count(*) = max(a) FROM t1 WHERE c1='aaaa';
count(*) = max(a)
1
SELECT c1 FROM t1 WHERE c1 = 'bbbb';
c1
bbbb
ALTER TABLE t1 CHANGE c1 c2 CHAR(10) NOT NULL DEFAULT 'cccc';
CHECK TABLE t1;
Table	Op	Msg_type	Msg_text
test.t1	check	note	The storage engine for the table doesn't support check
CHECK TABLE t1;
Table	Op	Msg_type	Msg_text
test.t1	check	note	The storage engine for the table doesn't support check
SHOW CREATE TABLE t1;
Table	Create Table
t1	CREATE TABLE `t1` (
  `a` int NOT NULL AUTO_INCREMENT,
  `b` int DEFAULT NULL,
  `c2` char(10) NOT NULL DEFAULT 'cccc',
  PRIMARY KEY (`a`)
) ENGINE=Dstore AUTO_INCREMENT=7 DEFAULT CHARSET=utf8mb4 COLLATE=utf8mb4_0900_ai_ci
DROP TABLE t1;
#
# Scenario 22:
# Create a small table, and add INSTANT columns and create hash,btree multi column index and verify
#
CREATE TABLE t1 (a INT NOT NULL AUTO_INCREMENT PRIMARY KEY, b INT);
INSERT INTO t1 VALUES(0, 1), (0, 2), (0, 3), (0, 4), (0, 5);
ALTER TABLE t1 ADD COLUMN c1 VARCHAR(10) NOT NULL DEFAULT 'aaaa', ALGORITHM = INSTANT;
CHECK TABLE t1;
Table	Op	Msg_type	Msg_text
test.t1	check	note	The storage engine for the table doesn't support check
CREATE INDEX id1 ON t1(c1) USING BTREE;
CREATE INDEX id2 ON t1(c1) USING HASH;
Warnings:
Note	3502	This storage engine does not support the HASH index algorithm, storage engine default was used instead.
Warning	1831	Duplicate index 'id2' defined on the table 'test.t1'. This is deprecated and will be disallowed in a future release.
INSERT INTO t1(a, c1) VALUES(0, 'bbbb');
SELECT count(*) = max(a) FROM t1 WHERE c1='aaaa';
count(*) = max(a)
1
SELECT c1 FROM t1 WHERE c1 = 'bbbb';
c1
bbbb
DROP INDEX id1 ON t1;
DROP INDEX id2 ON t1;
ALTER TABLE t1 ADD COLUMN c2 VARCHAR(10) NOT NULL DEFAULT 'cccc', ALGORITHM = INSTANT;
CHECK TABLE t1;
Table	Op	Msg_type	Msg_text
test.t1	check	note	The storage engine for the table doesn't support check
CREATE INDEX id1 ON t1(c1 ASC,c2 DESC) USING BTREE;
INSERT INTO t1(a, c2) VALUES(0, 'dddd');
SELECT count(*) = max(a) FROM t1 WHERE c1='cccc';
count(*) = max(a)
NULL
SELECT c1 FROM t1 WHERE c1 = 'dddd';
c1
ALTER TABLE t1 RENAME INDEX id1 TO id2;
DROP INDEX id2 ON t1;
CHECK TABLE t1;
Table	Op	Msg_type	Msg_text
test.t1	check	note	The storage engine for the table doesn't support check
SHOW CREATE TABLE t1;
Table	Create Table
t1	CREATE TABLE `t1` (
  `a` int NOT NULL AUTO_INCREMENT,
  `b` int DEFAULT NULL,
  `c1` varchar(10) NOT NULL DEFAULT 'aaaa',
  `c2` varchar(10) NOT NULL DEFAULT 'cccc',
  PRIMARY KEY (`a`)
) ENGINE=Dstore AUTO_INCREMENT=8 DEFAULT CHARSET=utf8mb4 COLLATE=utf8mb4_0900_ai_ci
DROP TABLE t1;
#
# Scenario 23:
# Create a small table, and add INSTANT columns and perform table join operation
#
CREATE TABLE t1 (a INT NOT NULL AUTO_INCREMENT PRIMARY KEY, b INT);
CREATE TABLE t2 (a INT NOT NULL AUTO_INCREMENT PRIMARY KEY, b INT);
INSERT INTO t1 VALUES(0, 1), (0, 2), (0, 3), (0, 4), (0, 5);
INSERT INTO t2 VALUES(0, 1), (0, 2), (0, 3), (0, 4), (0, 5);
ALTER TABLE t1 ADD COLUMN c1 VARCHAR(10) NOT NULL DEFAULT 'aaaa', ALGORITHM = INSTANT;
CHECK TABLE t1;
Table	Op	Msg_type	Msg_text
test.t1	check	note	The storage engine for the table doesn't support check
INSERT INTO t1(a, c1) VALUES(0, 'cccc');
SELECT count(*) = max(a) FROM t1 WHERE c1='aaaa';
count(*) = max(a)
1
SELECT c1 FROM t1 WHERE c1 = 'cccc';
c1
cccc
ALTER TABLE t2 ADD COLUMN c1 VARCHAR(10) NOT NULL DEFAULT 'bbbb', ALGORITHM = INSTANT;
CHECK TABLE t1;
Table	Op	Msg_type	Msg_text
test.t1	check	note	The storage engine for the table doesn't support check
INSERT INTO t2(a, c1) VALUES(0, 'cccc');
SELECT count(*) = max(a) FROM t2 WHERE c1='bbbb';
count(*) = max(a)
1
SELECT c1 FROM t2 WHERE c1 = 'cccc';
c1
cccc
SELECT * FROM t1 JOIN t2 ON t1.c1=t2.c1;
a	b	c1	a	b	c1
6	NULL	cccc	6	NULL	cccc
CHECK TABLE t1;
Table	Op	Msg_type	Msg_text
test.t1	check	note	The storage engine for the table doesn't support check
CHECK TABLE t2;
Table	Op	Msg_type	Msg_text
test.t2	check	note	The storage engine for the table doesn't support check
SHOW CREATE TABLE t1;
Table	Create Table
t1	CREATE TABLE `t1` (
  `a` int NOT NULL AUTO_INCREMENT,
  `b` int DEFAULT NULL,
  `c1` varchar(10) NOT NULL DEFAULT 'aaaa',
  PRIMARY KEY (`a`)
) ENGINE=Dstore AUTO_INCREMENT=7 DEFAULT CHARSET=utf8mb4 COLLATE=utf8mb4_0900_ai_ci
SHOW CREATE TABLE t2;
Table	Create Table
t2	CREATE TABLE `t2` (
  `a` int NOT NULL AUTO_INCREMENT,
  `b` int DEFAULT NULL,
  `c1` varchar(10) NOT NULL DEFAULT 'bbbb',
  PRIMARY KEY (`a`)
) ENGINE=Dstore AUTO_INCREMENT=7 DEFAULT CHARSET=utf8mb4 COLLATE=utf8mb4_0900_ai_ci
DROP TABLE t1;
DROP TABLE t2;
#
# Scenario 24:
# Create a small table, and add stored and(or) virtual columns
# after last stored column in the table
#
CREATE TABLE t1 (a INT NOT NULL AUTO_INCREMENT PRIMARY KEY, b INT, c INT, d INT GENERATED ALWAYS AS (b + c) VIRTUAL, e INT GENERATED ALWAYS AS (b * c) VIRTUAL);
INSERT INTO t1(a, b, c) VALUES(0, 1, 2), (0, 2, 3), (0, 3, 4), (0, 4, 5), (0, 5, 6);
ALTER TABLE t1 ADD COLUMN h INT NOT NULL AFTER c;
CHECK TABLE t1;
Table	Op	Msg_type	Msg_text
test.t1	check	note	The storage engine for the table doesn't support check
INSERT INTO t1(a, b, c, h) VALUES(0, 6, 20, 40);
SELECT * FROM t1;
a	b	c	h	d	e
1	1	2	0	3	2
2	2	3	0	5	6
3	3	4	0	7	12
4	4	5	0	9	20
5	5	6	0	11	30
6	6	20	40	26	120
ALTER TABLE t1 ADD COLUMN i VARCHAR(100) DEFAULT 'ABCD EFGH' AFTER h, ADD COLUMN f INT GENERATED ALWAYS AS (LENGTH(i)) AFTER i;
CHECK TABLE t1;
Table	Op	Msg_type	Msg_text
test.t1	check	note	The storage engine for the table doesn't support check
INSERT INTO t1(a, b, c, h, i) VALUES(0, 20, 30, 50, 'qwerty');
SELECT * FROM t1;
a	b	c	h	i	f	d	e
1	1	2	0	ABCD EFGH	9	3	2
2	2	3	0	ABCD EFGH	9	5	6
3	3	4	0	ABCD EFGH	9	7	12
4	4	5	0	ABCD EFGH	9	9	20
5	5	6	0	ABCD EFGH	9	11	30
6	6	20	40	ABCD EFGH	9	26	120
7	20	30	50	qwerty	6	50	600
CHECK TABLE t1;
Table	Op	Msg_type	Msg_text
test.t1	check	note	The storage engine for the table doesn't support check
SHOW CREATE TABLE t1;
Table	Create Table
t1	CREATE TABLE `t1` (
  `a` int NOT NULL AUTO_INCREMENT,
  `b` int DEFAULT NULL,
  `c` int DEFAULT NULL,
  `h` int NOT NULL,
  `i` varchar(100) DEFAULT 'ABCD EFGH',
  `f` int GENERATED ALWAYS AS (length(`i`)) VIRTUAL,
  `d` int GENERATED ALWAYS AS ((`b` + `c`)) VIRTUAL,
  `e` int GENERATED ALWAYS AS ((`b` * `c`)) VIRTUAL,
  PRIMARY KEY (`a`)
) ENGINE=Dstore AUTO_INCREMENT=8 DEFAULT CHARSET=utf8mb4 COLLATE=utf8mb4_0900_ai_ci
DROP TABLE t1;
#
# Test cases which don't care about row format start here
#
#
# Bug #28040201	ADDING A NEW COLUMN TO A TABLE HAVING A GENRATED COLUMN
# CRASHES THE SERVER
#
CREATE TABLE t1 (a TEXT GENERATED ALWAYS AS (lpad(1, 1, 1)) VIRTUAL);
ALTER TABLE t1 ADD COLUMN (b INT);
SHOW CREATE TABLE t1;
Table	Create Table
t1	CREATE TABLE `t1` (
  `a` text GENERATED ALWAYS AS (lpad(1,1,_utf8mb4'1')) VIRTUAL,
  `b` int DEFAULT NULL
) ENGINE=Dstore DEFAULT CHARSET=utf8mb4 COLLATE=utf8mb4_0900_ai_ci
DROP TABLE t1;
#
# Check adding a stored columns(along with virtual columns)
# after the last stored column of a table with functional index
# should be fine
#
CREATE TABLE t1 (col1 INT, col2 INT AS (col1 + col1), INDEX (col2));
INSERT INTO t1(col1) VALUES(10), (20), (30), (40);
ALTER TABLE t1 ADD COLUMN new_col INT, ALGORITHM=INSTANT;
SELECT * FROM t1;
col1	col2	new_col
10	20	NULL
20	40	NULL
30	60	NULL
40	80	NULL
ALTER TABLE t1 ADD COLUMN new_col_1 INT, ADD COLUMN new_col_2 INT GENERATED ALWAYS AS (new_col * 3), ALGORITHM=INSTANT;
SHOW CREATE TABLE t1;
Table	Create Table
t1	CREATE TABLE `t1` (
  `col1` int DEFAULT NULL,
  `col2` int GENERATED ALWAYS AS ((`col1` + `col1`)) VIRTUAL,
  `new_col` int DEFAULT NULL,
  `new_col_1` int DEFAULT NULL,
  `new_col_2` int GENERATED ALWAYS AS ((`new_col` * 3)) VIRTUAL,
  KEY `col2` (`col2`)
) ENGINE=Dstore DEFAULT CHARSET=utf8mb4 COLLATE=utf8mb4_0900_ai_ci
CHECK TABLE t1;
Table	Op	Msg_type	Msg_text
test.t1	check	note	The storage engine for the table doesn't support check
DROP TABLE t1;
# Instant add column with functional index.
CREATE TABLE t1(time_col time(6) DEFAULT NULL, id INT, KEY index_time_col ((time_to_sec(time_col))));
ALTER TABLE t1 ADD COLUMN col1 int,ALGORITHM=INSTANT;
ALTER TABLE t1 DROP COLUMN id,ALGORITHM=INSTANT;
DROP TABLE t1;
# Bug #33673961: data is incorrect after instant add column
CREATE TABLE t1 (id INT NOT NULL AUTO_INCREMENT PRIMARY KEY, a char(10));
INSERT INTO t1 VALUES(1, 'aa');
INSERT INTO t1 VALUES(2, 'bb');
ALTER TABLE t1 ADD b VARCHAR(20), ALGORITHM=INSTANT;
INSERT INTO t1 VALUES(3, 'cc', 'dd');
DROP TABLE t1;
CREATE TABLE t1 (id INT NOT NULL AUTO_INCREMENT PRIMARY KEY, a char(10));
INSERT INTO t1 VALUES(1, 'aa');
INSERT INTO t1 VALUES(2, 'bb');
ALTER TABLE t1 ADD b VARCHAR(20), ALGORITHM=COPY;
INSERT INTO t1 VALUES(3, 'cc', 'dd');
CHECKSUM is same
DROP TABLE t1;
CREATE TABLE `t1` (
`id` int NOT NULL AUTO_INCREMENT,
`c1` int DEFAULT NULL,
`c2` int DEFAULT NULL,
`virtual_col` int AS ((`c1` + `c2`)) VIRTUAL,
PRIMARY KEY (`id`)
) ENGINE=Dstore;
ALTER TABLE t1 ADD COLUMN c3 FLOAT DEFAULT NULL;
ALTER TABLE t1 ADD COLUMN c4 FLOAT DEFAULT -1524051188;
DROP TABLE t1;
# Add testing for unsigned types.
CREATE TABLE t1 (a INT NOT NULL AUTO_INCREMENT PRIMARY KEY, b INT);
INSERT INTO t1 VALUES(0, 1), (0, 2), (0, 3), (0, 4), (0, 5);
ALTER TABLE t1 ADD COLUMN g1 TINYINT UNSIGNED NOT NULL DEFAULT 10;
ALTER TABLE t1 ADD COLUMN g2 SMALLINT UNSIGNED NOT NULL DEFAULT 123;
ALTER TABLE t1 ADD COLUMN g3 INT UNSIGNED NOT NULL DEFAULT 12345;
ALTER TABLE t1 ADD COLUMN g4 BIGINT UNSIGNED NOT NULL DEFAULT 12345;
ALTER TABLE t1 ADD COLUMN g5 ENUM('value1', 'value2', 'value3') NOT NULL DEFAULT 'value1';
ALTER TABLE t1 ADD COLUMN g6 YEAR NOT NULL DEFAULT '2024';
DROP TABLE t1;
CREATE TABLE `test1` (
`id` int NOT NULL,
`varchar_col2` varchar(255) DEFAULT NULL,
`varchar_col8111111111111111111111111111111111111111111111111111%` varchar(255) DEFAULT NULL,
`varchar_col81111111111111111111111111111111111111111111111111111` varchar(255) DEFAULT NULL,
`varchar_col3` varchar(255) DEFAULT NULL,
PRIMARY KEY (`id`));
insert into test1 values(1, 'aa', 'bb', 'cc', 'dd');
alter table test1 drop `varchar_col8111111111111111111111111111111111111111111111111111%`, drop `varchar_col81111111111111111111111111111111111111111111111111111`,algorithm=instant;
select * from test1;
id	varchar_col2	varchar_col3
1	aa	dd
drop table test1;
create table t1(c1 int, `!hidden!_dropped_v1_p0_c1` int);
alter table t1 drop column c1,algorithm=instant;
ERROR 42000: Incorrect column name '!hidden!_dropped_v1_p0_c1'
drop table t1;
CREATE TABLE t1 (c1 INT NOT NULL PRIMARY KEY) engine=dstore;
ALTER TABLE t1 CHANGE COLUMN c1 C1 INT;
ALTER TABLE t1 ADD COLUMN adress char(255) FIRST;
DROP TABLE t1;
