##############################################
# Test instant ADD/DROP COLUMN for REDUNDANT format
##############################################
SET SESSION debug= '+d,show_dropped_column';
# Scenario 1
create table t1 (c1 char(10), c2 char(10));
# DD Metadata of columns in table
NAME	ORDINAL_POSITION	TYPE	HAS_NO_DEFAULT	HIDDEN	SE_PRIVATE_DATA
c1	1	MYSQL_TYPE_STRING	0	Visible	NULL
c2	2	MYSQL_TYPE_STRING	0	Visible	NULL
insert into t1 values ("r1c1", "r1c2");
select * from t1;
c1	c2
r1c1	r1c2
alter table t1 add column c3 char(10) default "def_c3" after c1;
# DD Metadata of columns in table
NAME	ORDINAL_POSITION	TYPE	HAS_NO_DEFAULT	HIDDEN	SE_PRIVATE_DATA
c1	1	MYSQL_TYPE_STRING	0	Visible	physical_pos=0;
c3	2	MYSQL_TYPE_STRING	0	Visible	default=0a6465665f633320202020;physical_pos=2;version_added=1;
c2	3	MYSQL_TYPE_STRING	0	Visible	physical_pos=1;
insert into t1 values ("r2c1", "r2c3", "r2c2");
select * from t1;
c1	c3	c2
r1c1	def_c3	r1c2
r2c1	r2c3	r2c2
drop table t1;
# Scenario 2
create table t1 (c1 char(10), c2 char(10), c3 char(10));
insert into t1 values ("r1c1", "r1c2", "r1c3");
alter table t1 drop column c2;
# DD Metadata of columns in table
NAME	ORDINAL_POSITION	TYPE	HAS_NO_DEFAULT	HIDDEN	SE_PRIVATE_DATA
c1	1	MYSQL_TYPE_STRING	0	Visible	physical_pos=0;
c3	2	MYSQL_TYPE_STRING	0	Visible	physical_pos=2;
!hidden!_dropped_v1_p1_c2	3	MYSQL_TYPE_STRING	0	SE	default_null=1;physical_pos=1;version_dropped=1;
select * from t1;
c1	c3
r1c1	r1c3
drop table t1;
# Scenario 3
create table t1 (c1 char(10), c2 char(10));
insert into t1 values ("r1c1", "r1c2");
select * from t1;
c1	c2
r1c1	r1c2
alter table t1 add column c3 char(10) default "def_c3" after c1, algorithm=INSTANT;
insert into t1 values ("r2c1", "r2c3", "r2c2");
select * from t1;
c1	c3	c2
r1c1	def_c3	r1c2
r2c1	r2c3	r2c2
alter table t1 drop column c2, algorithm=INSTANT;
select * from t1;
c1	c3
r1c1	def_c3
r2c1	r2c3
drop table t1;
# Scenario 4
create table t1 (c1 char(10), c2 char(10), c3 char(10));
insert into t1 values ("r1c1", "r1c2", "r1c3");
select * from t1;
c1	c2	c3
r1c1	r1c2	r1c3
alter table t1 drop column c2;
select * from t1;
c1	c3
r1c1	r1c3
drop table t1;
# Scenario 5
create table t1 (c1 char(10), c2 char(10));
insert into t1 values ("r1c1", "r1c2");
alter table t1 add column c3 char(10) default "def_c3" after c1;
select * from t1;
c1	c3	c2
r1c1	def_c3	r1c2
insert into t1 value ("r2c1", "r2c3", "r2c2");
alter table t1 drop column c2;
select * from t1;
c1	c3
r1c1	def_c3
r2c1	r2c3
drop table t1;
# Scenario 6
create table t1 (c1 char(10), c2 char(10));
insert into t1 values ("r1c1", "r1c2");
alter table t1 add column c2 char(10) default "def_c3", drop column c2;
select * from t1;
c1	c2
r1c1	def_c3
insert into t1 value ("r2c1", "r2c2");
select * from t1;
c1	c2
r1c1	def_c3
r2c1	r2c2
drop table t1;
# Scenario 7
create table t1 (c1 char(10), c2 char(10));
insert into t1 values ("r1c1", "r1c2");
alter table t1 add column c3 int after c1;
select * from t1;
c1	c3	c2
r1c1	NULL	r1c2
insert into t1 value ("r2c1", 3, "r2c2");
select * from t1;
c1	c3	c2
r1c1	NULL	r1c2
r2c1	3	r2c2
alter table t1 drop column c2;
select * from t1;
c1	c3
r1c1	NULL
r2c1	3
drop table t1;
# Scenario 8
create table t1 (c1 char(10), c2 char(10), c3 char(10));
insert into t1 values ("r1c1", NULL, "r1c3");
select * from t1;
c1	c2	c3
r1c1	NULL	r1c3
alter table t1 drop column c2;
# DD Metadata of columns in table
NAME	ORDINAL_POSITION	TYPE	HAS_NO_DEFAULT	HIDDEN	SE_PRIVATE_DATA
c1	1	MYSQL_TYPE_STRING	0	Visible	physical_pos=0;
c3	2	MYSQL_TYPE_STRING	0	Visible	physical_pos=2;
!hidden!_dropped_v1_p1_c2	3	MYSQL_TYPE_STRING	0	SE	default_null=1;physical_pos=1;version_dropped=1;
select * from t1;
c1	c3
r1c1	r1c3
drop table t1;
# Scenario 9
CREATE TABLE t1 (C1 char(10), C2 char(10), C3 char(10)) ROW_FORMAT=REDUNDANT;
Warnings:
Warning	1178	The storage engine for the table doesn't support ROW_FORMAT
INSERT INTO t1 values ("r1c1", "r1c2", "r1c3");
alter table t1 drop column c1;
Warnings:
Warning	1178	The storage engine for the table doesn't support ROW_FORMAT
select * from t1;
C2	C3
r1c2	r1c3
alter table t1 drop column c3;
Warnings:
Warning	1178	The storage engine for the table doesn't support ROW_FORMAT
select * from t1;
C2
r1c2
drop table t1;
# Scenario 10
create table t1 (c1 char(10) KEY, c2 char(10), key sec_idx(c2));
insert into t1 values ("r1c1", "r1c2");
select * from t1;
c1	c2
r1c1	r1c2
alter table t1 add column c3 char(10) default "def_c3";
select * from t1;
c1	c2	c3
r1c1	r1c2	def_c3
insert into t1 values ("r2c1", "r2c2", "r3c3");
drop table t1;
# Scenario 13
CREATE TABLE t1(a INT) ROW_FORMAT=REDUNDANT;
Warnings:
Warning	1178	The storage engine for the table doesn't support ROW_FORMAT
INSERT INTO t1 VALUES(1);
ALTER TABLE t1 add COLUMN (f INT generated always as (a+1) virtual, g INT );
Warnings:
Warning	1178	The storage engine for the table doesn't support ROW_FORMAT
ALTER TABLE t1 add COLUMN (h INT generated always as (a+1) virtual), add INDEX idx (h), algorithm=inplace;
Warnings:
Warning	1178	The storage engine for the table doesn't support ROW_FORMAT
DROP TABLE t1;
# Scenario 14
CREATE TABLE t1 (col1 int(11) DEFAULT NULL, col2 int(11) DEFAULT NULL, col3 int(11) DEFAULT NULL, col4 int(11) DEFAULT NULL, col5 int(11) GENERATED ALWAYS AS (col4 * col2) VIRTUAL, col6 int(11) GENERATED ALWAYS AS (col2 % col4) VIRTUAL, col7 int(11) GENERATED ALWAYS AS (col5 / col6) VIRTUAL, col8 int(11) GENERATED ALWAYS AS (col5 + col5) VIRTUAL, col9 text, extra int(11) DEFAULT NULL) ROW_FORMAT=REDUNDANT;
Warnings:
Warning	1681	Integer display width is deprecated and will be removed in a future release.
Warning	1681	Integer display width is deprecated and will be removed in a future release.
Warning	1681	Integer display width is deprecated and will be removed in a future release.
Warning	1681	Integer display width is deprecated and will be removed in a future release.
Warning	1681	Integer display width is deprecated and will be removed in a future release.
Warning	1681	Integer display width is deprecated and will be removed in a future release.
Warning	1681	Integer display width is deprecated and will be removed in a future release.
Warning	1681	Integer display width is deprecated and will be removed in a future release.
Warning	1681	Integer display width is deprecated and will be removed in a future release.
Warning	1178	The storage engine for the table doesn't support ROW_FORMAT
ALTER TABLE t1 DROP COLUMN col7;
Warnings:
Warning	1178	The storage engine for the table doesn't support ROW_FORMAT
ALTER TABLE t1 DROP COLUMN col6, DROP COLUMN col9;
Warnings:
Warning	1178	The storage engine for the table doesn't support ROW_FORMAT
DROP TABLE t1;
# Scenario 16
CREATE TABLE t1 (a serial key, b text) ROW_FORMAT=REDUNDANT;
Warnings:
Warning	1178	The storage engine for the table doesn't support ROW_FORMAT
INSERT INTO t1(b) VALUES(repeat("a short string - ",5));
INSERT INTO t1(b) VALUES(repeat("a long string - ",50));
INSERT INTO t1(b) SELECT b FROM t1;
ALTER TABLE t1 ADD COLUMN (c int), algorithm=INSTANT;
Warnings:
Warning	1178	The storage engine for the table doesn't support ROW_FORMAT
ALTER TABLE t1 ADD INDEX c (c), algorithm=INSTANT;
ERROR 0A000: ALGORITHM=INSTANT is not supported for this operation. Try ALGORITHM=COPY/INPLACE.
ALTER TABLE t1 ADD INDEX c (c), algorithm=INPLACE;
Warnings:
Warning	1178	The storage engine for the table doesn't support ROW_FORMAT
DROP TABLE t1;
# Scenario 17
CREATE TABLE t1 (c1 char(20), c2 char(20), c3 char(20), c4 char(20)) ROW_FORMAT=REDUNDANT;
Warnings:
Warning	1178	The storage engine for the table doesn't support ROW_FORMAT
ALTER TABLE t1 DROP COLUMN c4, ALGORITHM=INSTANT;
Warnings:
Warning	1178	The storage engine for the table doesn't support ROW_FORMAT
ALTER TABLE t1 DROP COLUMN c2, ALGORITHM=INSTANT;
Warnings:
Warning	1178	The storage engine for the table doesn't support ROW_FORMAT
ALTER TABLE test.t1 ADD c6 char(20), DROP COLUMN c3;
Warnings:
Warning	1178	The storage engine for the table doesn't support ROW_FORMAT
DROP TABLE t1;
# Scenario 19
CREATE TABLE t1 (a INT, b INT, c INT, d INT) ENGINE=DStore ROW_FORMAT=REDUNDANT;
Warnings:
Warning	1178	The storage engine for the table doesn't support ROW_FORMAT
ALTER TABLE t1 ADD COLUMN aa INT DEFAULT 1 FIRST;
Warnings:
Warning	1178	The storage engine for the table doesn't support ROW_FORMAT
ALTER TABLE t1 CHANGE aa e INT;
Warnings:
Warning	1178	The storage engine for the table doesn't support ROW_FORMAT
INSERT INTO t1 VALUES (1,1,1,1,1);
ALTER TABLE t1 ADD COLUMN a INT DEFAULT 1 FIRST, DROP COLUMN a, CHANGE b b INT;
Warnings:
Warning	1178	The storage engine for the table doesn't support ROW_FORMAT
ALTER TABLE t1 ADD COLUMN aa INT DEFAULT 1 AFTER a, DROP COLUMN b, CHANGE c c INT;
Warnings:
Warning	1178	The storage engine for the table doesn't support ROW_FORMAT
ALTER TABLE t1 CHANGE aa b INT;
Warnings:
Warning	1178	The storage engine for the table doesn't support ROW_FORMAT
DROP TABLE t1;
# Scenario 21
CREATE PROCEDURE test.fill_table (IN start INT) BEGIN SET @idx =start; WHILE (@idx > 0) DO INSERT INTO test.t1 (v) VALUES("aaaaaaaaaaaaa"); SET @idx = @idx - 1; END WHILE; END|
CREATE TABLE t1(id INT UNSIGNED AUTO_INCREMENT PRIMARY KEY) ROW_FORMAT=REDUNDANT;
Warnings:
Warning	1178	The storage engine for the table doesn't support ROW_FORMAT
ALTER TABLE t1 ADD COLUMN v VARCHAR(255) DEFAULT "default_value", ALGORITHM=INSTANT;
Warnings:
Warning	1178	The storage engine for the table doesn't support ROW_FORMAT
call fill_table(400);
DROP PROCEDURE test.fill_table;
DROP TABLE t1;
# Scenario 22
CREATE TABLE t1(id INT UNSIGNED AUTO_INCREMENT PRIMARY KEY) ROW_FORMAT=REDUNDANT;
Warnings:
Warning	1178	The storage engine for the table doesn't support ROW_FORMAT
ALTER TABLE t1 ADD COLUMN v VARCHAR(255) DEFAULT "default_value", ALGORITHM=INSTANT;
Warnings:
Warning	1178	The storage engine for the table doesn't support ROW_FORMAT
INSERT INTO test.t1 (v) VALUES("aaaaaaaaaaaaa");
INSERT INTO test.t1 (v) VALUES("aaaaaaaaaaaaa");
INSERT INTO test.t1 (v) VALUES("aaaaaaaaaaaaa");
SELECT * FROM t1;
id	v
1	aaaaaaaaaaaaa
2	aaaaaaaaaaaaa
3	aaaaaaaaaaaaa
DROP TABLE t1;
# Scenario 23
create table t1 (c1 char(10), c2 char(10));
# DD Metadata of columns in table
NAME	ORDINAL_POSITION	TYPE	HAS_NO_DEFAULT	HIDDEN	SE_PRIVATE_DATA
c1	1	MYSQL_TYPE_STRING	0	Visible	NULL
c2	2	MYSQL_TYPE_STRING	0	Visible	NULL
insert into t1 values ("r1c1", "r1c2");
select * from t1;
c1	c2
r1c1	r1c2
alter table t1 add column c3 char(10) default "def_c3" after c1;
# DD Metadata of columns in table
NAME	ORDINAL_POSITION	TYPE	HAS_NO_DEFAULT	HIDDEN	SE_PRIVATE_DATA
c1	1	MYSQL_TYPE_STRING	0	Visible	physical_pos=0;
c3	2	MYSQL_TYPE_STRING	0	Visible	default=0a6465665f633320202020;physical_pos=2;version_added=1;
c2	3	MYSQL_TYPE_STRING	0	Visible	physical_pos=1;
insert into t1 values ("r2c1", "r2c3", "r2c2");
select * from t1;
c1	c3	c2
r1c1	def_c3	r1c2
r2c1	r2c3	r2c2
alter table t1 add column c3 char(10) default "newnewnew", drop column c3;
select * from t1;
c1	c2	c3
r1c1	r1c2	newnewnew
r2c1	r2c2	newnewnew
DROP TABLE t1;
# Scenario 24
CREATE TABLE t1 (c1 char(10)) ROW_FORMAT=REDUNDANT;
Warnings:
Warning	1178	The storage engine for the table doesn't support ROW_FORMAT
ALTER TABLE t1 ADD COLUMN c2 INT;
Warnings:
Warning	1178	The storage engine for the table doesn't support ROW_FORMAT
ALTER TABLE t1 DROP COLUMN c2;
Warnings:
Warning	1178	The storage engine for the table doesn't support ROW_FORMAT
INSERT INTO t1 (c1) VALUES("aaaa");
select * from t1;
c1
aaaa
check table t1;
Table	Op	Msg_type	Msg_text
test.t1	check	note	The storage engine for the table doesn't support check
DROP TABLE t1;
# Scenario 26
CREATE TABLE t1 (c1 char(10) KEY, c2 char(10)) ROW_FORMAT=REDUNDANT;
Warnings:
Warning	1178	The storage engine for the table doesn't support ROW_FORMAT
INSERT INTO t1 values ("row1_c1", "row1_c2");
ALTER TABLE t1 ADD COLUMN c3 char(20) DEFAULT "default_c3", ALGORITHM=INSTANT;
Warnings:
Warning	1178	The storage engine for the table doesn't support ROW_FORMAT
INSERT INTO t1 values ("row2_c1", "row2_c2", "row2_c3");
ALTER TABLE t1 ADD COLUMN c4 char(20) DEFAULT NULL AFTER c1, ALGORITHM=INSTANT;
Warnings:
Warning	1178	The storage engine for the table doesn't support ROW_FORMAT
INSERT INTO t1 values ("row3_c1", "row3_c4", "row3_c2", "row3_c3");
ALTER TABLE t1 force;
Warnings:
Warning	1178	The storage engine for the table doesn't support ROW_FORMAT
SELECT * FROM t1;
c1	c4	c2	c3
row1_c1	NULL	row1_c2	default_c3
row3_c1	row3_c4	row3_c2	row3_c3
row2_c1	NULL	row2_c2	row2_c3
ALTER TABLE t1 DROP COLUMN c3, ALGORITHM=INSTANT;
Warnings:
Warning	1178	The storage engine for the table doesn't support ROW_FORMAT
ALTER TABLE t1 ADD COLUMN c5 INT after c2, ALGORITHM=INSTANT;
Warnings:
Warning	1178	The storage engine for the table doesn't support ROW_FORMAT
ALTER TABLE t1 DROP COLUMN c2, ALGORITHM=INSTANT;
Warnings:
Warning	1178	The storage engine for the table doesn't support ROW_FORMAT
DROP TABLE t1;
# Scenario 27
CREATE TABLE t1 (a INT NOT NULL AUTO_INCREMENT PRIMARY KEY, b INT) ROW_FORMAT=REDUNDANT;
Warnings:
Warning	1178	The storage engine for the table doesn't support ROW_FORMAT
ALTER TABLE t1 ADD COLUMN c INT NOT NULL;
Warnings:
Warning	1178	The storage engine for the table doesn't support ROW_FORMAT
ALTER TABLE t1 ADD COLUMN d VARCHAR(100);
Warnings:
Warning	1178	The storage engine for the table doesn't support ROW_FORMAT
INSERT INTO t1 VALUES(0, 5, 20, 'Hello world');
DROP TABLE t1;
# Scenario 28
CREATE TABLE t1 (a INT NOT NULL AUTO_INCREMENT PRIMARY KEY, b INT) ROW_FORMAT=REDUNDANT;
Warnings:
Warning	1178	The storage engine for the table doesn't support ROW_FORMAT
INSERT INTO t1 VALUES(0, 1), (0, 2), (0, 3), (0, 4), (0, 5);
SELECT * from t1;
a	b
1	1
2	2
3	3
4	4
5	5
ALTER TABLE t1 ADD COLUMN c INT NOT NULL DEFAULT 100, ADD COLUMN d INT GENERATED ALWAYS AS ((c * 2 + b)) VIRTUAL, ADD COLUMN e VARCHAR(100) DEFAULT 'Hello world';
Warnings:
Warning	1178	The storage engine for the table doesn't support ROW_FORMAT
SELECT * from t1;
a	b	c	d	e
1	1	100	201	Hello world
2	2	100	202	Hello world
3	3	100	203	Hello world
4	4	100	204	Hello world
5	5	100	205	Hello world
UPDATE t1 SET c = 200 WHERE a > 3;
SELECT * from t1;
a	b	c	d	e
1	1	100	201	Hello world
2	2	100	202	Hello world
3	3	100	203	Hello world
4	4	200	404	Hello world
5	5	200	405	Hello world
DROP TABLE t1;
# Scenario 29
CREATE TABLE t1 (c1 INT NOT NULL AUTO_INCREMENT PRIMARY KEY, c2 INT) ROW_FORMAT=REDUNDANT;;
Warnings:
Warning	1178	The storage engine for the table doesn't support ROW_FORMAT
INSERT INTO t1 VALUES(0, 1);
SELECT * from t1;
c1	c2
1	1
ALTER TABLE t1 ADD COLUMN c3 INT, ALGORITHM=INSTANT;
Warnings:
Warning	1178	The storage engine for the table doesn't support ROW_FORMAT
SELECT * from t1;
c1	c2	c3
1	1	NULL
ALTER TABLE t1 ADD COLUMN c4 CHAR(100), ALGORITHM=INSTANT;
Warnings:
Warning	1178	The storage engine for the table doesn't support ROW_FORMAT
SELECT * from t1;
c1	c2	c3	c4
1	1	NULL	NULL
UPDATE t1 SET c3 = 2;
SELECT * from t1;
c1	c2	c3	c4
1	1	2	NULL
DROP TABLE t1;
# Scenario 30
CREATE TABLE t1 (c1 char(10), c2 char(10)) ROW_FORMAT=REDUNDANT;;
Warnings:
Warning	1178	The storage engine for the table doesn't support ROW_FORMAT
INSERT INTO t1 VALUES("r1c1", "r1c2");
SELECT * from t1;
c1	c2
r1c1	r1c2
ALTER TABLE t1 ADD COLUMN c3 INT, ALGORITHM=INSTANT;
Warnings:
Warning	1178	The storage engine for the table doesn't support ROW_FORMAT
SELECT * from t1;
c1	c2	c3
r1c1	r1c2	NULL
ALTER TABLE t1 ADD COLUMN c4 char(100), ALGORITHM=INSTANT;
Warnings:
Warning	1178	The storage engine for the table doesn't support ROW_FORMAT
SELECT * from t1;
c1	c2	c3	c4
r1c1	r1c2	NULL	NULL
UPDATE t1 SET c3 = 2;
SELECT * from t1;
c1	c2	c3	c4
r1c1	r1c2	2	NULL
DROP TABLE t1;
# Scenario 31
CREATE TABLE t1 (c1 char(10), c2 char(10)) ROW_FORMAT=REDUNDANT;
Warnings:
Warning	1178	The storage engine for the table doesn't support ROW_FORMAT
INSERT INTO t1 VALUES("r1c1", "r1c2");
ALTER TABLE t1 ADD COLUMN c3 char(10) default "def_c3";
Warnings:
Warning	1178	The storage engine for the table doesn't support ROW_FORMAT
SELECT * from t1;
c1	c2	c3
r1c1	r1c2	def_c3
UPDATE t1 SET c3 = "new_c3";
SELECT * from t1;
c1	c2	c3
r1c1	r1c2	new_c3
UPDATE t1 SET c3 = "new2_c3";
SELECT * from t1;
c1	c2	c3
r1c1	r1c2	new2_c3
DROP TABLE t1;
# Scenario 32
CREATE TABLE t1 (a INT NOT NULL, b INT NOT NULL, PRIMARY KEY(a, b)) ROW_FORMAT=REDUNDANT;
Warnings:
Warning	1178	The storage engine for the table doesn't support ROW_FORMAT
INSERT INTO t1 VALUES(0, 1), (1, 2), (2, 3), (3, 4);
ALTER TABLE t1 ADD COLUMN c INT NOT NULL DEFAULT 5;
Warnings:
Warning	1178	The storage engine for the table doesn't support ROW_FORMAT
CHECK TABLE t1;
Table	Op	Msg_type	Msg_text
test.t1	check	note	The storage engine for the table doesn't support check
SELECT * FROM t1;
a	b	c
0	1	5
1	2	5
2	3	5
3	4	5
UPDATE t1 SET c = b WHERE b <= 2;
CHECK TABLE t1;
Table	Op	Msg_type	Msg_text
test.t1	check	note	The storage engine for the table doesn't support check
SELECT * FROM t1;
a	b	c
0	1	1
1	2	2
2	3	5
3	4	5
DROP TABLE t1;
# Scenario 33
CREATE TABLE t1(c1 longtext) ROW_FORMAT=REDUNDANT;
Warnings:
Warning	1178	The storage engine for the table doesn't support ROW_FORMAT
INSERT INTO t1 VALUES (repeat('x', 8098));
SELECT SUBSTRING(c1, 1000, 32) FROM t1;
SUBSTRING(c1, 1000, 32)
xxxxxxxxxxxxxxxxxxxxxxxxxxxxxxxx
ALTER TABLE t1 ADD COLUMN c2 INT, ALGORITHM=INSTANT;
Warnings:
Warning	1178	The storage engine for the table doesn't support ROW_FORMAT
SELECT SUBSTRING(c1, 1000, 32), c2 FROM t1;
SUBSTRING(c1, 1000, 32)	c2
xxxxxxxxxxxxxxxxxxxxxxxxxxxxxxxx	NULL
BEGIN;
UPDATE t1 SET c2 = 0;
SELECT SUBSTRING(c1, 1000, 32), c2 FROM t1;
SUBSTRING(c1, 1000, 32)	c2
xxxxxxxxxxxxxxxxxxxxxxxxxxxxxxxx	0
ROLLBACK;
SELECT SUBSTRING(c1, 1000, 32), c2 FROM t1;
SUBSTRING(c1, 1000, 32)	c2
xxxxxxxxxxxxxxxxxxxxxxxxxxxxxxxx	NULL
DROP TABLE t1;
# Scenario 44
CREATE TABLE t1 (a BLOB, b BLOB, c BLOB GENERATED ALWAYS AS (CONCAT(a,b)) VIRTUAL, h VARCHAR(10) DEFAULT NULL) ROW_FORMAT=REDUNDANT;
Warnings:
Warning	1178	The storage engine for the table doesn't support ROW_FORMAT
INSERT INTO t1 VALUES (REPEAT('g', 16000), REPEAT('x', 16000), DEFAULT, "kk");
CREATE INDEX idx ON t1(c(100));
ERROR 42000: BLOB column 'c' can't be used in key specification with the used table type
SELECT length(c) FROM t1;
length(c)
32000
START TRANSACTION;
INSERT INTO t1 VALUES (REPEAT('a', 16000), REPEAT('b', 16000), DEFAULT, 'mm');
ROLLBACK;
select left(convert(c using UTF8MB4),10), right(convert(c using UTF8MB4),10) from t1;
left(convert(c using UTF8MB4),10)	right(convert(c using UTF8MB4),10)
gggggggggg	xxxxxxxxxx
INSERT INTO t1 VALUES (REPEAT('a', 16000), REPEAT('b', 16000), DEFAULT, 'mm');
select left(convert(c using UTF8MB4),10), right(convert(c using UTF8MB4),10) from t1;
left(convert(c using UTF8MB4),10)	right(convert(c using UTF8MB4),10)
gggggggggg	xxxxxxxxxx
aaaaaaaaaa	bbbbbbbbbb
START TRANSACTION;
UPDATE t1 SET a = REPEAT('m', 16000) WHERE a like "aaa%";
ROLLBACK;
select left(convert(c using UTF8MB4),10), right(convert(c using UTF8MB4),10) from t1;
left(convert(c using UTF8MB4),10)	right(convert(c using UTF8MB4),10)
gggggggggg	xxxxxxxxxx
aaaaaaaaaa	bbbbbbbbbb
DROP TABLE t1;
# Scenario 45
CREATE TABLE t1 (a INT, b INT, c INT GENERATED ALWAYS AS(a+b), h VARCHAR(10), j INT, m INT  GENERATED ALWAYS AS(b + j), n VARCHAR(10), p VARCHAR(20) GENERATED ALWAYS AS(CONCAT(n, h)), INDEX idx1(c), INDEX idx2 (m), INDEX idx3(p)) ROW_FORMAT=REDUNDANT;
Warnings:
Warning	1178	The storage engine for the table doesn't support ROW_FORMAT
INSERT INTO t1 VALUES(11, 22, DEFAULT, "AAA", 8, DEFAULT, "XXX", DEFAULT);
INSERT INTO t1 VALUES(1, 2, DEFAULT, "uuu", 9, DEFAULT, "uu", DEFAULT);
INSERT INTO t1 VALUES(3, 4, DEFAULT, "uooo", 1, DEFAULT, "umm", DEFAULT);
ALTER TABLE t1 DROP COLUMN c, algorithm=inplace;
Warnings:
Warning	1178	The storage engine for the table doesn't support ROW_FORMAT
ALTER TABLE t1 DROP COLUMN p, ADD COLUMN s VARCHAR(20) GENERATED ALWAYS AS(CONCAT(n, h)), algorithm=inplace;
Warnings:
Warning	1178	The storage engine for the table doesn't support ROW_FORMAT
DROP TABLE t1;
# Scenario 48
CREATE TABLE t1 (c1 integer PRIMARY KEY AUTO_INCREMENT, c2 integer NULL UNIQUE) ROW_FORMAT=REDUNDANT;
Warnings:
Warning	1178	The storage engine for the table doesn't support ROW_FORMAT
ALTER TABLE t1 ADD COLUMN c3 int;
Warnings:
Warning	1178	The storage engine for the table doesn't support ROW_FORMAT
ALTER TABLE t1 DROP COLUMN c3;
Warnings:
Warning	1178	The storage engine for the table doesn't support ROW_FORMAT
ALTER TABLE t1 ADD COLUMN c4 int DEFAULT 1;
Warnings:
Warning	1178	The storage engine for the table doesn't support ROW_FORMAT
ALTER TABLE t1 CHANGE COLUMN c4 c4_new int NULL DEFAULT 1;
Warnings:
Warning	1178	The storage engine for the table doesn't support ROW_FORMAT
ALTER TABLE t1 CHANGE COLUMN c4_new c4_new int NULL DEFAULT 1;
Warnings:
Warning	1178	The storage engine for the table doesn't support ROW_FORMAT
DROP TABLE t1;
# Scenario 49
CREATE TABLE t1 (c1 char(20) KEY, c2 enum('a', 'b', 'c')) ROW_FORMAT=REDUNDANT;
Warnings:
Warning	1178	The storage engine for the table doesn't support ROW_FORMAT
INSERT INTO t1 values ("row1_c1", "a");
SELECT * from t1;
c1	c2
row1_c1	a
ALTER TABLE t1 ADD COLUMN c3 enum('x', 'y', 'z'), ALGORITHM=INSTANT;
Warnings:
Warning	1178	The storage engine for the table doesn't support ROW_FORMAT
SELECT * from t1;
c1	c2	c3
row1_c1	a	NULL
INSERT INTO t1 values ("row2_c2", "b", "y");
SELECT * from t1;
c1	c2	c3
row1_c1	a	NULL
row2_c2	b	y
ALTER TABLE t1 DROP COLUMN c2, ALGORITHM=INSTANT;
Warnings:
Warning	1178	The storage engine for the table doesn't support ROW_FORMAT
SELECT * from t1;
c1	c3
row1_c1	NULL
row2_c2	y
DROP TABLE t1;
# Scenario 50
CREATE TABLE t1 (c1 char(10), c2 char(10)) ROW_FORMAT=REDUNDANT;
Warnings:
Warning	1178	The storage engine for the table doesn't support ROW_FORMAT
ALTER TABLE t1 DROP COLUMN c2;
Warnings:
Warning	1178	The storage engine for the table doesn't support ROW_FORMAT
truncate table t1;
truncate table t1;
truncate table t1;
DROP TABLE t1;
# Scenario 52
CREATE TABLE t1(c1 int, c2 int, c3 int, c4 DOUBLE GENERATED ALWAYS AS (c1+c2) STORED, c5 DOUBLE GENERATED ALWAYS AS (c1-c2) VIRTUAL) ROW_FORMAT=REDUNDANT;;
Warnings:
Warning	1178	The storage engine for the table doesn't support ROW_FORMAT
INSERT INTO t1(c1,c2,c3) VALUES (1,1,1);
SELECT * FROM t1;
c1	c2	c3	c4	c5
1	1	1	2	0
ALTER TABLE t1 DROP COLUMN c2, ALGORITHM=INSTANT;
ERROR HY000: Column 'c2' has a generated column dependency.
ALTER TABLE t1 DROP COLUMN c3, ALGORITHM=INSTANT;
Warnings:
Warning	1178	The storage engine for the table doesn't support ROW_FORMAT
SELECT * FROM t1;
c1	c2	c4	c5
1	1	2	0
ALTER TABLE t1 DROP COLUMN c4, ALGORITHM=INSTANT;
Warnings:
Warning	1178	The storage engine for the table doesn't support ROW_FORMAT
SELECT * FROM t1;
c1	c2	c5
1	1	0
ALTER TABLE t1 ADD COLUMN c6 DOUBLE GENERATED ALWAYS AS (2*c1+c2) VIRTUAL, ALGORITHM=INSTANT;
Warnings:
Warning	1178	The storage engine for the table doesn't support ROW_FORMAT
SELECT * FROM t1;
c1	c2	c5	c6
1	1	0	3
ALTER TABLE t1 ADD COLUMN c7 DOUBLE GENERATED ALWAYS AS (c1+2*c2) STORED, ALGORITHM=INSTANT;
ERROR 0A000: ALGORITHM=INSTANT is not supported for this operation. Try ALGORITHM=COPY/INPLACE.
SELECT * FROM t1;
c1	c2	c5	c6
1	1	0	3
ALTER TABLE t1 ADD COLUMN c8 DOUBLE GENERATED ALWAYS AS (c1+2*c2) VIRTUAL FIRST, ALGORITHM=INSTANT;
ERROR 0A000: ALGORITHM=INSTANT is not supported. Reason: INPLACE ADD or DROP of virtual columns cannot be combined with other ALTER TABLE actions. Try ALGORITHM=COPY/INPLACE.
SELECT * FROM t1;
c1	c2	c5	c6
1	1	0	3
ALTER TABLE t1 add column c3 int after c2, ALGORITHM=INSTANT;
Warnings:
Warning	1178	The storage engine for the table doesn't support ROW_FORMAT
SELECT * FROM t1;
c1	c2	c3	c5	c6
1	1	NULL	0	3
ALTER TABLE t1 DROP column c3, add column c10 int as (c1+c2) virtual, ALGORITHM=INSTANT;
Warnings:
Warning	1178	The storage engine for the table doesn't support ROW_FORMAT
SELECT * FROM t1;
c1	c2	c5	c6	c10
1	1	0	3	2
ALTER TABLE t1 add column c3 int after c2, ALGORITHM=INSTANT;
Warnings:
Warning	1178	The storage engine for the table doesn't support ROW_FORMAT
SELECT * FROM t1;
c1	c2	c3	c5	c6	c10
1	1	NULL	0	3	2
ALTER TABLE t1 DROP column c3, drop column c6, ALGORITHM=INSTANT;
Warnings:
Warning	1178	The storage engine for the table doesn't support ROW_FORMAT
SELECT * FROM t1;
c1	c2	c5	c10
1	1	0	2
ALTER TABLE t1 add column c3 int after c2, ALGORITHM=INSTANT;
Warnings:
Warning	1178	The storage engine for the table doesn't support ROW_FORMAT
SELECT * FROM t1;
c1	c2	c3	c5	c10
1	1	NULL	0	2
ALTER TABLE t1 DROP column c3, add column c11 int as (c1+c2) virtual first, ALGORITHM=INSTANT;
ERROR 0A000: ALGORITHM=INSTANT is not supported. Reason: INPLACE ADD or DROP of virtual columns cannot be combined with other ALTER TABLE actions. Try ALGORITHM=COPY/INPLACE.
SELECT * FROM t1;
c1	c2	c3	c5	c10
1	1	NULL	0	2
DROP TABLE t1;
# Scenario 53
# Table with functional index.
CREATE TABLE t1 (id int NOT NULL AUTO_INCREMENT KEY, c1 varchar(10) DEFAULT NULL, c2 varchar(10) DEFAULT NULL, INDEX idx((concat(c1, "c1")))) ROW_FORMAT=REDUNDANT;;
Warnings:
Warning	1178	The storage engine for the table doesn't support ROW_FORMAT
INSERT INTO t1(c1, c2) values("abc", "def");
SELECT * FROM t1;
id	c1	c2
1	abc	def
ALTER TABLE t1 DROP COLUMN c2, ADD COLUMN c3 varchar(10) as (c1) virtual after id, ALGORITHM=INSTANT;
ERROR 0A000: ALGORITHM=INSTANT is not supported. Reason: INPLACE ADD or DROP of virtual columns cannot be combined with other ALTER TABLE actions. Try ALGORITHM=COPY/INPLACE.
ALTER TABLE t1 DROP COLUMN c2, ADD COLUMN c3 varchar(10) as (c1) virtual, ALGORITHM=INSTANT;
ERROR 0A000: ALGORITHM=INSTANT is not supported. Reason: INPLACE ADD or DROP of virtual columns cannot be combined with other ALTER TABLE actions. Try ALGORITHM=COPY/INPLACE.
ALTER TABLE t1 DROP COLUMN c2, ALGORITHM=INSTANT;
Warnings:
Warning	1178	The storage engine for the table doesn't support ROW_FORMAT
SELECT * FROM t1;
id	c1
1	abc
DROP TABLE t1;
# Scenario 57
CREATE TABLE t1 (c1 CHAR(20), c2 CHAR(20), PRIMARY KEY PK(c1(4))) ROW_FORMAT=REDUNDANT;;
Warnings:
Warning	1178	The storage engine for the table doesn't support ROW_FORMAT
INSERT INTO t1 VALUES ("r1c1", "r1c2");
SELECT * FROM t1;
c1	c2
r1c1	r1c2
ALTER TABLE t1 ADD COLUMN c3 char(20) DEFAULT "c3_def", ALGORITHM=INSTANT;
Warnings:
Warning	1178	The storage engine for the table doesn't support ROW_FORMAT
INSERT INTO t1 VALUES ("r2c1", "r2c2", "r2c3");
SELECT * FROM t1;
c1	c2	c3
r1c1	r1c2	c3_def
r2c1	r2c2	r2c3
DROP TABLE t1;
# Scenario 58
# Validating record in table with INSTANT ADD/DROP columns
CREATE TABLE t1 (c1 CHAR(10), c2 CHAR(10)) ROW_FORMAT=REDUNDANT;
Warnings:
Warning	1178	The storage engine for the table doesn't support ROW_FORMAT
INSERT INTO t1 VALUES ("r1c1", "r1c2");
ALTER TABLE t1 ADD COLUMN c3 CHAR(10), ALGORITHM=INSTANT;
Warnings:
Warning	1178	The storage engine for the table doesn't support ROW_FORMAT
INSERT INTO t1 VALUES ("r2c1", "r2c2", "r2c3");
ALTER TABLE t1 DROP COLUMN c1, ALGORITHM=INSTANT;
Warnings:
Warning	1178	The storage engine for the table doesn't support ROW_FORMAT
INSERT INTO t1 (c2) VALUES ("r3c2");
ALTER TABLE t1 ADD COLUMN c4 CHAR(10), ALGORITHM=INSTANT;
Warnings:
Warning	1178	The storage engine for the table doesn't support ROW_FORMAT
INSERT INTO t1 (c2) VALUES ("r4c2");
SELECT * From t1;
c2	c3	c4
r1c2	NULL	NULL
r4c2	NULL	NULL
r3c2	NULL	NULL
r2c2	r2c3	NULL
DROP TABLE t1;
# Scenario 59
# A scenario when #fields were not updated correctly in REDUNDANT record for not-inplace update.
CREATE TABLE t1 (c1 VARCHAR(20), c2 CHAR(20)) ROW_FORMAT=REDUNDANT;
Warnings:
Warning	1178	The storage engine for the table doesn't support ROW_FORMAT
INSERT INTO t1 VALUES ("r1c1", "r1c2");
SELECT * FROM t1;
c1	c2
r1c1	r1c2
ALTER TABLE t1 DROP COLUMN c2, ALGORITHM=INSTANT;
Warnings:
Warning	1178	The storage engine for the table doesn't support ROW_FORMAT
UPDATE t1 SET c1="r1c11111111111";
SELECT * FROM t1;
c1
r1c11111111111
DROP TABLE t1;
# Scenario 61
# When a table is truncated, it's instant metadata is reset. It shall
# also reset instant metadata of columns.
CREATE TABLE t1 (c1 VARCHAR(1008)) ROW_FORMAT=REDUNDANT;
Warnings:
Warning	1178	The storage engine for the table doesn't support ROW_FORMAT
ALTER TABLE t1 ADD COLUMN c2 INT;
Warnings:
Warning	1178	The storage engine for the table doesn't support ROW_FORMAT
TRUNCATE TABLE t1;
INSERT INTO t1 (c1, c2) VALUES (CONCAT(REPEAT('z', 1008)),1);
INSERT INTO t1 (c1, c2) VALUES (CONCAT(REPEAT('z', 1008)),2);
INSERT INTO t1 (c1, c2) VALUES (CONCAT(REPEAT('z', 1008)),3);
INSERT INTO t1 (c1, c2) VALUES (CONCAT(REPEAT('z', 1008)),4);
INSERT INTO t1 (c1, c2) VALUES (CONCAT(REPEAT('z', 1008)),5);
INSERT INTO t1 (c1, c2) VALUES (CONCAT(REPEAT('z', 1008)),6);
INSERT INTO t1 (c1, c2) VALUES (CONCAT(REPEAT('z', 1008)),7);
INSERT INTO t1 (c1, c2) VALUES (CONCAT(REPEAT('z', 1008)),8);
ALTER TABLE t1 ADD COLUMN c3 VARCHAR(500);
Warnings:
Warning	1178	The storage engine for the table doesn't support ROW_FORMAT
UPDATE t1 SET c3 = CONCAT(REPEAT('c', 500));
DROP TABLE t1;
# Scenario 64
# When nullbitmap size on physical record changes after INSTANT ADD columns.
CREATE TABLE t1 (c0 char(9) KEY, c1 char (10), c2 char(20), c3 char(30), c4 char(40), c5 char(50), c6 char(60), c7 char(70), c8 char(80)) ROW_FORMAT=REDUNDANT;
Warnings:
Warning	1178	The storage engine for the table doesn't support ROW_FORMAT
Insert into t1 values(
REPEAT("a", 8),
REPEAT("1", 9),
REPEAT("2", 19),
REPEAT("3", 29),
REPEAT("4", 39),
REPEAT("5", 49),
REPEAT("6", 59),
REPEAT("7", 69),
REPEAT("8", 79));
Insert into t1 values(
REPEAT("b", 8),
REPEAT("1", 9),
REPEAT("2", 19),
REPEAT("3", 29),
REPEAT("4", 39),
REPEAT("5", 49),
REPEAT("6", 59),
REPEAT("7", 69),
REPEAT("8", 79));
Alter table t1 add column c9 char(90);
Warnings:
Warning	1178	The storage engine for the table doesn't support ROW_FORMAT
Insert into t1 values(
REPEAT("c", 8),
REPEAT("1", 9),
REPEAT("2", 19),
REPEAT("3", 29),
REPEAT("4", 39),
REPEAT("5", 49),
REPEAT("6", 59),
REPEAT("7", 69),
REPEAT("8", 79),
REPEAT("9", 89));
DROP table t1;
###########
# CLEANUP #
###########
