CREATE TABLE employees (
id INT AUTO_INCREMENT PRIMARY KEY,
name VARCHAR(100),
salary INT
);
CREATE INDEX idx_salary ON employees(salary);
INSERT INTO employees(name, salary) VALUES
('Alice', 1500),
('Bob', 2500),
('Charlie', 3500),
('David', 1200),
('Eve', 3200),
('Frank', 1800),
('Grace', 3100),
('Helen', 2800),
('Ivy', 1900),
('Jack', 3300);
ANALYZE TABLE employees UPDATE HISTOGRAM ON salary;
Table	Op	Msg_type	Msg_text
test.employees	histogram	status	Histogram statistics created for column 'salary'.
ANALYZE TABLE employees;
Table	Op	Msg_type	Msg_text
test.employees	analyze	status	OK
set optimizer_switch='mrr=on,mrr_cost_based=off';
explain SELECT * FROM employees WHERE salary BETWEEN 1000 AND 2000 OR salary BETWEEN 3000 AND 4000 ORDER BY id;
id	select_type	table	partitions	type	possible_keys	key	key_len	ref	rows	filtered	Extra
1	SIMPLE	employees	NULL	range	idx_salary	idx_salary	5	NULL	8	100.00	Using index condition; Using MRR; Using filesort
Warnings:
Note	1003	/* select#1 */ select `test`.`employees`.`id` AS `id`,`test`.`employees`.`name` AS `name`,`test`.`employees`.`salary` AS `salary` from `test`.`employees` where ((`test`.`employees`.`salary` between 1000 and 2000) or (`test`.`employees`.`salary` between 3000 and 4000)) order by `test`.`employees`.`id`
SELECT * FROM employees WHERE salary BETWEEN 1000 AND 2000 OR salary BETWEEN 3000 AND 4000 ORDER BY id;
id	name	salary
1	Alice	1500
3	Charlie	3500
4	David	1200
5	Eve	3200
6	Frank	1800
7	Grace	3100
9	Ivy	1900
10	Jack	3300
explain SELECT /*+ NO_MRR(employees) */ * FROM employees WHERE salary BETWEEN 1000 AND 2000 OR salary BETWEEN 3000 AND 4000 ORDER BY id;
id	select_type	table	partitions	type	possible_keys	key	key_len	ref	rows	filtered	Extra
1	SIMPLE	employees	NULL	range	idx_salary	idx_salary	5	NULL	8	100.00	Using index condition; Using filesort
Warnings:
Note	1003	/* select#1 */ select /*+ NO_MRR(`employees`@`select#1`) */ `test`.`employees`.`id` AS `id`,`test`.`employees`.`name` AS `name`,`test`.`employees`.`salary` AS `salary` from `test`.`employees` where ((`test`.`employees`.`salary` between 1000 and 2000) or (`test`.`employees`.`salary` between 3000 and 4000)) order by `test`.`employees`.`id`
SELECT /*+ NO_MRR(employees) */ * FROM employees WHERE salary BETWEEN 1000 AND 2000 OR salary BETWEEN 3000 AND 4000 ORDER BY id;
id	name	salary
1	Alice	1500
3	Charlie	3500
4	David	1200
5	Eve	3200
6	Frank	1800
7	Grace	3100
9	Ivy	1900
10	Jack	3300
drop table employees;
set optimizer_switch=default;
CREATE TABLE departments (
dept_id INT AUTO_INCREMENT PRIMARY KEY,
dept_name VARCHAR(100)
);
INSERT INTO departments (dept_name) VALUES
('HR'),
('Finance'),
('Engineering'),
('Marketing'),
('Sales');
ANALYZE TABLE departments UPDATE HISTOGRAM ON dept_id;
Table	Op	Msg_type	Msg_text
test.departments	histogram	status	Histogram statistics created for column 'dept_id'.
ANALYZE TABLE departments;
Table	Op	Msg_type	Msg_text
test.departments	analyze	status	OK
CREATE TABLE employees (
emp_id INT AUTO_INCREMENT PRIMARY KEY,
emp_name VARCHAR(100),
salary INT,
dept_id INT,
FOREIGN KEY (dept_id) REFERENCES departments(dept_id)
);
CREATE INDEX idx_dept_id ON employees(dept_id);
INSERT INTO employees (emp_name, salary, dept_id) VALUES
('Alice', 5000, 1),
('Bob', 6000, 2),
('Charlie', 7000, 3),
('David', 5500, 1),
('Eve', 8000, 3),
('Frank', 5800, 2),
('Grace', 7500, 4),
('Helen', 8500, 5),
('Ivy', 6500, 4),
('Jack', 9000, 5);
INSERT INTO employees (emp_name, salary, dept_id) VALUES
('Alice', 5000, 1),
('Bob', 6000, 2),
('Charlie', 7000, 3),
('David', 5500, 1),
('Eve', 8000, 3),
('Frank', 5800, 2),
('Grace', 7500, 4),
('Helen', 8500, 5),
('Ivy', 6500, 4),
('Jack', 9000, 5);
ANALYZE TABLE employees UPDATE HISTOGRAM ON emp_id,dept_id;
Table	Op	Msg_type	Msg_text
test.employees	histogram	status	Histogram statistics created for column 'dept_id'.
test.employees	histogram	status	Histogram statistics created for column 'emp_id'.
ANALYZE TABLE employees;
Table	Op	Msg_type	Msg_text
test.employees	analyze	status	OK
set optimizer_switch='mrr=on,mrr_cost_based=off,batched_key_access=on';
EXPLAIN SELECT e.emp_name, e.salary, d.dept_name FROM employees e JOIN departments d ON e.dept_id = d.dept_id ORDER BY 1;
id	select_type	table	partitions	type	possible_keys	key	key_len	ref	rows	filtered	Extra
1	SIMPLE	d	NULL	ALL	PRIMARY	NULL	NULL	NULL	5	100.00	Using temporary; Using filesort
1	SIMPLE	e	NULL	ref	idx_dept_id	idx_dept_id	5	test.d.dept_id	4	100.00	Using join buffer (Batched Key Access)
Warnings:
Note	1003	/* select#1 */ select `test`.`e`.`emp_name` AS `emp_name`,`test`.`e`.`salary` AS `salary`,`test`.`d`.`dept_name` AS `dept_name` from `test`.`employees` `e` join `test`.`departments` `d` where (`test`.`e`.`dept_id` = `test`.`d`.`dept_id`) order by `test`.`e`.`emp_name`
SELECT e.emp_name, e.salary, d.dept_name FROM employees e JOIN departments d ON e.dept_id = d.dept_id ORDER BY 1;
emp_name	salary	dept_name
Alice	5000	HR
Alice	5000	HR
Bob	6000	Finance
Bob	6000	Finance
Charlie	7000	Engineering
Charlie	7000	Engineering
David	5500	HR
David	5500	HR
Eve	8000	Engineering
Eve	8000	Engineering
Frank	5800	Finance
Frank	5800	Finance
Grace	7500	Marketing
Grace	7500	Marketing
Helen	8500	Sales
Helen	8500	Sales
Ivy	6500	Marketing
Ivy	6500	Marketing
Jack	9000	Sales
Jack	9000	Sales
EXPLAIN SELECT /*+ NO_BKA(e) */ e.emp_name, e.salary, d.dept_name FROM employees e JOIN departments d ON e.dept_id = d.dept_id ORDER BY 1;
id	select_type	table	partitions	type	possible_keys	key	key_len	ref	rows	filtered	Extra
1	SIMPLE	d	NULL	ALL	PRIMARY	NULL	NULL	NULL	5	100.00	Using temporary; Using filesort
1	SIMPLE	e	NULL	ref	idx_dept_id	idx_dept_id	5	test.d.dept_id	4	100.00	NULL
Warnings:
Note	1003	/* select#1 */ select /*+ NO_BKA(`e`@`select#1`) */ `test`.`e`.`emp_name` AS `emp_name`,`test`.`e`.`salary` AS `salary`,`test`.`d`.`dept_name` AS `dept_name` from `test`.`employees` `e` join `test`.`departments` `d` where (`test`.`e`.`dept_id` = `test`.`d`.`dept_id`) order by `test`.`e`.`emp_name`
SELECT /*+ NO_BKA(e) */ e.emp_name, e.salary, d.dept_name FROM employees e JOIN departments d ON e.dept_id = d.dept_id ORDER BY 1;
emp_name	salary	dept_name
Alice	5000	HR
Alice	5000	HR
Bob	6000	Finance
Bob	6000	Finance
Charlie	7000	Engineering
Charlie	7000	Engineering
David	5500	HR
David	5500	HR
Eve	8000	Engineering
Eve	8000	Engineering
Frank	5800	Finance
Frank	5800	Finance
Grace	7500	Marketing
Grace	7500	Marketing
Helen	8500	Sales
Helen	8500	Sales
Ivy	6500	Marketing
Ivy	6500	Marketing
Jack	9000	Sales
Jack	9000	Sales
drop table employees, departments;
set optimizer_switch='mrr=on,mrr_cost_based=off,batched_key_access=on';
CREATE TABLE orders (
id INT PRIMARY KEY AUTO_INCREMENT,
user_id INT NOT NULL,
amount DECIMAL(10,2),
status VARCHAR(20),
INDEX idx_user_id (user_id)
) ENGINE=Dstore;
INSERT INTO orders (user_id, amount, status)
WITH RECURSIVE seq AS (
SELECT 1 AS n UNION ALL SELECT n+1 FROM seq WHERE n < 100
)
SELECT 
150 + ((n-1) % 101),
10.00 + ((n % 101) * 0.5),
CASE WHEN 150 + ((n-1) % 101) < 200 THEN 'pending' ELSE 'completed' END
FROM seq;
ANALYZE TABLE orders UPDATE HISTOGRAM ON id,user_id;
Table	Op	Msg_type	Msg_text
test.orders	histogram	status	Histogram statistics created for column 'id'.
test.orders	histogram	status	Histogram statistics created for column 'user_id'.
ANALYZE TABLE orders;
Table	Op	Msg_type	Msg_text
test.orders	analyze	status	OK
BEGIN;
EXPLAIN SELECT * FROM orders WHERE user_id BETWEEN 180 AND 220 AND status = 'pending' FOR UPDATE;
id	select_type	table	partitions	type	possible_keys	key	key_len	ref	rows	filtered	Extra
1	SIMPLE	orders	NULL	range	idx_user_id	idx_user_id	4	NULL	41	10.00	Using where; Using MRR
Warnings:
Note	1003	/* select#1 */ select `test`.`orders`.`id` AS `id`,`test`.`orders`.`user_id` AS `user_id`,`test`.`orders`.`amount` AS `amount`,`test`.`orders`.`status` AS `status` from `test`.`orders` where ((`test`.`orders`.`status` = 'pending') and (`test`.`orders`.`user_id` between 180 and 220))
SELECT * FROM orders WHERE user_id BETWEEN 180 AND 220 AND status = 'pending' limit 5 FOR UPDATE;
id	user_id	amount	status
31	180	25.50	pending
32	181	26.00	pending
33	182	26.50	pending
34	183	27.00	pending
35	184	27.50	pending
UPDATE orders SET amount = amount * 1.1 WHERE user_id BETWEEN 180 AND 220;
SELECT * FROM orders WHERE user_id BETWEEN 180 AND 220 AND status = 'pending' limit 5;
id	user_id	amount	status
31	180	28.05	pending
32	181	28.60	pending
33	182	29.15	pending
34	183	29.70	pending
35	184	30.25	pending
COMMIT;
DROP TABLE orders;
CREATE TABLE t_shared_lock (
id INT PRIMARY KEY AUTO_INCREMENT,
user_id INT NOT NULL,
amount DECIMAL(10,2),
status VARCHAR(20),
INDEX idx_user_id (user_id))
ENGINE=Dstore;
INSERT INTO t_shared_lock (user_id, amount, status) VALUES
(150, 10.00, 'pending'),
(160, 15.00, 'completed'),
(170, 20.00, 'pending'),
(180, 25.00, 'completed');
BEGIN;
SELECT * FROM t_shared_lock WHERE user_id BETWEEN 150 AND 180 AND status = 'pending';
id	user_id	amount	status
1	150	10.00	pending
3	170	20.00	pending
COMMIT;
CALL mtr.add_suppression(".*CDELockTuple failed.*");
SET SESSION DEBUG='+d,cde_lock_tuple_injection';
SELECT * FROM t_shared_lock WHERE user_id BETWEEN 150 AND 180 AND status = 'pending';
id	user_id	amount	status
1	150	10.00	pending
3	170	20.00	pending
SET SESSION DEBUG='-d,cde_lock_tuple_injection';
CALL mtr.add_suppression(".*FetchTuple fail.*");
SET SESSION DEBUG='+d,cde_fetch_tuple_injection';
SELECT * FROM t_shared_lock WHERE user_id BETWEEN 150 AND 180 AND status = 'pending';
ERROR HY000: Got error 168 - 'Unknown (generic) error from engine' from storage engine
SET SESSION DEBUG='-d,cde_fetch_tuple_injection';
DROP TABLE t_shared_lock;
set optimizer_switch=default;
