# -------------------------------
# -------------------------------
# Content of the test file:
# Offset pushdown and non-locking read
SET @old_dstore_lock_wait_timeout = @@global.dstore_lock_wait_timeout;
SET @@global.dstore_lock_wait_timeout = 1;
CREATE TABLE `tv` (
`id` int NOT NULL,
`c` int NOT NULL,
`data` varchar(32) DEFAULT NULL,
PRIMARY KEY (`id`),
KEY `idx_tv_c` (`c`)
);
INSERT INTO tv VALUES (5,5,'row1'), (6,6,'row2'),(7,7,'row3'), (8,8,'row4');
start transaction;
SELECT * FROM tv WHERE c > 5  LIMIT 1 OFFSET 1 FOR UPDATE;
id	c	data
7	7	row3
# Check that we don't skip any rows
START TRANSACTION;
SELECT * FROM tv WHERE c > 5  LIMIT 1 OFFSET 2 FOR UPDATE;
ERROR HY000: Lock wait timeout exceeded; try restarting transaction
SELECT /*+ NO_OFFSET_PUSHDOWN() */ * FROM tv WHERE c > 5  LIMIT 1 OFFSET 2 FOR UPDATE;
ERROR HY000: Lock wait timeout exceeded; try restarting transaction
rollback;
rollback;
start transaction;
SELECT * FROM tv WHERE c > 5  LIMIT 1 OFFSET 1 FOR UPDATE;
id	c	data
7	7	row3
START TRANSACTION;
update tv set data='row0' where id =5;
update tv set data='row0' where id =6;
ERROR HY000: Lock wait timeout exceeded; try restarting transaction
update tv set data='row0' where id =7;
ERROR HY000: Lock wait timeout exceeded; try restarting transaction
update tv set data='row0' where id =8;
rollback;
rollback;
start transaction;
SELECT c FROM tv WHERE c > 5  LIMIT 1 OFFSET 1 FOR UPDATE;
c
7
START TRANSACTION;
update tv set data='row0' where id =5;
update tv set data='row0' where id =6;
ERROR HY000: Lock wait timeout exceeded; try restarting transaction
update tv set data='row0' where id =7;
ERROR HY000: Lock wait timeout exceeded; try restarting transaction
update tv set data='row0' where id =8;
rollback;
rollback;
start transaction;
SELECT * FROM tv LIMIT 1 OFFSET 1 FOR UPDATE;
id	c	data
6	6	row2
START TRANSACTION;
update tv set data='row0' where id =5;
ERROR HY000: Lock wait timeout exceeded; try restarting transaction
update tv set data='row0' where id =6;
ERROR HY000: Lock wait timeout exceeded; try restarting transaction
update tv set data='row0' where id =7;
update tv set data='row0' where id =8;
rollback;
rollback;
start transaction;
SELECT c FROM tv LIMIT 1 OFFSET 1 FOR UPDATE;
c
6
START TRANSACTION;
update tv set data='row0' where id =5;
ERROR HY000: Lock wait timeout exceeded; try restarting transaction
update tv set data='row0' where id =6;
ERROR HY000: Lock wait timeout exceeded; try restarting transaction
update tv set data='row0' where id =7;
update tv set data='row0' where id =8;
rollback;
rollback;
DROP TABLE tv;
# Restore orig wait timeout
# BOTTOM
show variables LIKE '%dstore_lock_wait_timeout%';
Variable_name	Value
dstore_lock_wait_timeout	1
SET @@global.dstore_lock_wait_timeout = @old_dstore_lock_wait_timeout;
show variables LIKE '%dstore_lock_wait_timeout%';
Variable_name	Value
dstore_lock_wait_timeout	50
