#
# Bug#20443863 USE OF WORST_SEEKS IN FIND_BEST_REF() CAN LEAD TO
#              WRONG QUERY PLAN
#
CREATE TABLE t1 (
i1 INTEGER,
i2 INTEGER,
i3 INTEGER,
KEY(i1,i2)
) ENGINE=Dstore;
INSERT INTO t1 VALUES (1, 1, 1), (1, 1, 1),(1, 1, 1),(1, 1, 1),
(2, 2, 1), (2, 2, 1),(2, 2, 1),(2, 2, 1),
(3, 3, 1), (3, 3, 1),(3, 3, 1),(3, 3, 1);
ANALYZE TABLE t1 UPDATE HISTOGRAM ON i1,i2;
Table	Op	Msg_type	Msg_text
test.t1	histogram	status	Histogram statistics created for column 'i1'.
test.t1	histogram	status	Histogram statistics created for column 'i2'.
EXPLAIN FORMAT=JSON SELECT i3 FROM t1 WHERE i1 = 1 AND i2 = 1;
EXPLAIN
{
  "query_block": {
    "select_id": 1,
    "cost_info": {
      "query_cost": "0.35"
    },
    "table": {
      "table_name": "t1",
      "access_type": "ref",
      "possible_keys": [
        "i1"
      ],
      "key": "i1",
      "used_key_parts": [
        "i1",
        "i2"
      ],
      "key_length": "10",
      "ref": [
        "const",
        "const"
      ],
      "rows_examined_per_scan": 1,
      "rows_produced_per_join": 1,
      "filtered": "100.00",
      "cost_info": {
        "read_cost": "0.25",
        "eval_cost": "0.10",
        "prefix_cost": "0.35",
        "data_read_per_join": "16"
      },
      "used_columns": [
        "i1",
        "i2",
        "i3"
      ]
    }
  }
}
Warnings:
Note	1003	/* select#1 */ select `test`.`t1`.`i3` AS `i3` from `test`.`t1` where ((`test`.`t1`.`i2` = 1) and (`test`.`t1`.`i1` = 1))
EXPLAIN FORMAT=JSON SELECT i3 FROM t1 WHERE i1 = 1 AND i3 = 1;
EXPLAIN
{
  "query_block": {
    "select_id": 1,
    "cost_info": {
      "query_cost": "0.90"
    },
    "table": {
      "table_name": "t1",
      "access_type": "ref",
      "possible_keys": [
        "i1"
      ],
      "key": "i1",
      "used_key_parts": [
        "i1"
      ],
      "key_length": "5",
      "ref": [
        "const"
      ],
      "rows_examined_per_scan": 4,
      "rows_produced_per_join": 0,
      "filtered": "10.00",
      "cost_info": {
        "read_cost": "0.50",
        "eval_cost": "0.04",
        "prefix_cost": "0.90",
        "data_read_per_join": "6"
      },
      "used_columns": [
        "i1",
        "i3"
      ],
      "attached_condition": "(`test`.`t1`.`i3` = 1)"
    }
  }
}
Warnings:
Note	1003	/* select#1 */ select `test`.`t1`.`i3` AS `i3` from `test`.`t1` where ((`test`.`t1`.`i3` = 1) and (`test`.`t1`.`i1` = 1))
UPDATE mysql.server_cost
SET cost_value=0.1
WHERE cost_name="row_evaluate_cost";
UPDATE mysql.server_cost
SET cost_value=0.05
WHERE cost_name="key_compare_cost";
UPDATE mysql.server_cost
SET cost_value=1.0
WHERE cost_name="memory_temptable_create_cost";
UPDATE mysql.server_cost
SET cost_value=0.1
WHERE cost_name="memory_temptable_row_cost";
UPDATE mysql.server_cost
SET cost_value=20
WHERE cost_name="disk_temptable_create_cost";
UPDATE mysql.server_cost
SET cost_value=0.5
WHERE cost_name="disk_temptable_row_cost";
UPDATE mysql.engine_cost
SET cost_value=0.25
WHERE cost_name="memory_block_read_cost";
UPDATE mysql.engine_cost
SET cost_value=1.0
WHERE cost_name="io_block_read_cost";
UPDATE mysql.server_cost
SET cost_value = 2 * cost_value;
UPDATE mysql.engine_cost
SET cost_value = 2 * cost_value;
SELECT cost_name, cost_value FROM mysql.server_cost;
cost_name	cost_value
disk_temptable_create_cost	40
disk_temptable_row_cost	1
key_compare_cost	0.1
memory_temptable_create_cost	2
memory_temptable_row_cost	0.2
row_evaluate_cost	0.2
SELECT cost_name, cost_value FROM mysql.engine_cost;
cost_name	cost_value
io_block_read_cost	2
memory_block_read_cost	0.5
FLUSH OPTIMIZER_COSTS;
EXPLAIN FORMAT=JSON SELECT i3 FROM t1 WHERE i1 = 1 AND i2 = 1;
EXPLAIN
{
  "query_block": {
    "select_id": 1,
    "cost_info": {
      "query_cost": "0.70"
    },
    "table": {
      "table_name": "t1",
      "access_type": "ref",
      "possible_keys": [
        "i1"
      ],
      "key": "i1",
      "used_key_parts": [
        "i1",
        "i2"
      ],
      "key_length": "10",
      "ref": [
        "const",
        "const"
      ],
      "rows_examined_per_scan": 1,
      "rows_produced_per_join": 1,
      "filtered": "100.00",
      "cost_info": {
        "read_cost": "0.50",
        "eval_cost": "0.20",
        "prefix_cost": "0.70",
        "data_read_per_join": "16"
      },
      "used_columns": [
        "i1",
        "i2",
        "i3"
      ]
    }
  }
}
Warnings:
Note	1003	/* select#1 */ select `test`.`t1`.`i3` AS `i3` from `test`.`t1` where ((`test`.`t1`.`i2` = 1) and (`test`.`t1`.`i1` = 1))
EXPLAIN FORMAT=JSON SELECT i3 FROM t1 WHERE i1 = 1 AND i3 = 1;
EXPLAIN
{
  "query_block": {
    "select_id": 1,
    "cost_info": {
      "query_cost": "1.80"
    },
    "table": {
      "table_name": "t1",
      "access_type": "ref",
      "possible_keys": [
        "i1"
      ],
      "key": "i1",
      "used_key_parts": [
        "i1"
      ],
      "key_length": "5",
      "ref": [
        "const"
      ],
      "rows_examined_per_scan": 4,
      "rows_produced_per_join": 0,
      "filtered": "10.00",
      "cost_info": {
        "read_cost": "1.00",
        "eval_cost": "0.08",
        "prefix_cost": "1.80",
        "data_read_per_join": "6"
      },
      "used_columns": [
        "i1",
        "i3"
      ],
      "attached_condition": "(`test`.`t1`.`i3` = 1)"
    }
  }
}
Warnings:
Note	1003	/* select#1 */ select `test`.`t1`.`i3` AS `i3` from `test`.`t1` where ((`test`.`t1`.`i3` = 1) and (`test`.`t1`.`i1` = 1))
UPDATE mysql.server_cost
SET cost_value=DEFAULT;
UPDATE mysql.engine_cost
SET cost_value=DEFAULT;
FLUSH OPTIMIZER_COSTS;
DROP TABLE t1;
#
# Bug#20947871 INDEX SCAN COST IN TEST_IF_CHEAPER_ORDERING() DOES
#              NOT USE COST CONSTANTS
#
CREATE TABLE t1 (
pk INTEGER PRIMARY KEY,
a INTEGER,
b INTEGER,
c CHAR(255),
UNIQUE KEY k1 (a)
);
INSERT INTO t1 VALUES (1, 1, NULL, "Abc"), (2, 2, NULL, "Abc"),
(3, 3, NULL, "Abc"), (4, 4, NULL, "Abc");
INSERT INTO t1 SELECT a + 4, a + 4, b, c FROM t1;
INSERT INTO t1 SELECT a + 8, a + 8, b, c FROM t1;
INSERT INTO t1 SELECT a + 16, a + 16, b, c FROM t1;
INSERT INTO t1 SELECT a + 32, a + 32, b, c FROM t1;
INSERT INTO t1 SELECT a + 64, a + 64, b, c FROM t1;
INSERT INTO t1 SELECT a + 128, a + 128, b, c FROM t1;
CREATE TABLE t2 (
d INTEGER PRIMARY KEY,
e INTEGER
);
INSERT INTO t2 SELECT a, b FROM t1;
# Query should be optimized for the LIMIT. Query plan should
# use index without filesort
EXPLAIN FORMAT=JSON SELECT * FROM t1 JOIN t2 ON b=d ORDER BY a LIMIT 4;
EXPLAIN
{
  "query_block": {
    "select_id": 1,
    "cost_info": {
      "query_cost": "119.95"
    },
    "ordering_operation": {
      "using_filesort": false,
      "nested_loop": [
        {
          "table": {
            "table_name": "t1",
            "access_type": "index",
            "key": "k1",
            "used_key_parts": [
              "a"
            ],
            "key_length": "5",
            "rows_examined_per_scan": 4,
            "rows_produced_per_join": 256,
            "filtered": "100.00",
            "cost_info": {
              "read_cost": "4.75",
              "eval_cost": "25.60",
              "prefix_cost": "30.35",
              "data_read_per_join": "260K"
            },
            "used_columns": [
              "pk",
              "a",
              "b",
              "c"
            ],
            "attached_condition": "(`test`.`t1`.`b` is not null)"
          }
        },
        {
          "table": {
            "table_name": "t2",
            "access_type": "eq_ref",
            "possible_keys": [
              "PRIMARY"
            ],
            "key": "PRIMARY",
            "used_key_parts": [
              "d"
            ],
            "key_length": "4",
            "ref": [
              "test.t1.b"
            ],
            "rows_examined_per_scan": 1,
            "rows_produced_per_join": 256,
            "filtered": "100.00",
            "cost_info": {
              "read_cost": "64.00",
              "eval_cost": "25.60",
              "prefix_cost": "119.95",
              "data_read_per_join": "4K"
            },
            "used_columns": [
              "d",
              "e"
            ]
          }
        }
      ]
    }
  }
}
Warnings:
Note	1003	/* select#1 */ select `test`.`t1`.`pk` AS `pk`,`test`.`t1`.`a` AS `a`,`test`.`t1`.`b` AS `b`,`test`.`t1`.`c` AS `c`,`test`.`t2`.`d` AS `d`,`test`.`t2`.`e` AS `e` from `test`.`t1` join `test`.`t2` where (`test`.`t2`.`d` = `test`.`t1`.`b`) order by `test`.`t1`.`a` limit 4
UPDATE mysql.server_cost
SET cost_value=0.1
WHERE cost_name="row_evaluate_cost";
UPDATE mysql.server_cost
SET cost_value=0.05
WHERE cost_name="key_compare_cost";
UPDATE mysql.server_cost
SET cost_value=1.0
WHERE cost_name="memory_temptable_create_cost";
UPDATE mysql.server_cost
SET cost_value=0.1
WHERE cost_name="memory_temptable_row_cost";
UPDATE mysql.server_cost
SET cost_value=20
WHERE cost_name="disk_temptable_create_cost";
UPDATE mysql.server_cost
SET cost_value=0.5
WHERE cost_name="disk_temptable_row_cost";
UPDATE mysql.engine_cost
SET cost_value=0.25
WHERE cost_name="memory_block_read_cost";
UPDATE mysql.engine_cost
SET cost_value=1.0
WHERE cost_name="io_block_read_cost";
UPDATE mysql.server_cost
SET cost_value = 0.5 * cost_value;
UPDATE mysql.engine_cost
SET cost_value = 0.5 * cost_value;
SELECT cost_name, cost_value FROM mysql.server_cost;
cost_name	cost_value
disk_temptable_create_cost	10
disk_temptable_row_cost	0.25
key_compare_cost	0.025
memory_temptable_create_cost	0.5
memory_temptable_row_cost	0.05
row_evaluate_cost	0.05
SELECT cost_name, cost_value FROM mysql.engine_cost;
cost_name	cost_value
io_block_read_cost	0.5
memory_block_read_cost	0.125
FLUSH OPTIMIZER_COSTS;
# This should be optimized for the LIMIT. Query plan should
# use index without filesort
EXPLAIN FORMAT=JSON SELECT * FROM t1 JOIN t2 ON b=d ORDER BY a LIMIT 4;
EXPLAIN
{
  "query_block": {
    "select_id": 1,
    "cost_info": {
      "query_cost": "59.97"
    },
    "ordering_operation": {
      "using_filesort": false,
      "nested_loop": [
        {
          "table": {
            "table_name": "t1",
            "access_type": "index",
            "key": "k1",
            "used_key_parts": [
              "a"
            ],
            "key_length": "5",
            "rows_examined_per_scan": 4,
            "rows_produced_per_join": 256,
            "filtered": "100.00",
            "cost_info": {
              "read_cost": "2.38",
              "eval_cost": "12.80",
              "prefix_cost": "15.18",
              "data_read_per_join": "260K"
            },
            "used_columns": [
              "pk",
              "a",
              "b",
              "c"
            ],
            "attached_condition": "(`test`.`t1`.`b` is not null)"
          }
        },
        {
          "table": {
            "table_name": "t2",
            "access_type": "eq_ref",
            "possible_keys": [
              "PRIMARY"
            ],
            "key": "PRIMARY",
            "used_key_parts": [
              "d"
            ],
            "key_length": "4",
            "ref": [
              "test.t1.b"
            ],
            "rows_examined_per_scan": 1,
            "rows_produced_per_join": 256,
            "filtered": "100.00",
            "cost_info": {
              "read_cost": "32.00",
              "eval_cost": "12.80",
              "prefix_cost": "59.98",
              "data_read_per_join": "4K"
            },
            "used_columns": [
              "d",
              "e"
            ]
          }
        }
      ]
    }
  }
}
Warnings:
Note	1003	/* select#1 */ select `test`.`t1`.`pk` AS `pk`,`test`.`t1`.`a` AS `a`,`test`.`t1`.`b` AS `b`,`test`.`t1`.`c` AS `c`,`test`.`t2`.`d` AS `d`,`test`.`t2`.`e` AS `e` from `test`.`t1` join `test`.`t2` where (`test`.`t2`.`d` = `test`.`t1`.`b`) order by `test`.`t1`.`a` limit 4
UPDATE mysql.server_cost
SET cost_value=DEFAULT;
UPDATE mysql.engine_cost
SET cost_value=DEFAULT;
FLUSH OPTIMIZER_COSTS;
DROP TABLE t1, t2;
#
# BUG2025082104009 Optimize Dstore cost model interface 'ha_cde::scan_cost'
#
CREATE TABLE t1(
a INT NOT NULL,
b ENUM('aaa','bbb','ccc'),
c TIMESTAMP NOT NULL DEFAULT '2025-08-08 10:00:00',
UNIQUE KEY (a)) ENGINE=Dstore;
CREATE TABLE t2(
a INT NOT NULL,
b ENUM('aaa','bbb','ccc'),
c TIMESTAMP NOT NULL DEFAULT '2025-08-08 10:00:00',
UNIQUE KEY (a)) ENGINE=InnoDB;
INSERT INTO t1(a,b) VALUES
( 1, 'bbb'),( 3, 'bbb'),( 5, 'bbb'),( 7, 'bbb'),( 9, 'bbb'),(11, 'bbb'),(13, 'bbb'),(15, 'bbb'),
(17, 'bbb'),(19, 'bbb'),(21, 'bbb'),(23, 'bbb'),(25, 'bbb'),(27, 'bbb'),(29, 'bbb'),(31, 'bbb'),
(33, 'bbb'),(35, 'bbb'),(37, 'bbb'),(39, 'bbb'),(41, 'bbb'),(43, 'bbb'),(45, 'bbb'),(47, 'bbb'),
(49, 'bbb'),(51, 'bbb'),(53, 'bbb'),(55, 'bbb'),(57, 'bbb'),(59, 'bbb'),(61, 'bbb'),(63, 'bbb'),
(65, 'bbb'),(67, 'ccc'),(69, 'ccc'),(71, 'aaa'),(73, 'aaa'),(75, 'aaa'),(77, 'aaa'),(79, 'aaa'),
(81, 'aaa'),(83, 'ccc'),(85,  NULL),(87,  NULL),(89,  NULL),(91,  NULL),(93,  NULL),(95,  NULL),
(97,  NULL),(99,  NULL),(101, NULL),(103, NULL),(105, NULL),(107, NULL),(109, NULL),(111, NULL),
(113, NULL);
INSERT INTO t2 SELECT * FROM t1;
ANALYZE TABLE t1 UPDATE HISTOGRAM ON a;
Table	Op	Msg_type	Msg_text
test.t1	histogram	status	Histogram statistics created for column 'a'.
ANALYZE TABLE t1,t2;
Table	Op	Msg_type	Msg_text
test.t1	analyze	status	OK
test.t2	analyze	status	OK
EXPLAIN SELECT t1.c, t1.b, t1.a FROM t1 where t1.b not in (select a from t1 order by 1) order by 1,2,3;
id	select_type	table	partitions	type	possible_keys	key	key_len	ref	rows	filtered	Extra
1	PRIMARY	t1	NULL	ALL	NULL	NULL	NULL	NULL	57	100.00	Using where; Using filesort
2	SUBQUERY	t1	NULL	index	a	a	4	NULL	57	100.00	Using index
Warnings:
Note	1003	/* select#1 */ select `test`.`t1`.`c` AS `c`,`test`.`t1`.`b` AS `b`,`test`.`t1`.`a` AS `a` from `test`.`t1` where <in_optimizer>(`test`.`t1`.`b`,`test`.`t1`.`b` in ( <materialize> (/* select#2 */ select `test`.`t1`.`a` from `test`.`t1` where true ), <primary_index_lookup>(`test`.`t1`.`b` in <temporary table> on <auto_distinct_key> where ((`test`.`t1`.`b` = `<materialized_subquery>`.`a`)))) is false) order by `test`.`t1`.`c`,`test`.`t1`.`b`,`test`.`t1`.`a`
EXPLAIN SELECT t2.c, t2.b, t2.a FROM t2 where t2.b not in (select a from t2 order by 1) order by 1,2,3;
id	select_type	table	partitions	type	possible_keys	key	key_len	ref	rows	filtered	Extra
1	PRIMARY	t2	NULL	ALL	NULL	NULL	NULL	NULL	57	100.00	Using where; Using filesort
2	SUBQUERY	t2	NULL	index	a	a	4	NULL	57	100.00	Using index
Warnings:
Note	1003	/* select#1 */ select `test`.`t2`.`c` AS `c`,`test`.`t2`.`b` AS `b`,`test`.`t2`.`a` AS `a` from `test`.`t2` where <in_optimizer>(`test`.`t2`.`b`,`test`.`t2`.`b` in ( <materialize> (/* select#2 */ select `test`.`t2`.`a` from `test`.`t2` where true ), <primary_index_lookup>(`test`.`t2`.`b` in <temporary table> on <auto_distinct_key> where ((`test`.`t2`.`b` = `<materialized_subquery>`.`a`)))) is false) order by `test`.`t2`.`c`,`test`.`t2`.`b`,`test`.`t2`.`a`
SELECT t1.c, t1.b, t1.a FROM t1 where t1.b not in (select a from t1 order by 1) order by 1,2,3;
c	b	a
2025-08-08 10:00:00	bbb	1
2025-08-08 10:00:00	bbb	3
2025-08-08 10:00:00	bbb	5
2025-08-08 10:00:00	bbb	7
2025-08-08 10:00:00	bbb	9
2025-08-08 10:00:00	bbb	11
2025-08-08 10:00:00	bbb	13
2025-08-08 10:00:00	bbb	15
2025-08-08 10:00:00	bbb	17
2025-08-08 10:00:00	bbb	19
2025-08-08 10:00:00	bbb	21
2025-08-08 10:00:00	bbb	23
2025-08-08 10:00:00	bbb	25
2025-08-08 10:00:00	bbb	27
2025-08-08 10:00:00	bbb	29
2025-08-08 10:00:00	bbb	31
2025-08-08 10:00:00	bbb	33
2025-08-08 10:00:00	bbb	35
2025-08-08 10:00:00	bbb	37
2025-08-08 10:00:00	bbb	39
2025-08-08 10:00:00	bbb	41
2025-08-08 10:00:00	bbb	43
2025-08-08 10:00:00	bbb	45
2025-08-08 10:00:00	bbb	47
2025-08-08 10:00:00	bbb	49
2025-08-08 10:00:00	bbb	51
2025-08-08 10:00:00	bbb	53
2025-08-08 10:00:00	bbb	55
2025-08-08 10:00:00	bbb	57
2025-08-08 10:00:00	bbb	59
2025-08-08 10:00:00	bbb	61
2025-08-08 10:00:00	bbb	63
2025-08-08 10:00:00	bbb	65
SELECT t2.c, t2.b, t2.a FROM t2 where t2.b not in (select a from t2 order by 1) order by 1,2,3;
c	b	a
2025-08-08 10:00:00	bbb	1
2025-08-08 10:00:00	bbb	3
2025-08-08 10:00:00	bbb	5
2025-08-08 10:00:00	bbb	7
2025-08-08 10:00:00	bbb	9
2025-08-08 10:00:00	bbb	11
2025-08-08 10:00:00	bbb	13
2025-08-08 10:00:00	bbb	15
2025-08-08 10:00:00	bbb	17
2025-08-08 10:00:00	bbb	19
2025-08-08 10:00:00	bbb	21
2025-08-08 10:00:00	bbb	23
2025-08-08 10:00:00	bbb	25
2025-08-08 10:00:00	bbb	27
2025-08-08 10:00:00	bbb	29
2025-08-08 10:00:00	bbb	31
2025-08-08 10:00:00	bbb	33
2025-08-08 10:00:00	bbb	35
2025-08-08 10:00:00	bbb	37
2025-08-08 10:00:00	bbb	39
2025-08-08 10:00:00	bbb	41
2025-08-08 10:00:00	bbb	43
2025-08-08 10:00:00	bbb	45
2025-08-08 10:00:00	bbb	47
2025-08-08 10:00:00	bbb	49
2025-08-08 10:00:00	bbb	51
2025-08-08 10:00:00	bbb	53
2025-08-08 10:00:00	bbb	55
2025-08-08 10:00:00	bbb	57
2025-08-08 10:00:00	bbb	59
2025-08-08 10:00:00	bbb	61
2025-08-08 10:00:00	bbb	63
2025-08-08 10:00:00	bbb	65
DROP TABLE t1,t2;
