set explicit_defaults_for_timestamp=ON;
set global log_bin_trust_function_creators=true;
set sql_mode = '';
drop database if exists xm;
create database xm;
use xm;
create table xm1(a int, b int, c int);
create table xm2(a int, b int, c int);
create table xm3(a int, b int, c int);
alter table xm1 add unique key(a);
alter table xm2 add unique key(a);
alter table xm3 add unique key(a);
insert into xm1 values(1, 100, 1000);
insert into xm1 values(3, 300, 3000);
insert into xm2 select * from xm1;
insert into xm3 select * from xm2;
select * from xm1;
a	b	c
1	100	1000
3	300	3000
select * from xm2;
a	b	c
1	100	1000
3	300	3000
select * from xm3;
a	b	c
1	100	1000
3	300	3000
insert into xm1 values(2, 200, 2000);
insert into xm2 values(2, 200, 2000);
insert into xm3 values(2, 200, 2000);
create function rand_num()
returns int(5)
begin
declare i int default 0;
insert into xm1 values(7, 70, 700);
insert into xm2 values(7, 70, 700);
insert into xm3 select * from xm1;
set i=floor(100+rand()*10);
return i;
end|
CREATE PROCEDURE p_insert_xmm(in id INTEGER)
begin
start transaction;
insert into xm1 values(id, id*10, id*100);
insert into xm2 values(id, id*10, id*100);
commit;
start transaction;
update xm3 set a=5;
select count(*) from xm1;
select count(*) from xm2;
select a from xm3;
commit;
end|
CREATE PROCEDURE vv_insert_xmm(in id INTEGER)
begin
start transaction;
insert into xm1 values(id, id*10, id*100);
insert into xm2 values(id, id*10, id*100);
commit;
update xm1 set a=a*55;
update xm3 set a=5;
select count(*) from xm1;
select count(*) from xm2;
select a from xm3;
end|
begin;
select rand_num();
ERROR 23000: Duplicate entry '1' for key 'xm3.a'
select * from xm1;
a	b	c
1	100	1000
3	300	3000
2	200	2000
select * from xm2;
a	b	c
1	100	1000
3	300	3000
2	200	2000
select * from xm3;
a	b	c
1	100	1000
3	300	3000
2	200	2000
commit;
select * from xm1;
a	b	c
1	100	1000
3	300	3000
2	200	2000
select * from xm2;
a	b	c
1	100	1000
3	300	3000
2	200	2000
select * from xm3;
a	b	c
1	100	1000
3	300	3000
2	200	2000
call p_insert_xmm(9);
ERROR 23000: Duplicate entry '5' for key 'xm3.a'
select count(*) from xm1;
count(*)
4
select count(*) from xm2;
count(*)
4
select count(*) from xm3;
count(*)
3
commit;
select count(*) from xm1;
count(*)
4
select count(*) from xm2;
count(*)
4
select count(*) from xm3;
count(*)
3
begin;
call vv_insert_xmm(111);
ERROR 23000: Duplicate entry '5' for key 'xm3.a'
select * from xm1;
a	b	c
55	100	1000
165	300	3000
110	200	2000
495	90	900
6105	1110	11100
select * from xm3;
a	b	c
1	100	1000
3	300	3000
2	200	2000
select * from xm3;
a	b	c
1	100	1000
3	300	3000
2	200	2000
commit;
select * from xm1;
a	b	c
55	100	1000
165	300	3000
110	200	2000
495	90	900
6105	1110	11100
select * from xm3;
a	b	c
1	100	1000
3	300	3000
2	200	2000
select * from xm3;
a	b	c
1	100	1000
3	300	3000
2	200	2000
drop database xm;
