#
# CDE
#
use test;
create table t1(n int);
begin;
savepoint `my_savepoint`;
insert into t1 values (7);
savepoint `savept2`;
insert into t1 values (3);
select n from t1;
n
7
3
savepoint savept3;
rollback to savepoint savept2;
rollback to savepoint savept3;
ERROR 42000: SAVEPOINT savept3 does not exist
rollback to savepoint savept2;
release savepoint `my_savepoint`;
select n from t1;
n
7
rollback to savepoint `my_savepoint`;
ERROR 42000: SAVEPOINT my_savepoint does not exist
rollback to savepoint savept2;
ERROR 42000: SAVEPOINT savept2 does not exist
insert into t1 values (8);
savepoint sv;
commit;
savepoint sv;
set autocommit=1;
delete from t1;
begin;
insert into t1 values (1);
savepoint `savept1`;
insert into t1 values (2);
savepoint `savept1`;
insert into t1 values (3);
rollback to savepoint `savept1`;
select n from t1;
n
1
2
commit;
drop table t1;
