set global dstore_lock_wait_timeout = 5;
CREATE TABLE tab_parent_hwsql_new_feature_sql_filter_017 (id INT NOT NULL, PRIMARY KEY (id)) ENGINE=dstore;
INSERT into tab_parent_hwsql_new_feature_sql_filter_017 values(1),(2),(3),(4),(5),(6),(7),(8),(9),(10),(11),(12),(13),(14),(15),(16),(17),(18),(19),(20),(21);
SET TRANSACTION_ISOLATION='REPEATABLE-READ';
BEGIN;
SELECT * from tab_parent_hwsql_new_feature_sql_filter_017 FOR UPDATE;
id
1
2
3
4
5
6
7
8
9
10
11
12
13
14
15
16
17
18
19
20
21
SET TRANSACTION_ISOLATION='REPEATABLE-READ';
UPDATE tab_parent_hwsql_new_feature_sql_filter_017 SET id=id+1 WHERE id >=21;
ERROR HY000: Lock wait timeout exceeded; try restarting transaction
SELECT * from tab_parent_hwsql_new_feature_sql_filter_017 FOR UPDATE;
id
1
2
3
4
5
6
7
8
9
10
11
12
13
14
15
16
17
18
19
20
21
COMMIT;
SET TRANSACTION_ISOLATION='READ-COMMITTED';
BEGIN;
SELECT * from tab_parent_hwsql_new_feature_sql_filter_017 FOR UPDATE;
id
1
2
3
4
5
6
7
8
9
10
11
12
13
14
15
16
17
18
19
20
21
SET TRANSACTION_ISOLATION='READ-COMMITTED';
UPDATE tab_parent_hwsql_new_feature_sql_filter_017 SET id=id+1 WHERE id >=21;
ERROR HY000: Lock wait timeout exceeded; try restarting transaction
SELECT * from tab_parent_hwsql_new_feature_sql_filter_017 FOR UPDATE;
id
1
2
3
4
5
6
7
8
9
10
11
12
13
14
15
16
17
18
19
20
21
COMMIT;
DROP TABLE tab_parent_hwsql_new_feature_sql_filter_017;
CREATE TABLE t0(c0 DOUBLE  COMMENT 'asdf'  UNIQUE KEY PRIMARY KEY NOT NULL COLUMN_FORMAT DYNAMIC STORAGE DISK) ENGINE=dstore;
INSERT INTO t0(c0) VALUES(1085561577);
INSERT IGNORE INTO t0(c0) VALUES(1.085561577E9);
Warnings:
Warning	1062	Duplicate entry '1085561577' for key 't0.PRIMARY'
INSERT LOW_PRIORITY IGNORE INTO t0(c0) VALUES(NULL);
Warnings:
Warning	1048	Column 'c0' cannot be null
INSERT DELAYED IGNORE INTO t0(c0) VALUES(1085561577), (NULL), ("1085561577");
Warnings:
Warning	3005	INSERT DELAYED is no longer supported. The statement was converted to INSERT.
Warning	1062	Duplicate entry '1085561577' for key 't0.PRIMARY'
Warning	1048	Column 'c0' cannot be null
Warning	1062	Duplicate entry '0' for key 't0.PRIMARY'
Warning	1062	Duplicate entry '1085561577' for key 't0.PRIMARY'
INSERT DELAYED IGNORE INTO t0(c0) VALUES(90458813);
Warnings:
Warning	3005	INSERT DELAYED is no longer supported. The statement was converted to INSERT.
SET TRANSACTION_ISOLATION='SERIALIZABLE';
BEGIN;
SELECT DISTINCT t0.c0 FROM t0 FOR SHARE;
c0
0
90458813
1085561577
SET TRANSACTION_ISOLATION='SERIALIZABLE';
BEGIN;
SELECT t0.c0 FROM t0 FOR SHARE;
ERROR HY000: Lock wait timeout exceeded; try restarting transaction
COMMIT;
ROLLBACK;
DROP TABLE t0;
CREATE TABLE t1(c1 INT, c2 INT, PRIMARY KEY(c1));
INSERT INTO t1 VALUES(1,1),(2,2);
SET TRANSACTION_ISOLATION='READ-COMMITTED';
BEGIN;
DELETE FROM t1 WHERE c2 = 1;
SET TRANSACTION_ISOLATION='READ-COMMITTED';
SELECT c1 FROM t1 FOR UPDATE;
COMMIT;
c1
2
DROP TABLE t1;
set global dstore_lock_wait_timeout=50;
