SET global dstore_lock_wait_timeout=1;
# Case 1: Test primary index
CREATE TABLE t1(
seat_id    INT,
state      INT,
PRIMARY KEY(seat_id)
) ENGINE=Dstore;
INSERT INTO t1 VALUES(1,0), (2,0), (3,0), (4,0);
BEGIN;
SELECT * FROM t1 WHERE state = 0 LIMIT 2 FOR SHARE;
seat_id	state
1	0
2	0
BEGIN;
SELECT * FROM t1 WHERE state = 0 LIMIT 2 LOCK IN SHARE MODE;
ERROR HY000: Lock wait timeout exceeded; try restarting transaction
SELECT * FROM t1 WHERE state = 0 LIMIT 2 FOR SHARE;
ERROR HY000: Lock wait timeout exceeded; try restarting transaction
SELECT * FROM t1 WHERE state = 0 LIMIT 2 FOR SHARE NOWAIT;
ERROR HY000: Statement aborted because lock(s) could not be acquired immediately and NOWAIT is set.
SELECT * FROM t1 WHERE state = 0 LIMIT 2 FOR SHARE SKIP LOCKED;
seat_id	state
3	0
4	0
SELECT * FROM t1 WHERE state = 0 LIMIT 2 FOR UPDATE;
ERROR HY000: Lock wait timeout exceeded; try restarting transaction
SELECT * FROM t1 WHERE state = 0 LIMIT 2 FOR UPDATE NOWAIT;
ERROR HY000: Statement aborted because lock(s) could not be acquired immediately and NOWAIT is set.
SELECT * FROM t1 WHERE state = 0 LIMIT 2 FOR UPDATE SKIP LOCKED;
seat_id	state
3	0
4	0
SELECT * FROM t1 WHERE seat_id > 0 LIMIT 2 FOR UPDATE NOWAIT;
ERROR HY000: Statement aborted because lock(s) could not be acquired immediately and NOWAIT is set.
SELECT * FROM t1 WHERE seat_id > 0 LIMIT 2 FOR UPDATE SKIP LOCKED;
seat_id	state
3	0
4	0
COMMIT;
SELECT * FROM t1 WHERE state = 0 LIMIT 2 FOR UPDATE;
seat_id	state
1	0
2	0
SELECT * FROM t1 WHERE state = 0 LIMIT 2 LOCK IN SHARE MODE;
ERROR HY000: Lock wait timeout exceeded; try restarting transaction
SELECT * FROM t1 WHERE state = 0 LIMIT 2 FOR SHARE;
ERROR HY000: Lock wait timeout exceeded; try restarting transaction
SELECT * FROM t1 WHERE state = 0 LIMIT 2 FOR SHARE NOWAIT;
ERROR HY000: Statement aborted because lock(s) could not be acquired immediately and NOWAIT is set.
SELECT * FROM t1 WHERE state = 0 LIMIT 2 FOR SHARE SKIP LOCKED;
seat_id	state
3	0
4	0
SELECT * FROM t1 WHERE state = 0 LIMIT 2 FOR UPDATE;
ERROR HY000: Lock wait timeout exceeded; try restarting transaction
SELECT * FROM t1 WHERE state = 0 LIMIT 2 FOR UPDATE NOWAIT;
ERROR HY000: Statement aborted because lock(s) could not be acquired immediately and NOWAIT is set.
SELECT * FROM t1 WHERE state = 0 LIMIT 2 FOR UPDATE SKIP LOCKED;
seat_id	state
3	0
4	0
SELECT * FROM t1 WHERE seat_id > 0 LIMIT 2 FOR UPDATE NOWAIT;
ERROR HY000: Statement aborted because lock(s) could not be acquired immediately and NOWAIT is set.
SELECT * FROM t1 WHERE seat_id > 0 LIMIT 2 FOR UPDATE SKIP LOCKED;
seat_id	state
3	0
4	0
COMMIT;
COMMIT;
DROP TABLE t1;
# Case 2: Test primary index & secondary index
CREATE TABLE t1(
seat_id    INT,
row_id     INT,
state      INT,
PRIMARY KEY(seat_id),
KEY(row_id)
) ENGINE=Dstore;
INSERT INTO t1 VALUES(1,1,0), (2,1,0), (3,2,0), (4,2,0);
# Test secondary key
BEGIN;
SELECT * FROM t1 WHERE state = 0 AND row_id = 1 LIMIT 1 FOR UPDATE NOWAIT;
seat_id	row_id	state
1	1	0
BEGIN;
SELECT * FROM t1 WHERE state = 0 AND row_id = 1 LIMIT 1 FOR UPDATE NOWAIT;
ERROR HY000: Statement aborted because lock(s) could not be acquired immediately and NOWAIT is set.
SELECT * FROM t1 WHERE state = 0 AND row_id = 1 LIMIT 1 FOR UPDATE SKIP LOCKED;
seat_id	row_id	state
2	1	0
SELECT * FROM t1 WHERE state = 0 AND row_id > 0 LIMIT 1 FOR UPDATE NOWAIT;
ERROR HY000: Statement aborted because lock(s) could not be acquired immediately and NOWAIT is set.
SELECT * FROM t1 WHERE state = 0 AND row_id > 0 LIMIT 1 FOR UPDATE SKIP LOCKED;
seat_id	row_id	state
2	1	0
SELECT * FROM t1 WHERE state = 0 FOR UPDATE NOWAIT;
ERROR HY000: Statement aborted because lock(s) could not be acquired immediately and NOWAIT is set.
SELECT * FROM t1 WHERE state = 0 FOR UPDATE SKIP LOCKED;
seat_id	row_id	state
2	1	0
3	2	0
4	2	0
COMMIT;
COMMIT;
BEGIN;
SELECT * FROM t1 WHERE seat_id = 1 FOR UPDATE NOWAIT;
seat_id	row_id	state
1	1	0
BEGIN;
SELECT * FROM t1 WHERE state = 0 AND row_id = 1 LIMIT 1 FOR UPDATE NOWAIT;
ERROR HY000: Statement aborted because lock(s) could not be acquired immediately and NOWAIT is set.
SELECT * FROM t1 WHERE state = 0 AND row_id = 1 LIMIT 1 FOR UPDATE SKIP LOCKED;
seat_id	row_id	state
2	1	0
SELECT * FROM t1 WHERE state = 0 FOR UPDATE NOWAIT;
ERROR HY000: Statement aborted because lock(s) could not be acquired immediately and NOWAIT is set.
SELECT * FROM t1 WHERE state = 0 FOR UPDATE SKIP LOCKED;
seat_id	row_id	state
2	1	0
3	2	0
4	2	0
COMMIT;
COMMIT;
DROP TABLE t1;
# Case 3: Test for CdeLockTuple fail in ReadIndexOnly
CREATE TABLE t1(
seat_id    INT,
row_id     INT,
state      INT,
PRIMARY KEY(seat_id),
KEY(row_id)
) ENGINE=Dstore;
INSERT INTO t1 VALUES(1,1,0), (2,1,0), (3,2,0), (4,2,0);
BEGIN;
SELECT row_id FROM t1 WHERE row_id = 1 FOR UPDATE NOWAIT;
row_id
1
1
BEGIN;
SELECT row_id FROM t1 WHERE row_id = 1 FOR UPDATE NOWAIT;
ERROR HY000: Statement aborted because lock(s) could not be acquired immediately and NOWAIT is set.
SELECT row_id FROM t1 WHERE row_id = 1 FOR UPDATE SKIP LOCKED;
row_id
COMMIT;
COMMIT;
DROP TABLE t1;
SET global dstore_lock_wait_timeout=default;
# Case 4: Test for CdeLockNewestTuple Case
call mtr.add_suppression("lock newest tuple failed.*");
call mtr.add_suppression("Got error 10006 when reading table.*");
CREATE TABLE t1(
seat_id    INT,
state      INT,
PRIMARY KEY(seat_id)
) ENGINE=Dstore;
INSERT INTO t1 VALUES(1,0), (2,0), (3,0), (4,0);
begin;
update t1 set seat_id = 1000000000 where seat_id  = 4;
set debug_sync = "before_lock_tuple WAIT_FOR continue1 EXECUTE 2";
select * from t1 where seat_id = 4 for update NOWAIT;;
set debug_sync = "before_lock_tuple WAIT_FOR continue2 EXECUTE 2";
select * from t1 where seat_id = 4 for update SKIP LOCKED;;
commit;
set debug_sync = "now signal continue1";
set debug_sync = "now signal continue2";
begin;
select * from t1 where seat_id = 1000000000 for update;
seat_id	state
1000000000	0
set debug_sync = "now signal continue1";
set debug_sync = "now signal continue2";
ERROR HY000: Statement aborted because lock(s) could not be acquired immediately and NOWAIT is set.
seat_id	state
commit;
DROP TABLE t1;
