SET GLOBAL TRANSACTION ISOLATION LEVEL READ COMMITTED;
# this mtr includes test cases:
# test-replace into, session1 commit.
# test-replace into, session1 rollback.
# test-insert/update conflict.
# test-update/update conflict.
# test-insert select.
drop table if exists test;
# Establish connection thr1 (user=root)
# Establish connection thr2 (user=root)
# test-replace into, session1 commit. rr and rc are same.
# +----------------------------+--------------------------------+
# | session1                   | session2                       |
# +----------------------------+--------------------------------+
# | begin;                     | begin;                         |
# | insert into t value(1,10); |                                |
# |                            | replace into t values(1,20);   |
# |                            | #wait                          |
# | commit;                    |                                |
# |                            | #continue                      |
# |                            | select * from  t;              |
# |                            | #1,20                          |
# |                            | commit;                        |
# |                            | insert into t values(1,50);    |
# |                            | #error, duplicate              |
# |                            | insert into t values(2,10);    |
# |                            | update t set b=30 where a = 1; |
# |                            | select * from t;               |
# |                            | #1,30;2,10                     |
# |                            | update t set b = 50;           |
# |                            | delete from t;                 |
# |                            | select * from t;               |
# |                            | #1,50;2,50                     |
# +----------------------------+--------------------------------+
# get isolation for thr1.
select @@transaction_isolation;
@@transaction_isolation
READ-COMMITTED
# get isolation for thr2.
select @@transaction_isolation;
@@transaction_isolation
READ-COMMITTED
# Switching to connection 'default'.
create table t(a int primary key, b int);
# Switching to connection 'thr1'.
begin;
insert into t value(1,10);
# Switching to connection 'thr2'.
begin;
replace into t values(1,20);
# Switching to connection 'thr1'.
commit;
# Switching to connection 'thr2'.
commit;
select * from  t;
a	b
1	20
# Switching to connection 'thr1'.
insert into t values(1,50);
ERROR 23000: Duplicate entry '1' for key 't.PRIMARY'
insert into t values(2,10);
update t set b = 30 where a = 1;
select * from t;
a	b
1	30
2	10
update t set b = 50;
select * from t;
a	b
1	50
2	50
delete from t;
select * from t;
a	b
drop table t;
# test-replace into, session1 rollback. rr and rc are same.
# +----------------------------+--------------------------------+
# | session1                   | session2                       |
# +----------------------------+--------------------------------+
# | begin;                     | begin;                         |
# | insert into t value(1,10); |                                |
# |                            | replace into t values(1,20);   |
# |                            | #wait                          |
# | rollback;                  |                                |
# |                            | #continue                      |
# |                            | select * from  t;              |
# |                            | #1,20                          |
# |                            | commit;                        |
# |                            | insert into t values(1,50);    |
# |                            | #error, duplicate              |
# |                            | insert into t values(2,10);    |
# |                            | update t set b=30 where a = 1; |
# |                            | select * from t;               |
# |                            | #1,30;2,10                     |
# |                            | update t set b = 50;           |
# |                            | delete from t;                 |
# |                            | select * from t;               |
# |                            | #1,50;2,50                     |
# +----------------------------+--------------------------------+
# get isolation for thr1.
select @@transaction_isolation;
@@transaction_isolation
READ-COMMITTED
# get isolation for thr2.
select @@transaction_isolation;
@@transaction_isolation
READ-COMMITTED
# Switching to connection 'default'.
create table t(a int primary key, b int);
# Switching to connection 'thr1'.
begin;
insert into t value(1,10);
# Switching to connection 'thr2'.
begin;
replace into t values(1,20);
# Switching to connection 'thr1'.
rollback;
# Switching to connection 'thr2'.
commit;
select * from  t;
a	b
1	20
# Switching to connection 'thr1'.
insert into t values(1,50);
ERROR 23000: Duplicate entry '1' for key 't.PRIMARY'
insert into t values(2,10);
update t set b = 30 where a = 1;
select * from t;
a	b
2	10
1	30
update t set b = 50;
select * from t;
a	b
2	50
1	50
delete from t;
select * from t;
a	b
drop table t;
# test-insert/update conflict
# +------------------------------+----------------------------------------------------+
# | session1                     | session2                                           |
# +------------------------------+----------------------------------------------------+
# | begin;                       | begin;                                             |
# |                              | select * from t where a = 1;                       |
# | insert into t values(1,'m'); |                                                    |
# |                              | select * from t where a = 1;                       |
# |                              | # empty                                            |
# |                              | select * from t for update where a = 1;            |
# |                              | # empty                                            |
# | commit;                      |                                                    |
# |                              | select * from t where a = 1;                       |
# |                              | # empty for rr and 1,m for rc                      |
# |                              | select * from t for update where a = 1;            |
# |                              | # 1,m                                              |
# +------------------------------+----------------------------------------------------+
# get isolation for thr1.
select @@transaction_isolation;
@@transaction_isolation
READ-COMMITTED
# get isolation for thr2.
select @@transaction_isolation;
@@transaction_isolation
READ-COMMITTED
create table t(a int primary key, b char(10));
begin;
select * from t;
a	b
# Switching to connection 'thr1'.
begin;
insert into t values(1,'m');
# Switching to connection 'thr2'.
select * from t where a = 1;
a	b
select * from t where a = 1 for update;
a	b
# Switching to connection 'thr1'.
commit;
# Switching to connection 'thr2'.
select * from t where a = 1;
a	b
1	m
select * from t where a = 1 for update;
a	b
1	m
commit;
select * from t where a = 1;
a	b
1	m
select * from t where a = 1 for update;
a	b
1	m
drop table t;
# test-update/update conflict
# +----------------------------------+-----------------------------------------+
# | session1                         | session2                                |
# +----------------------------------+-----------------------------------------+
# | begin;                           | begin;                                  |
# |                                  | select * from t where a = 1;            |
# |                                  | #1,m                                    |
# | update t set b ='x' where a = 1; |                                         |
# |                                  | update t set b ='y' where a = 1;        |
# |                                  | #wait                                   |
# | commit;                          |                                         |
# |                                  | select * from t where a = 1;            |
# |                                  | #rr/rc 1, y                             |
# |                                  | select * from t where a = 1 for update; |
# |                                  | #1,y                                    |
# |                                  | commit;                                 |
# +----------------------------------+-----------------------------------------+
# get isolation for thr1.
select @@transaction_isolation;
@@transaction_isolation
READ-COMMITTED
# get isolation for thr2.
select @@transaction_isolation;
@@transaction_isolation
READ-COMMITTED
create table t(a int primary key, b char(10));
insert into t values(1,'a');
begin;
select * from t where a = 1;
a	b
1	a
# Switching to connection 'thr1'.
begin;
update t set b ='x' where a = 1;
# Switching to connection 'thr2'.
update t set b ='y' where a = 1;
# Switching to connection 'thr1'.
commit;
# Switching to connection 'thr2'.
select * from t where a = 1;
a	b
1	y
select * from t where a = 1 for update;
a	b
1	y
commit;
select * from t where a = 1;
a	b
1	y
select * from t where a = 1 for update;
a	b
1	y
# Switching to connection 'default'.
drop table t;
# test-insert select
# +----------------------------------+----------------------------------+
# | session1                         | session2                         |
# +----------------------------------+----------------------------------+
# | begin;                           | begin;                           |
# | insert into t1 select * from t1; |                                  |
# | select  count(*) from t1;        |                                  |
# | #4(1)                            |                                  |
# |                                  | select  count(*) from t1;        |
# |                                  | #2(2)                            |
# |                                  | insert into t1 select * from t1; |
# |                                  | select  count(*) from t1;        |
# |                                  | #4(3)                            |
# | select  count(*) from t1;        |                                  |
# | #4(4)                            |                                  |
# | commit;                          |                                  |
# | select  count(*) from t1;        |                                  |
# | #4(5)                            |                                  |
# |                                  | select  count(*) from t1;        |
# |                                  | #rc 6, rr 4(6)                   |
# |                                  | insert into t1 select * from t1; |
# |                                  | select  count(*) from t1;        |
# |                                  | #rc 12, rr 8(7)                  |
# | select  count(*) from t1;        |                                  |
# | #4(8)                            |                                  |
# |                                  | commit;                          |
# |                                  | select  count(*) from t1;        |
# |                                  | #rc 12, rr 10 (9)                |
# | select  count(*) from t1;        |                                  |
# | #rc 12, rr 10 (10)                |                                  |
# +----------------------------------+----------------------------------+
# get isolation for thr1.
select @@transaction_isolation;
@@transaction_isolation
READ-COMMITTED
# get isolation for thr2.
select @@transaction_isolation;
@@transaction_isolation
READ-COMMITTED
create table t1(a int);
insert into t1 values(1),(2);
begin;
# Switching to connection 'thr1'.
begin;
insert into t1 select * from t1;
# result is 4(1)
select  count(*) from t1;
count(*)
4
# Switching to connection 'thr2'.
# result is 2(2)
select  count(*) from t1;
count(*)
2
insert into t1 select * from t1;
# result is 4(3)
select  count(*) from t1;
count(*)
4
# Switching to connection 'thr1'.
# result is 4(4)
select  count(*) from t1;
count(*)
4
commit;
# result is 4(5)
select  count(*) from t1;
count(*)
4
# Switching to connection 'thr2'.
# result is rc 6, rr 4 (6)
select  count(*) from t1;
count(*)
6
insert into t1 select * from t1;
# result is rc 12, rr 8(7)
select  count(*) from t1;
count(*)
12
# Switching to connection 'thr1'.
# result is 4(8)
select  count(*) from t1;
count(*)
4
# Switching to connection 'thr2'.
commit;
# result is rc 12, rr 10 (9)
select  count(*) from t1;
count(*)
12
# Switching to connection 'thr2'.
# result is rc 12, rr 10 (10)
select  count(*) from t1;
count(*)
12
# Switching to connection 'default'.
drop table t1;
SET GLOBAL TRANSACTION ISOLATION LEVEL REPEATABLE READ;
# this mtr includes test cases:
# test-replace into, session1 commit.
# test-replace into, session1 rollback.
# test-insert/update conflict.
# test-update/update conflict.
# test-insert select.
drop table if exists test;
# Establish connection thr1 (user=root)
# Establish connection thr2 (user=root)
# test-replace into, session1 commit. rr and rc are same.
# +----------------------------+--------------------------------+
# | session1                   | session2                       |
# +----------------------------+--------------------------------+
# | begin;                     | begin;                         |
# | insert into t value(1,10); |                                |
# |                            | replace into t values(1,20);   |
# |                            | #wait                          |
# | commit;                    |                                |
# |                            | #continue                      |
# |                            | select * from  t;              |
# |                            | #1,20                          |
# |                            | commit;                        |
# |                            | insert into t values(1,50);    |
# |                            | #error, duplicate              |
# |                            | insert into t values(2,10);    |
# |                            | update t set b=30 where a = 1; |
# |                            | select * from t;               |
# |                            | #1,30;2,10                     |
# |                            | update t set b = 50;           |
# |                            | delete from t;                 |
# |                            | select * from t;               |
# |                            | #1,50;2,50                     |
# +----------------------------+--------------------------------+
# get isolation for thr1.
select @@transaction_isolation;
@@transaction_isolation
REPEATABLE-READ
# get isolation for thr2.
select @@transaction_isolation;
@@transaction_isolation
REPEATABLE-READ
# Switching to connection 'default'.
create table t(a int primary key, b int);
# Switching to connection 'thr1'.
begin;
insert into t value(1,10);
# Switching to connection 'thr2'.
begin;
replace into t values(1,20);
# Switching to connection 'thr1'.
commit;
# Switching to connection 'thr2'.
commit;
select * from  t;
a	b
1	20
# Switching to connection 'thr1'.
insert into t values(1,50);
ERROR 23000: Duplicate entry '1' for key 't.PRIMARY'
insert into t values(2,10);
update t set b = 30 where a = 1;
select * from t;
a	b
1	30
2	10
update t set b = 50;
select * from t;
a	b
1	50
2	50
delete from t;
select * from t;
a	b
drop table t;
# test-replace into, session1 rollback. rr and rc are same.
# +----------------------------+--------------------------------+
# | session1                   | session2                       |
# +----------------------------+--------------------------------+
# | begin;                     | begin;                         |
# | insert into t value(1,10); |                                |
# |                            | replace into t values(1,20);   |
# |                            | #wait                          |
# | rollback;                  |                                |
# |                            | #continue                      |
# |                            | select * from  t;              |
# |                            | #1,20                          |
# |                            | commit;                        |
# |                            | insert into t values(1,50);    |
# |                            | #error, duplicate              |
# |                            | insert into t values(2,10);    |
# |                            | update t set b=30 where a = 1; |
# |                            | select * from t;               |
# |                            | #1,30;2,10                     |
# |                            | update t set b = 50;           |
# |                            | delete from t;                 |
# |                            | select * from t;               |
# |                            | #1,50;2,50                     |
# +----------------------------+--------------------------------+
# get isolation for thr1.
select @@transaction_isolation;
@@transaction_isolation
REPEATABLE-READ
# get isolation for thr2.
select @@transaction_isolation;
@@transaction_isolation
REPEATABLE-READ
# Switching to connection 'default'.
create table t(a int primary key, b int);
# Switching to connection 'thr1'.
begin;
insert into t value(1,10);
# Switching to connection 'thr2'.
begin;
replace into t values(1,20);
# Switching to connection 'thr1'.
rollback;
# Switching to connection 'thr2'.
commit;
select * from  t;
a	b
1	20
# Switching to connection 'thr1'.
insert into t values(1,50);
ERROR 23000: Duplicate entry '1' for key 't.PRIMARY'
insert into t values(2,10);
update t set b = 30 where a = 1;
select * from t;
a	b
2	10
1	30
update t set b = 50;
select * from t;
a	b
2	50
1	50
delete from t;
select * from t;
a	b
drop table t;
# test-insert/update conflict
# +------------------------------+----------------------------------------------------+
# | session1                     | session2                                           |
# +------------------------------+----------------------------------------------------+
# | begin;                       | begin;                                             |
# |                              | select * from t where a = 1;                       |
# | insert into t values(1,'m'); |                                                    |
# |                              | select * from t where a = 1;                       |
# |                              | # empty                                            |
# |                              | select * from t for update where a = 1;            |
# |                              | # empty                                            |
# | commit;                      |                                                    |
# |                              | select * from t where a = 1;                       |
# |                              | # empty for rr and 1,m for rc                      |
# |                              | select * from t for update where a = 1;            |
# |                              | # 1,m                                              |
# +------------------------------+----------------------------------------------------+
# get isolation for thr1.
select @@transaction_isolation;
@@transaction_isolation
REPEATABLE-READ
# get isolation for thr2.
select @@transaction_isolation;
@@transaction_isolation
REPEATABLE-READ
create table t(a int primary key, b char(10));
begin;
select * from t;
a	b
# Switching to connection 'thr1'.
begin;
insert into t values(1,'m');
# Switching to connection 'thr2'.
select * from t where a = 1;
a	b
select * from t where a = 1 for update;
a	b
# Switching to connection 'thr1'.
commit;
# Switching to connection 'thr2'.
select * from t where a = 1;
a	b
select * from t where a = 1 for update;
a	b
1	m
commit;
select * from t where a = 1;
a	b
1	m
select * from t where a = 1 for update;
a	b
1	m
drop table t;
# test-update/update conflict
# +----------------------------------+-----------------------------------------+
# | session1                         | session2                                |
# +----------------------------------+-----------------------------------------+
# | begin;                           | begin;                                  |
# |                                  | select * from t where a = 1;            |
# |                                  | #1,m                                    |
# | update t set b ='x' where a = 1; |                                         |
# |                                  | update t set b ='y' where a = 1;        |
# |                                  | #wait                                   |
# | commit;                          |                                         |
# |                                  | select * from t where a = 1;            |
# |                                  | #rr/rc 1, y                             |
# |                                  | select * from t where a = 1 for update; |
# |                                  | #1,y                                    |
# |                                  | commit;                                 |
# +----------------------------------+-----------------------------------------+
# get isolation for thr1.
select @@transaction_isolation;
@@transaction_isolation
REPEATABLE-READ
# get isolation for thr2.
select @@transaction_isolation;
@@transaction_isolation
REPEATABLE-READ
create table t(a int primary key, b char(10));
insert into t values(1,'a');
begin;
select * from t where a = 1;
a	b
1	a
# Switching to connection 'thr1'.
begin;
update t set b ='x' where a = 1;
# Switching to connection 'thr2'.
update t set b ='y' where a = 1;
# Switching to connection 'thr1'.
commit;
# Switching to connection 'thr2'.
select * from t where a = 1;
a	b
1	y
select * from t where a = 1 for update;
a	b
1	y
commit;
select * from t where a = 1;
a	b
1	y
select * from t where a = 1 for update;
a	b
1	y
# Switching to connection 'default'.
drop table t;
# test-insert select
# +----------------------------------+----------------------------------+
# | session1                         | session2                         |
# +----------------------------------+----------------------------------+
# | begin;                           | begin;                           |
# | insert into t1 select * from t1; |                                  |
# | select  count(*) from t1;        |                                  |
# | #4(1)                            |                                  |
# |                                  | select  count(*) from t1;        |
# |                                  | #2(2)                            |
# |                                  | insert into t1 select * from t1; |
# |                                  | select  count(*) from t1;        |
# |                                  | #4(3)                            |
# | select  count(*) from t1;        |                                  |
# | #4(4)                            |                                  |
# | commit;                          |                                  |
# | select  count(*) from t1;        |                                  |
# | #4(5)                            |                                  |
# |                                  | select  count(*) from t1;        |
# |                                  | #rc 6, rr 4(6)                   |
# |                                  | insert into t1 select * from t1; |
# |                                  | select  count(*) from t1;        |
# |                                  | #rc 12, rr 8(7)                  |
# | select  count(*) from t1;        |                                  |
# | #4(8)                            |                                  |
# |                                  | commit;                          |
# |                                  | select  count(*) from t1;        |
# |                                  | #rc 12, rr 10 (9)                |
# | select  count(*) from t1;        |                                  |
# | #rc 12, rr 10 (10)                |                                  |
# +----------------------------------+----------------------------------+
# get isolation for thr1.
select @@transaction_isolation;
@@transaction_isolation
REPEATABLE-READ
# get isolation for thr2.
select @@transaction_isolation;
@@transaction_isolation
REPEATABLE-READ
create table t1(a int);
insert into t1 values(1),(2);
begin;
# Switching to connection 'thr1'.
begin;
insert into t1 select * from t1;
# result is 4(1)
select  count(*) from t1;
count(*)
4
# Switching to connection 'thr2'.
# result is 2(2)
select  count(*) from t1;
count(*)
2
insert into t1 select * from t1;
# result is 4(3)
select  count(*) from t1;
count(*)
4
# Switching to connection 'thr1'.
# result is 4(4)
select  count(*) from t1;
count(*)
4
commit;
# result is 4(5)
select  count(*) from t1;
count(*)
4
# Switching to connection 'thr2'.
# result is rc 6, rr 4 (6)
select  count(*) from t1;
count(*)
4
insert into t1 select * from t1;
# result is rc 12, rr 8(7)
select  count(*) from t1;
count(*)
8
# Switching to connection 'thr1'.
# result is 4(8)
select  count(*) from t1;
count(*)
4
# Switching to connection 'thr2'.
commit;
# result is rc 12, rr 10 (9)
select  count(*) from t1;
count(*)
10
# Switching to connection 'thr2'.
# result is rc 12, rr 10 (10)
select  count(*) from t1;
count(*)
10
# Switching to connection 'default'.
drop table t1;
CREATE TABLE IF NOT EXISTS TB_TEST1(ID INT, EMPLOYEE_ID INT, NAME VARCHAR(10), AGE INT, ID_CARD BIGINT,PHONE_NUMBER BIGINT, PRIMARY KEY(ID, EMPLOYEE_ID, ID_CARD, PHONE_NUMBER));
INSERT INTO TB_TEST1 VALUES(1,1001,'ZHANGSAN',25,610001,10086),(2,1002,'LISI',25,610002,10086),(3,1003,'WANGWU',25,610003,10086);
START TRANSACTION WITH CONSISTENT SNAPSHOT;
UPDATE TB_TEST1 SET AGE=18 WHERE ID%3=0;
SELECT COUNT(*) FROM TB_TEST1 WHERE AGE != 18;
COUNT(*)
2
DROP TABLE TB_TEST1;
SET SESSION TRANSACTION ISOLATION LEVEL READ COMMITTED;
START TRANSACTION WITH CONSISTENT SNAPSHOT;
Warnings:
Warning	138	Dstore: WITH CONSISTENT SNAPSHOT was ignored because this phrase can only be used with REPEATABLE READ isolation level.
Warning	138	InnoDB: WITH CONSISTENT SNAPSHOT was ignored because this phrase can only be used with REPEATABLE READ isolation level.
drop table if exists test;
# Establish connection thr1 (user=root)
# Establish connection thr2 (user=root)
# Switching to connection 'default'.
create table test(a int primary key, b int);
insert into test value(1,10);
# Switching to connection 'thr1'.
SET TRANSACTION ISOLATION LEVEL SERIALIZABLE;
begin;
SELECT * FROM test WHERE a = 1;
a	b
1	10
# Switching to connection 'thr2'.
SET TRANSACTION ISOLATION LEVEL SERIALIZABLE;
begin;
SELECT * FROM test WHERE a = 1;
a	b
1	10
commit;
# Switching to connection 'thr1'.
commit;
drop table test;
CREATE TABLE t2(i INT NOT NULL PRIMARY KEY);
INSERT INTO t2 VALUES (1);
set autocommit=0;
lock table t2 write;
INSERT INTO t2 VALUES (3),(1),(2),(5),(4),(7),(6);
ERROR 23000: Duplicate entry '1' for key 't2.PRIMARY'
unlock tables;
commit;
set autocommit=1;
select * from t2;
i
1
select * from t2 ignore index(primary);
i
1
drop table t2;
