set dstore_ddl_enable_batch_insert_for_inplace_rebuild = on;
SET DEBUG_SYNC = 'RESET';
#
# Bug#15863023 SUPPORT IN-PLACE EXTENSION OF VARCHAR COLUMN
#
create table t1 (a SERIAL PRIMARY KEY, c varchar(2) UNIQUE) ENGINE=Dstore;
INSERT INTO t1 (c) VALUES('a'),('bb');
ALTER TABLE t1 CHANGE c b varchar(2), drop index c, add index (b,a);
ALTER TABLE t1 CHANGE b c varchar(4);
INSERT IGNORE INTO t1 (c) VALUES('eeeee'),('ffffff');
Warnings:
Warning	1265	Data truncated for column 'c' at row 1
Warning	1265	Data truncated for column 'c' at row 2
INSERT INTO t1 (c) VALUES('ccc'),('dddd');
SELECT * FROM t1 ORDER BY c;
a	c
1	a
2	bb
5	ccc
6	dddd
3	eeee
4	ffff
DROP TABLE t1;
# Bug#15863023 - case1
SET DEBUG_SYNC = 'RESET';
CREATE TABLE t1 (a INT AUTO_INCREMENT PRIMARY KEY, b VARCHAR(254) charset latin1) ENGINE = Dstore;
INSERT IGNORE INTO t1 (b) VALUES (repeat('a',254)),(repeat('b',254)),(repeat('c',300));
Warnings:
Warning	1265	Data truncated for column 'b' at row 3
SELECT a,LEFT(b,10),LENGTH(b) = 254 FROM t1 ORDER BY a;
a	LEFT(b,10)	LENGTH(b) = 254
1	aaaaaaaaaa	1
2	bbbbbbbbbb	1
3	cccccccccc	1
SET DEBUG_SYNC = 'dstore_commit_inplace_alter_table_enter SIGNAL s1 WAIT_FOR s2';
ALTER TABLE t1 CHANGE b b varchar(255) charset latin1;;
SET lock_wait_timeout = 1;
SET DEBUG_SYNC='now WAIT_FOR s1';
INSERT INTO t1 (b) VALUES (repeat('d',300));
ERROR HY000: Lock wait timeout exceeded; try restarting transaction
SELECT a,LEFT(b,10),LENGTH(b) = 254 FROM t1 ORDER BY a;
ERROR HY000: Lock wait timeout exceeded; try restarting transaction
UPDATE t1 SET b = repeat('y',300) WHERE b = repeat('a',254) ;
ERROR HY000: Lock wait timeout exceeded; try restarting transaction
SELECT a,LEFT(b,10),LENGTH(b) = 254 FROM t1 ORDER BY a;
ERROR HY000: Lock wait timeout exceeded; try restarting transaction
DELETE FROM t1 WHERE b = repeat('y',254);
ERROR HY000: Lock wait timeout exceeded; try restarting transaction
SELECT a,LEFT(b,10),LENGTH(b) = 254 FROM t1 ORDER BY a;
ERROR HY000: Lock wait timeout exceeded; try restarting transaction
SET DEBUG_SYNC='now SIGNAL s2';
SHOW CREATE TABLE t1;
Table	Create Table
t1	CREATE TABLE `t1` (
  `a` int NOT NULL AUTO_INCREMENT,
  `b` varchar(255) CHARACTER SET latin1 COLLATE latin1_swedish_ci DEFAULT NULL,
  PRIMARY KEY (`a`)
) ENGINE=Dstore AUTO_INCREMENT=4 DEFAULT CHARSET=utf8mb4 COLLATE=utf8mb4_0900_ai_ci
INSERT IGNORE INTO t1 (b) VALUES (repeat('d',300));
Warnings:
Warning	1265	Data truncated for column 'b' at row 1
SELECT a,LEFT(b,10),LENGTH(b) = 254 FROM t1 ORDER BY a;
a	LEFT(b,10)	LENGTH(b) = 254
1	aaaaaaaaaa	1
2	bbbbbbbbbb	1
3	cccccccccc	1
4	dddddddddd	0
UPDATE IGNORE t1 SET b = repeat('y',300) WHERE b = repeat('a',254) ;
Warnings:
Warning	1265	Data truncated for column 'b' at row 1
SELECT a,LEFT(b,10),LENGTH(b) = 254 FROM t1 ORDER BY a;
a	LEFT(b,10)	LENGTH(b) = 254
1	yyyyyyyyyy	0
2	bbbbbbbbbb	1
3	cccccccccc	1
4	dddddddddd	0
DELETE FROM t1 WHERE b = repeat('y',255);
SELECT a,LEFT(b,10),LENGTH(b) = 254 FROM t1 ORDER BY a;
a	LEFT(b,10)	LENGTH(b) = 254
2	bbbbbbbbbb	1
3	cccccccccc	1
4	dddddddddd	0
DROP TABLE t1;
# Bug#15863023 - case4. enlarge varchar other alter operations runs copy
# if length is more than 255
SET DEBUG_SYNC = 'RESET';
CREATE TABLE t1 (a INT DEFAULT 100 , b VARCHAR(254) CHARACTER SET latin1,
c VARCHAR(254) CHARACTER SET utf8, d CHAR(10) DEFAULT 'test') ENGINE=Dstore CHARSET=utf8;
Warnings:
Warning	3719	'utf8' is currently an alias for the character set UTF8MB3, but will be an alias for UTF8MB4 in a future release. Please consider using UTF8MB4 in order to be unambiguous.
Warning	3719	'utf8' is currently an alias for the character set UTF8MB3, but will be an alias for UTF8MB4 in a future release. Please consider using UTF8MB4 in order to be unambiguous.
CREATE INDEX c1 ON t1(c);
INSERT IGNORE INTO t1 (a,b) VALUES (1,repeat('a',254)),(2,repeat('b',254)),(3,repeat('c',300));
Warnings:
Warning	1265	Data truncated for column 'b' at row 3
SELECT a,LEFT(b,10),LENGTH(b) = 254 FROM t1 ORDER BY a;
a	LEFT(b,10)	LENGTH(b) = 254
1	aaaaaaaaaa	1
2	bbbbbbbbbb	1
3	cccccccccc	1
ALTER TABLE t1 ADD INDEX idx(b),CHANGE b b varchar(256) CHARACTER SET latin1,CHANGE c c varchar(256) CHARACTER SET utf8,DROP INDEX c1 ,ALGORITHM=INPLACE;
ERROR 0A000: ALGORITHM=INPLACE is not supported. Reason: Cannot change column type INPLACE. Try ALGORITHM=COPY.
ALTER TABLE t1 ADD INDEX idx(b),CHANGE d d char(100) ,ALGORITHM=INPLACE;
ERROR 0A000: ALGORITHM=INPLACE is not supported. Reason: Cannot change column type INPLACE. Try ALGORITHM=COPY.
ALTER TABLE t1 ADD INDEX idx1(b),CHANGE d d VARCHAR(100) ,ALGORITHM=INPLACE;
ERROR 0A000: ALGORITHM=INPLACE is not supported. Reason: Cannot change column type INPLACE. Try ALGORITHM=COPY.
ALTER TABLE t1 ADD INDEX idx(b),CHANGE b b varchar(355) CHARACTER SET latin1,CHANGE c c varchar(255) CHARACTER SET utf8,DROP INDEX c1 ;
Warnings:
Warning	3719	'utf8' is currently an alias for the character set UTF8MB3, but will be an alias for UTF8MB4 in a future release. Please consider using UTF8MB4 in order to be unambiguous.
DROP TABLE t1;
set dstore_ddl_enable_batch_insert_for_inplace_rebuild = off;
SET DEBUG_SYNC = 'RESET';
#
# Bug#15863023 SUPPORT IN-PLACE EXTENSION OF VARCHAR COLUMN
#
create table t1 (a SERIAL PRIMARY KEY, c varchar(2) UNIQUE) ENGINE=Dstore;
INSERT INTO t1 (c) VALUES('a'),('bb');
ALTER TABLE t1 CHANGE c b varchar(2), drop index c, add index (b,a);
ALTER TABLE t1 CHANGE b c varchar(4);
INSERT IGNORE INTO t1 (c) VALUES('eeeee'),('ffffff');
Warnings:
Warning	1265	Data truncated for column 'c' at row 1
Warning	1265	Data truncated for column 'c' at row 2
INSERT INTO t1 (c) VALUES('ccc'),('dddd');
SELECT * FROM t1 ORDER BY c;
a	c
1	a
2	bb
5	ccc
6	dddd
3	eeee
4	ffff
DROP TABLE t1;
# Bug#15863023 - case1
SET DEBUG_SYNC = 'RESET';
CREATE TABLE t1 (a INT AUTO_INCREMENT PRIMARY KEY, b VARCHAR(254) charset latin1) ENGINE = Dstore;
INSERT IGNORE INTO t1 (b) VALUES (repeat('a',254)),(repeat('b',254)),(repeat('c',300));
Warnings:
Warning	1265	Data truncated for column 'b' at row 3
SELECT a,LEFT(b,10),LENGTH(b) = 254 FROM t1 ORDER BY a;
a	LEFT(b,10)	LENGTH(b) = 254
1	aaaaaaaaaa	1
2	bbbbbbbbbb	1
3	cccccccccc	1
SET DEBUG_SYNC = 'dstore_commit_inplace_alter_table_enter SIGNAL s1 WAIT_FOR s2';
ALTER TABLE t1 CHANGE b b varchar(255) charset latin1;;
SET lock_wait_timeout = 1;
SET DEBUG_SYNC='now WAIT_FOR s1';
INSERT INTO t1 (b) VALUES (repeat('d',300));
ERROR HY000: Lock wait timeout exceeded; try restarting transaction
SELECT a,LEFT(b,10),LENGTH(b) = 254 FROM t1 ORDER BY a;
ERROR HY000: Lock wait timeout exceeded; try restarting transaction
UPDATE t1 SET b = repeat('y',300) WHERE b = repeat('a',254) ;
ERROR HY000: Lock wait timeout exceeded; try restarting transaction
SELECT a,LEFT(b,10),LENGTH(b) = 254 FROM t1 ORDER BY a;
ERROR HY000: Lock wait timeout exceeded; try restarting transaction
DELETE FROM t1 WHERE b = repeat('y',254);
ERROR HY000: Lock wait timeout exceeded; try restarting transaction
SELECT a,LEFT(b,10),LENGTH(b) = 254 FROM t1 ORDER BY a;
ERROR HY000: Lock wait timeout exceeded; try restarting transaction
SET DEBUG_SYNC='now SIGNAL s2';
SHOW CREATE TABLE t1;
Table	Create Table
t1	CREATE TABLE `t1` (
  `a` int NOT NULL AUTO_INCREMENT,
  `b` varchar(255) CHARACTER SET latin1 COLLATE latin1_swedish_ci DEFAULT NULL,
  PRIMARY KEY (`a`)
) ENGINE=Dstore AUTO_INCREMENT=4 DEFAULT CHARSET=utf8mb4 COLLATE=utf8mb4_0900_ai_ci
INSERT IGNORE INTO t1 (b) VALUES (repeat('d',300));
Warnings:
Warning	1265	Data truncated for column 'b' at row 1
SELECT a,LEFT(b,10),LENGTH(b) = 254 FROM t1 ORDER BY a;
a	LEFT(b,10)	LENGTH(b) = 254
1	aaaaaaaaaa	1
2	bbbbbbbbbb	1
3	cccccccccc	1
4	dddddddddd	0
UPDATE IGNORE t1 SET b = repeat('y',300) WHERE b = repeat('a',254) ;
Warnings:
Warning	1265	Data truncated for column 'b' at row 1
SELECT a,LEFT(b,10),LENGTH(b) = 254 FROM t1 ORDER BY a;
a	LEFT(b,10)	LENGTH(b) = 254
1	yyyyyyyyyy	0
2	bbbbbbbbbb	1
3	cccccccccc	1
4	dddddddddd	0
DELETE FROM t1 WHERE b = repeat('y',255);
SELECT a,LEFT(b,10),LENGTH(b) = 254 FROM t1 ORDER BY a;
a	LEFT(b,10)	LENGTH(b) = 254
2	bbbbbbbbbb	1
3	cccccccccc	1
4	dddddddddd	0
DROP TABLE t1;
# Bug#15863023 - case4. enlarge varchar other alter operations runs copy
# if length is more than 255
SET DEBUG_SYNC = 'RESET';
CREATE TABLE t1 (a INT DEFAULT 100 , b VARCHAR(254) CHARACTER SET latin1,
c VARCHAR(254) CHARACTER SET utf8, d CHAR(10) DEFAULT 'test') ENGINE=Dstore CHARSET=utf8;
Warnings:
Warning	3719	'utf8' is currently an alias for the character set UTF8MB3, but will be an alias for UTF8MB4 in a future release. Please consider using UTF8MB4 in order to be unambiguous.
Warning	3719	'utf8' is currently an alias for the character set UTF8MB3, but will be an alias for UTF8MB4 in a future release. Please consider using UTF8MB4 in order to be unambiguous.
CREATE INDEX c1 ON t1(c);
INSERT IGNORE INTO t1 (a,b) VALUES (1,repeat('a',254)),(2,repeat('b',254)),(3,repeat('c',300));
Warnings:
Warning	1265	Data truncated for column 'b' at row 3
SELECT a,LEFT(b,10),LENGTH(b) = 254 FROM t1 ORDER BY a;
a	LEFT(b,10)	LENGTH(b) = 254
1	aaaaaaaaaa	1
2	bbbbbbbbbb	1
3	cccccccccc	1
ALTER TABLE t1 ADD INDEX idx(b),CHANGE b b varchar(256) CHARACTER SET latin1,CHANGE c c varchar(256) CHARACTER SET utf8,DROP INDEX c1 ,ALGORITHM=INPLACE;
ERROR 0A000: ALGORITHM=INPLACE is not supported. Reason: Cannot change column type INPLACE. Try ALGORITHM=COPY.
ALTER TABLE t1 ADD INDEX idx(b),CHANGE d d char(100) ,ALGORITHM=INPLACE;
ERROR 0A000: ALGORITHM=INPLACE is not supported. Reason: Cannot change column type INPLACE. Try ALGORITHM=COPY.
ALTER TABLE t1 ADD INDEX idx1(b),CHANGE d d VARCHAR(100) ,ALGORITHM=INPLACE;
ERROR 0A000: ALGORITHM=INPLACE is not supported. Reason: Cannot change column type INPLACE. Try ALGORITHM=COPY.
ALTER TABLE t1 ADD INDEX idx(b),CHANGE b b varchar(355) CHARACTER SET latin1,CHANGE c c varchar(255) CHARACTER SET utf8,DROP INDEX c1 ;
Warnings:
Warning	3719	'utf8' is currently an alias for the character set UTF8MB3, but will be an alias for UTF8MB4 in a future release. Please consider using UTF8MB4 in order to be unambiguous.
DROP TABLE t1;
set dstore_ddl_enable_batch_insert_for_inplace_rebuild = default;
