call mtr.add_suppression("Inplace prepare create index fail, index name: .*");
CREATE TABLE t1 (c1 INT PRIMARY KEY, c2 INT, c3 TEXT)
ENGINE=Dstore STATS_PERSISTENT=0;
INSERT INTO t1 VALUES (1,1,''), (2,2,''), (3,3,''), (4,4,''), (5,5,'');
SET DEBUG_SYNC = 'RESET';
SET DEBUG_SYNC = 'write_row_noreplace SIGNAL have_handle WAIT_FOR go_ahead';
INSERT INTO t1 VALUES(1,2,3);
SET DEBUG_SYNC = 'now WAIT_FOR have_handle';
SET lock_wait_timeout = 1;
ALTER TABLE t1 ADD UNIQUE INDEX(c2);
ERROR HY000: Lock wait timeout exceeded; try restarting transaction
SET DEBUG_SYNC = 'now SIGNAL go_ahead';
ERROR 23000: Duplicate entry '1' for key 't1.PRIMARY'
call mtr.add_suppression("CdeInplacePrepareCreateIndex fail! key name = .*");
call mtr.add_suppression("cde_tuple_desc::build_index_tuple_desc fail! index_tuple_desc is nullptr");
call mtr.add_suppression("Dstore inplace alter table fail due to out of resources, error code.*");
SET SESSION DEBUG = '+d,dstore_OOM_prepare_inplace_alter';
ALTER TABLE t1 ADD UNIQUE INDEX(c2);
ERROR HY000: Out of memory; check if mysqld or some other process uses all available memory; if not, you may have to use 'ulimit' to allow mysqld to use more memory or you can add more swap space
SET SESSION DEBUG = '-d,dstore_OOM_prepare_inplace_alter';
SET SESSION DEBUG = '+d,dstore_OOM_inplace_alter';
SET SESSION DEBUG = '+d,dstore_build_index_fail';
CREATE UNIQUE INDEX c2 ON t1(c2);
ERROR HY000: Out of memory; check if mysqld or some other process uses all available memory; if not, you may have to use 'ulimit' to allow mysqld to use more memory or you can add more swap space
SET SESSION DEBUG = '-d,dstore_OOM_inplace_alter';
SET SESSION DEBUG = '-d,dstore_build_index_fail';
CREATE UNIQUE INDEX c2 ON t1(c2);
DROP INDEX c2 ON t1;
DROP TABLE t1;
CREATE TABLE tt_49 (ipkey INT AUTO_INCREMENT, v1 VARCHAR(19), i2 INT, c3 CHAR(30), g4  CHAR(6) AS  (CONCAT(SUBSTRING(i2,1,2),SUBSTRING(c3,1,4))),  PRIMARY KEY(ipkey), INDEX tt_49i0(v1, g4 DESC, i2 DESC, ipkey, c3 ASC) , INDEX tt_49i1(c3, g4, ipkey) , INDEX tt_49i2(ipkey, g4, v1, i2, c3 DESC)  ) ENGINE=dstore;
ALTER TABLE tt_49 RENAME COLUMN ipkey To ipkey_rename, LOCK=EXCLUSIVE, ALGORITHM=DEFAULT;
ALTER TABLE tt_49 MODIFY COLUMN  i2 INT(16), LOCK=EXCLUSIVE;
Warnings:
Warning	1681	Integer display width is deprecated and will be removed in a future release.
ALTER TABLE tt_49 ADD INDEX tt_49120(i2 ASC) , LOCK=SHARED, ALGORITHM=inplace;
INSERT INTO tt_49  ( ipkey_rename ,v1 ,i2 ,c3 ,g4 ) VALUES( NULL, 'ys4ewPX', 6663, 'WaRIBCCU5', default ) ;
ALTER TABLE tt_49 MODIFY COLUMN  i2 INT(11), LOCK=SHARED, ALGORITHM=inplace;
Warnings:
Warning	1681	Integer display width is deprecated and will be removed in a future release.
ALTER TABLE tt_49 MODIFY COLUMN  v1 VARCHAR(29), LOCK=DEFAULT, ALGORITHM=instant;
SELECT * FROM tt_49 force index(tt_49i2) WHERE ipkey_rename > 0;
ipkey_rename	v1	i2	c3	g4
1	ys4ewPX	6663	WaRIBCCU5	66WaRI
DROP TABLE tt_49;
CREATE TABLE t1(c2 VARBINARY (12), UNIQUE(c2));
CREATE TABLE IF NOT EXISTS t3 (c1 INT4 UNSIGNED NULL, c2 INT4 UNSIGNED NULL, c3 VARBINARY (12) NULL, FOREIGN KEY (c3) REFERENCES t1(c2));
ALTER TABLE t1 RENAME COLUMN c2 TO c1, ALGORITHM=inplace;
drop table t3,t1;
CREATE TABLE tt_1(lbN130 longblob, cN22 char(23) DEFAULT NULL, vN240 varchar(20) DEFAULT NULL, gN248 varchar(10) GENERATED ALWAYS AS (concat(substr(`cN22`,1,2),substr(`vN240`,1,4),substr(`cN22`,1,4))) VIRTUAL, cN113 char(16) DEFAULT NULL, KEY `tt_1614` (`cN113` DESC,`cN22` DESC,`vN240`,`gN248`));
INSERT INTO tt_1 VALUES ('2DDVyZy5iNp6VUB8k5nuzRu0i59FSeQxVyQYFXDvH0Mhg8feJlZteBbYhbihn7VDn98TAX98saeUkX8F2MyYPwmm3dEpzaGpmNVdd1aOq7HRG2KY63cHKlwi2H4oUlA5RzdotrxFry5JXfYL9bnKZjmjZR6gANJMNuOmgH0A6IwLzK3XqmVk99xLAlDYZqgi1WXPRy0CUyfmOvB5abU3wIVM8jzU4z49Vamd4eug2piRicjYDVSqt25hD',NULL,NULL,DEFAULT,NULL);
ALTER TABLE tt_1 DROP COLUMN gN248, LOCK=SHARED, ALGORITHM=INPLACE;
drop table tt_1;
CREATE TABLE `tt_94` (
`v0` varchar(9) DEFAULT NULL,
`v1_rename` varchar(16) DEFAULT NULL,
`f2_rename` float DEFAULT NULL,
`iN55` int DEFAULT NULL,
`gN227` varchar(9) GENERATED ALWAYS AS (concat(substr(`iN55`,1,5),substr(`v0`,1,4))) VIRTUAL,
`tN190` tinyint(1) DEFAULT NULL,
`iN105` int DEFAULT NULL,
`iN58` int DEFAULT NULL,
`vN133_rename` varchar(19) DEFAULT NULL,
`iN265` int DEFAULT NULL,
`iN101` int DEFAULT NULL,
`iN157` int DEFAULT NULL,
`gN84` varchar(18) GENERATED ALWAYS AS (concat(substr(`v0`,1,7),substr(`iN105`,1,3),substr(`iN105`,1,6),`tN190`,`tN190`)) VIRTUAL,
`vN22` varchar(15) DEFAULT NULL,
`vN193` varchar(15) DEFAULT NULL,
`gN64` varchar(22) GENERATED ALWAYS AS (concat(`tN190`,substr(`vN193`,1,6),substr(`v1_rename`,1,7),substr(`v0`,1,8))) STORED,
KEY `tt_94i0` (`v0` DESC),
KEY `tt_94i1` (`v0`,`v1_rename` DESC,`f2_rename`),
KEY `tt_94359` (`f2_rename`),
KEY `tt_94105` (`f2_rename` DESC,`v1_rename`,`v0` DESC),
KEY `tt_94134` (`v1_rename`,`f2_rename`),
KEY `tt_94688` (`f2_rename` DESC),
KEY `tt_94831` (`f2_rename` DESC),
KEY `tt_94818` (`v1_rename` DESC,`v0`),
KEY `tt_9410` (`tN190`),
KEY `tt_94899` (`iN105`,`v1_rename`,`iN58` DESC,`v0`,`iN55`,`tN190`),
KEY `tt_94325` (`iN265` DESC,`v1_rename`),
KEY `tt_94417` (`vN133_rename`,`v0` DESC),
KEY `tt_94843` (`v1_rename`,`f2_rename`,`iN105`,`iN265`,`iN157`,`iN58` DESC),
KEY `tt_94363` (`v0` DESC,`vN22`,`f2_rename`,`v1_rename` DESC,`iN157` DESC,`iN58` DESC),
KEY `tt_94796` (`v1_rename` DESC,`gN227` DESC),
KEY `tt_94884` (`v0` DESC,`v1_rename` DESC,`f2_rename`,`gN227`,`iN55`,`tN190`),
KEY `tt_94876` (`v0` DESC,`tN190` DESC,`gN227` DESC,`v1_rename`,`iN58`,`f2_rename`),
KEY `tt_9443` (`iN58` DESC,`iN55`,`tN190`,`v0` DESC,`v1_rename` DESC,`iN105` DESC,`gN227` DESC,`f2_rename` DESC),
KEY `tt_94580` (`gN227` DESC),
KEY `tt_94472` (`v0`,`tN190`,`vN133_rename` DESC,`iN58` DESC,`gN227`,`v1_rename`),
KEY `tt_9461` (`tN190` DESC,`iN58`,`f2_rename` DESC,`iN105` DESC,`vN133_rename` DESC,`v0`,`iN55`,`v1_rename`,`gN227` DESC),
KEY `tt_94432` (`v0`,`v1_rename`,`gN227`,`vN133_rename` DESC),
KEY `tt_94779` (`v1_rename` DESC,`iN105`,`iN58` DESC,`vN133_rename`,`f2_rename`,`gN227`,`tN190`,`iN55`),
KEY `tt_94695` (`tN190` DESC,`gN84`,`iN157`,`iN58`),
KEY `tt_94298` (`gN227`,`tN190`,`iN157`,`f2_rename` DESC,`gN84`,`iN58` DESC,`v1_rename` DESC,`vN22`,`iN101` DESC,`vN133_rename`),
KEY `tt_94689` (`vN22` DESC,`iN265`,`iN101`,`gN227`,`iN58`)
) ENGINE=Dstore;
Warnings:
Warning	1681	Integer display width is deprecated and will be removed in a future release.
Warning	1831	Duplicate index 'tt_94831' defined on the table 'test.tt_94'. This is deprecated and will be disallowed in a future release.
ALTER TABLE tt_94 DROP COLUMN gN84, LOCK=SHARED, ALGORITHM=INPLACE;
DROP TABLE tt_94;
CREATE TABLE `tt_83` (
`ipkey` int NOT NULL,
`d1` double DEFAULT NULL,
`f2` float DEFAULT NULL,
`gN275_rename` varchar(10) GENERATED ALWAYS AS (concat(`ipkey`)) VIRTUAL,
`gN61` char(6) GENERATED ALWAYS AS (concat(substr(`d1`,1,2),substr(`ipkey`,1,4))) VIRTUAL,
`gN40` char(6) GENERATED ALWAYS AS (concat(substr(`d1`,1,2),substr(`ipkey`,1,2),substr(`ipkey`,1,1),substr(`ipkey`,1,1))) VIRTUAL,
PRIMARY KEY (`ipkey`),
KEY `tt_83i0` (`d1`,`f2`,`ipkey`),
KEY `tt_83939_rename` (`d1`),
KEY `tt_83314` (`ipkey`,`f2`,`d1`),
KEY `tt_830` (`ipkey`,`d1`),
KEY `tt_8328` (`d1` DESC,`ipkey`),
KEY `tt_83573` (`ipkey`,`f2`),
KEY `tt_83979_rename` (`ipkey`),
KEY `tt_83662` (`d1`),
KEY `tt_83238` (`d1`),
KEY `tt_83582` (`d1`,`f2` DESC),
KEY `tt_83330_rename` (`f2`),
KEY `tt_83968` (`f2`),
KEY `tt_83756` (`gN275_rename`,`d1` DESC,`ipkey`),
KEY `tt_83118` (`f2`,`gN275_rename`,`ipkey` DESC),
KEY `tt_83401` (`f2`,`d1`,`ipkey`,`gN275_rename`),
KEY `tt_8333` (`gN275_rename`,`f2`),
KEY `tt_83706` (`gN275_rename` DESC,`d1`),
KEY `tt_83417` (`gN275_rename` DESC,`d1` DESC),
KEY `tt_83814` (`f2`,`gN275_rename`,`d1`),
KEY `tt_83991` (`ipkey`,`f2` DESC,`d1`,`gN61`),
KEY `tt_8342` (`ipkey`,`gN40`,`gN61` DESC,`gN275_rename`),
KEY `tt_83973` (`f2`,`gN61`,`ipkey`,`gN275_rename` DESC,`d1`),
KEY `tt_83909` (`gN275_rename` DESC,`f2`,`d1`,`gN61`),
KEY `tt_83877` (`gN61`),
KEY `tt_83514` (`d1`,`ipkey`,`gN61`,`f2`,`gN275_rename`)
) ENGINE=Dstore;
Warnings:
Warning	1831	Duplicate index 'tt_83662' defined on the table 'test.tt_83'. This is deprecated and will be disallowed in a future release.
Warning	1831	Duplicate index 'tt_83238' defined on the table 'test.tt_83'. This is deprecated and will be disallowed in a future release.
Warning	1831	Duplicate index 'tt_83968' defined on the table 'test.tt_83'. This is deprecated and will be disallowed in a future release.
INSERT INTO `tt_83` (`ipkey`, `d1`, `f2`) VALUES (242639,0,0),(197623,0,0),(107177,0,0),(325030,0,0),(273908,0,0),(365851,0,0),(273040,0,0),(265431,0,0);
ALTER TABLE tt_83 DROP COLUMN gN275_rename, LOCK=SHARED, ALGORITHM=inplace;
Warnings:
Warning	1831	Duplicate index 'tt_83756' defined on the table 'test.tt_83'. This is deprecated and will be disallowed in a future release.
Warning	1831	Duplicate index 'tt_8333' defined on the table 'test.tt_83'. This is deprecated and will be disallowed in a future release.
Warning	1831	Duplicate index 'tt_83706' defined on the table 'test.tt_83'. This is deprecated and will be disallowed in a future release.
drop table tt_83;
##################################################################
# 1. Test with dml commit                                        #
##################################################################
CREATE TABLESPACE tb1 ENGINE=DSTORE;
SET DEBUG_SYNC = 'dstore_row_log_replay_before SIGNAL start_logging WAIT_FOR dml_done';
ALTER TABLE employees
# 1. Rename index
RENAME INDEX idx_name TO idx_name_new,
# 2. Rename column
CHANGE COLUMN created_at created_ts TIMESTAMP DEFAULT CURRENT_TIMESTAMP,
# 3. Drop index
DROP PRIMARY KEY,
DROP INDEX idx_status_created,
# 4. Recreate the deleted index and add a comment to cover Alter_inplace_info::ALTER_INDEX_COMMENT branch.
ADD INDEX idx_status_created (status, created_ts) COMMENT 'Recreated Index',
# 5. Creat primary/secondary/prefix/virtual/composite indexes
ADD PRIMARY KEY (employee_id, name),
ADD INDEX idx_email_created_brief (email(30), created_ts, brief_description(30)),
ADD UNIQUE INDEX idx_unique_email (email),
ADD INDEX idx_name_gender_age (name, gender, age_group),
ADD INDEX idx_credit_score (credit_score DESC),
ALGORITHM = INPLACE, LOCK=NONE;
SET DEBUG_SYNC = 'now WAIT_FOR start_logging';
SET GLOBAL debug="+d,not_compress_for_lob";
INSERT INTO employees (employee_id, department_id, country_id, boss_id, name, email, age, created_at) VALUES
('U006', 'D002', 'C001', 'U001','sunba', 'sunba@example.com', 28, '2024-07-20 14:45:00');
INSERT INTO employees (employee_id, department_id, country_id, boss_id, name, email, age, gender, status, credit_score, created_at, brief_description) VALUES
('U007', 'D002', 'C001', 'U001', 'wuming', 'wuming@example.com', 25, 'M', 1, 750, '2024-08-20 15:45:00', repeat('B', 14000));
UPDATE employees SET email = 'zhangsan_new@example.com', brief_description = repeat('I am zhangsan', 600), j = JSON_QUOTE(repeat('A', 3000)) WHERE employee_id = 'U001';
UPDATE employees SET email = 'ZhangSan_new@example.com' WHERE employee_id = 'U001';
UPDATE employees SET j = JSON_QUOTE(repeat('A', 6000)) WHERE employee_id = 'U001';
UPDATE employees SET brief_description = repeat('I am zhangsan', 1000) WHERE employee_id = 'U001';
UPDATE employees SET brief_description = repeat('I am zhangsan', 10) WHERE employee_id = 'U001';
UPDATE employees SET brief_description = repeat('A', 9000) WHERE employee_id = 'U002';
UPDATE employees SET age = 37 WHERE employee_id = 'U002';
UPDATE employees SET brief_description = repeat('A', 23000) WHERE employee_id = 'U002';
INSERT INTO employees (employee_id, department_id, country_id, boss_id, name, email, age, gender, status, credit_score, created_at, brief_description) VALUES
('U008', 'D002', 'C001', 'U001', 'zhangyue', 'zhangyue@example.com', 25, 'M', 1, 750, '2024-08-20 15:45:00', repeat('C', 14000));
DELETE FROM employees WHERE employee_id = 'U003';
DELETE FROM employees WHERE employee_id = 'U005';
SELECT table_name,index_name,status,replayed_row_log_items,total_row_log_items FROM INFORMATION_SCHEMA.DSTORE_ONLINE_DDL_PROGRESS ORDER BY index_name;
table_name	index_name	status	replayed_row_log_items	total_row_log_items
./test/employees	idx_credit_score	Creating index	0	9
./test/employees	idx_email_created_brief	Creating index	0	9
./test/employees	idx_name_gender_age	Creating index	0	11
./test/employees	idx_unique_email	Creating index	0	9
./test/employees	PRIMARY	Creating index	0	9
SET GLOBAL debug="-d,not_compress_for_lob";
SET DEBUG_SYNC = 'now SIGNAL dml_done';
SELECT table_name,index_name,status,replayed_row_log_items,total_row_log_items FROM INFORMATION_SCHEMA.DSTORE_ONLINE_DDL_PROGRESS;
table_name	index_name	status	replayed_row_log_items	total_row_log_items
SHOW CREATE TABLE employees;
Table	Create Table
employees	CREATE TABLE `employees` (
  `employee_id` varchar(32) NOT NULL,
  `department_id` varchar(32) NOT NULL,
  `country_id` varchar(32) DEFAULT NULL,
  `boss_id` varchar(32) DEFAULT NULL,
  `name` varchar(50) NOT NULL,
  `email` varchar(150) DEFAULT NULL,
  `age` tinyint unsigned DEFAULT NULL,
  `gender` enum('M','F','O') DEFAULT 'O',
  `status` tinyint DEFAULT '1' COMMENT '0:禁用,1:正常,2:冻结',
  `credit_score` int DEFAULT '0',
  `created_ts` timestamp NULL DEFAULT CURRENT_TIMESTAMP,
  `age_group` varchar(20) GENERATED ALWAYS AS ((case when (`age` < 18) then _utf8mb4'minor' when (`age` between 18 and 35) then _utf8mb4'youth' when (`age` between 36 and 55) then _utf8mb4'midlife' else _utf8mb4'elderly' end)) VIRTUAL,
  `brief_description` varchar(60000) CHARACTER SET latin1 COLLATE latin1_swedish_ci DEFAULT NULL,
  `j` json DEFAULT NULL,
  PRIMARY KEY (`employee_id`,`name`),
  UNIQUE KEY `idx_unique_email` (`email`),
  KEY `fk_group` (`department_id`),
  KEY `fk_country` (`country_id`),
  KEY `boss_id` (`boss_id`),
  KEY `idx_name_new` (`name`),
  KEY `idx_status_created` (`status`,`created_ts`) COMMENT 'Recreated Index',
  KEY `idx_email_created_brief` (`email`(30),`created_ts`,`brief_description`(30)),
  KEY `idx_credit_score` (`credit_score` DESC),
  KEY `idx_name_gender_age` (`name`,`gender`,`age_group`),
  CONSTRAINT `employees_fk_1` FOREIGN KEY (`boss_id`) REFERENCES `employees` (`employee_id`) ON DELETE CASCADE ON UPDATE CASCADE,
  CONSTRAINT `fk_country` FOREIGN KEY (`country_id`) REFERENCES `countrys` (`country_id`) ON DELETE SET NULL ON UPDATE CASCADE,
  CONSTRAINT `fk_group` FOREIGN KEY (`department_id`) REFERENCES `departments` (`department_id`) ON DELETE CASCADE ON UPDATE CASCADE
) /*!50100 TABLESPACE `tb1` */ ENGINE=Dstore DEFAULT CHARSET=utf8mb4 COLLATE=utf8mb4_0900_ai_ci
SELECT employee_id, name, email, age, gender
, status, credit_score, created_ts, age_group
, CHAR_LENGTH(brief_description)
FROM employees IGNORE INDEX (PRIMARY)
ORDER BY employee_id;
employee_id	name	email	age	gender	status	credit_score	created_ts	age_group	CHAR_LENGTH(brief_description)
U001	zhangsan	ZhangSan_new@example.com	25	M	1	750	2023-01-15 13:30:00	youth	130
U002	lisi	lisi@example.com	37	M	1	800	2023-06-15 10:30:00	midlife	23000
U004	zhaoliu	zhaoliu@example.com	45	M	0	550	2023-08-10 09:15:00	midlife	1500
U006	sunba	sunba@example.com	28	O	1	0	2024-07-20 14:45:00	youth	NULL
U007	wuming	wuming@example.com	25	M	1	750	2024-08-20 15:45:00	youth	14000
U008	zhangyue	zhangyue@example.com	25	M	1	750	2024-08-20 15:45:00	youth	14000
SELECT employee_id, name
FROM employees FORCE INDEX (PRIMARY);
employee_id	name
U001	zhangsan
U002	lisi
U004	zhaoliu
U006	sunba
U007	wuming
U008	zhangyue
SELECT status, created_ts
FROM employees FORCE INDEX (idx_status_created);
status	created_ts
0	2023-08-10 09:15:00
1	2023-01-15 13:30:00
1	2023-06-15 10:30:00
1	2024-07-20 14:45:00
1	2024-08-20 15:45:00
1	2024-08-20 15:45:00
SELECT email, created_ts
FROM employees FORCE INDEX (idx_email_created_brief)
WHERE email IS NOT NULL;
email	created_ts
lisi@example.com	2023-06-15 10:30:00
sunba@example.com	2024-07-20 14:45:00
wuming@example.com	2024-08-20 15:45:00
ZhangSan_new@example.com	2023-01-15 13:30:00
zhangyue@example.com	2024-08-20 15:45:00
zhaoliu@example.com	2023-08-10 09:15:00
SELECT name, gender
FROM employees FORCE INDEX (idx_name_gender_age);
name	gender
lisi	M
sunba	O
wuming	M
zhangsan	M
zhangyue	M
zhaoliu	M
SELECT credit_score
FROM employees FORCE INDEX (idx_credit_score);
credit_score
800
750
750
750
550
0
##################################################################
# 2. Test with dml rollback                                      #
##################################################################
SET DEBUG_SYNC = 'dstore_row_log_replay_before SIGNAL start_logging WAIT_FOR dml_done';
ALTER TABLE employees
# 1. Rename index
RENAME INDEX idx_name TO idx_name_new,
# 2. Rename column
CHANGE COLUMN created_at created_ts TIMESTAMP DEFAULT CURRENT_TIMESTAMP,
# 3. Drop index
DROP PRIMARY KEY,
DROP INDEX idx_status_created,
# 4. Recreate the deleted index and add a comment to cover Alter_inplace_info::ALTER_INDEX_COMMENT branch.
ADD INDEX idx_status_created (status, created_ts) COMMENT 'Recreated Index',
# 5. Creat primary/secondary/prefix/virtual/composite indexes
ADD PRIMARY KEY (employee_id, name),
ADD INDEX idx_email_created_brief (email(30), created_ts, brief_description(30)),
ADD UNIQUE INDEX idx_unique_email (email),
ADD INDEX idx_name_gender_age (name, gender, age_group),
ADD INDEX idx_credit_score (credit_score DESC),
ALGORITHM = INPLACE, LOCK=NONE;
SET DEBUG_SYNC = 'now WAIT_FOR start_logging';
SET GLOBAL debug="+d,not_compress_for_lob";
BEGIN;
INSERT INTO employees (employee_id, department_id, country_id, boss_id, name, email, age, created_at) VALUES
('U006', 'D002', 'C001', 'U001','sunba', 'sunba@example.com', 28, '2024-07-20 14:45:00');
INSERT INTO employees (employee_id, department_id, country_id, boss_id, name, email, age, gender, status, credit_score, created_at, brief_description) VALUES
('U007', 'D002', 'C001', 'U001', 'wuming', 'wuming@example.com', 25, 'M', 1, 750, '2024-08-20 15:45:00', repeat('B', 14000));
UPDATE employees SET email = 'zhangsan_new@example.com', brief_description = repeat('I am zhangsan', 600), j = JSON_QUOTE(repeat('A', 3000)) WHERE employee_id = 'U001';
UPDATE employees SET email = 'ZhangSan_new@example.com' WHERE employee_id = 'U001';
UPDATE employees SET j = JSON_QUOTE(repeat('A', 6000)) WHERE employee_id = 'U001';
UPDATE employees SET brief_description = repeat('I am zhangsan', 1000) WHERE employee_id = 'U001';
UPDATE employees SET brief_description = repeat('I am zhangsan', 10) WHERE employee_id = 'U001';
UPDATE employees SET brief_description = repeat('A', 9000) WHERE employee_id = 'U002';
UPDATE employees SET age = 37 WHERE employee_id = 'U002';
UPDATE employees SET brief_description = repeat('A', 23000) WHERE employee_id = 'U002';
INSERT INTO employees (employee_id, department_id, country_id, boss_id, name, email, age, gender, status, credit_score, created_at, brief_description) VALUES
('U008', 'D002', 'C001', 'U001', 'zhangyue', 'zhangyue@example.com', 25, 'M', 1, 750, '2024-08-20 15:45:00', repeat('C', 14000));
DELETE FROM employees WHERE employee_id = 'U003';
DELETE FROM employees WHERE employee_id = 'U005';
ROLLBACK;
SELECT table_name,index_name,status,replayed_row_log_items,total_row_log_items FROM INFORMATION_SCHEMA.DSTORE_ONLINE_DDL_PROGRESS ORDER BY index_name;
table_name	index_name	status	replayed_row_log_items	total_row_log_items
./test/employees	idx_credit_score	Creating index	0	18
./test/employees	idx_email_created_brief	Creating index	0	18
./test/employees	idx_name_gender_age	Creating index	0	22
./test/employees	idx_unique_email	Creating index	0	18
./test/employees	PRIMARY	Creating index	0	18
SET GLOBAL debug="-d,not_compress_for_lob";
SET DEBUG_SYNC = 'now SIGNAL dml_done';
SELECT table_name,index_name,status,replayed_row_log_items,total_row_log_items FROM INFORMATION_SCHEMA.DSTORE_ONLINE_DDL_PROGRESS;
table_name	index_name	status	replayed_row_log_items	total_row_log_items
SHOW CREATE TABLE employees;
Table	Create Table
employees	CREATE TABLE `employees` (
  `employee_id` varchar(32) NOT NULL,
  `department_id` varchar(32) NOT NULL,
  `country_id` varchar(32) DEFAULT NULL,
  `boss_id` varchar(32) DEFAULT NULL,
  `name` varchar(50) NOT NULL,
  `email` varchar(150) DEFAULT NULL,
  `age` tinyint unsigned DEFAULT NULL,
  `gender` enum('M','F','O') DEFAULT 'O',
  `status` tinyint DEFAULT '1' COMMENT '0:禁用,1:正常,2:冻结',
  `credit_score` int DEFAULT '0',
  `created_ts` timestamp NULL DEFAULT CURRENT_TIMESTAMP,
  `age_group` varchar(20) GENERATED ALWAYS AS ((case when (`age` < 18) then _utf8mb4'minor' when (`age` between 18 and 35) then _utf8mb4'youth' when (`age` between 36 and 55) then _utf8mb4'midlife' else _utf8mb4'elderly' end)) VIRTUAL,
  `brief_description` varchar(60000) CHARACTER SET latin1 COLLATE latin1_swedish_ci DEFAULT NULL,
  `j` json DEFAULT NULL,
  PRIMARY KEY (`employee_id`,`name`),
  UNIQUE KEY `idx_unique_email` (`email`),
  KEY `fk_group` (`department_id`),
  KEY `fk_country` (`country_id`),
  KEY `boss_id` (`boss_id`),
  KEY `idx_name_new` (`name`),
  KEY `idx_status_created` (`status`,`created_ts`) COMMENT 'Recreated Index',
  KEY `idx_email_created_brief` (`email`(30),`created_ts`,`brief_description`(30)),
  KEY `idx_credit_score` (`credit_score` DESC),
  KEY `idx_name_gender_age` (`name`,`gender`,`age_group`),
  CONSTRAINT `employees_fk_1` FOREIGN KEY (`boss_id`) REFERENCES `employees` (`employee_id`) ON DELETE CASCADE ON UPDATE CASCADE,
  CONSTRAINT `fk_country` FOREIGN KEY (`country_id`) REFERENCES `countrys` (`country_id`) ON DELETE SET NULL ON UPDATE CASCADE,
  CONSTRAINT `fk_group` FOREIGN KEY (`department_id`) REFERENCES `departments` (`department_id`) ON DELETE CASCADE ON UPDATE CASCADE
) /*!50100 TABLESPACE `tb1` */ ENGINE=Dstore DEFAULT CHARSET=utf8mb4 COLLATE=utf8mb4_0900_ai_ci
SELECT employee_id, name, email, age, gender
, status, credit_score, created_ts, age_group
, CHAR_LENGTH(brief_description)
FROM employees IGNORE INDEX (PRIMARY)
ORDER BY employee_id;
employee_id	name	email	age	gender	status	credit_score	created_ts	age_group	CHAR_LENGTH(brief_description)
U001	zhangsan	zhangsan@example.com	25	M	1	750	2023-01-15 13:30:00	youth	390
U002	lisi	lisi@example.com	30	M	1	800	2023-06-15 10:30:00	youth	60000
U003	wangwu	wangwu@example.com	17	F	1	650	2023-07-20 14:45:00	minor	660
U004	zhaoliu	zhaoliu@example.com	45	M	0	550	2023-08-10 09:15:00	midlife	1500
U005	qianqi	qianqi@example.com	60	F	2	900	2023-09-05 16:20:00	elderly	45000
SELECT employee_id, name
FROM employees FORCE INDEX (PRIMARY);
employee_id	name
U001	zhangsan
U002	lisi
U003	wangwu
U004	zhaoliu
U005	qianqi
SELECT status, created_ts
FROM employees FORCE INDEX (idx_status_created);
status	created_ts
0	2023-08-10 09:15:00
1	2023-01-15 13:30:00
1	2023-06-15 10:30:00
1	2023-07-20 14:45:00
2	2023-09-05 16:20:00
SELECT email, created_ts
FROM employees FORCE INDEX (idx_email_created_brief)
WHERE email IS NOT NULL;
email	created_ts
lisi@example.com	2023-06-15 10:30:00
qianqi@example.com	2023-09-05 16:20:00
wangwu@example.com	2023-07-20 14:45:00
zhangsan@example.com	2023-01-15 13:30:00
zhaoliu@example.com	2023-08-10 09:15:00
SELECT name, gender
FROM employees FORCE INDEX (idx_name_gender_age);
name	gender
lisi	M
qianqi	F
wangwu	F
zhangsan	M
zhaoliu	M
SELECT credit_score
FROM employees FORCE INDEX (idx_credit_score);
credit_score
900
800
750
650
550
##################################################################
# 3. Test with reboot and dml rollback(Verify tableId is valid)  #
##################################################################
# restart:
SET DEBUG_SYNC = 'dstore_row_log_replay_before SIGNAL start_logging WAIT_FOR dml_done';
ALTER TABLE employees
# 1. Rename index
RENAME INDEX idx_name TO idx_name_new,
# 2. Rename column
CHANGE COLUMN created_at created_ts TIMESTAMP DEFAULT CURRENT_TIMESTAMP,
# 3. Drop index
DROP PRIMARY KEY,
DROP INDEX idx_status_created,
# 4. Recreate the deleted index and add a comment to cover Alter_inplace_info::ALTER_INDEX_COMMENT branch.
ADD INDEX idx_status_created (status, created_ts) COMMENT 'Recreated Index',
# 5. Creat primary/secondary/prefix/virtual/composite indexes
ADD PRIMARY KEY (employee_id, name),
ADD INDEX idx_email_created_brief (email(30), created_ts, brief_description(30)),
ADD UNIQUE INDEX idx_unique_email (email),
ADD INDEX idx_name_gender_age (name, gender, age_group),
ADD INDEX idx_credit_score (credit_score DESC),
ALGORITHM = INPLACE, LOCK=NONE;
SET DEBUG_SYNC = 'now WAIT_FOR start_logging';
SET GLOBAL debug="+d,not_compress_for_lob";
BEGIN;
INSERT INTO employees (employee_id, department_id, country_id, boss_id, name, email, age, created_at) VALUES
('U006', 'D002', 'C001', 'U001','sunba', 'sunba@example.com', 28, '2024-07-20 14:45:00');
INSERT INTO employees (employee_id, department_id, country_id, boss_id, name, email, age, gender, status, credit_score, created_at, brief_description) VALUES
('U007', 'D002', 'C001', 'U001', 'wuming', 'wuming@example.com', 25, 'M', 1, 750, '2024-08-20 15:45:00', repeat('B', 14000));
UPDATE employees SET email = 'zhangsan_new@example.com', brief_description = repeat('I am zhangsan', 600), j = JSON_QUOTE(repeat('A', 3000)) WHERE employee_id = 'U001';
UPDATE employees SET email = 'ZhangSan_new@example.com' WHERE employee_id = 'U001';
UPDATE employees SET j = JSON_QUOTE(repeat('A', 6000)) WHERE employee_id = 'U001';
UPDATE employees SET brief_description = repeat('I am zhangsan', 1000) WHERE employee_id = 'U001';
UPDATE employees SET brief_description = repeat('I am zhangsan', 10) WHERE employee_id = 'U001';
UPDATE employees SET brief_description = repeat('A', 9000) WHERE employee_id = 'U002';
UPDATE employees SET age = 37 WHERE employee_id = 'U002';
UPDATE employees SET brief_description = repeat('A', 23000) WHERE employee_id = 'U002';
INSERT INTO employees (employee_id, department_id, country_id, boss_id, name, email, age, gender, status, credit_score, created_at, brief_description) VALUES
('U008', 'D002', 'C001', 'U001', 'zhangyue', 'zhangyue@example.com', 25, 'M', 1, 750, '2024-08-20 15:45:00', repeat('C', 14000));
DELETE FROM employees WHERE employee_id = 'U003';
DELETE FROM employees WHERE employee_id = 'U005';
ROLLBACK;
SELECT table_name,index_name,status,replayed_row_log_items,total_row_log_items FROM INFORMATION_SCHEMA.DSTORE_ONLINE_DDL_PROGRESS ORDER BY index_name;
table_name	index_name	status	replayed_row_log_items	total_row_log_items
./test/employees	idx_credit_score	Creating index	0	18
./test/employees	idx_email_created_brief	Creating index	0	18
./test/employees	idx_name_gender_age	Creating index	0	22
./test/employees	idx_unique_email	Creating index	0	18
./test/employees	PRIMARY	Creating index	0	18
SET GLOBAL debug="-d,not_compress_for_lob";
SET DEBUG_SYNC = 'now SIGNAL dml_done';
SELECT table_name,index_name,status,replayed_row_log_items,total_row_log_items FROM INFORMATION_SCHEMA.DSTORE_ONLINE_DDL_PROGRESS;
table_name	index_name	status	replayed_row_log_items	total_row_log_items
SHOW CREATE TABLE employees;
Table	Create Table
employees	CREATE TABLE `employees` (
  `employee_id` varchar(32) NOT NULL,
  `department_id` varchar(32) NOT NULL,
  `country_id` varchar(32) DEFAULT NULL,
  `boss_id` varchar(32) DEFAULT NULL,
  `name` varchar(50) NOT NULL,
  `email` varchar(150) DEFAULT NULL,
  `age` tinyint unsigned DEFAULT NULL,
  `gender` enum('M','F','O') DEFAULT 'O',
  `status` tinyint DEFAULT '1' COMMENT '0:禁用,1:正常,2:冻结',
  `credit_score` int DEFAULT '0',
  `created_ts` timestamp NULL DEFAULT CURRENT_TIMESTAMP,
  `age_group` varchar(20) GENERATED ALWAYS AS ((case when (`age` < 18) then _utf8mb4'minor' when (`age` between 18 and 35) then _utf8mb4'youth' when (`age` between 36 and 55) then _utf8mb4'midlife' else _utf8mb4'elderly' end)) VIRTUAL,
  `brief_description` varchar(60000) CHARACTER SET latin1 COLLATE latin1_swedish_ci DEFAULT NULL,
  `j` json DEFAULT NULL,
  PRIMARY KEY (`employee_id`,`name`),
  UNIQUE KEY `idx_unique_email` (`email`),
  KEY `fk_group` (`department_id`),
  KEY `fk_country` (`country_id`),
  KEY `boss_id` (`boss_id`),
  KEY `idx_name_new` (`name`),
  KEY `idx_status_created` (`status`,`created_ts`) COMMENT 'Recreated Index',
  KEY `idx_email_created_brief` (`email`(30),`created_ts`,`brief_description`(30)),
  KEY `idx_credit_score` (`credit_score` DESC),
  KEY `idx_name_gender_age` (`name`,`gender`,`age_group`),
  CONSTRAINT `employees_fk_1` FOREIGN KEY (`boss_id`) REFERENCES `employees` (`employee_id`) ON DELETE CASCADE ON UPDATE CASCADE,
  CONSTRAINT `fk_country` FOREIGN KEY (`country_id`) REFERENCES `countrys` (`country_id`) ON DELETE SET NULL ON UPDATE CASCADE,
  CONSTRAINT `fk_group` FOREIGN KEY (`department_id`) REFERENCES `departments` (`department_id`) ON DELETE CASCADE ON UPDATE CASCADE
) /*!50100 TABLESPACE `tb1` */ ENGINE=Dstore DEFAULT CHARSET=utf8mb4 COLLATE=utf8mb4_0900_ai_ci
SELECT employee_id, name, email, age, gender
, status, credit_score, created_ts, age_group
, CHAR_LENGTH(brief_description)
FROM employees IGNORE INDEX (PRIMARY)
ORDER BY employee_id;
employee_id	name	email	age	gender	status	credit_score	created_ts	age_group	CHAR_LENGTH(brief_description)
U001	zhangsan	zhangsan@example.com	25	M	1	750	2023-01-15 13:30:00	youth	390
U002	lisi	lisi@example.com	30	M	1	800	2023-06-15 10:30:00	youth	60000
U003	wangwu	wangwu@example.com	17	F	1	650	2023-07-20 14:45:00	minor	660
U004	zhaoliu	zhaoliu@example.com	45	M	0	550	2023-08-10 09:15:00	midlife	1500
U005	qianqi	qianqi@example.com	60	F	2	900	2023-09-05 16:20:00	elderly	45000
SELECT employee_id, name
FROM employees FORCE INDEX (PRIMARY);
employee_id	name
U001	zhangsan
U002	lisi
U003	wangwu
U004	zhaoliu
U005	qianqi
SELECT status, created_ts
FROM employees FORCE INDEX (idx_status_created);
status	created_ts
0	2023-08-10 09:15:00
1	2023-01-15 13:30:00
1	2023-06-15 10:30:00
1	2023-07-20 14:45:00
2	2023-09-05 16:20:00
SELECT email, created_ts
FROM employees FORCE INDEX (idx_email_created_brief)
WHERE email IS NOT NULL;
email	created_ts
lisi@example.com	2023-06-15 10:30:00
qianqi@example.com	2023-09-05 16:20:00
wangwu@example.com	2023-07-20 14:45:00
zhangsan@example.com	2023-01-15 13:30:00
zhaoliu@example.com	2023-08-10 09:15:00
SELECT name, gender
FROM employees FORCE INDEX (idx_name_gender_age);
name	gender
lisi	M
qianqi	F
wangwu	F
zhangsan	M
zhaoliu	M
SELECT credit_score
FROM employees FORCE INDEX (idx_credit_score);
credit_score
900
800
750
650
550
##################################################################
# 4. Test with dml commit and rollback                           #
##################################################################
SET DEBUG_SYNC = 'dstore_row_log_replay_before SIGNAL start_logging WAIT_FOR dml_done';
ALTER TABLE employees
# 1. Rename index
RENAME INDEX idx_name TO idx_name_new,
# 2. Rename column
CHANGE COLUMN created_at created_ts TIMESTAMP DEFAULT CURRENT_TIMESTAMP,
# 3. Drop index
DROP PRIMARY KEY,
DROP INDEX idx_status_created,
# 4. Recreate the deleted index and add a comment to cover Alter_inplace_info::ALTER_INDEX_COMMENT branch.
ADD INDEX idx_status_created (status, created_ts) COMMENT 'Recreated Index',
# 5. Creat primary/secondary/prefix/virtual/composite indexes
ADD PRIMARY KEY (employee_id, name),
ADD INDEX idx_email_created_brief (email(30), created_ts, brief_description(30)),
ADD UNIQUE INDEX idx_unique_email (email),
ADD INDEX idx_name_gender_age (name, gender, age_group),
ADD INDEX idx_credit_score (credit_score DESC),
ALGORITHM = INPLACE, LOCK=NONE;
SET DEBUG_SYNC = 'now WAIT_FOR start_logging';
SET GLOBAL debug="+d,not_compress_for_lob";
INSERT INTO employees (employee_id, department_id, country_id, boss_id, name, email, age, created_at) VALUES
('U006', 'D002', 'C001', 'U001','sunba', 'sunba@example.com', 28, '2024-07-20 14:45:00');
INSERT INTO employees (employee_id, department_id, country_id, boss_id, name, email, age, gender, status, credit_score, created_at, brief_description) VALUES
('U007', 'D002', 'C001', 'U001', 'wuming', 'wuming@example.com', 25, 'M', 1, 750, '2024-08-20 15:45:00', repeat('B', 14000));
BEGIN;
UPDATE employees SET email = 'zhangsan_new@example.com', brief_description = repeat('I am zhangsan', 600) WHERE employee_id = 'U001';
UPDATE employees SET email = 'ZhangSan_new@example.com' WHERE employee_id = 'U001';
UPDATE employees SET j = JSON_QUOTE(repeat('A', 6000)) WHERE employee_id = 'U001';
UPDATE employees SET brief_description = repeat('I am zhangsan', 1000) WHERE employee_id = 'U001';
UPDATE employees SET brief_description = repeat('I am zhangsan', 10) WHERE employee_id = 'U001';
UPDATE employees SET brief_description = repeat('A', 9000) WHERE employee_id = 'U002';
UPDATE employees SET age = 37 WHERE employee_id = 'U002';
UPDATE employees SET brief_description = repeat('A', 23000) WHERE employee_id = 'U002';
INSERT INTO employees (employee_id, department_id, country_id, boss_id, name, email, age, gender, status, credit_score, created_at, brief_description) VALUES
('U008', 'D002', 'C001', 'U001', 'zhangyue', 'zhangyue@example.com', 25, 'M', 1, 750, '2024-08-20 15:45:00', repeat('C', 14000));
DELETE FROM employees WHERE employee_id = 'U003';
DELETE FROM employees WHERE employee_id = 'U005';
ROLLBACK;
SELECT table_name,index_name,status,replayed_row_log_items,total_row_log_items FROM INFORMATION_SCHEMA.DSTORE_ONLINE_DDL_PROGRESS ORDER BY index_name;
table_name	index_name	status	replayed_row_log_items	total_row_log_items
./test/employees	idx_credit_score	Creating index	0	20
./test/employees	idx_email_created_brief	Creating index	0	20
./test/employees	idx_name_gender_age	Creating index	0	24
./test/employees	idx_unique_email	Creating index	0	20
./test/employees	PRIMARY	Creating index	0	20
SET GLOBAL debug="-d,not_compress_for_lob";
SET DEBUG_SYNC = 'now SIGNAL dml_done';
SELECT table_name,index_name,status,replayed_row_log_items,total_row_log_items FROM INFORMATION_SCHEMA.DSTORE_ONLINE_DDL_PROGRESS;
table_name	index_name	status	replayed_row_log_items	total_row_log_items
SHOW CREATE TABLE employees;
Table	Create Table
employees	CREATE TABLE `employees` (
  `employee_id` varchar(32) NOT NULL,
  `department_id` varchar(32) NOT NULL,
  `country_id` varchar(32) DEFAULT NULL,
  `boss_id` varchar(32) DEFAULT NULL,
  `name` varchar(50) NOT NULL,
  `email` varchar(150) DEFAULT NULL,
  `age` tinyint unsigned DEFAULT NULL,
  `gender` enum('M','F','O') DEFAULT 'O',
  `status` tinyint DEFAULT '1' COMMENT '0:禁用,1:正常,2:冻结',
  `credit_score` int DEFAULT '0',
  `created_ts` timestamp NULL DEFAULT CURRENT_TIMESTAMP,
  `age_group` varchar(20) GENERATED ALWAYS AS ((case when (`age` < 18) then _utf8mb4'minor' when (`age` between 18 and 35) then _utf8mb4'youth' when (`age` between 36 and 55) then _utf8mb4'midlife' else _utf8mb4'elderly' end)) VIRTUAL,
  `brief_description` varchar(60000) CHARACTER SET latin1 COLLATE latin1_swedish_ci DEFAULT NULL,
  `j` json DEFAULT NULL,
  PRIMARY KEY (`employee_id`,`name`),
  UNIQUE KEY `idx_unique_email` (`email`),
  KEY `fk_group` (`department_id`),
  KEY `fk_country` (`country_id`),
  KEY `boss_id` (`boss_id`),
  KEY `idx_name_new` (`name`),
  KEY `idx_status_created` (`status`,`created_ts`) COMMENT 'Recreated Index',
  KEY `idx_email_created_brief` (`email`(30),`created_ts`,`brief_description`(30)),
  KEY `idx_credit_score` (`credit_score` DESC),
  KEY `idx_name_gender_age` (`name`,`gender`,`age_group`),
  CONSTRAINT `employees_fk_1` FOREIGN KEY (`boss_id`) REFERENCES `employees` (`employee_id`) ON DELETE CASCADE ON UPDATE CASCADE,
  CONSTRAINT `fk_country` FOREIGN KEY (`country_id`) REFERENCES `countrys` (`country_id`) ON DELETE SET NULL ON UPDATE CASCADE,
  CONSTRAINT `fk_group` FOREIGN KEY (`department_id`) REFERENCES `departments` (`department_id`) ON DELETE CASCADE ON UPDATE CASCADE
) /*!50100 TABLESPACE `tb1` */ ENGINE=Dstore DEFAULT CHARSET=utf8mb4 COLLATE=utf8mb4_0900_ai_ci
SELECT employee_id, name, email, age, gender
, status, credit_score, created_ts, age_group
, CHAR_LENGTH(brief_description)
FROM employees IGNORE INDEX (PRIMARY)
ORDER BY employee_id;
employee_id	name	email	age	gender	status	credit_score	created_ts	age_group	CHAR_LENGTH(brief_description)
U001	zhangsan	zhangsan@example.com	25	M	1	750	2023-01-15 13:30:00	youth	390
U002	lisi	lisi@example.com	30	M	1	800	2023-06-15 10:30:00	youth	60000
U003	wangwu	wangwu@example.com	17	F	1	650	2023-07-20 14:45:00	minor	660
U004	zhaoliu	zhaoliu@example.com	45	M	0	550	2023-08-10 09:15:00	midlife	1500
U005	qianqi	qianqi@example.com	60	F	2	900	2023-09-05 16:20:00	elderly	45000
U006	sunba	sunba@example.com	28	O	1	0	2024-07-20 14:45:00	youth	NULL
U007	wuming	wuming@example.com	25	M	1	750	2024-08-20 15:45:00	youth	14000
SELECT employee_id, name
FROM employees FORCE INDEX (PRIMARY);
employee_id	name
U001	zhangsan
U002	lisi
U003	wangwu
U004	zhaoliu
U005	qianqi
U006	sunba
U007	wuming
SELECT status, created_ts
FROM employees FORCE INDEX (idx_status_created);
status	created_ts
0	2023-08-10 09:15:00
1	2023-01-15 13:30:00
1	2023-06-15 10:30:00
1	2023-07-20 14:45:00
1	2024-07-20 14:45:00
1	2024-08-20 15:45:00
2	2023-09-05 16:20:00
SELECT email, created_ts
FROM employees FORCE INDEX (idx_email_created_brief)
WHERE email IS NOT NULL;
email	created_ts
lisi@example.com	2023-06-15 10:30:00
qianqi@example.com	2023-09-05 16:20:00
sunba@example.com	2024-07-20 14:45:00
wangwu@example.com	2023-07-20 14:45:00
wuming@example.com	2024-08-20 15:45:00
zhangsan@example.com	2023-01-15 13:30:00
zhaoliu@example.com	2023-08-10 09:15:00
SELECT name, gender
FROM employees FORCE INDEX (idx_name_gender_age);
name	gender
lisi	M
qianqi	F
sunba	O
wangwu	F
wuming	M
zhangsan	M
zhaoliu	M
SELECT credit_score
FROM employees FORCE INDEX (idx_credit_score);
credit_score
900
800
750
750
650
550
0
##################################################################
# 5. Test with dml triggered by foreign key and commit           #
##################################################################
SET DEBUG_SYNC = 'dstore_row_log_replay_before SIGNAL start_logging WAIT_FOR dml_done';
ALTER TABLE employees
# 1. Rename index
RENAME INDEX idx_name TO idx_name_new,
# 2. Rename column
CHANGE COLUMN created_at created_ts TIMESTAMP DEFAULT CURRENT_TIMESTAMP,
# 3. Drop index
DROP PRIMARY KEY,
DROP INDEX idx_status_created,
# 4. Recreate the deleted index and add a comment to cover Alter_inplace_info::ALTER_INDEX_COMMENT branch.
ADD INDEX idx_status_created (status, created_ts) COMMENT 'Recreated Index',
# 5. Creat primary/secondary/prefix/virtual/composite indexes
ADD PRIMARY KEY (employee_id, name),
ADD INDEX idx_email_created_brief (email(30), created_ts, brief_description(30)),
ADD UNIQUE INDEX idx_unique_email (email),
ADD INDEX idx_name_gender_age (name, gender, age_group),
ADD INDEX idx_credit_score (credit_score DESC),
ALGORITHM = INPLACE, LOCK=NONE;
SET DEBUG_SYNC = 'now WAIT_FOR start_logging';
SET GLOBAL debug="+d,not_compress_for_lob";
INSERT INTO employees (employee_id, department_id, country_id, boss_id, name, email, age, created_at) VALUES
('U006', 'D002', 'C001', 'U001','sunba', 'sunba@example.com', 28, '2024-07-20 14:45:00');
INSERT INTO employees (employee_id, department_id, country_id, boss_id, name, email, age, gender, status, credit_score, created_at, brief_description) VALUES
('U007', 'D002', 'C001', 'U001', 'wuming', 'wuming@example.com', 25, 'M', 1, 750, '2024-08-20 15:45:00', repeat('B', 14000));
DELETE FROM employees WHERE employee_id='U002';
INSERT INTO employees (employee_id, department_id, country_id, boss_id, name, email, age, gender, status, credit_score, created_at, brief_description) VALUES
('U008', 'D002', 'C001', 'U001', 'zhangyue', 'zhangyue@example.com', 25, 'M', 1, 750, '2024-08-20 15:45:00', repeat('C', 14000));
UPDATE departments SET department_id='D001_new' WHERE department_id = 'D001';
DELETE FROM departments WHERE department_id = 'D002';
SELECT table_name,index_name,status,replayed_row_log_items,total_row_log_items FROM INFORMATION_SCHEMA.DSTORE_ONLINE_DDL_PROGRESS ORDER BY index_name;
table_name	index_name	status	replayed_row_log_items	total_row_log_items
./test/employees	idx_credit_score	Creating index	0	9
./test/employees	idx_email_created_brief	Creating index	0	9
./test/employees	idx_name_gender_age	Creating index	0	9
./test/employees	idx_unique_email	Creating index	0	9
./test/employees	PRIMARY	Creating index	0	9
SET GLOBAL debug="-d,not_compress_for_lob";
SET DEBUG_SYNC = 'now SIGNAL dml_done';
SELECT table_name,index_name,status,replayed_row_log_items,total_row_log_items FROM INFORMATION_SCHEMA.DSTORE_ONLINE_DDL_PROGRESS;
table_name	index_name	status	replayed_row_log_items	total_row_log_items
SHOW CREATE TABLE employees;
Table	Create Table
employees	CREATE TABLE `employees` (
  `employee_id` varchar(32) NOT NULL,
  `department_id` varchar(32) NOT NULL,
  `country_id` varchar(32) DEFAULT NULL,
  `boss_id` varchar(32) DEFAULT NULL,
  `name` varchar(50) NOT NULL,
  `email` varchar(150) DEFAULT NULL,
  `age` tinyint unsigned DEFAULT NULL,
  `gender` enum('M','F','O') DEFAULT 'O',
  `status` tinyint DEFAULT '1' COMMENT '0:禁用,1:正常,2:冻结',
  `credit_score` int DEFAULT '0',
  `created_ts` timestamp NULL DEFAULT CURRENT_TIMESTAMP,
  `age_group` varchar(20) GENERATED ALWAYS AS ((case when (`age` < 18) then _utf8mb4'minor' when (`age` between 18 and 35) then _utf8mb4'youth' when (`age` between 36 and 55) then _utf8mb4'midlife' else _utf8mb4'elderly' end)) VIRTUAL,
  `brief_description` varchar(60000) CHARACTER SET latin1 COLLATE latin1_swedish_ci DEFAULT NULL,
  `j` json DEFAULT NULL,
  PRIMARY KEY (`employee_id`,`name`),
  UNIQUE KEY `idx_unique_email` (`email`),
  KEY `fk_group` (`department_id`),
  KEY `fk_country` (`country_id`),
  KEY `boss_id` (`boss_id`),
  KEY `idx_name_new` (`name`),
  KEY `idx_status_created` (`status`,`created_ts`) COMMENT 'Recreated Index',
  KEY `idx_email_created_brief` (`email`(30),`created_ts`,`brief_description`(30)),
  KEY `idx_credit_score` (`credit_score` DESC),
  KEY `idx_name_gender_age` (`name`,`gender`,`age_group`),
  CONSTRAINT `employees_fk_1` FOREIGN KEY (`boss_id`) REFERENCES `employees` (`employee_id`) ON DELETE CASCADE ON UPDATE CASCADE,
  CONSTRAINT `fk_country` FOREIGN KEY (`country_id`) REFERENCES `countrys` (`country_id`) ON DELETE SET NULL ON UPDATE CASCADE,
  CONSTRAINT `fk_group` FOREIGN KEY (`department_id`) REFERENCES `departments` (`department_id`) ON DELETE CASCADE ON UPDATE CASCADE
) /*!50100 TABLESPACE `tb1` */ ENGINE=Dstore DEFAULT CHARSET=utf8mb4 COLLATE=utf8mb4_0900_ai_ci
SELECT employee_id, name, email, age, gender
, status, credit_score, created_ts, age_group
, CHAR_LENGTH(brief_description)
FROM employees IGNORE INDEX (PRIMARY)
ORDER BY employee_id;
employee_id	name	email	age	gender	status	credit_score	created_ts	age_group	CHAR_LENGTH(brief_description)
U001	zhangsan	zhangsan@example.com	25	M	1	750	2023-01-15 13:30:00	youth	390
U003	wangwu	wangwu@example.com	17	F	1	650	2023-07-20 14:45:00	minor	660
SELECT employee_id, name
FROM employees FORCE INDEX (PRIMARY);
employee_id	name
U001	zhangsan
U003	wangwu
SELECT status, created_ts
FROM employees FORCE INDEX (idx_status_created);
status	created_ts
1	2023-01-15 13:30:00
1	2023-07-20 14:45:00
SELECT email, created_ts
FROM employees FORCE INDEX (idx_email_created_brief)
WHERE email IS NOT NULL;
email	created_ts
wangwu@example.com	2023-07-20 14:45:00
zhangsan@example.com	2023-01-15 13:30:00
SELECT name, gender
FROM employees FORCE INDEX (idx_name_gender_age);
name	gender
wangwu	F
zhangsan	M
SELECT credit_score
FROM employees FORCE INDEX (idx_credit_score);
credit_score
750
650
##################################################################
# 6. Test with dml triggered by foreign key and rollback         #
##################################################################
SET DEBUG_SYNC = 'dstore_row_log_replay_before SIGNAL start_logging WAIT_FOR dml_done';
ALTER TABLE employees
# 1. Rename index
RENAME INDEX idx_name TO idx_name_new,
# 2. Rename column
CHANGE COLUMN created_at created_ts TIMESTAMP DEFAULT CURRENT_TIMESTAMP,
# 3. Drop index
DROP PRIMARY KEY,
DROP INDEX idx_status_created,
# 4. Recreate the deleted index and add a comment to cover Alter_inplace_info::ALTER_INDEX_COMMENT branch.
ADD INDEX idx_status_created (status, created_ts) COMMENT 'Recreated Index',
# 5. Creat primary/secondary/prefix/virtual/composite indexes
ADD PRIMARY KEY (employee_id, name),
ADD INDEX idx_email_created_brief (email(30), created_ts, brief_description(30)),
ADD UNIQUE INDEX idx_unique_email (email),
ADD INDEX idx_name_gender_age (name, gender, age_group),
ADD INDEX idx_credit_score (credit_score DESC),
ALGORITHM = INPLACE, LOCK=NONE;
SET DEBUG_SYNC = 'now WAIT_FOR start_logging';
SET GLOBAL debug="+d,not_compress_for_lob";
BEGIN;
INSERT INTO employees (employee_id, department_id, country_id, boss_id, name, email, age, created_at) VALUES
('U006', 'D002', 'C001', 'U001','sunba', 'sunba@example.com', 28, '2024-07-20 14:45:00');
INSERT INTO employees (employee_id, department_id, country_id, boss_id, name, email, age, gender, status, credit_score, created_at, brief_description) VALUES
('U007', 'D002', 'C001', 'U001', 'wuming', 'wuming@example.com', 25, 'M', 1, 750, '2024-08-20 15:45:00', repeat('B', 14000));
DELETE FROM employees WHERE employee_id='U002';
INSERT INTO employees (employee_id, department_id, country_id, boss_id, name, email, age, gender, status, credit_score, created_at, brief_description) VALUES
('U008', 'D002', 'C001', 'U001', 'zhangyue', 'zhangyue@example.com', 25, 'M', 1, 750, '2024-08-20 15:45:00', repeat('C', 14000));
UPDATE departments SET department_id='D001_new' WHERE department_id = 'D001';
DELETE FROM departments WHERE department_id = 'D002';
ROLLBACK;
SELECT table_name,index_name,status,replayed_row_log_items,total_row_log_items FROM INFORMATION_SCHEMA.DSTORE_ONLINE_DDL_PROGRESS ORDER BY index_name;
table_name	index_name	status	replayed_row_log_items	total_row_log_items
./test/employees	idx_credit_score	Creating index	0	18
./test/employees	idx_email_created_brief	Creating index	0	18
./test/employees	idx_name_gender_age	Creating index	0	18
./test/employees	idx_unique_email	Creating index	0	18
./test/employees	PRIMARY	Creating index	0	18
SET GLOBAL debug="-d,not_compress_for_lob";
SET DEBUG_SYNC = 'now SIGNAL dml_done';
SELECT table_name,index_name,status,replayed_row_log_items,total_row_log_items FROM INFORMATION_SCHEMA.DSTORE_ONLINE_DDL_PROGRESS;
table_name	index_name	status	replayed_row_log_items	total_row_log_items
SHOW CREATE TABLE employees;
Table	Create Table
employees	CREATE TABLE `employees` (
  `employee_id` varchar(32) NOT NULL,
  `department_id` varchar(32) NOT NULL,
  `country_id` varchar(32) DEFAULT NULL,
  `boss_id` varchar(32) DEFAULT NULL,
  `name` varchar(50) NOT NULL,
  `email` varchar(150) DEFAULT NULL,
  `age` tinyint unsigned DEFAULT NULL,
  `gender` enum('M','F','O') DEFAULT 'O',
  `status` tinyint DEFAULT '1' COMMENT '0:禁用,1:正常,2:冻结',
  `credit_score` int DEFAULT '0',
  `created_ts` timestamp NULL DEFAULT CURRENT_TIMESTAMP,
  `age_group` varchar(20) GENERATED ALWAYS AS ((case when (`age` < 18) then _utf8mb4'minor' when (`age` between 18 and 35) then _utf8mb4'youth' when (`age` between 36 and 55) then _utf8mb4'midlife' else _utf8mb4'elderly' end)) VIRTUAL,
  `brief_description` varchar(60000) CHARACTER SET latin1 COLLATE latin1_swedish_ci DEFAULT NULL,
  `j` json DEFAULT NULL,
  PRIMARY KEY (`employee_id`,`name`),
  UNIQUE KEY `idx_unique_email` (`email`),
  KEY `fk_group` (`department_id`),
  KEY `fk_country` (`country_id`),
  KEY `boss_id` (`boss_id`),
  KEY `idx_name_new` (`name`),
  KEY `idx_status_created` (`status`,`created_ts`) COMMENT 'Recreated Index',
  KEY `idx_email_created_brief` (`email`(30),`created_ts`,`brief_description`(30)),
  KEY `idx_credit_score` (`credit_score` DESC),
  KEY `idx_name_gender_age` (`name`,`gender`,`age_group`),
  CONSTRAINT `employees_fk_1` FOREIGN KEY (`boss_id`) REFERENCES `employees` (`employee_id`) ON DELETE CASCADE ON UPDATE CASCADE,
  CONSTRAINT `fk_country` FOREIGN KEY (`country_id`) REFERENCES `countrys` (`country_id`) ON DELETE SET NULL ON UPDATE CASCADE,
  CONSTRAINT `fk_group` FOREIGN KEY (`department_id`) REFERENCES `departments` (`department_id`) ON DELETE CASCADE ON UPDATE CASCADE
) /*!50100 TABLESPACE `tb1` */ ENGINE=Dstore DEFAULT CHARSET=utf8mb4 COLLATE=utf8mb4_0900_ai_ci
SELECT employee_id, name, email, age, gender
, status, credit_score, created_ts, age_group
, CHAR_LENGTH(brief_description)
FROM employees IGNORE INDEX (PRIMARY)
ORDER BY employee_id;
employee_id	name	email	age	gender	status	credit_score	created_ts	age_group	CHAR_LENGTH(brief_description)
U001	zhangsan	zhangsan@example.com	25	M	1	750	2023-01-15 13:30:00	youth	390
U002	lisi	lisi@example.com	30	M	1	800	2023-06-15 10:30:00	youth	60000
U003	wangwu	wangwu@example.com	17	F	1	650	2023-07-20 14:45:00	minor	660
U004	zhaoliu	zhaoliu@example.com	45	M	0	550	2023-08-10 09:15:00	midlife	1500
U005	qianqi	qianqi@example.com	60	F	2	900	2023-09-05 16:20:00	elderly	45000
SELECT employee_id, name
FROM employees FORCE INDEX (PRIMARY);
employee_id	name
U001	zhangsan
U002	lisi
U003	wangwu
U004	zhaoliu
U005	qianqi
SELECT status, created_ts
FROM employees FORCE INDEX (idx_status_created);
status	created_ts
0	2023-08-10 09:15:00
1	2023-01-15 13:30:00
1	2023-06-15 10:30:00
1	2023-07-20 14:45:00
2	2023-09-05 16:20:00
SELECT email, created_ts
FROM employees FORCE INDEX (idx_email_created_brief)
WHERE email IS NOT NULL;
email	created_ts
lisi@example.com	2023-06-15 10:30:00
qianqi@example.com	2023-09-05 16:20:00
wangwu@example.com	2023-07-20 14:45:00
zhangsan@example.com	2023-01-15 13:30:00
zhaoliu@example.com	2023-08-10 09:15:00
SELECT name, gender
FROM employees FORCE INDEX (idx_name_gender_age);
name	gender
lisi	M
qianqi	F
wangwu	F
zhangsan	M
zhaoliu	M
SELECT credit_score
FROM employees FORCE INDEX (idx_credit_score);
credit_score
900
800
750
650
550
##################################################################
# 7. Test with dml triggered by foreign key, commit and rollback #
##################################################################
SET DEBUG_SYNC = 'dstore_row_log_replay_before SIGNAL start_logging WAIT_FOR dml_done';
ALTER TABLE employees
# 1. Rename index
RENAME INDEX idx_name TO idx_name_new,
# 2. Rename column
CHANGE COLUMN created_at created_ts TIMESTAMP DEFAULT CURRENT_TIMESTAMP,
# 3. Drop index
DROP PRIMARY KEY,
DROP INDEX idx_status_created,
# 4. Recreate the deleted index and add a comment to cover Alter_inplace_info::ALTER_INDEX_COMMENT branch.
ADD INDEX idx_status_created (status, created_ts) COMMENT 'Recreated Index',
# 5. Creat primary/secondary/prefix/virtual/composite indexes
ADD PRIMARY KEY (employee_id, name),
ADD INDEX idx_email_created_brief (email(30), created_ts, brief_description(30)),
ADD UNIQUE INDEX idx_unique_email (email),
ADD INDEX idx_name_gender_age (name, gender, age_group),
ADD INDEX idx_credit_score (credit_score DESC),
ALGORITHM = INPLACE, LOCK=NONE;
SET DEBUG_SYNC = 'now WAIT_FOR start_logging';
SET GLOBAL debug="+d,not_compress_for_lob";
INSERT INTO employees (employee_id, department_id, country_id, boss_id, name, email, age, created_at) VALUES
('U006', 'D002', 'C001', 'U001','sunba', 'sunba@example.com', 28, '2024-07-20 14:45:00');
INSERT INTO employees (employee_id, department_id, country_id, boss_id, name, email, age, gender, status, credit_score, created_at, brief_description) VALUES
('U007', 'D002', 'C001', 'U001', 'wuming', 'wuming@example.com', 25, 'M', 1, 750, '2024-08-20 15:45:00', repeat('B', 14000));
DELETE FROM employees WHERE employee_id='U002';
BEGIN;
INSERT INTO employees (employee_id, department_id, country_id, boss_id, name, email, age, gender, status, credit_score, created_at, brief_description) VALUES
('U008', 'D002', 'C001', 'U001', 'zhangyue', 'zhangyue@example.com', 25, 'M', 1, 750, '2024-08-20 15:45:00', repeat('C', 14000));
UPDATE departments SET department_id='D001_new' WHERE department_id = 'D001';
DELETE FROM departments WHERE department_id = 'D002';
ROLLBACK;
SELECT table_name,index_name,status,replayed_row_log_items,total_row_log_items FROM INFORMATION_SCHEMA.DSTORE_ONLINE_DDL_PROGRESS ORDER BY index_name;
table_name	index_name	status	replayed_row_log_items	total_row_log_items
./test/employees	idx_credit_score	Creating index	0	13
./test/employees	idx_email_created_brief	Creating index	0	13
./test/employees	idx_name_gender_age	Creating index	0	13
./test/employees	idx_unique_email	Creating index	0	13
./test/employees	PRIMARY	Creating index	0	13
SET GLOBAL debug="-d,not_compress_for_lob";
SET DEBUG_SYNC = 'now SIGNAL dml_done';
SELECT table_name,index_name,status,replayed_row_log_items,total_row_log_items FROM INFORMATION_SCHEMA.DSTORE_ONLINE_DDL_PROGRESS;
table_name	index_name	status	replayed_row_log_items	total_row_log_items
SHOW CREATE TABLE employees;
Table	Create Table
employees	CREATE TABLE `employees` (
  `employee_id` varchar(32) NOT NULL,
  `department_id` varchar(32) NOT NULL,
  `country_id` varchar(32) DEFAULT NULL,
  `boss_id` varchar(32) DEFAULT NULL,
  `name` varchar(50) NOT NULL,
  `email` varchar(150) DEFAULT NULL,
  `age` tinyint unsigned DEFAULT NULL,
  `gender` enum('M','F','O') DEFAULT 'O',
  `status` tinyint DEFAULT '1' COMMENT '0:禁用,1:正常,2:冻结',
  `credit_score` int DEFAULT '0',
  `created_ts` timestamp NULL DEFAULT CURRENT_TIMESTAMP,
  `age_group` varchar(20) GENERATED ALWAYS AS ((case when (`age` < 18) then _utf8mb4'minor' when (`age` between 18 and 35) then _utf8mb4'youth' when (`age` between 36 and 55) then _utf8mb4'midlife' else _utf8mb4'elderly' end)) VIRTUAL,
  `brief_description` varchar(60000) CHARACTER SET latin1 COLLATE latin1_swedish_ci DEFAULT NULL,
  `j` json DEFAULT NULL,
  PRIMARY KEY (`employee_id`,`name`),
  UNIQUE KEY `idx_unique_email` (`email`),
  KEY `fk_group` (`department_id`),
  KEY `fk_country` (`country_id`),
  KEY `boss_id` (`boss_id`),
  KEY `idx_name_new` (`name`),
  KEY `idx_status_created` (`status`,`created_ts`) COMMENT 'Recreated Index',
  KEY `idx_email_created_brief` (`email`(30),`created_ts`,`brief_description`(30)),
  KEY `idx_credit_score` (`credit_score` DESC),
  KEY `idx_name_gender_age` (`name`,`gender`,`age_group`),
  CONSTRAINT `employees_fk_1` FOREIGN KEY (`boss_id`) REFERENCES `employees` (`employee_id`) ON DELETE CASCADE ON UPDATE CASCADE,
  CONSTRAINT `fk_country` FOREIGN KEY (`country_id`) REFERENCES `countrys` (`country_id`) ON DELETE SET NULL ON UPDATE CASCADE,
  CONSTRAINT `fk_group` FOREIGN KEY (`department_id`) REFERENCES `departments` (`department_id`) ON DELETE CASCADE ON UPDATE CASCADE
) /*!50100 TABLESPACE `tb1` */ ENGINE=Dstore DEFAULT CHARSET=utf8mb4 COLLATE=utf8mb4_0900_ai_ci
SELECT employee_id, name, email, age, gender
, status, credit_score, created_ts, age_group
, CHAR_LENGTH(brief_description)
FROM employees IGNORE INDEX (PRIMARY)
ORDER BY employee_id;
employee_id	name	email	age	gender	status	credit_score	created_ts	age_group	CHAR_LENGTH(brief_description)
U001	zhangsan	zhangsan@example.com	25	M	1	750	2023-01-15 13:30:00	youth	390
U003	wangwu	wangwu@example.com	17	F	1	650	2023-07-20 14:45:00	minor	660
U006	sunba	sunba@example.com	28	O	1	0	2024-07-20 14:45:00	youth	NULL
U007	wuming	wuming@example.com	25	M	1	750	2024-08-20 15:45:00	youth	14000
SELECT employee_id, name
FROM employees FORCE INDEX (PRIMARY);
employee_id	name
U001	zhangsan
U003	wangwu
U006	sunba
U007	wuming
SELECT status, created_ts
FROM employees FORCE INDEX (idx_status_created);
status	created_ts
1	2023-01-15 13:30:00
1	2023-07-20 14:45:00
1	2024-07-20 14:45:00
1	2024-08-20 15:45:00
SELECT email, created_ts
FROM employees FORCE INDEX (idx_email_created_brief)
WHERE email IS NOT NULL;
email	created_ts
sunba@example.com	2024-07-20 14:45:00
wangwu@example.com	2023-07-20 14:45:00
wuming@example.com	2024-08-20 15:45:00
zhangsan@example.com	2023-01-15 13:30:00
SELECT name, gender
FROM employees FORCE INDEX (idx_name_gender_age);
name	gender
sunba	O
wangwu	F
wuming	M
zhangsan	M
SELECT credit_score
FROM employees FORCE INDEX (idx_credit_score);
credit_score
750
750
650
0
##################################################################
# 8. Online create index duplicate error with dml-commit         #
##################################################################
call mtr.add_suppression("\\[DSTORE\\] Apply row log *");
call mtr.add_suppression("\\[DSTORE\\] Merged row log *");
CREATE TABLE t1 (c1 INT, c2 INT, c3 INT, c4 VARCHAR(100)) ENGINE=DSTORE;
CREATE PROCEDURE InsertIncrementalData(
IN n INT,
IN start INT,
IN m INT
)
BEGIN
DECLARE i INT DEFAULT 0;
WHILE i < n DO
INSERT INTO t1 (c1, c2, c3, c4)
VALUES (
start + i,
start + i,
start + i,
REPEAT('a', m)
);
SET i = i + 1;
END WHILE;
END //
CALL InsertIncrementalData(100, 1, 100);
SET DEBUG_SYNC = 'dstore_after_one_rowlog_replay_thread_created SIGNAL start_logging WAIT_FOR dml_done';
ALTER TABLE t1
ADD UNIQUE INDEX idx_c1 (c1),
ADD UNIQUE INDEX idx_c2 (c2),
ADD UNIQUE INDEX idx_c3 (c3),
ADD INDEX idx_c4 (c4),
ALGORITHM = INPLACE, LOCK=NONE;
SET DEBUG_SYNC = 'now WAIT_FOR start_logging';
INSERT INTO t1 VALUES (1001,1001,1001,'a'), (1,1003,1003,'b'), (1002,1002,1002,'c');
CALL InsertIncrementalData(3000, 2001, 100);
SET DEBUG_SYNC = 'now SIGNAL dml_done';
ERROR 23000: Duplicate entry '1' for key 't1.idx_c1'
SELECT count(*) FROM t1;
count(*)
3103
SHOW CREATE TABLE t1;
Table	Create Table
t1	CREATE TABLE `t1` (
  `c1` int DEFAULT NULL,
  `c2` int DEFAULT NULL,
  `c3` int DEFAULT NULL,
  `c4` varchar(100) DEFAULT NULL
) ENGINE=Dstore DEFAULT CHARSET=utf8mb4 COLLATE=utf8mb4_0900_ai_ci
DROP TABLE t1;
CREATE TABLE t1 (c1 INT, c2 INT, c3 INT, c4 VARCHAR(100)) ENGINE=DSTORE;
CALL InsertIncrementalData(100, 1, 100);
SET DEBUG_SYNC = 'dstore_row_log_replay_before SIGNAL start_logging WAIT_FOR dml_done';
ALTER TABLE t1
ADD UNIQUE INDEX idx_c1 (c1),
ADD UNIQUE INDEX idx_c2 (c2),
ADD UNIQUE INDEX idx_c3 (c3),
ADD INDEX idx_c4 (c4),
ALGORITHM = INPLACE, LOCK=NONE;
SET DEBUG_SYNC = 'now WAIT_FOR start_logging';
INSERT INTO t1 VALUES (1001,1001,1001,'a'), (1,1003,1003,'b'), (1002,1002,1002,'c');
CALL InsertIncrementalData(3000, 2001, 100);
SET DEBUG_SYNC = 'now SIGNAL dml_done';
ERROR 23000: Duplicate entry '1' for key 't1.idx_c1'
SELECT count(*) FROM t1;
count(*)
3103
SHOW CREATE TABLE t1;
Table	Create Table
t1	CREATE TABLE `t1` (
  `c1` int DEFAULT NULL,
  `c2` int DEFAULT NULL,
  `c3` int DEFAULT NULL,
  `c4` varchar(100) DEFAULT NULL
) ENGINE=Dstore DEFAULT CHARSET=utf8mb4 COLLATE=utf8mb4_0900_ai_ci
DROP TABLE t1;
DROP PROCEDURE InsertIncrementalData;
SET debug_sync = 'RESET';
##################################################################
# 9. Online create index duplicate error with dml-rollback       #
##################################################################
call mtr.add_suppression("\\[DSTORE\\] Apply row log *");
call mtr.add_suppression("\\[DSTORE\\] Merged row log *");
SET DEBUG_SYNC = 'dstore_row_log_replay_before SIGNAL start_logging WAIT_FOR dml_done';
ALTER TABLE employees
# 1. Rename index
RENAME INDEX idx_name TO idx_name_new,
# 2. Rename column
CHANGE COLUMN created_at created_ts TIMESTAMP DEFAULT CURRENT_TIMESTAMP,
# 3. Drop index
DROP PRIMARY KEY,
DROP INDEX idx_status_created,
# 4. Recreate the deleted index and add a comment to cover Alter_inplace_info::ALTER_INDEX_COMMENT branch.
ADD INDEX idx_status_created (status, created_ts) COMMENT 'Recreated Index',
# 5. Creat primary/secondary/prefix/virtual/composite indexes
ADD PRIMARY KEY (employee_id, name),
ADD INDEX idx_email_created_brief (email(30), created_ts, brief_description(30)),
ADD UNIQUE INDEX idx_unique_email (email),
ADD INDEX idx_name_gender_age (name, gender, age_group),
ADD INDEX idx_credit_score (credit_score DESC),
ALGORITHM = INPLACE, LOCK=NONE;
SET DEBUG_SYNC = 'now WAIT_FOR start_logging';
SET GLOBAL debug="+d,not_compress_for_lob";
INSERT INTO employees (employee_id, department_id, country_id, boss_id, name, email, age, created_at) VALUES
('U006', 'D002', 'C001', 'U001','sunba', 'sunba@example.com', 28, '2024-07-20 14:45:00');
BEGIN;
INSERT INTO employees (employee_id, department_id, country_id, boss_id, name, email, age, gender, status, credit_score, created_at, brief_description) VALUES
('U007', 'D002', 'C001', 'U001', 'wuming', 'sunba@example.com', 25, 'M', 1, 750, '2024-08-20 15:45:00', repeat('B', 14000));
ROLLBACK;
SELECT table_name,index_name,status,replayed_row_log_items,total_row_log_items FROM INFORMATION_SCHEMA.DSTORE_ONLINE_DDL_PROGRESS ORDER BY index_name;
table_name	index_name	status	replayed_row_log_items	total_row_log_items
./test/employees	idx_credit_score	Creating index	0	3
./test/employees	idx_email_created_brief	Creating index	0	3
./test/employees	idx_name_gender_age	Creating index	0	3
./test/employees	idx_unique_email	Creating index	0	3
./test/employees	PRIMARY	Creating index	0	3
SET GLOBAL debug="-d,not_compress_for_lob";
SET DEBUG_SYNC = 'now SIGNAL dml_done';
ERROR 23000: Duplicate entry 'sunba@example.com' for key 'employees.idx_unique_email'
SELECT table_name,index_name,status,replayed_row_log_items,total_row_log_items FROM INFORMATION_SCHEMA.DSTORE_ONLINE_DDL_PROGRESS;
table_name	index_name	status	replayed_row_log_items	total_row_log_items
###################################################################
# 10. Online create functional index with dml commit and rollback #
###################################################################
call mtr.add_suppression("\\[DSTORE\\] Apply row log *");
call mtr.add_suppression("\\[DSTORE\\] Merged row log *");
SET DEBUG_SYNC = 'dstore_row_log_replay_before SIGNAL start_logging WAIT_FOR dml_done';
ALTER TABLE employees
# 1. Drop index
DROP INDEX idx_status_created,
# 2. Recreate the deleted index.
ADD INDEX idx_status_created (status, created_at),
# 3. Creat secondary/prefix/virtual/functional/composite indexes
ADD INDEX idx_email_created_brief (email(30), created_at, brief_description(30)),
ADD INDEX idx_name_gender_age (name, gender, age_group),
ADD INDEX idx_credit_score (credit_score DESC),
ADD INDEX idx_func ((CONCAT(employee_id, department_id))),
ALGORITHM = INPLACE, LOCK=NONE;
SET DEBUG_SYNC = 'now WAIT_FOR start_logging';
SET GLOBAL debug="+d,not_compress_for_lob";
INSERT INTO employees (employee_id, department_id, country_id, boss_id, name, email, age, created_at) VALUES
('U006', 'D002', 'C001', 'U001','sunba', 'sunba@example.com', 28, '2024-07-20 14:45:00');
INSERT INTO employees (employee_id, department_id, country_id, boss_id, name, email, age, gender, status, credit_score, created_at, brief_description) VALUES
('U007', 'D002', 'C001', 'U001', 'wuming', 'wuming@example.com', 25, 'M', 1, 750, '2024-08-20 15:45:00', repeat('B', 14000));
BEGIN;
UPDATE employees SET email = 'zhangsan_new@example.com', brief_description = repeat('I am zhangsan', 600) WHERE employee_id = 'U001';
UPDATE employees SET email = 'ZhangSan_new@example.com' WHERE employee_id = 'U001';
UPDATE employees SET j = JSON_QUOTE(repeat('A', 6000)) WHERE employee_id = 'U001';
UPDATE employees SET brief_description = repeat('I am zhangsan', 1000) WHERE employee_id = 'U001';
UPDATE employees SET brief_description = repeat('I am zhangsan', 10) WHERE employee_id = 'U001';
UPDATE employees SET brief_description = repeat('A', 9000) WHERE employee_id = 'U002';
UPDATE employees SET age = 37 WHERE employee_id = 'U002';
UPDATE employees SET brief_description = repeat('A', 23000) WHERE employee_id = 'U002';
INSERT INTO employees (employee_id, department_id, country_id, boss_id, name, email, age, gender, status, credit_score, created_at, brief_description) VALUES
('U008', 'D002', 'C001', 'U001', 'zhangyue', 'zhangyue@example.com', 25, 'M', 1, 750, '2024-08-20 15:45:00', repeat('C', 14000));
DELETE FROM employees WHERE employee_id = 'U003';
DELETE FROM employees WHERE employee_id = 'U005';
ROLLBACK;
DELETE FROM employees WHERE employee_id='U002';
BEGIN;
INSERT INTO employees (employee_id, department_id, country_id, boss_id, name, email, age, gender, status, credit_score, created_at, brief_description) VALUES
('U008', 'D002', 'C001', 'U001', 'zhangyue', 'zhangyue@example.com', 25, 'M', 1, 750, '2024-08-20 15:45:00', repeat('C', 14000));
UPDATE departments SET department_id='D001_new' WHERE department_id = 'D001';
DELETE FROM departments WHERE department_id = 'D002';
ROLLBACK;
SELECT table_name,index_name,status,replayed_row_log_items,total_row_log_items FROM INFORMATION_SCHEMA.DSTORE_ONLINE_DDL_PROGRESS ORDER BY index_name;
table_name	index_name	status	replayed_row_log_items	total_row_log_items
./test/employees	idx_credit_score	Creating index	0	31
./test/employees	idx_email_created_brief	Creating index	0	31
./test/employees	idx_func	Creating index	0	39
./test/employees	idx_name_gender_age	Creating index	0	35
SET GLOBAL debug="-d,not_compress_for_lob";
SET DEBUG_SYNC = 'now SIGNAL dml_done';
SELECT table_name,index_name,status,replayed_row_log_items,total_row_log_items FROM INFORMATION_SCHEMA.DSTORE_ONLINE_DDL_PROGRESS;
table_name	index_name	status	replayed_row_log_items	total_row_log_items
SHOW CREATE TABLE employees;
Table	Create Table
employees	CREATE TABLE `employees` (
  `employee_id` varchar(32) NOT NULL,
  `department_id` varchar(32) NOT NULL,
  `country_id` varchar(32) DEFAULT NULL,
  `boss_id` varchar(32) DEFAULT NULL,
  `name` varchar(50) NOT NULL,
  `email` varchar(150) DEFAULT NULL,
  `age` tinyint unsigned DEFAULT NULL,
  `gender` enum('M','F','O') DEFAULT 'O',
  `status` tinyint DEFAULT '1' COMMENT '0:禁用,1:正常,2:冻结',
  `credit_score` int DEFAULT '0',
  `created_at` timestamp NULL DEFAULT CURRENT_TIMESTAMP,
  `age_group` varchar(20) GENERATED ALWAYS AS ((case when (`age` < 18) then _utf8mb4'minor' when (`age` between 18 and 35) then _utf8mb4'youth' when (`age` between 36 and 55) then _utf8mb4'midlife' else _utf8mb4'elderly' end)) VIRTUAL,
  `brief_description` varchar(60000) CHARACTER SET latin1 COLLATE latin1_swedish_ci DEFAULT NULL,
  `j` json DEFAULT NULL,
  PRIMARY KEY (`employee_id`),
  KEY `fk_group` (`department_id`),
  KEY `fk_country` (`country_id`),
  KEY `boss_id` (`boss_id`),
  KEY `idx_name` (`name`),
  KEY `idx_status_created` (`status`,`created_at`),
  KEY `idx_email_created_brief` (`email`(30),`created_at`,`brief_description`(30)),
  KEY `idx_credit_score` (`credit_score` DESC),
  KEY `idx_name_gender_age` (`name`,`gender`,`age_group`),
  KEY `idx_func` ((concat(`employee_id`,`department_id`))),
  CONSTRAINT `employees_fk_1` FOREIGN KEY (`boss_id`) REFERENCES `employees` (`employee_id`) ON DELETE CASCADE ON UPDATE CASCADE,
  CONSTRAINT `fk_country` FOREIGN KEY (`country_id`) REFERENCES `countrys` (`country_id`) ON DELETE SET NULL ON UPDATE CASCADE,
  CONSTRAINT `fk_group` FOREIGN KEY (`department_id`) REFERENCES `departments` (`department_id`) ON DELETE CASCADE ON UPDATE CASCADE
) /*!50100 TABLESPACE `tb1` */ ENGINE=Dstore DEFAULT CHARSET=utf8mb4 COLLATE=utf8mb4_0900_ai_ci
SELECT employee_id, name, email, age, gender
, status, credit_score, created_at, age_group
, CHAR_LENGTH(brief_description)
FROM employees IGNORE INDEX (PRIMARY)
ORDER BY employee_id;
employee_id	name	email	age	gender	status	credit_score	created_at	age_group	CHAR_LENGTH(brief_description)
U001	zhangsan	zhangsan@example.com	25	M	1	750	2023-01-15 13:30:00	youth	390
U003	wangwu	wangwu@example.com	17	F	1	650	2023-07-20 14:45:00	minor	660
U006	sunba	sunba@example.com	28	O	1	0	2024-07-20 14:45:00	youth	NULL
U007	wuming	wuming@example.com	25	M	1	750	2024-08-20 15:45:00	youth	14000
SELECT status, created_at
FROM employees FORCE INDEX (idx_status_created);
status	created_at
1	2023-01-15 13:30:00
1	2023-07-20 14:45:00
1	2024-07-20 14:45:00
1	2024-08-20 15:45:00
SELECT email, created_at
FROM employees FORCE INDEX (idx_email_created_brief)
WHERE email IS NOT NULL;
email	created_at
sunba@example.com	2024-07-20 14:45:00
wangwu@example.com	2023-07-20 14:45:00
wuming@example.com	2024-08-20 15:45:00
zhangsan@example.com	2023-01-15 13:30:00
SELECT name, gender
FROM employees FORCE INDEX (idx_name_gender_age);
name	gender
sunba	O
wangwu	F
wuming	M
zhangsan	M
SELECT credit_score
FROM employees FORCE INDEX (idx_credit_score);
credit_score
750
750
650
0
SELECT CONCAT(employee_id, department_id), employee_id, department_id
FROM employees FORCE INDEX (idx_func)
ORDER BY CONCAT(employee_id, department_id);
CONCAT(employee_id, department_id)	employee_id	department_id
U001D001	U001	D001
U003D001	U003	D001
U006D002	U006	D002
U007D002	U007	D002
DROP TABLE employees;
DROP TABLE countrys;
DROP TABLE departments;
##################################################################
# 11. Test create index scene that not support online yet        #
##################################################################
CREATE TABLE t1 (c1 INT NOT NULL) ENGINE=DSTORE;
ALTER TABLE t1 ADD COLUMN id BIGINT UNSIGNED NOT NULL AUTO_INCREMENT, ADD UNIQUE KEY (id), ALGORITHM=INPLACE, LOCK=NONE;
ERROR 0A000: LOCK=NONE is not supported. Reason: Adding an auto-increment column requires a lock. Try LOCK=SHARED.
DROP TABLE t1;
CREATE TABLE t1(i INT PRIMARY KEY, j JSON) ENGINE=DSTORE;
INSERT INTO t1 VALUES (1,'"2019-1-1"'),(2,'"2019-01-01"'),(3,CAST(DATE'2019-1-1' AS JSON));
INSERT INTO t1(i)values(4);
ALTER TABLE t1 ADD INDEX idx1((CAST(j->'$' AS DATE))), ALGORITHM = INPLACE, LOCK=NONE;
ERROR 0A000: LOCK=NONE is not supported. Reason: Creating index on virtual column based on lob or json type is not supported.. Try LOCK=SHARED.
DROP TABLE t1;
CREATE TABLE t1(i INT PRIMARY KEY, j JSON, j_date DATE AS (CAST(j->>'$' AS DATE)) VIRTUAL ) ENGINE=DSTORE;
INSERT INTO t1 (i,j) VALUES (1,'"2019-1-1"'),(2,'"2019-01-01"'),(3,CAST(DATE'2019-1-1' AS JSON));
ALTER TABLE t1 ADD INDEX idx1(j_date), ALGORITHM = INPLACE, LOCK=NONE;
ERROR 0A000: LOCK=NONE is not supported. Reason: Creating index on virtual column based on lob or json type is not supported.. Try LOCK=SHARED.
DROP TABLE t1;
##################################################################
# 12. Test rollback upon failure of DML during online DDL        #
##################################################################
SET debug_sync = 'RESET';
call mtr.add_suppression("\\[DSTORE\\] Apply row log *");
call mtr.add_suppression("\\[DSTORE\\] Merged row log *");
ALTER TABLE employees
DROP FOREIGN KEY employees_fk_1;
SET DEBUG_SYNC = 'dstore_row_log_replay_before SIGNAL start_logging WAIT_FOR dml_done';
ALTER TABLE employees
# 1. Rename index
RENAME INDEX idx_name TO idx_name_new,
# 2. Rename column
CHANGE COLUMN created_at created_ts TIMESTAMP DEFAULT CURRENT_TIMESTAMP,
# 3. Drop index
DROP PRIMARY KEY,
DROP INDEX idx_status_created,
# 4. Recreate the deleted index and add a comment to cover Alter_inplace_info::ALTER_INDEX_COMMENT branch.
ADD INDEX idx_status_created (status, created_ts) COMMENT 'Recreated Index',
# 5. Creat primary/secondary/prefix/virtual column/single-columncomposite indexes
ADD PRIMARY KEY (employee_id, name),
#ADD INDEX idx_email_created_brief (email(30), created_ts, brief_description(30)),
ADD INDEX idx_email_created_brief (email, created_ts),
ADD UNIQUE INDEX idx_unique_email (email),
#ADD INDEX idx_name_gender_age (name, gender, age_group),
ADD INDEX idx_name_gender_age (name, gender),
ADD INDEX idx_credit_score (credit_score DESC),
ALGORITHM = INPLACE, LOCK=NONE;
SET DEBUG_SYNC = 'now WAIT_FOR start_logging';
INSERT INTO employees (employee_id, department_id, country_id, boss_id, name, email, age, gender, status, credit_score, created_at, brief_description) VALUES
('U006', 'D001', 'C001', 'U001', 'zhangsan', 'zhangsan1@example.com', 25, 'M', 1, 750, '2023-01-15 13:30:00', repeat('I am zhangsan', 30)),
('U007', 'D001', 'C001', 'U002', 'lisi', 'lisi1@example.com', 30, 'M', 1, 800, '2023-06-15 10:30:00', repeat('A', 60000)),
('U008', 'D001', 'C002', 'U003', 'wangwu', 'wangwu1@example.com', 17, 'F', 1, 650, '2023-07-20 14:45:00', repeat('I am wangwu', 60)),
('U009', 'D002', 'C001', 'U004', 'zhaoliu', 'zhaoliu1@example.com', 45, 'M', 0, 550, '2023-08-10 09:15:00', repeat('Make zhaoliu great again!', 60)),
('U008', 'D002', 'C001', 'U005', 'zhaoliu', 'zhaoliu1@example.com', 45, 'M', 0, 550, '2023-08-10 09:15:00', repeat('Make zhaoliu great again!', 60)),
('U010', 'D002', 'C002', 'U006', 'qianqi', 'qianqi1@example.com', 60, 'F', 2, 900, '2023-09-05 16:20:00', repeat('waaaaagh!', 5000));
ERROR 23000: Duplicate entry 'U008' for key 'employees.PRIMARY'
INSERT INTO employees (employee_id, department_id, country_id, boss_id, name, email, age, gender, status, credit_score, created_at, brief_description) VALUES
('U006', 'D001', 'C001', 'U001', 'zhangsan', 'zhangsan2@example.com', 25, 'M', 1, 750, '2023-01-15 13:30:00', repeat('I am zhangsan', 30)),
('U007', 'D001', 'C001', 'U002', 'lisi', 'lisi2@example.com', 30, 'M', 1, 800, '2023-06-15 10:30:00', repeat('A', 60000)),
('U008', 'D001', 'C002', 'U003', 'wangwu', 'wangwu2@example.com', 17, 'F', 1, 650, '2023-07-20 14:45:00', repeat('I am wangwu', 60)),
('U009', 'D002', 'C001', 'U004', 'zhaosi', 'zhaosi2@example.com', 45, 'M', 0, 550, '2023-08-10 09:15:00', repeat('Make zhaoliu great again!', 60)),
('U0010', 'D002', 'C001', 'U005', 'zhaoliu', 'zhaoliu2@example.com', 45, 'M', 0, 550, '2023-08-10 09:15:00', repeat('Make zhaoliu great again!', 60)),
('U0011', 'D002', 'C002', 'U006', 'qianqi', 'qianqi2@example.com', 60, 'F', 2, 900, '2023-09-05 16:20:00', repeat('waaaaagh!', 5000));
UPDATE employees SET employee_id = 'U012' WHERE employee_id IN ('U001', 'U002', 'U003');
ERROR 23000: Duplicate entry 'U012' for key 'employees.PRIMARY'
SET DEBUG_SYNC = 'now SIGNAL dml_done';
DROP TABLE employees;
DROP TABLE countrys;
DROP TABLE departments;
DROP TABLESPACE tb1;
