set dstore_ddl_enable_batch_insert_for_inplace_rebuild = on;
CREATE TABLE t (c1 INT PRIMARY KEY, c2 INT NOT NULL, c3 INT) ENGINE=Dstore;
INSERT INTO t VALUES (1,2,3),(4,5,6),(7,8,9);
ALTER TABLE t CHANGE c1 c1 INT NULL FIRST, ALGORITHM=INPLACE;
ERROR 42000: All parts of a PRIMARY KEY must be NOT NULL; if you need NULL in a key, use UNIQUE instead
ALTER TABLE t MODIFY c3 INT NOT NULL, ALGORITHM=INPLACE;
affected rows: 0
info: Records: 0  Duplicates: 0  Warnings: 0
ALTER TABLE t CHANGE c2 c2 INT, CHANGE c2 c2 INT NOT NULL;
ERROR 42S22: Unknown column 'c2' in 't'
ALTER TABLE t MODIFY c2 INT, MODIFY c2 INT NOT NULL;
ERROR 42S22: Unknown column 'c2' in 't'
ALTER TABLE t MODIFY c2 INT UNSIGNED, MODIFY c2 INT;
ERROR 42S22: Unknown column 'c2' in 't'
ALTER TABLE t MODIFY c2 CHAR(1) NOT NULL, MODIFY c2 INT NOT NULL;
ERROR 42S22: Unknown column 'c2' in 't'
ALTER TABLE t CHANGE c2 c2 INT NOT NULL;
affected rows: 0
info: Records: 0  Duplicates: 0  Warnings: 0
ALTER TABLE t MODIFY c2 INT NOT NULL;
affected rows: 0
info: Records: 0  Duplicates: 0  Warnings: 0
UPDATE t SET c2=NULL;
ERROR 23000: Column 'c2' cannot be null
SELECT * FROM t;
c1	c2	c3
1	2	3
4	5	6
7	8	9
ALTER TABLE t MODIFY c2 INT, ALGORITHM=INPLACE;
BEGIN;
UPDATE t SET c2=NULL;
SELECT * FROM t;
c1	c2	c3
1	NULL	3
4	NULL	6
7	NULL	9
ROLLBACK;
SELECT * FROM t;
c1	c2	c3
1	2	3
4	5	6
7	8	9
ALTER TABLE t MODIFY c2 INT NULL, ALGORITHM=INPLACE;
DROP TABLE t;
CREATE TABLE t1(c1 INT);
ALTER TABLE t1 ADD CONSTRAINT UNIQUE KEY i1(c1);
ALTER TABLE t1 CHANGE c1 c1 INT SIGNED NOT NULL,ADD KEY(c1);
DROP TABLE t1;
call mtr.add_suppression(".*callback execution failed.*");
CREATE TABLE t1(c1 INT);
INSERT INTO t1 values(NULL);
ALTER TABLE t1 CHANGE c1 c1 INT SIGNED NOT NULL,ADD KEY(c1);
ERROR 22004: Invalid use of NULL value
SHOW CREATE TABLE t1;
Table	Create Table
t1	CREATE TABLE `t1` (
  `c1` int DEFAULT NULL
) ENGINE=Dstore DEFAULT CHARSET=utf8mb4 COLLATE=utf8mb4_0900_ai_ci
DROP TABLE t1;
set dstore_ddl_enable_batch_insert_for_inplace_rebuild = off;
CREATE TABLE t (c1 INT PRIMARY KEY, c2 INT NOT NULL, c3 INT) ENGINE=Dstore;
INSERT INTO t VALUES (1,2,3),(4,5,6),(7,8,9);
ALTER TABLE t CHANGE c1 c1 INT NULL FIRST, ALGORITHM=INPLACE;
ERROR 42000: All parts of a PRIMARY KEY must be NOT NULL; if you need NULL in a key, use UNIQUE instead
ALTER TABLE t MODIFY c3 INT NOT NULL, ALGORITHM=INPLACE;
affected rows: 0
info: Records: 0  Duplicates: 0  Warnings: 0
ALTER TABLE t CHANGE c2 c2 INT, CHANGE c2 c2 INT NOT NULL;
ERROR 42S22: Unknown column 'c2' in 't'
ALTER TABLE t MODIFY c2 INT, MODIFY c2 INT NOT NULL;
ERROR 42S22: Unknown column 'c2' in 't'
ALTER TABLE t MODIFY c2 INT UNSIGNED, MODIFY c2 INT;
ERROR 42S22: Unknown column 'c2' in 't'
ALTER TABLE t MODIFY c2 CHAR(1) NOT NULL, MODIFY c2 INT NOT NULL;
ERROR 42S22: Unknown column 'c2' in 't'
ALTER TABLE t CHANGE c2 c2 INT NOT NULL;
affected rows: 0
info: Records: 0  Duplicates: 0  Warnings: 0
ALTER TABLE t MODIFY c2 INT NOT NULL;
affected rows: 0
info: Records: 0  Duplicates: 0  Warnings: 0
UPDATE t SET c2=NULL;
ERROR 23000: Column 'c2' cannot be null
SELECT * FROM t;
c1	c2	c3
1	2	3
4	5	6
7	8	9
ALTER TABLE t MODIFY c2 INT, ALGORITHM=INPLACE;
BEGIN;
UPDATE t SET c2=NULL;
SELECT * FROM t;
c1	c2	c3
1	NULL	3
4	NULL	6
7	NULL	9
ROLLBACK;
SELECT * FROM t;
c1	c2	c3
1	2	3
4	5	6
7	8	9
ALTER TABLE t MODIFY c2 INT NULL, ALGORITHM=INPLACE;
DROP TABLE t;
CREATE TABLE t1(c1 INT);
ALTER TABLE t1 ADD CONSTRAINT UNIQUE KEY i1(c1);
ALTER TABLE t1 CHANGE c1 c1 INT SIGNED NOT NULL,ADD KEY(c1);
DROP TABLE t1;
call mtr.add_suppression(".*callback execution failed.*");
CREATE TABLE t1(c1 INT);
INSERT INTO t1 values(NULL);
ALTER TABLE t1 CHANGE c1 c1 INT SIGNED NOT NULL,ADD KEY(c1);
ERROR 22004: Invalid use of NULL value
SHOW CREATE TABLE t1;
Table	Create Table
t1	CREATE TABLE `t1` (
  `c1` int DEFAULT NULL
) ENGINE=Dstore DEFAULT CHARSET=utf8mb4 COLLATE=utf8mb4_0900_ai_ci
DROP TABLE t1;
set dstore_ddl_enable_batch_insert_for_inplace_rebuild = default;
